lemma	pos	date	grouping	identifier	description	context	indexes_target_token	indexes_target_sentence	context_tokenized	indexes_target_token_tokenized	indexes_target_sentence_tokenized	context_lemmatized	context_pos	context_normalized
Naturschönheit	NN	1890	1	lasswitz_seife_1890-2773-5	 	Sie haben kein Gefühl für Naturschönheit,“ erwiderte der Blonde und warf eine Eierschale so dicht an dem Farnkraut vorüber, daß Tröpfchen vor Schreck bald ins Wasser gefallen wäre.	26:40	0:180	Sie haben kein Gefühl für Naturſchönheit , “ erwiderte der Blonde und warf eine Eierſchale ſo dicht an dem Farnkraut vorüber , daß Tröpfchen vor Schreck bald ins Waſſer gefallen wäre .	5	0:32	sie haben keine Gefühl für Naturschönheit , " erwidern d Blonde und werfen eine Eierschale so dicht an d Farnkraut vorüber , daß Tropfchen vor Schreck bald ins Wasser gefallen sein .	PPER VAFIN PIAT NN APPR NN $, $( VVFIN ART NN KON VVFIN ART NN ADV ADJD APPR ART NN PTKVZ $, KOUS NN APPR NN ADV APPRART NN VVPP VAFIN $.	Sie haben kein Gefühl für Naturschönheit , " erwiderte der Blonde und warf eine Eierschale so dicht an dem Farnkraut vorüber , daß Tröpfchen vor Schreck bald ins Wasser gefallen wäre .
Naturschönheit	NN	1846	1	vischer_aesthetik01_1846-537-13	 	Dabei fällt der erste Abschnitt des zweiten Theils, die Lehre von der Naturschönheit, sogleich weg.	70:84	0:99	Dabei fällt der erſte Abſchnitt des zweiten Theils , die Lehre von der Naturſchönheit , ſogleich weg .	13	0:18	dabei fällen d erst Abschnitt d zweit Teil , d Lehre von d Naturschönheit , sogleich weg .	PAV VVFIN ART ADJA NN ART ADJA NN $, ART NN APPR ART NN $, ADV PTKVZ $.	Dabei fällt der erste Abschnitt des zweiten Teils , die Lehre von der Naturschönheit , sogleich weg .
Naturschönheit	NN	1847	1	vischer_aesthetik0201_1847-738-57	 	Uebrigens versteht sich, daß in einem solchen gegebenen Ganzen allerdings Producte der Technik, Kleider, Pferdezeug, Fahnen, Mauerverkleidungen mit dem Licht der Sonne, des Feuers, den Farben der Erde, der Pflanzen-, der Thierwelt und dem Colorit des menschlichen Leibes zusammenwirken können, ohne daß wir darum das Gebiet der Naturschönheit verlassen, denn jene Producte des Kunstfleißes sind in diesem Zusammenhang, wiewohl an sich beabsichtigt, zufällige Schönheit.	328:342	0:469	Uebrigens verſteht ſich , daß in einem ſolchen gegebenen Ganzen allerdings Producte der Technik , Kleider , Pferdezeug , Fahnen , Mauerverkleidungen mit dem Licht der Sonne , des Feuers , den Farben der Erde , der Pflanzen- , der Thierwelt und dem Colorit des menſchlichen Leibes zuſammenwirken können , ohne daß wir darum das Gebiet der Naturſchönheit verlaſſen , denn jene Producte des Kunſtfleißes ſind in dieſem Zuſammenhang , wiewohl an ſich beabſichtigt , zufällige Schönheit .	57	0:78	übrigens verstehen sich , daß in eine solch gegeben Ganze allerdings Produkt d Technik , Kleid , Pferdezeug , Fahne , Mauerverkleidung mit d Licht d Sonne , d Feuer , d Farbe d Erde , d pflanzen- , d Tierwelt und d Kolorit d menschlich Leib zusammenwirken können , ohne daß wir darum d Gebiet d Naturschönheit verlassen , denn jen Produkt d Kunstfleiß sein in diese Zusammenhäng , wiewohl an sich beabsichtigen , zufällig Schönheit .	ADV VVFIN PRF $, KOUS APPR ART PIAT ADJA NN ADV NN ART NN $, NN $, NN $, NN $, NN APPR ART NN ART NN $, ART NN $, ART NN ART NN $, ART TRUNC $, ART NN KON ART NN ART ADJA NN VVINF VMINF $, KOUI KOUS PPER PAV ART NN ART NN VVINF $, KON PDAT NN ART NN VAFIN APPR PDAT NN $, KOUS APPR PRF VVFIN $, ADJA NN $.	Übrigens versteht sich , daß in einem solchen gegebenen Ganzen allerdings Produkte der Technik , Kleider , Pferdezeug , Fahnen , Mauerverkleidungen mit dem Licht der Sonne , des Feuers , den Farben der Erde , der Pflanzen- , der Tierwelt und dem Kolorit des menschlichen Leibes zusammenwirken können , ohne daß wir darum das Gebiet der Naturschönheit verlassen , denn jene Produkte des Kunstfleißes sind in diesem Zusammenhäng , wiewohl an sich beabsichtigt , zufällige Schönheit .
Naturschönheit	NN	1881	1	rein_japan01_1881-7873-40	 	5. Provinz Setsu, die volkreichste und jetzt wichtigste im Kinai, steigt vom flachen Strande zwischen Hiogo und Ôsaka zu 6—700 Meter hohen bewaldeten Bergen gen Westen empor und ist in diesem Theile gleich Yamato und Yamashiro reich an Naturschönheiten.	236:252	0:253	5. Provinz Setsu , die volkreichste und jetzt wichtigste im Kinai , steigt vom flachen Strande zwischen Hiogo und Ôsaka zu 6—700 Meter hohen bewaldeten Bergen gen Westen empor und ist in diesem Theile gleich Yamato und Yamashiro reich an Naturschönheiten .	40	0:42	5. Provinz Setsu , d volkreich und jetzt wichtig im Kinai , steigen vom flach Strand zwischen Hiogo und Osaka zu 6--700 Meter hoch bewaldet Berg gen Westen empor und sein in diese Teil gleich Yamato und Yamashiro reich an Naturschönheit .	ADJA NN NE $, ART ADJA KON ADV ADJA APPRART NN $, VVFIN APPRART ADJA NN APPR NE KON NE APPR CARD NN ADJA ADJA NN APPR NN PTKVZ KON VAFIN APPR PDAT NN ADV NE KON NE ADJD APPR NN $.	5. Provinz Setsu , die volkreichste und jetzt wichtigste im Kinai , steigt vom flachen Strande zwischen Hiogo und Osaka zu 6--700 Meter hohen bewaldeten Bergen gen Westen empor und ist in diesem Teile gleich Yamato und Yamashiro reich an Naturschönheiten .
Naturschönheit	NN	1848	1	vischer_aesthetik0202_1848-473-88	 	Wird aber dennoch von diesen willkührlichen Verbindungen Einiges hinübergenommen in die wahre Schöpfung der Schönheit, wie Centauren, das Gefolge des Bacchus, Engel, Teufel, Gespenster, Wunder aller Art, so ist wohl zu bedenken: erstens, daß diese Geschöpfe zu den Stoffen gehören, welche die künstlerische Phantasie von dem Volksglauben überkommt, welcher in dieser Richtung noch nicht wahrhaft ästhetisch, sondern in der unreifen Weise der Einbildungskraft gedichtet: Stoffe, welche die Phantasie nun hinnimmt, wie Objecte der Naturschönheit, so aber, daß sie sich thätig erweist, das wuchernde Uebermaaß zu beschneiden, die unstete Flucht zum Stehen zu bringen, das Wildfremde mehr und mehr zu vermenschlichen.	529:543	0:713	Wird aber dennoch von dieſen willkührlichen Verbindungen Einiges hinübergenommen in die wahre Schöpfung der Schönheit , wie Centauren , das Gefolge des Bacchus , Engel , Teufel , Geſpenſter , Wunder aller Art , ſo iſt wohl zu bedenken : erſtens , daß dieſe Geſchöpfe zu den Stoffen gehören , welche die künſtleriſche Phantaſie von dem Volksglauben überkommt , welcher in dieſer Richtung noch nicht wahrhaft äſthetiſch , ſondern in der unreifen Weiſe der Einbildungskraft gedichtet : Stoffe , welche die Phantaſie nun hinnimmt , wie Objecte der Naturſchönheit , ſo aber , daß ſie ſich thätig erweist , das wuchernde Uebermaaß zu beſchneiden , die unſtete Flucht zum Stehen zu bringen , das Wildfremde mehr und mehr zu vermenſchlichen .	88	0:121	werden aber dennoch von diese willkürlich Verbindung einiges hinübernehmen in d wahr Schöpfung d Schönheit , wie Kentaur , d Gefolge d Bacchus , Engel , Teufel , Gespenst , Wunder alle Art , so sein wohl zu bedenken : erstens , daß diese Geschöpf zu d Stoff gehören , welche d künstlerisch Phantasie von d Volksglauben überkommen , welche in diese Richtung noch nicht wahrhaft ästhetisch , sondern in d unreif Weise d Einbildungskraft dichten : Stoff , welche d Phantasie nun hinnehmen , wie Objekt d Naturschönheit , so aber , daß sie sich tätig erweisen , d wuchernd Übermaß zu beschneiden , d unstet Flucht zum Stehen zu bringen , d Wildfremde mehr und mehr zu vermenschlichen .	VAFIN ADV ADV APPR PDAT ADJA NN PIS VVPP APPR ART ADJA NN ART NN $, PWAV NN $, ART NN ART NE $, NE $, NE $, NN $, NN PIAT NN $, ADV VAFIN ADV PTKZU VVINF $. ADV $, KOUS PDAT NN APPR ART NN VVFIN $, PRELS ART ADJA NN APPR ART NN VVFIN $, PRELS APPR PDAT NN ADV PTKNEG ADV ADJD $, KON APPR ART ADJA NN ART NN VVPP $. NN $, PRELS ART NN ADV VVFIN $, KOKOM NN ART NN $, ADV ADV $, KOUS PPER PRF ADJD VVFIN $, ART ADJA NN PTKZU VVINF $, ART ADJA NN APPRART NN PTKZU VVINF $, ART NN ADV KON ADV PTKZU VVINF $.	Wird aber dennoch von diesen willkürlichen Verbindungen Einiges hinübergenommen in die wahre Schöpfung der Schönheit , wie Kentauren , das Gefolge des Bacchus , Engel , Teufel , Gespenster , Wunder aller Art , so ist wohl zu bedenken : erstens , daß diese Geschöpfe zu den Stoffen gehören , welche die künstlerische Phantasie von dem Volksglauben überkommt , welcher in dieser Richtung noch nicht wahrhaft ästhetisch , sondern in der unreifen Weise der Einbildungskraft gedichtet : Stoffe , welche die Phantasie nun hinnimmt , wie Objekte der Naturschönheit , so aber , daß sie sich tätig erweist , das wuchernde Übermaß zu beschneiden , die unstete Flucht zum Stehen zu bringen , das Wildfremde mehr und mehr zu vermenschlichen .
Naturschönheit	NN	1857	1	vischer_aesthetik030204_1857-1316-12	 	Durch alle diese Eigenschaften hat endlich die Scalenbewegung 4) auch vollkommenste Naturschönheit, sie ist ein Naturschönes, das man nicht anders haben möchte, ein Naturschönes zwar von sehr großer Einfachheit und daher für sich allein nicht befriedigend, aber darin doch gefällig durch reine, unmittelbare, ungekünstelte Objectivität.	84:98	0:336	Durch alle dieſe Eigenſchaften hat endlich die Scalenbewegung 4 ) auch vollkommenſte Naturſchönheit , ſie iſt ein Naturſchönes , das man nicht anders haben möchte , ein Naturſchönes zwar von ſehr großer Einfachheit und daher für ſich allein nicht befriedigend , aber darin doch gefällig durch reine , unmittelbare , ungekünſtelte Objectivität .	12	0:53	durch alle diese Eigenschaft haben endlich d Skalabewegung 4 ) auch vollkommen Naturschönheit , sie sein eine naturschön , die man nicht anders haben mögen , eine naturschön zwar von sehr groß Einfachheit und daher für sich allein nicht befriedigend , aber darin doch gefällig durch rein , unmittelbar , ungekünstelt Objektivität .	APPR PIAT PDAT NN VAFIN ADV ART NN CARD $( ADV ADJA NN $, PPER VAFIN ART ADJA $, PRELS PIS PTKNEG ADV VAINF VMFIN $, ART ADJA ADV APPR ADV ADJA NN KON PAV APPR PRF ADV PTKNEG ADJD $, KON PAV ADV ADJD APPR ADJA $, ADJA $, ADJA NN $.	Durch alle diese Eigenschaften hat endlich die Skalenbewegung 4 ) auch vollkommenste Naturschönheit , sie ist ein Naturschönes , das man nicht anders haben möchte , ein Naturschönes zwar von sehr großer Einfachheit und daher für sich allein nicht befriedigend , aber darin doch gefällig durch reine , unmittelbare , ungekünstelte Objektivität .
Naturschönheit	NN	1848	1	vischer_aesthetik0202_1848-366-3	 	Sie schaut die Naturschönheit; sie könnte dieß nicht, wenn sie nicht auch das Gewöhnliche mit hellen Sinnen faßte, denn sie unterscheidet jene von diesem.	15:29	0:154	Sie ſchaut die Naturſchönheit ; ſie könnte dieß nicht , wenn ſie nicht auch das Gewöhnliche mit hellen Sinnen faßte , denn ſie unterſcheidet jene von dieſem .	3	0:28	sie schauen d Naturschönheit ; sie können diese nicht , wenn sie nicht auch d Gewöhnliche mit hell Sinnen fassen , denn sie unterscheiden jene von diese .	PPER VVFIN ART NN $. PPER VMFIN PDS PTKNEG $, KOUS PPER PTKNEG ADV ART NN APPR ADJA NN VVFIN $, KON PPER VVFIN PDS APPR PDAT $.	Sie schaut die Naturschönheit ; sie könnte dies nicht , wenn sie nicht auch das Gewöhnliche mit hellen Sinnen faßte , denn sie unterscheidet jene von diesem .
Naturschönheit	NN	1892	1	lehnert_seehaefen02_1892-2424-1	 	Die Naturschönheiten Cubas zeichnen sich durch ihre Lieblichkeit und Mannigfaltigkeit aus.	4:20	0:90	Die Naturschönheiten Cubas zeichnen sich durch ihre Lieblichkeit und Mannigfaltigkeit aus .	1	0:12	d Naturschönheit Cuba zeichnen sich durch ihr Lieblichkeit und Mannigfaltigkeit aus .	ART NN NE VVFIN PRF APPR PPOSAT NN KON NN PTKVZ $.	Die Naturschönheiten Cubas zeichnen sich durch ihre Lieblichkeit und Mannigfaltigkeit aus .
Naturschönheit	NN	1862	1	fontane_brandenburg01_1862-1083-19	 	Dies mag es zum Theil erklären, weshalb ein Punkt unserer heimathlichen Mark so völlig unbesucht bleibt, dessen Naturschönheiten mindestens nicht verächtlich zu behandeln und dessen historische Erinnerungen allerersten Ranges sind.	112:128	0:231	Dies mag es zum Theil erklären , weshalb ein Punkt unſerer heimathlichen Mark ſo völlig unbeſucht bleibt , deſſen Naturſchönheiten mindeſtens nicht verächtlich zu behandeln und deſſen hiſtoriſche Erinnerungen allererſten Ranges ſind .	19	0:33	diese mögen es zum Teil erklären , weshalb eine Punkt unsere heimatlich Mark so völlig unbesucht bleiben , die Naturschönheit mindestens nicht verächtlich zu behandeln und die historisch Erinnerung allererst Rang sein .	PDS VMFIN PPER APPRART NN VVINF $, PWAV ART NN PPOSAT ADJA NN ADV ADJD ADJD VVFIN $, PRELAT NN ADV PTKNEG ADJD PTKZU VVINF KON PRELAT ADJA NN ADJA NN VAFIN $.	Dies mag es zum Teil erklären , weshalb ein Punkt unserer heimatlichen Mark so völlig unbesucht bleibt , dessen Naturschönheiten mindestens nicht verächtlich zu behandeln und dessen historische Erinnerungen allerersten Ranges sind .
Naturschönheit	NN	1869	1	michelis_reiseschule_1869-2397-64	 	Was er der Art findet, schreibt er aus, ordnet und gruppirt die Bruchstücke nach seinem Sinne, nimmt die ganze Collection mit auf jede seiner Reisen und versichert, daß alle Naturscenen, welche die Wirklichkeit ihm vorführt, ihn an diesen oder jenen Theil seiner Sammlung, und umgekehrt jeder Theil derselben, den er zu Hause liest, an genossene Naturschönheiten in der anregendsten Weise erinnere.	346:362	0:398	Was er der Art findet , ſchreibt er aus , ordnet und gruppirt die Bruchſtücke nach ſeinem Sinne , nimmt die ganze Collection mit auf jede ſeiner Reiſen und verſichert , daß alle Naturſcenen , welche die Wirklichkeit ihm vorführt , ihn an dieſen oder jenen Theil ſeiner Sammlung , und umgekehrt jeder Theil derſelben , den er zu Hauſe lieſt , an genoſſene Naturſchönheiten in der anregendſten Weiſe erinnere .	64	0:71	was er d Art finden , schreiben er aus , ordnen und gruppieren d Bruchstück nach seine Sinn , nehmen d ganz Kollektion mit auf jede seine Reise und versichern , daß alle Naturszene , welche d Wirklichkeit er vorführen , er an diese oder jen Teil seine Sammelung , und umgekehrt jede Teil dieselbe , die er zu Haus lesen , an genießen Naturschönheit in d anregend Weise erinnern .	PWS PPER ART NN VVFIN $, VVFIN PPER PTKVZ $, VVFIN KON VVFIN ART NN APPR PPOSAT NN $, VVFIN ART ADJA NN APPR APPR PIAT PPOSAT NN KON VVFIN $, KOUS PIAT NN $, PRELS ART NN PPER VVFIN $, PPER APPR PDAT KON PDAT NN PPOSAT NN $, KON ADJD PIAT NN PDS $, PRELS PPER APPR NN VVFIN $, APPR ADJA NN APPR ART ADJA NN VVFIN $.	Was er der Art findet , schreibt er aus , ordnet und gruppiert die Bruchstücke nach seinem Sinne , nimmt die ganze Kollektion mit auf jede seiner Reisen und versichert , daß alle Naturszenen , welche die Wirklichkeit ihm vorführt , ihn an diesen oder jenen Teil seiner Sammlung , und umgekehrt jeder Teil derselben , den er zu Hause liest , an genossene Naturschönheiten in der anregendsten Weise erinnere .
Naturschönheit	NN	1847	1	vischer_aesthetik0201_1847-307-7	 	Beide Welten treten zweimal auf, als Naturschönheit, dann als ideal umgebildete Schönheit.	37:51	0:90	Beide Welten treten zweimal auf , als Naturſchönheit , dann als ideal umgebildete Schönheit .	7	0:15	beide Welt treten zweimal auf , als Naturschönheit , dann als ideal umgebildet Schönheit .	PIAT NN VVFIN ADV PTKVZ $, KOKOM NN $, ADV KOKOM ADJD ADJA NN $.	Beide Welten treten zweimal auf , als Naturschönheit , dann als ideal umgebildete Schönheit .
Naturschönheit	NN	1845	1	griesinger_psychische_1845-5055-12	 	Die Anstalt muss dabei in einer gesunden, und wo möglich an Naturschönheiten reichen Gegend liegen, vielleicht am besten in unmittelbarer Nähe eines kleinen Städtchens, aus welchem sie ihre Bedürfnisse bequem beziehen, mit dessen Bewohnern sie leicht einigen Verkehr unterhalten kann; sehr grosse Städte brauchen indessen gleichfalls Anstalten in ihrer Nähe, und solche haben den Vortheil, viele frische Fälle zu bekommen; unter keinen Umständen aber soll eine Anstalt innerhalb der Mauern einer Stadt errichtet werden.	60:76	0:519	Die Anstalt muss dabei in einer gesunden , und wo möglich an Naturschönheiten reichen Gegend liegen , vielleicht am besten in unmittelbarer Nähe eines kleinen Städtchens , aus welchem sie ihre Bedürfnisse bequem beziehen , mit dessen Bewohnern sie leicht einigen Verkehr unterhalten kann ; sehr grosse Städte brauchen indessen gleichfalls Anstalten in ihrer Nähe , und solche haben den Vortheil , viele frische Fälle zu bekommen ; unter keinen Umständen aber soll eine Anstalt innerhalb der Mauern einer Stadt errichtet werden .	12	0:83	d Anstalt müssen dabei in eine gesund , und wo möglich an Naturschönheit reich Gegend liegen , vielleicht am gut in unmittelbar Nähe eine klein Stadtchen , aus welche sie ihr Bedürfnis bequem beziehen , mit die Bewohner sie leicht einige Verkehr unterhalten können ; sehr groß Stadt brauchen indessen gleichfalls Anstalten in ihr Nähe , und solch haben d Vorteil , viel frisch Fall zu bekommen ; unter keine Umstand aber sollen eine Anstalt innerhalb d Mauer eine Stadt errichten werden .	ART NN VMFIN PAV APPR ART ADJA $, KON PWAV ADJD APPR NN ADJA NN VVFIN $, ADV PTKA ADJD APPR ADJA NN ART ADJA NN $, APPR PRELS PPER PPOSAT NN ADJD VVINF $, APPR PRELAT NN PPER ADJD PIAT NN VVINF VMFIN $. ADV ADJA NN VVFIN ADV ADV NN APPR PPOSAT NN $, KON PIS VAFIN ART NN $, PIAT ADJA NN PTKZU VVINF $. APPR PIAT NN ADV VMFIN ART NN APPR ART NN ART NN VVPP VAINF $.	Die Anstalt muss dabei in einer gesunden , und wo möglich an Naturschönheiten reichen Gegend liegen , vielleicht am besten in unmittelbarer Nähe eines kleinen Städtchens , aus welchem sie ihre Bedürfnisse bequem beziehen , mit dessen Bewohnern sie leicht einigen Verkehr unterhalten kann ; sehr große Städte brauchen indessen gleichfalls Anstalten in ihrer Nähe , und solche haben den Vorteil , viele frische Fälle zu bekommen ; unter keinen Umständen aber soll eine Anstalt innerhalb der Mauern einer Stadt errichtet werden .
Naturschönheit	NN	1892	1	lehnert_seehaefen02_1892-4399-4	 	Letzteres ist eine an Naturschönheiten überreiche, etwa 12 km lange Schlucht am oberen Merced River, welche von senkrechten Granitwänden eingefasst wird, über die zahlreiche Wasserfälle stürzen (darunter der Yosemité-Fall, 2600 engl. Fuss hoch, der höchste Wasserfall der Erde).	22:38	0:278	Letzteres ist eine an Naturschönheiten überreiche , etwa 12 km lange Schlucht am oberen Merced River , welche von senkrechten Granitwänden eingefasst wird , über die zahlreiche Wasserfälle stürzen ( darunter der Yosemité-Fall , 2600 engl. Fuss hoch , der höchste Wasserfall der Erde ) .	4	0:46	letztere sein eine an Naturschönheit überreichen , etwa 12 Km lang Schlucht am ober Merced River , welche von senkrecht Granitwand einfassen werden , über d zahlreich Wasserfall stürzen ( darunter d Yosemite-Fall , 2600 Engl. Fuß hoch , d hoch Wasserfall d Erde ) .	PIS VAFIN ART APPR NN VVFIN $, ADV CARD NN ADJA NN APPRART ADJA NE NE $, PRELS APPR ADJA NN VVPP VAFIN $, APPR ART ADJA NN VVINF $( PAV ART NN $, CARD NN NN PTKVZ $, ART ADJA NN ART NN $( $.	Letzteres ist eine an Naturschönheiten überreiche , etwa 12 km lange Schlucht am oberen Merced River , welche von senkrechten Granitwänden eingefasst wird , über die zahlreiche Wasserfälle stürzen ( darunter der Yosemite-Fall , 2600 engl. Fuß hoch , der höchste Wasserfall der Erde ) .
Naturschönheit	NN	1820	1	froelich_virginia01_1820-1290-6	 	Mit durstigen Zügen trank’ ich jede Naturschönheit, jede Frühlingslust, wie der heitere Sterbende noch begierig den Duft der Blüthen und die Strahlen des Lichts empfängt.	36:50	0:170	Mit durſtigen Zuͤgen trank’ ich jede Naturſchoͤnheit , jede Fruͤhlingsluſt , wie der heitere Sterbende noch begierig den Duft der Bluͤthen und die Strahlen des Lichts empfaͤngt .	6	0:28	mit durstig Zug trinken ich jede Naturschönheit , jede Frühlingslust , wie d heiter Sterbende noch begierig d Duft d Blüte und d Strahl d Licht empfangen .	APPR ADJA NN VVFIN PPER PIAT NN $, PIAT NN $, PWAV ART ADJA NN ADV ADJD ART NN ART NN KON ART NN ART NN VVFIN $.	Mit durstigen Zügen trank ich jede Naturschönheit , jede Frühlingslust , wie der heitere Sterbende noch begierig den Duft der Blüten und die Strahlen des Lichts empfängt .
Naturschönheit	NN	1847	1	vischer_aesthetik0201_1847-3049-23	 	Ebenso ist es in der Aesthetik neu, daß diese Durchwanderung der Geschichte zu ihren Aufgaben, daß in die Lehre von der Naturschönheit auch eine Physiognomik der Geschichte gehört.	120:134	0:180	Ebenſo iſt es in der Aeſthetik neu , daß dieſe Durchwanderung der Geſchichte zu ihren Aufgaben , daß in die Lehre von der Naturſchönheit auch eine Phyſiognomik der Geſchichte gehört .	23	0:31	ebenso sein es in d Ästhetik neu , daß diese Durchwanderung d Geschichte zu ihr Aufgabe , daß in d Lehre von d Naturschönheit auch eine Physiognomik d Geschichte gehören .	ADV VAFIN PPER APPR ART NN ADJD $, KOUS PDAT NN ART NN APPR PPOSAT NN $, KOUS APPR ART NN APPR ART NN ADV ART NN ART NN VVFIN $.	Ebenso ist es in der Ästhetik neu , daß diese Durchwanderung der Geschichte zu ihren Aufgaben , daß in die Lehre von der Naturschönheit auch eine Physiognomik der Geschichte gehört .
Naturschönheit	NN	1847	1	vischer_aesthetik0201_1847-3263-14	 	Hier ist wieder ein Punkt, wo besonders einleuchtet, warum wir von der Naturschönheit in dieser Breite reden; denn jeder weiß, daß diese Gelegenheit ungezwungenen Anblicks dem Künstler unersetzlich ist.	71:85	0:202	Hier iſt wieder ein Punkt , wo beſonders einleuchtet , warum wir von der Naturſchönheit in dieſer Breite reden ; denn jeder weiß , daß dieſe Gelegenheit ungezwungenen Anblicks dem Künſtler unerſetzlich iſt .	14	0:34	hier sein wieder eine Punkt , wo besonders einleuchten , warum wir von d Naturschönheit in diese Breite reden ; denn jede wissen , daß diese Gelegenheit ungezwingen Anblick d Künstler unersetzlich sein .	ADV VAFIN ADV ART NN $, PWAV ADV VVFIN $, PWAV PPER APPR ART NN APPR PDAT NN VVINF $. KON PIS VVFIN $, KOUS PDAT NN ADJA NN ART NN ADJD VAFIN $.	Hier ist wieder ein Punkt , wo besonders einleuchtet , warum wir von der Naturschönheit in dieser Breite reden ; denn jeder weiß , daß diese Gelegenheit ungezwungenen Anblicks dem Künstler unersetzlich ist .
Naturschönheit	NN	1891	1	lehnert_seehaefen01_1891-14638-7	 	Auf der grünen Insel, dem durch Naturschönheiten mancherlei Art interessanten, von einem eigenthümlichen, vom angelsächsischen Wesen ganz verschiedenen Menschenschlage bewohnten Irland begegnen wir einer an Buchten und natürlichen Häfen reichen Küstenentwicklung, welche den Bedürfnissen des Handels und der Schiffahrt zum Vortheile gereicht.	32:48	0:342	Auf der grünen Insel , dem durch Naturschönheiten mancherlei Art interessanten , von einem eigenthümlichen , vom angelsächsischen Wesen ganz verschiedenen Menschenschlage bewohnten Irland begegnen wir einer an Buchten und natürlichen Häfen reichen Küstenentwicklung , welche den Bedürfnissen des Handels und der Schiffahrt zum Vortheile gereicht .	7	0:47	auf d grün Insel , die durch Naturschönheit mancherlei Art interessant , von eine eigentümlich , vom angelsächsisch Wesen ganz verschieden Menschenschlage bewohnt Irland begegnen wir eine an Bucht und natürlich Hafen reich Küstenentwicklung , welche d Bedürfnis d Handel und d Schiffahrt zum Vorteil gereichen .	APPR ART ADJA NN $, PRELS APPR NN PIAT NN ADJA $, APPR ART ADJA $, APPRART ADJA NN ADV ADJA NN ADJA NE VVFIN PPER ART APPR NN KON ADJA NN ADJA NN $, PRELS ART NN ART NN KON ART NN APPRART NN VVPP $.	Auf der grünen Insel , dem durch Naturschönheiten mancherlei Art interessanten , von einem eigentümlichen , vom angelsächsischen Wesen ganz verschiedenen Menschenschlage bewohnten Irland begegnen wir einer an Buchten und natürlichen Häfen reichen Küstenentwicklung , welche den Bedürfnissen des Handels und der Schiffahrt zum Vorteile gereicht .
Naturschönheit	NN	1847	1	vischer_aesthetik0201_1847-3014-11	 	Diese Studien bilden den Erfahrungsstoff für die mimische Kunst; die Naturschönheit gibt auch hier die Vorlage, die vorausgehen muß, Niemand kann und darf die Kunst der Mimik abstract aus der Phantasie spinnen.	69:83	0:210	Dieſe Studien bilden den Erfahrungsſtoff für die mimiſche Kunſt ; die Naturſchönheit gibt auch hier die Vorlage , die vorausgehen muß , Niemand kann und darf die Kunſt der Mimik abſtract aus der Phantaſie ſpinnen .	11	0:36	diese Studie bilden d Erfahrungsstoff für d mimisch Kunst ; d Naturschönheit geben auch hier d Vorlage , die vorausgehen müssen , niemand können und dürfen d Kunst d Mimik abstrakt aus d Phantasie spinnen .	PDAT NN VVFIN ART NN APPR ART ADJA NN $. ART NN VVFIN ADV ADV ART NN $, PRELS VVINF VMFIN $, PIS VMFIN KON VMFIN ART NN ART NN ADJD APPR ART NN VVFIN $.	Diese Studien bilden den Erfahrungsstoff für die mimische Kunst ; die Naturschönheit gibt auch hier die Vorlage , die vorausgehen muß , Niemand kann und darf die Kunst der Mimik abstrakt aus der Phantasie spinnen .
Naturschönheit	NN	1848	1	vischer_aesthetik0202_1848-612-14	 	Der Genius geht, wie im folgenden §. wieder aufzufassen ist, von der Naturschönheit aus.	69:83	0:88	Der Genius geht , wie im folgenden §. wieder aufzufaſſen iſt , von der Naturſchönheit aus .	14	0:17	d Genius gehen , wie im folgend §. wieder auffassen sein , von d Naturschönheit aus .	ART NN VVFIN $, PWAV APPRART ADJA $( ADV VVIZU VAFIN $, APPR ART NN PTKVZ $.	Der Genius geht , wie im folgenden §. wieder aufzufassen ist , von der Naturschönheit aus .
