lemma	pos	date	grouping	identifier	description	context	indexes_target_token	indexes_target_sentence	context_tokenized	indexes_target_token_tokenized	indexes_target_sentence_tokenized	context_lemmatized	context_pos	context_normalized
Naturschönheit	NN	1978	2	2532889X_1978-01-14_01_176.tcf.xml-12-4	 	Sehr angetan von solcher Naturschönheit war auch der 28jänrige Johann Wolfgang Goethe, der vor genau 200 Jahren • in die nach ihrem Entdecker benannte Baumannshöhle einstieg, die heute längst zu den öffentlichen Schau -	25:39	0:219	Sehr angetan von solcher Naturschönheit war auch der 28jänrige Johann Wolfgang Goethe , der vor genau 200 Jahren • in die nach ihrem Entdecker benannte Baumannshöhle einstieg , die heute längst zu den öffentlichen Schau -	4	0:36	sehr angetan von solch Naturschönheit sein auch d 28jänrige Johann Wolfgang Goethe , die vor genau 200 Jahr • in d nach ihr Entdecker benennt Baumannshöhle einsteigen , die heute längst zu d öffentlich Schau -	ADV ADJD APPR PIAT NN VAFIN ADV ART NN NE NE NE $, PRELS APPR ADJD CARD NN $( APPR ART APPR PPOSAT NN ADJA NN VVFIN $, PRELS ADV ADV APPR ART ADJA NN $(	
Naturschönheit	NN	1978	2	2532889X_1978-10-17_01_173.tcf.xml-39-52	 	Karlheinz Munds und Günter Rückers schönen Film über den Schöpfer der „Internationale", „De Geyter — Geschichte eines Liedes", Kurt Tetzlaffs Film „Und sie bewegt. sich doch" über die Entstehung von Brechts „Galilei", Werner Kohlerts „Romantisch pittoreske Reise durch die Naturschönheiten der Sächsischen Schweiz", die zugleich auch zum gedankenreichen Ausflug in die Historie einer Landschaft wurde, die Filmpolemiken von Sabine Katins, den Bericht Heinz Schnabels und Fritz Haberlands über den ersten Fliegerkosmonauten der DDR oder auch „Das kürzere Streichholz — Einige Erinnerungen von Hans Rodenberg", ein faszinierender, filmisch ungewöhnlicher Lebensbericht, der Erika ¦ und Rolf Richter zu danken ist.	273:289	0:711	Karlheinz Munds und Günter Rückers schönen Film über den Schöpfer der „ Internationale " , „ De Geyter — Geschichte eines Liedes " , Kurt Tetzlaffs Film „ Und sie bewegt . sich doch " über die Entstehung von Brechts „ Galilei " , Werner Kohlerts „ Romantisch pittoreske Reise durch die Naturschönheiten der Sächsischen Schweiz " , die zugleich auch zum gedankenreichen Ausflug in die Historie einer Landschaft wurde , die Filmpolemiken von Sabine Katins , den Bericht Heinz Schnabels und Fritz Haberlands über den ersten Fliegerkosmonauten der DDR oder auch „ Das kürzere Streichholz — Einige Erinnerungen von Hans Rodenberg " , ein faszinierender , filmisch ungewöhnlicher Lebensbericht , der Erika ¦ und Rolf Richter zu danken ist .	52	0:121	Karlheinz Mund und Günter Rückers schön Film über d Schöpfer d „ international " , „ de geyter — Geschichte eine Lied " , Kurt Tetzlaff Film „ und sie bewegen . sich doch " über d Entstehung von Brecht „ Galilei " , Werner Kohlert „ Romantisch pittoresk Reise durch d Naturschönheit d sächsisch Schweiz " , die zugleich auch zum gedankenreich Ausflug in d Historie eine Landschaft werden , d Filmpolemik von Sabine Katins , d Bericht Heinz Schnabel und Fritz Haberland über d erst Fliegerkosmonaut d DDR oder auch „ d kurz Streichholz — einige Erinnerung von Hans Rodenberg " , eine faszinierend , filmisch ungewöhnlich Lebensbericht , d Erika ¦ und Rolf Richter zu danken sein .	NE NE KON NE NE ADJA NN APPR ART NN ART $( ADJA $( $, $( FM FM $( NN ART NN $( $, NE NE NN $( KON PPER VVFIN $. PRF ADV $( APPR ART NN APPR NE $( NE $( $, NE NE $( NN ADJA NN APPR ART NN ART ADJA NE $( $, PRELS ADV ADV APPRART ADJA NN APPR ART NN ART NN VAFIN $, ART NN APPR NE NE $, ART NN NE NE KON NE NE APPR ART ADJA NN ART NE KON ADV $( ART ADJA NN $( PIAT NN APPR NE NE $( $, ART ADJA $, ADJD ADJA NN $, ART NN $( KON NE NN PTKZU VVINF VAFIN $.	
Naturschönheit	NN	1965	2	26120215_1965_09_04_01_080.tcf.xml-7-5	 	Doch viel Zeit um die Naturschönheiten zu bewundern, ließ Trainer Karoly Soos seinen Schützlingen nicht.	22:38	0:104	Doch viel Zeit um die Naturschönheiten zu bewundern , ließ Trainer Karoly Soos seinen Schützlingen nicht .	5	0:17	doch viel Zeit um d Naturschönheit zu bewundern , lassen Trainer Karoly Soos seine Schützling nicht .	KON PIAT NN APPR ART NN PTKZU VVINF $, VVFIN NN NE NE PPOSAT NN PTKNEG $.	
Naturschönheit	NN	1961	2	26120215_1961_05_12_01_280.tcf.xml-102-25	 	Ungern trennen wir uns von der schönen CSSR. die uns nicht nur mit ihrer bedeutenden und leistungsfähigen Industrie beeindruckt, sondern unsere Herzen mit ihren Naturschönheiten gewinnt, mit den reizvollen, sanften Tälern und Höhen des Mittelgebirges, der herben Schönheit der dunklen Karpatenwalder oder mit dem eindrucksvollen Hochgebirge der Hohen Tatra.	161:177	0:357	Ungern trennen wir uns von der schönen CSSR. die uns nicht nur mit ihrer bedeutenden und leistungsfähigen Industrie beeindruckt , sondern unsere Herzen mit ihren Naturschönheiten gewinnt , mit den reizvollen , sanften Tälern und Höhen des Mittelgebirges , der herben Schönheit der dunklen Karpatenwalder oder mit dem eindrucksvollen Hochgebirge der Hohen Tatra .	25	0:54	ungern trennen wir uns von d schön CSSR. d wir nicht nur mit ihr bedeutend und leistungsfähig Industrie beeindrucken , sondern unsere Herz mit ihr Naturschönheit gewinnen , mit d reizvoll , sanft Tal und Höhe d Mittelgebirge , d herb Schönheit d dunkel Karpatenwalder oder mit d eindrucksvoll Hochgebirge d hoch Tatra .	ADV VVFIN PPER PRF APPR ART ADJA NN ART PPER PTKNEG ADV APPR PPOSAT ADJA KON ADJA NN VVPP $, KON PPOSAT NN APPR PPOSAT NN VVFIN $, APPR ART ADJA $, ADJA NN KON NN ART NN $, ART ADJA NN ART ADJA NN KON APPR ART ADJA NN ART ADJA NN $.	
Naturschönheit	NN	1980	2	2532889X_1980-10-06_01_043.tcf.xml-15-19	 	Die Leitungen dieser Erholungsstätten geben viele Anregungen, so zur Freizeitgestaltung, für Stadtrundfahrten, Sportwetucampfe, Hinweise auf Naturschönheiten und anderes mehr.	141:157	0:175	Die Leitungen dieser Erholungsstätten geben viele Anregungen , so zur Freizeitgestaltung , für Stadtrundfahrten , Sportwetucampfe , Hinweise auf Naturschönheiten und anderes mehr .	19	0:24	d Leitung diese Erholungsstätte geben viel Anregung , so zur Freizeitgestaltung , für Stadtrundfahrt , Sportwetucampfe , Hinweis auf Naturschönheit und andere mehr .	ART NN PDAT NN VVFIN PIAT NN $, ADV APPRART NN $, APPR NN $, NE $, NN APPR NN KON PIS PIS $.	
Naturschönheit	NN	1962	2	2532889X_1962-08-10_01_050.tcf.xml-8-8	 	Nur ein Mensch, der die ganz besondere Naturschönheit Württembergs in sich aufgenommen hatte, konnte so zauberhafte Geschichten wie den s, Knulp" oder „Klingsors letzter Sommer** oder einen Roman so voller Poesie wie uNarziß und Goldmund" schreiben.	39:53	0:249	Nur ein Mensch , der die ganz besondere Naturschönheit Württembergs in sich aufgenommen hatte , konnte so zauberhafte Geschichten wie den s , Knulp " oder „ Klingsors letzter Sommer** oder einen Roman so voller Poesie wie uNarziß und Goldmund " schreiben .	8	0:43	nur eine Mensch , die d ganz besondere Naturschönheit Württemberg in sich aufnehmen haben , können so zauberhaft Geschichte wie d s , knulp " oder „ Klingsor letzte Sommer** oder eine Roman so voll Poesie wie Unarziß und Goldmund " schreiben .	ADV ART NN $, PRELS ART ADV ADJA NN NE APPR PRF VVPP VAFIN $, VMFIN ADV ADJA NN KOKOM ART FM $, FM $( KON $( NE ADJA NN KON ART NN ADV ADJA NN KOKOM NE KON NE $( VVINF $.	
Naturschönheit	NN	1979	2	2532889X_1979-11-22_01_075.tcf.xml-7-10	 	Insgesamt erhielten 45 Gedenkstätten, Altertumer und Orte von außergewöhnlicher Naturschönheit in aller Welt dieses Prädikat, darunter die Königsgräber des antiken Theben, der Mounit Everest und der Grand Canon in den USA.	80:94	0:222	Insgesamt erhielten 45 Gedenkstätten , Altertumer und Orte von außergewöhnlicher Naturschönheit in aller Welt dieses Prädikat , darunter die Königsgräber des antiken Theben , der Mounit Everest und der Grand Canon in den USA .	10	0:35	insgesamt erhalten 45 Gedenkstätte , Altertumer und Ort von außergewöhnlich Naturschönheit in alle Welt diese Prädikat , darunter d Königsgrab d antik Theben , die Mounit Everest und d grand canon in d Usa .	ADV VVFIN CARD NN $, NE KON NN APPR ADJA NN APPR PIAT NN PDAT NN $, PAV ART NN ART ADJA NE $, PRELS NE NE KON ART FM FM APPR ART NE $.	
Naturschönheit	NN	1989	2	26120215_1989_05_17_01_182.tcf.xml-2-8	 	Neben Sachliteratur, die in Wort und Bild Naturschönheiten sowie erhaltenswerte Kunststätten dn allen Teilen der Welt vorstellt. sind geschichtliche Abrisse und dokumentarische Darstellungen zu sehen.	42:58	0:200	Neben Sachliteratur , die in Wort und Bild Naturschönheiten sowie erhaltenswerte Kunststätten dn allen Teilen der Welt vorstellt . sind geschichtliche Abrisse und dokumentarische Darstellungen zu sehen .	8	0:28	neben Sacheliteratur , die in Wort und Bild Naturschönheit sowie erhaltenswert Kunststätte Dn alle Teil d Welt vorstellen . sein geschichtlich Abriß und dokumentarisch Darstellung zu sehen .	APPR NN $, PRELS APPR NN KON NN NN KON ADJA NN NE PIAT NN ART NN VVFIN $. VAFIN ADJA NN KON ADJA NN PTKZU VVINF $.	
Naturschönheit	NN	1983	2	26120215_1983_02_14_01_100.tcf.xml-12-3	 	Sie lernten die Naturschönheiten der Löcknitz-Landschaft kennen, und bewährten sich im touristischen Mehrkampf. Gut erholt werden die Schülerlotsen morgen zurückkehren.	16:32	0:168	Sie lernten die Naturschönheiten der Löcknitz-Landschaft kennen , und bewährten sich im touristischen Mehrkampf. Gut erholt werden die Schülerlotsen morgen zurückkehren .	3	0:22	sie lernen d Naturschönheit d Löcknitz-Landschaft kennen , und bewährt sich im touristisch Mehrkampf. gut erholen werden d Schülerlotse morgen zurückkehren .	PPER VVFIN ART NN ART NN VVINF $, KON ADJA PRF APPRART ADJA NN ADJD VVPP VAFIN ART NN ADV VVINF $.	
Naturschönheit	NN	1963	2	2532889X_1963-10-23_01_115.tcf.xml-46-6	 	Land, das so reich an Naturschönheiten ist mit nach Moskau.	22:38	0:59	Land , das so reich an Naturschönheiten ist mit nach Moskau .	6	0:12	Land , die so reich an Naturschönheit sein mit nach Moskau .	NN $, PRELS ADV ADJD APPR NN VAFIN APPR APPR NE $.	
Naturschönheit	NN	1978	2	26120215_1978_08_10_01_321.tcf.xml-5-20	 	Dresden, Prag und Sofia Werke der bildenden Kunst über cien AHtuü der Werktätigen in diesem Teil Bulgariens sowie über Naturschönheiten von Wyschez schallen.	119:135	0:157	Dresden , Prag und Sofia Werke der bildenden Kunst über cien AHtuü der Werktätigen in diesem Teil Bulgariens sowie über Naturschönheiten von Wyschez schallen .	20	0:25	Dresden , Prag und Sofia Werk d bildend Kunst über Cien Ahtuü d Werktätige in diese Teil Bulgarien sowie über Naturschönheit von Wyschez schallen .	NE $, NE KON NE NN ART ADJA NN APPR NE NE ART NN APPR PDAT NN NE KON APPR NN APPR NE VVINF $.	
Naturschönheit	NN	1983	2	2532889X_1983-06-08_01_071.tcf.xml-7-17	 	Seine Arbeiten beziehen ihren eigentümlichen Reiz aus der Verbindung von bilddichterischer Phantasie und den mannigfachen Anregungen der Naturschönheiten, die seine kubanische Heimat bietet	137:153	0:189	Seine Arbeiten beziehen ihren eigentümlichen Reiz aus der Verbindung von bilddichterischer Phantasie und den mannigfachen Anregungen der Naturschönheiten , die seine kubanische Heimat bietet	17	0:24	seine Arbeit beziehen ihr eigentümlich Reiz aus d Verbindung von bilddichterisch Phantasie und d mannigfach Anregung d Naturschönheit , die seine kubanisch Heimat bieten	PPOSAT NN VVFIN PPOSAT ADJA NN APPR ART NN APPR ADJA NN KON ART ADJA NN ART NN $, PRELS PPOSAT ADJA NN VVFIN	
Naturschönheit	NN	1978	2	26120215_1978_03_25_01_449.tcf.xml-32-17	 	Überall im Kreis Beeskow spürte ich eine Atmosphäre der aktiven Naturliebe, der engagierten Pflege der heimatlichen Naturschönheiten.	116:132	0:133	Überall im Kreis Beeskow spürte ich eine Atmosphäre der aktiven Naturliebe , der engagierten Pflege der heimatlichen Naturschönheiten .	17	0:19	überall im Kreis Beeskow spüren ich eine Atmosphäre d aktiv Naturliebe , d engagiert Pflege d heimatlich Naturschönheit .	ADV APPRART NN NE VVFIN PPER ART NN ART ADJA NN $, ART ADJA NN ART ADJA NN $.	
Naturschönheit	NN	1984	2	2532889X_1984-12-18_01_121.tcf.xml-8-9	 	Ein Naturlehrpfad soll angelegt werden, reizvoller Weg zu Naturschönheiten.	58:74	0:75	Ein Naturlehrpfad soll angelegt werden , reizvoller Weg zu Naturschönheiten .	9	0:11	eine Naturlehrpfad sollen anlegen werden , reizvoll Weg zu Naturschönheit .	ART NN VMFIN VVPP VAINF $, ADJA NN APPR NN $.	
Naturschönheit	NN	1981	2	26120215_1981_05_14_01_262.tcf.xml-55-14	 	fahren, weil es so viel Malerisches und Pittoreskes zu schauen gibt ein mit Naturschönheiten gesegnetes Land.	76:92	0:109	fahren , weil es so viel Malerisches und Pittoreskes zu schauen gibt ein mit Naturschönheiten gesegnetes Land .	14	0:18	fahren , weil es so viel malerisch und pittoresk zu schauen geben eine mit Naturschönheit gesegnet Land .	VVINF $, KOUS PPER ADV PIAT ADJA KON ADJA PTKZU VVINF VVFIN ART APPR NN ADJA NN $.	
Naturschönheit	NN	1974	2	2532889X_1974-06-08_01_241.tcf.xml-19-16	 	Wenn in diesem Jahr trotzdem schon zahlreiche Reisebüros Tagesausfluge hierher organisieren, dann eben wegen der Naturschönheiten, wegen des Barockschlosses von Räckeve, in dessen Hof während der warmen Jahreszeit auch Konzerte erklingen, wegen eines Thermalbades und der weithin berühmten Ikonen in der serbischen Kirche von Radceve.	113:129	0:334	Wenn in diesem Jahr trotzdem schon zahlreiche Reisebüros Tagesausfluge hierher organisieren , dann eben wegen der Naturschönheiten , wegen des Barockschlosses von Räckeve , in dessen Hof während der warmen Jahreszeit auch Konzerte erklingen , wegen eines Thermalbades und der weithin berühmten Ikonen in der serbischen Kirche von Radceve .	16	0:50	wenn in diese Jahr trotzdem schon zahlreich Reisebüro Tagesausflug hierher organisieren , dann eben wegen d Naturschönheit , wegen d Barockschloß von Räckeve , in die Hof während d warm Jahreszeit auch Konzert erklingen , wegen eine Thermalbad und d weithin berühmt Ikone in d serbisch Kirche von Radceve .	KOUS APPR PDAT NN PAV ADV ADJA NN NN PAV VVINF $, ADV ADV APPR ART NN $, APPR ART NN APPR NE $, APPR PRELAT NN APPR ART ADJA NN ADV NN VVINF $, APPR ART NN KON ART ADV ADJA NN APPR ART ADJA NN APPR NE $.	
Naturschönheit	NN	1969	2	2532889X_1969-01-25_01_293.tcf.xml-2-14	 	Nepal, das Königreich am Fuße des Himalaya, beeindruckt jeden Fremden durch seine Naturschönheiten.	82:98	0:99	Nepal , das Königreich am Fuße des Himalaya , beeindruckt jeden Fremden durch seine Naturschönheiten .	14	0:16	Nepal , d Königreich am Fuß d Himalaya , beeindruckt jede Fremde durch seine Naturschönheit .	NE $, ART NN APPRART NN ART NE $, ADJD PIAT NN APPR PPOSAT NN $.	
Naturschönheit	NN	1988	2	26120215_1988_11_26_01_086.tcf.xml-4-10	 	Da sind zum Beispiel ungewöhnliche Kompositionen von exotischen und einheimischen Naturschönheiten: Elegante Paradiesvogelblumen mit Grasern und glutrotem Strauchgeäst, die Flamingoblume in dekorativer Nachbarschaft von Farnen und Zweigen.	82:98	0:239	Da sind zum Beispiel ungewöhnliche Kompositionen von exotischen und einheimischen Naturschönheiten : Elegante Paradiesvogelblumen mit Grasern und glutrotem Strauchgeäst , die Flamingoblume in dekorativer Nachbarschaft von Farnen und Zweigen .	10	0:30	da sein zum Beispiel ungewöhnlich Komposition von exotisch und einheimisch Naturschönheit : elegant Paradiesvogelblume mit Graser und glutrot Strauchgeäst , d Flamingoblume in dekorativ Nachbarschaft von Farn und Zweig .	ADV VAFIN APPRART NN ADJA NN APPR ADJA KON ADJA NN $. ADJA NN APPR NN KON ADJA NN $, ART NN APPR ADJA NN APPR NN KON NN $.	
Naturschönheit	NN	1963	2	26120215_1963_12_15_01_259.tcf.xml-11-12	 	Weil Stolz und Würde der Nation es gebieten und weil die kostbaren Naturschönheiten der Parks den kommenden Generationen ungeschmälert übergeben werden sollen.	67:83	0:159	Weil Stolz und Würde der Nation es gebieten und weil die kostbaren Naturschönheiten der Parks den kommenden Generationen ungeschmälert übergeben werden sollen .	12	0:23	weil Stolz und Würde d Nation es gebieten und weil d kostbar Naturschönheit d Park d kommend Generation ungeschmälert übergeben werden sollen .	KOUS NN KON NN ART NN PPER VVINF KON KOUS ART ADJA NN ART NN ART ADJA NN ADJD VVPP VAINF VMFIN $.	
Naturschönheit	NN	1976	2	2532889X_1976-09-11_01_346.tcf.xml-20-7	 	So wird die Obedska Bara als einzigartige Naturschönheit erhalten werden und Reservat für Zug-und Sumpfvögel bleiben, zugleich aber als Ausflugsziel für die Belgrader immer anziehender werden.	42:56	0:192	So wird die Obedska Bara als einzigartige Naturschönheit erhalten werden und Reservat für Zug- und Sumpfvögel bleiben , zugleich aber als Ausflugsziel für die Belgrader immer anziehender werden .	7	0:29	so werden d Obedska Bara als einzigartig Naturschönheit erhalten werden und Reservat für zug- und Sumpfvogel bleiben , zugleich aber als Ausflugsziel für d Belgrader immer anziehend werden .	ADV VAFIN ART NN NE KOUS ADJA NN VVPP VAINF KON NN APPR TRUNC KON NN VVINF $, ADV ADV KOUS NN APPR ART ADJA ADV ADJD VAINF $.	
Naturschönheit	NN	1984	2	2532889X_1984-07-09_01_058.tcf.xml-4-1	 	Die Naturschönheiten und kulturhistorischen Se henswürdigkeiten ziehen jährlich rund vier Millionen Ausflügler sowie 260000 Urlauber an	4:20	0:135	Die Naturschönheiten und kulturhistorischen Se henswürdigkeiten ziehen jährlich rund vier Millionen Ausflügler sowie 260000 Urlauber an	1	0:16	d Naturschönheit und kulturhistorisch Se Henswürdigkeiten ziehen jährlich rund vier Million Ausflügler sowie 260000 Urlauber an	ART NN KON ADJA NE NE VVFIN ADJD ADJD CARD NN NN KON CARD NN PTKVZ	
Naturschönheit	NN	1957	2	26120215_1957_04_13_01_180.tcf.xml-14-13	 	Es geht in das Kerngebiet des „Blumenthal '" mit seinen herrlichen Naturschönheiten, Waldseen und Höhen.	67:83	0:104	Es geht in das Kerngebiet des „ Blumenthal ' " mit seinen herrlichen Naturschönheiten , Waldseen und Höhen .	13	0:19	es gehen in d Kerngebiet d „ Blumenthal ' " mit seine herrlich Naturschönheit , Waldsee und Höhe .	PPER VVFIN APPR ART NN ART $( NE $( $( APPR PPOSAT ADJA NN $, NN KON NN $.	
Naturschönheit	NN	1966	2	26120215_1966_01_09_01_048.tcf.xml-2-2	 	Die zauberhaften Naturschönheiten und die einzigartigen klimatischen Bedingungen regten sowjetische Wissenschaftler an, ein Projekt zur Schaffung eines Nationalparks der UdSSR rund um den Baikalsee auszuarbeiten, wobei gleichzeitig die natürlichen Reserven des Baikalsees rationell volkswirtschaftlich genutzt werden sollen.	17:33	0:324	Die zauberhaften Naturschönheiten und die einzigartigen klimatischen Bedingungen regten sowjetische Wissenschaftler an , ein Projekt zur Schaffung eines Nationalparks der UdSSR rund um den Baikalsee auszuarbeiten , wobei gleichzeitig die natürlichen Reserven des Baikalsees rationell volkswirtschaftlich genutzt werden sollen .	2	0:40	d zauberhaft Naturschönheit und d einzigartig klimatisch Bedingung regen sowjetisch Wissenschaftler an , eine Projekt zur Schaffung eine Nationalpark d UdSSR rund um d Baikalsee ausarbeiten , wobei gleichzeitig d natürlich Reserve d Baikalsee rationell volkswirtschaftlich nutzen werden sollen .	ART ADJA NN KON ART ADJA ADJA NN VVFIN ADJA NN PTKVZ $, ART NN APPRART NN ART NN ART NN ADJD APPR ART NE VVIZU $, PWAV ADJD ART ADJA NN ART NE ADJD ADJD VVPP VAINF VMFIN $.	
Naturschönheit	NN	1982	2	26120215_1982_07_30_01_055.tcf.xml-9-26	 	Neben zahlreichen botanischen Gärten in allen Landesteilen gibt es in der SFRJ 20 Naturparks, 50 Naturschutzgebiete sowie über 100 Naturreservate, die der Bewahrung besonderer Naturschönheiten, aber auch einer einmaligen Fauna und Flora dienen.	176:192	0:244	Neben zahlreichen botanischen Gärten in allen Landesteilen gibt es in der SFRJ 20 Naturparks , 50 Naturschutzgebiete sowie über 100 Naturreservate , die der Bewahrung besonderer Naturschönheiten , aber auch einer einmaligen Fauna und Flora dienen .	26	0:37	neben zahlreich botanisch Garten in alle Landesteil geben es in d SFRJ 20 Naturpark , 50 Naturschutzgebiet sowie über 100 Naturreservat , die d Bewahrung besondere Naturschönheit , aber auch eine einmalig Fauna und Flora dienen .	APPR ADJA ADJA NN APPR PIAT NN VVFIN PPER APPR ART NE CARD NN $, CARD NN KON APPR CARD NN $, PRELS ART NN ADJA NN $, ADV ADV ART ADJA NN KON NN VVINF $.	
Naturschönheit	NN	1982	2	2532889X_1982-09-08_01_122.tcf.xml-15-24	 	In diesem Sinne versuchen die Mitarbeiter des Nationalparks, freiwillige Helfer des Naturschutzverbandes und die Angehörigen des Bergrettungsdienstes, Massentounsmus und die Erhaltung der Naturschönheiten in Einklang zu bringen.	188:204	0:228	In diesem Sinne versuchen die Mitarbeiter des Nationalparks , freiwillige Helfer des Naturschutzverbandes und die Angehörigen des Bergrettungsdienstes , Massentounsmus und die Erhaltung der Naturschönheiten in Einklang zu bringen .	24	0:30	in diese Sinn versuchen d Mitarbeiter d Nationalpark , freiwillig Helfer d Naturschutzverband und d Angehörige d Bergrettungsdienst , Massentounsmus und d Erhaltung d Naturschönheit in Einklang zu bringen .	APPR PDAT NN VVFIN ART NN ART NN $, ADJA NN ART NN KON ART NN ART NN $, NE KON ART NN ART NN APPR NN PTKZU VVINF $.	
Naturschönheit	NN	1972	2	26120215_1972_03_05_01_026.tcf.xml-12-16	 	Im Chemiebezirk Halle konzentrieren die Bürger im Mach-mit-Wettbewerb viele Aktivitäten auf die Pflege der Naturschönheiten und auf den Landschaftsschutz.	107:123	0:154	Im Chemiebezirk Halle konzentrieren die Bürger im Mach- mit- Wettbewerb viele Aktivitäten auf die Pflege der Naturschönheiten und auf den Landschaftsschutz .	16	0:22	im Chemiebezirk Halle konzentrieren d Bürger im mach- mit- Wettbewerb viel Aktivität auf d Pflege d Naturschönheit und auf d Landschaftsschutz .	APPRART NN NE VVFIN ART NN APPRART TRUNC TRUNC NN PIAT NN APPR ART NN ART NN KON APPR ART NN $.	
Naturschönheit	NN	1967	2	26120215_1967_02_04_01_248.tcf.xml-41-7	 	Oberst Hiroshi. ein leidenschaftlicher Verehrer von Naturschönheiten und zugleich ein sehr kriegerisch gesinnter Mann, hatte unterwegs geprahlt, daß die iapanischen Truppen in China dreimal so schnell vorrucken wurden wie zu Besinn des Jahrhunderts in Rußland.	52:68	0:260	Oberst Hiroshi . ein leidenschaftlicher Verehrer von Naturschönheiten und zugleich ein sehr kriegerisch gesinnter Mann , hatte unterwegs geprahlt , daß die iapanischen Truppen in China dreimal so schnell vorrucken wurden wie zu Besinn des Jahrhunderts in Rußland .	7	0:39	Oberst Hiroshi . eine leidenschaftlich Verehrer von Naturschönheit und zugleich eine sehr kriegerisch gesinnt Mann , haben unterwegs prahlen , daß d iapanischen Truppe in China dreimal so schnell vorrucken werden wie zu besinnen d Jahrhundert in Rußland .	NN NE $. ART ADJA NN APPR NN KON ADV ART ADV ADJD ADJA NN $, VAFIN ADV VVPP $, KOUS ART ADJA NN APPR NE ADV ADV ADJD VVINF VAFIN KOKOM APPR VVIMP ART NN APPR NE $.	
Naturschönheit	NN	1987	2	2532889X_1987-08-08_01_278.tcf.xml-10-17	 	Wenn man nicht gerade „Kilometer schrubbt", kann man links und rechts der Route viele Naturschönheiten bewundern, Wanderungen zu Fuß in die Landschafts-und Naturschutzgebiete unternehmen oder auch den Rotemoorberg bei Wesenberg erklimmen.	86:102	0:238	Wenn man nicht gerade „ Kilometer schrubbt " , kann man links und rechts der Route viele Naturschönheiten bewundern , Wanderungen zu Fuß in die Landschafts- und Naturschutzgebiete unternehmen oder auch den Rotemoorberg bei Wesenberg erklimmen .	17	0:37	wenn man nicht gerade „ Kilometer schrubben " , können man links und rechts d Route viel Naturschönheit bewundern , Wanderung zu Fuß in d landschafts- und Naturschutzgebiet unternehmen oder auch d Rotemoorberg bei Wesenberg erklimmen .	KOUS PIS PTKNEG ADV $( NN VVFIN $( $, VMFIN PIS ADV KON ADV ART NN PIAT NN VVINF $, NN APPR NN APPR ART TRUNC KON NN VVINF KON ADV ART NN APPR NN VVINF $.	
Naturschönheit	NN	1975	2	26120215_1975_02_25_01_161.tcf.xml-3-8	 	Bei frühlingshaftem Wetter genießen sie auf Wanderungen die Naturschönheiten des Thüringer Waldes oder des Südharzes.	60:76	0:117	Bei frühlingshaftem Wetter genießen sie auf Wanderungen die Naturschönheiten des Thüringer Waldes oder des Südharzes .	8	0:16	bei frühlingshaft Wetter genießen sie auf Wanderung d Naturschönheit d thüringer Wald oder d Südenharz .	APPR ADJA NN VVFIN PPER APPR NN ART NN ART ADJA NN KON ART NN $.	
Naturschönheit	NN	1965	2	2532889X_1965-04-16_01_121.tcf.xml-66-5	 	Man mußte einen Teil der Naturschönheit opfern, um Größeres zu erhalten.	25:39	0:72	Man mußte einen Teil der Naturschönheit opfern , um Größeres zu erhalten .	5	0:13	man müssen eine Teil d Naturschönheit opfern , um Größere zu erhalten .	PIS VMFIN ART NN ART NN VVINF $, KOUI NN PTKZU VVINF $.	
Naturschönheit	NN	1955	2	2532889X_1955-03-02_01_066.tcf.xml-22-10	 	Scltene Pflanzen sollen gezüchtet werden * geologische Besonderheiten untersucht und Naturschönheiten zugänglich ¦ gemacht und beschrieben werden.	85:101	0:146	Scltene Pflanzen sollen gezüchtet werden * geologische Besonderheiten untersucht und Naturschönheiten zugänglich ¦ gemacht und beschrieben werden .	10	0:18	Scltene Pflanze sollen züchten werden * geologisch Besonderheit untersuchen und Naturschönheit zugänglich ¦ machen und beschreiben werden .	NE NN VMFIN VVPP VAINF XY ADJA NN VVPP KON NN ADJD $( VVPP KON VVPP VAINF $.	
