lemma	identifier	context	indexes_target_token	context_normalized
Pachtzins	baumstark_encyclopaedie_1835-17495-57	Jedoch man macht besonders beim Salzmonopole den Einwand, daß es für den Volkswohlstand äußerst nützlich sei, im ganzen Lande einen gleichförmigen Salzpreis zu erhalten und daß dies vorzüglich durch die Salzsteuer, wenn der Staat die Regie nicht habe, erschwert werde, weil die Kosten der Versendung, die Haltung der Magazine und der Pachtzins einen weit größeren Aufwand begründen müsse, als die Regiekosten des Staats betrügen, und der deßhalb und durch die Steuer steigende Salzpreis die Consumtion des Salzes und den Steuerertrag vermindern, so wie die Lust zum einschwärzen vergrößern werde6).	334:343	Jedoch man macht besonders beim Salzmonopole den Einwand , daß es für den Volkswohlstand äußerst nützlich sei , im ganzen Lande einen gleichförmigen Salzpreis zu erhalten und daß dies vorzüglich durch die Salzsteuer , wenn der Staat die Regie nicht habe , erschwert werde , weil die Kosten der Versendung , die Haltung der Magazine und der Pachtzins einen weit größeren Aufwand begründen müsse , als die Regiekosten des Staats betrügen , und der deshalb und durch die Steuer steigende Salzpreis die Konsumtion des Salzes und den Steuerertrag vermindern , so wie die Lust zum einschwärzen vergrößern werde6 ) .
Pachtzins	fontane_brandenburg02_1863-6330-3	Später wurde der Pachtzins wahrscheinlich ausschließlich in Geld geleistet, weshalb wir von einer Kasse sprechen hören, die sich auf dem Schulzenhof in Kienbaum befand und daselbst verwaltet wurde.	17:26	Später wurde der Pachtzins wahrscheinlich ausschließlich in Geld geleistet , weshalb wir von einer Kasse sprechen hören , die sich auf dem Schulzenhof in Kienbaum befand und daselbst verwaltet wurde .
Pachtzins	baumstark_encyclopaedie_1835-17605-46	93. Uebers. von v. Th. VI. 73. Allein man ist der Meinung, es seien wenige Menschen so vermögend und einflußreich, daß man ihnen die Post anvertrauen könne, und ein Privatunternehmer würde jeden ansehnlichen Monopolgewinn in Anspruch nehmen, während der Staat einen kleinen Pachtzins erhalten würde und die Benutzer der Post hohes Porto bezahlen müßten; auch könnten Privatunternehmer fremdem Einflusse zugänglich sein und die Staatscorrespondenz belauern (Rau III. §. 210.).	274:283	93. Uebers. von v. Th. VI. 73. Allein man ist der Meinung , es seien wenige Menschen so vermögend und einflußreich , daß man ihnen die Post anvertrauen könne , und ein Privatunternehmer würde jeden ansehnlichen Monopolgewinn in Anspruch nehmen , während der Staat einen kleinen Pachtzins erhalten würde und die Benutzer der Post hohes Porto bezahlen müßten ; auch könnten Privatunternehmer fremdem Einflusse zugänglich sein und die Staatskorrespondenz belauern ( Rau III. §. 210. ) .
Pachtzins	baumstark_encyclopaedie_1835-6855-31	Denn Nachlässigkeit und Unterschlagung von Seiten derselben ist die schlimmste Beziehung dieser Bewirthschaftungsart1); 2) durch Verpachtung, d. h. indem man dasselbe einem Anderen gegen eine Vergütung (Pachtzins) zur Nutzung überläßt.	203:212	Denn Nachlässigkeit und Unterschlagung von Seiten derselben ist die schlimmste Beziehung dieser Bewirthschaftungsart1 ) ; 2 ) durch Verpachtung , d. h. indem man dasselbe einem Anderen gegen eine Vergütung ( Pachtzins ) zur Nutzung überläßt .
Pachtzins	baumstark_encyclopaedie_1835-12453-8	Die Rente aus der Verpachtung von Grundstücken heißt Pachtzins.	53:62	Die Rente aus der Verpachtung von Grundstücken heißt Pachtzins .
Pachtzins	baumstark_encyclopaedie_1835-14687-12	Je sicherer die Caution ist, desto niedriger kann daher auch der Pachtzins werden.	65:74	Je sicherer die Kaution ist , desto niedriger kann daher auch der Pachtzins werden .
Pachtzins	baumstark_encyclopaedie_1835-14686-19	Letztere berechnet der Verpachter nebst seinen Verlusten durch schlechte Naturalien, schlechte Münzen u. dgl. bei der Calculation des Pachtzinses mit ein.	134:145	Letztere berechnet der Verpachter nebst seinen Verlusten durch schlechte Naturalien , schlechte Münzen u. dgl. bei der Kalkulation des Pachtzinses mit ein .
Pachtzins	baumstark_encyclopaedie_1835-17318-31	Die Erbzinsverleihung, d. h. Ueberlassung des vollständigen erblichen Eigenthums der Nutzung am Gute unter Vorbehalt des Obereigenthums, zu dessen bloßer Anerkennung eine sich nicht nach dem Gutsertrage oder üblichen Pachtzinse richtende Abgabe (Erbenzins) jährlich bezahlt werden muß.	217:227	Die Erbzinsverleihung , d. h. Überlassung des vollständigen erblichen Eigentums der Nutzung am Gute unter Vorbehalt des Obereigentums , zu dessen bloßer Anerkennung eine sich nicht nach dem Gutsertrage oder üblichen Pachtzinse richtende Abgabe ( Erbenzins ) jährlich bezahlt werden muß .
Pachtzins	baumstark_encyclopaedie_1835-14609-8	Aber c) die ausbedungene Grundrente oder der Pachtzins, er werde ganz oder zum Theile in Geld und zum Theile in Naturalien entrichtet, ist nichts als ein Preis für die gestaltete Bodenbenutzung und richtet sich also nach den Preisregulatoren, nämlich nach dem Werthe der Nutzung, nach den zum Bezuge des Ertrages zu machenden Kostenauslagen, nach der Zahlfähigkeit des Pachters, nach dem üblichen Pachtzinse, nach den Concurrenzverhältnissen, und nach dem Geldwerthe6).	45:54	Aber c ) die ausbedungene Grundrente oder der Pachtzins , er werde ganz oder zum Teile in Geld und zum Teile in Naturalien entrichtet , ist nichts als ein Preis für die gestaltete Bodenbenutzung und richtet sich also nach den Preisregulatoren , nämlich nach dem Werte der Nutzung , nach den zum Bezuge des Ertrages zu machenden Kostenauslagen , nach der Zahlfähigkeit des Pachters , nach dem üblichen Pachtzinse , nach den Konkurrenzverhältnissen , und nach dem Geldwerthe6 ) .
Pachtzins	keller_seldwyla_1856-1019-13	Die Lumpen möchten indessen gar zu gern etwas zu naschen bekommen durch den Pachtzins, was sie freilich mit der Verkaufssumme auch thun könnten; allein wir würden uns hüten, dasselbe zu hoch hinauf zu treiben und wir wüßten dann doch was wir hätten und wem das Land gehört! «	76:85	Die Lumpen möchten indessen gar zu gern etwas zu naschen bekommen durch den Pachtzins , was sie freilich mit der Verkaufssumme auch tun könnten ; allein wir würden uns hüten , dasselbe zu hoch hinauf zu treiben und wir wüßten dann doch was wir hätten und wem das Land gehört ! "
Pachtzins	thuenen_staat_1826-1770-19	Nach Sinclair (Grundgesetze des Ackerbaues Seite 558) trägt ein Acre Gartenland in der Nähe von London an Pachtzins 10 Pf. Sterling an Armentaxen, Zehnten und andern Abgaben 8 Pf. zusammen also 18 Pf. Sterling; dies macht für 100 □ R. ungefähr 58 Thaler.	106:115	Nach Sinclair ( Grundgesetze des Ackerbaues Seite 558 ) trägt ein Acre Gartenland in der Nähe von London an Pachtzins 10 Pf. Sterling an Armentaxen , Zehnten und anderen Abgaben 8 Pf. zusammen also 18 Pf. Sterling ; dies macht für 100 □ R. ungefähr 58 Taler .
Pachtzins	fontane_brandenburg04_1882-3740-3	Später wurde der Pachtzins ausschließlich in Geld geleistet, von welcher Zeit an wir von einer auf dem Schulzenhofe befindlichen Kasse sprechen hören.	17:26	Später wurde der Pachtzins ausschließlich in Geld geleistet , von welcher Zeit an wir von einer auf dem Schulzenhofe befindlichen Kasse sprechen hören .
Pachtzins	nn_nrhz257_1849-218-9	Die Staats-und Kirchengüter müssen parzellenweise zu einem mäßigen Pachtzins an die Armen in Zeitpacht ausgethan werden.	67:76	Die Staats- und Kirchengüter müssen parzellenweise zu einem mäßigen Pachtzins an die Armen in Zeitpacht ausgetan werden .
Pachtzins	baumstark_encyclopaedie_1835-18078-5	Daß man dabei den üblichen Pachtzins zu Grunde legt, versteht sich um so mehr von selbst, als diese Steuer nur in Ländern, wo Pachtungen häufig sind, in Anwendung kommt (§. 492.). 2)	27:36	Daß man dabei den üblichen Pachtzins zu Grunde legt , versteht sich um so mehr von selbst , als diese Steuer nur in Ländern , wo Pachtungen häufig sind , in Anwendung kommt ( §. 492. ) . 2 )
Pachtzins	baumstark_encyclopaedie_1835-14683-5	Die Kosten als Regulatoren der Pachtzinsen sind auf jene Art schon erklärt.	31:42	Die Kosten als Regulatoren der Pachtzinsen sind auf jene Art schon erklärt .
Pachtzins	lehnert_seehaefen02_1892-371-14	Der weitläufige Grund ist Eigenthum der Regierung, wird aber von dieser gegen einen Pachtzins von einem Shilling per Jahr der Gemeinde überlassen.	84:93	Der weitläufige Grund ist Eigentum der Regierung , wird aber von dieser gegen einen Pachtzins von einem Shilling per Jahr der Gemeinde überlassen .
Pachtzins	baumstark_encyclopaedie_1835-12463-4	Es wird daher der Pachtzins und Miethzins enthalten müssen: α) den Zins der Anschaffungskosten, β) eine Vergütung der stets nothwendigen Kosten der Erhaltung; γ) einen Ersatz für die allmälige aus dem Gebrauche hervorgehende Verschlechterung; δ) eine Versicherung für die etwaigen Unglücksfälle; ε) eine Belohnung für die Mühe der Ausleihegeschäfte; und η) eine Wiedererstattung der mit gerichtlichen Streitigkeiten verbundenen Kosten u. dgl.	18:27	Es wird daher der Pachtzins und Mietzins enthalten müssen : α ) den Zins der Anschaffungskosten , β ) eine Vergütung der stets notwendigen Kosten der Erhaltung ; γ ) einen Ersatz für die allmähliche aus dem Gebrauche hervorgehende Verschlechterung ; d ) eine Versicherung für die etwaigen Unglücksfälle ; ε ) eine Belohnung für die Mühe der Ausleihegeschäfte ; und η ) eine Wiedererstattung der mit gerichtlichen Streitigkeiten verbundenen Kosten u. dgl.
Pachtzins	mommsen_roemische01_1854-268-2	Der mittlere Pachtzins für einen Arpent Ackerland ist 100 Franken jährlich.	13:22	Der mittlere Pachtzins für einen Arpent Ackerland ist 100 Franken jährlich .
Pachtzins	baumstark_encyclopaedie_1835-14603-40	Benutzt der Eigenthümer diese Naturkräfte selbst, dann wird das genannte Einkommen Grundrente im eigentlichen Sinne (natürliche Grundrente) genannt; überläßt er sie aber einem Andern zur Benutzung und empfängt er hierfür eine Vergütung, so heißt dieselbe Pachtzins (ausbedungene Grundrente).	255:264	Benutzt der Eigentümer diese Naturkräfte selbst , dann wird das genannte Einkommen Grundrente im eigentlichen Sinne ( natürliche Grundrente ) genannt ; überläßt er sie aber einem Anderen zur Benutzung und empfängt er hierfür eine Vergütung , so heißt dieselbe Pachtzins ( ausbedungene Grundrente ) .
Pachtzins	nn_nrhz200b_1849-8-13	Der fromme Staat hat ihn an einen loyalen Unterthanen verpachtet, der seinen Pachtzins an ihm herauszuschlagen sucht und ihm für schweres Geld schlechtes Essen und noch schlechteres Bier liefert.	77:86	Der fromme Staat hat ihn an einen loyalen Untertanen verpachtet , der seinen Pachtzins an ihm herauszuschlagen sucht und ihm für schweres Geld schlechtes Essen und noch schlechteres Bier liefert .
Pachtzins	nn_nrhz200b_1849-13-6	Der loyale Pächter muß ja seinen Pachtzins bezahlen und auch noch etwas verdienen.	33:42	Der loyale Pächter muß ja seinen Pachtzins bezahlen und auch noch etwas verdienen .
Pachtzins	buecher_volkswirtschaft_1893-327-5	Merces heißt sowohl Lohn als Pachtzins, Mietzins, Kapitalzins, Preis.	29:38	Merces heißt sowohl Lohn als Pachtzins , Mietzins , Kapitalzins , Preis .
Pachtzins	schmoller_kleingewerbe_1870-5921-53	Ist nicht heute noch das Herz jedes Edeldenkenden auf Seite Solon’s, wenn er die Schuldverhältnisse der untern Klassen Athens ordnet, ihre Schulden reduzirt; sind wir nicht heute noch alle auf Seite der landfordernden Plebejer in Rom, auf Seite jener späteren kaiserlichen Gesetze, welche verboten, dem Kolonen den Pachtzins weiter zu erhöhen?	315:324	Ist nicht heute noch das Herz jedes Edeldenkenden auf Seite Solon's , wenn er die Schuldverhältnisse der unteren Klassen Athens ordnet , ihre Schulden reduziert ; sind wir nicht heute noch alle auf Seite der landfordernden Plebejer in Rom , auf Seite jener späteren kaiserlichen Gesetze , welche verboten , dem Kolonen den Pachtzins weiter zu erhöhen ?
Pachtzins	baumstark_encyclopaedie_1835-17316-41	Es wird aber gegen sie auch eingewendet: die zu große Beschränkung des Erbpachters in der Behandlung des Gutes, der Verlust des Dispositionsrechtes über das Gut auf Seiten des Staats, die Entbehrung des Vortheils aus der möglichen Steigerung des Pachtzinses nach Ablauf der Pachtzeit bei der Zeitpacht, die nothwendige Verzichtung des Staats auf die Theilnahme an dem aus irgend einem Grunde gesteigerten Gutsertrage, und der Schaden, welcher für die Staatskasse aus einem unveränderlichen Kanon hervorgeht, wenn der Geldwerth sinken und der Preis der Güter steigen würde5).	246:257	Es wird aber gegen sie auch eingewendet : die zu große Beschränkung des Erbpachters in der Behandlung des Gutes , der Verlust des Dispositionsrechtes über das Gut auf Seiten des Staats , die Entbehrung des Vorteils aus der möglichen Steigerung des Pachtzinses nach Ablauf der Pachtzeit bei der Zeitpacht , die notwendige Verzichtung des Staats auf die Teilnahme an dem aus irgend einem Grunde gesteigerten Gutsertrage , und der Schaden , welcher für die Staatskasse aus einem unveränderlichen Kanon hervorgeht , wenn der Geldwert sinken und der Preis der Güter steigen würde5 ) .
Pachtzins	baumstark_encyclopaedie_1835-17288-12	v. Malchus I. §. 22. ist der Ansicht, man solle den Pachtzins in Geld fordern und sich ihn so, selbst wenn er in Rohproducten fixirt sei, bezahlen lassen.	52:61	v. Malchus I. §. 22. ist der Ansicht , man solle den Pachtzins in Geld fordern und sich ihn so , selbst wenn er in Rohprodukten fixiert sei , bezahlen lassen .
Pachtzins	nn_nrhz105_1848-385-19	Fast die meisten der in ihm besprochenen Petitionen erstreben eine Abhülfe der partikulärsten Noth, Geldunterstützungen, Erlaß von Pachtzinsen, Erdledigung lästiger Prozesse u. dgl. m.	131:142	Fast die meisten der in ihm besprochenen Petitionen erstreben eine Abhilfe der partikulärsten Not , Geldunterstützungen , Erlaße von Pachtzinsen , Erdledigung lästiger Prozesse u. dgl. m .
Pachtzins	baumstark_encyclopaedie_1835-6876-13	Wichtige Punkte dabei sind: die Länge der Pachtzeit, die Größe des Pachtzinses, die Termine seiner Zahlung, die Gewährleistung des Pachters, die Veränderungen der Pachtstücke, die Behandlung der Untergebenen, die Cession der Pacht, die Art der Uebernahme und die Unterhaltung des Kapitales, die Art und Höhe der Caution, die Remissionen (totale und partiale), und die Aufstellung eines sorgfältigen Inventariums über alle zum Gute gehörige und übernommene Realitäten.	67:78	Wichtige Punkte dabei sind : die Länge der Pachtzeit , die Größe des Pachtzinses , die Termine seiner Zahlung , die Gewährleistung des Pachters , die Veränderungen der Pachtstücke , die Behandlung der Untergebenen , die Zession der Pacht , die Art der Übernahme und die Unterhaltung des Kapitales , die Art und Höhe der Kaution , die Remissionen ( totale und partiale ) , und die Aufstellung eines sorgfältigen Inventariums über alle zum Gute gehörige und übernommene Realitäten .
Pachtzins	stein_verwaltungslehre07_1868-2190-10	Die dritte Kategorie enthält diejenigen, welche der Bauer als Pachtzins leistet für Grundstücke, die ihm der Gutsherr entweder förmlich als Pacht übertragen hat, oder bei denen das ursprüngliche Eigenthum des Gutsherrn gar nicht bezweifelt wird.	62:71	Die dritte Kategorie enthält diejenigen , welche der Bauer als Pachtzins leistet für Grundstücke , die ihm der Gutsherr entweder förmlich als Pacht übertragen hat , oder bei denen das ursprüngliche Eigentum des Gutsherrn gar nicht bezweifelt wird .
Pachtzins	thuenen_staat_1826-1771-3	Nun ist der Pachtzins zwar noch keine reine Landrente, sondern von der Pacht müssen die Zinsen des in den Glasfenstern, den Bewehrungen u. s. w. steckenden Kapitals abgezogen werden, um die wirkliche Landrente zu finden; aber diese Zinsen können sehr beträchtlich seyn, und die reine Nutzung des Bodens überwiegt doch noch die, welche wir für den isolirten Staat gefunden haben.	12:21	Nun ist der Pachtzins zwar noch keine reine Landrente , sondern von der Pacht müssen die Zinsen des in den Glasfenstern , den Bewehrungen u. s. w. steckenden Kapitals abgezogen werden , um die wirkliche Landrente zu finden ; aber diese Zinsen können sehr beträchtlich sein , und die reine Nutzung des Bodens überwiegt doch noch die , welche wir für den isolierten Staat gefunden haben .
Pachtzins	baumstark_encyclopaedie_1835-14688-26	So streng, als eben in der Theorie gerechnet wird, geschieht dies nicht in der Praxis, sondern man geht da mehr von dem üblichen Pachtzinse aus, woraus natürlich bei veränderten Verhältnissen um so mehr Verluste für die eine oder andere Parthie entstehen können, wenn der Contract nicht so gestellt ist, daß er mit veränderten Verhältnissen von selbst fällt oder steigt, also eine fixe Summe beträgt.	129:139	So streng , als eben in der Theorie gerechnet wird , geschieht dies nicht in der Praxis , sondern man geht da mehr von dem üblichen Pachtzinse aus , woraus natürlich bei veränderten Verhältnissen um so mehr Verluste für die eine oder andere Partie entstehen können , wenn der Kontrakt nicht so gestellt ist , daß er mit veränderten Verhältnissen von selbst fällt oder steigt , also eine fixe Summe beträgt .
Pachtzins	baumstark_encyclopaedie_1835-12545-42	Die Verpachtung ist jedoch nur möglich, wenn zu einer Handlung ein hinreichendes Capital an Gewerbseinrichtungen vorhanden ist; es kann sich aber hier der Beweis vorfinden, daß Privilegien und eine Kundschaft als wahre Capitalien zu betrachten sind, indem der Pachtzins, wenn diese garantirt sind, um ein Bedeutendes steigt.	260:269	Die Verpachtung ist jedoch nur möglich , wenn zu einer Handlung ein hinreichendes Kapital an Gewerbseinrichtungen vorhanden ist ; es kann sich aber hier der Beweis vorfinden , daß Privilegien und eine Kundschaft als wahre Kapitalien zu betrachten sind , indem der Pachtzins , wenn diese garantiert sind , um ein Bedeutendes steigt .
Pachtzins	baumstark_encyclopaedie_1835-14682-19	Ist kein Capital im und auf dem Boden mit verpachtet, so ist jener Rest der höchste Satz des Pachtzinses.	93:104	Ist kein Kapital im und auf dem Boden mit verpachtet , so ist jener Rest der höchste Satz des Pachtzinses .
Pachtzins	brunner_rechtsgeschichte01_1887-4197-37	Der Erbpächter zahlte einen Zins und konnte das Erbpachtgut (terra conducta) beliebig veräussern. Vereinzelt findet sich in fränkischer Zeit noch die römische Teilpacht, colonia partiaria, bei welcher ein Teil der Früchte als Pachtzins bezahlt wurde, doch hat sie in Gallien kaum die Rolle gespielt wie in Italien, wo sie innerhalb der sogenannten libellarischen Pachtverhältnisse fortlebte.	226:235	Der Erbpächter zahlte einen Zins und konnte das Erbpachtgut ( terra conducta ) beliebig veräußern . Vereinzelt findet sich in fränkischer Zeit noch die römische Teilpacht , colonia partiaria , bei welcher ein Teil der Früchte als Pachtzins bezahlt wurde , doch hat sie in Gallien kaum die Rolle gespielt wie in Italien , wo sie innerhalb der sogenannten libellarischen Pachtverhältnisse fortlebte .
Pachtzins	baumstark_encyclopaedie_1835-14644-30	Solche auffallende Widersprüche hat man sich nicht gescheut einem Ricardo unterzuschieben, obschon ganz deutlich aus seiner Rentenlehre hervorgeht, daß er von der entrichteten Rente spricht, welche vom Pachtzinse ganz verschieden ist, da dieser auch Capitalzins enthalten kann für das mit dem Boden verpachtete Capital.	202:212	Solche auffallende Widersprüche hat man sich nicht gescheut einem Ricardo unterzuschieben , obschon ganz deutlich aus seiner Rentenlehre hervorgeht , daß er von der entrichteten Rente spricht , welche vom Pachtzinse ganz verschieden ist , da dieser auch Kapitalzins enthalten kann für das mit dem Boden verpachtete Kapital .
Pachtzins	beck_eisen01_1884-16044-15	3. der Graf darf den Waldschmied, solange dieser seinen Verpflichtungen nachkommt, in dem Pachtzins nicht steigern;	90:99	3. der Graf darf den Waldschmied , solange dieser seinen Verpflichtungen nachkommt , in dem Pachtzins nicht steigern ;
Pachtzins	baumstark_encyclopaedie_1835-14609-68	Aber c) die ausbedungene Grundrente oder der Pachtzins, er werde ganz oder zum Theile in Geld und zum Theile in Naturalien entrichtet, ist nichts als ein Preis für die gestaltete Bodenbenutzung und richtet sich also nach den Preisregulatoren, nämlich nach dem Werthe der Nutzung, nach den zum Bezuge des Ertrages zu machenden Kostenauslagen, nach der Zahlfähigkeit des Pachters, nach dem üblichen Pachtzinse, nach den Concurrenzverhältnissen, und nach dem Geldwerthe6).	397:407	Aber c ) die ausbedungene Grundrente oder der Pachtzins , er werde ganz oder zum Teile in Geld und zum Teile in Naturalien entrichtet , ist nichts als ein Preis für die gestaltete Bodenbenutzung und richtet sich also nach den Preisregulatoren , nämlich nach dem Werte der Nutzung , nach den zum Bezuge des Ertrages zu machenden Kostenauslagen , nach der Zahlfähigkeit des Pachters , nach dem üblichen Pachtzinse , nach den Konkurrenzverhältnissen , und nach dem Geldwerthe6 ) .
Pachtzins	beck_eisen03_1897-15269-21	Mit diesem Vertrage machte der Pächter schlechte Geschäfte, und musste die Hütte am 7. September 1713 anderweit verpachtet und der Pachtzins heruntergesetzt werden.	131:140	Mit diesem Vertrage machte der Pächter schlechte Geschäfte , und mußte die Hütte am 7. September 1713 anderweit verpachtet und der Pachtzins heruntergesetzt werden .
Pachtzins	baumstark_encyclopaedie_1835-17312-55	Für diese sprechen die Vortheile großer Landgüter (§. 432.), die größere Fähigkeit großer Gutspächter zur Ertragung von Unglücksfällen ohne Staatsremissionen und die besondere Vereinfachung der Staatsdomänenverwaltung; dagegen aber wird geltend gemacht die geringere Concurrenz der Pächter für so große Güter, daher der Verlust der aus großer Concurrenz erfolgenden Steigerung des Pachtzinses, die Schwierigkeit der Trennung und Aufhebung der bäuerlichen Lasten, der dem Pachter gegebene Spielraum zur Ausübung seiner Gewalt und Laune auf die Unterthanen, die Unausführbarkeit einer gleichen Sorgfalt für alle, besonders die entfernteren, Gutstheile und die Ungegründetheit der Hoffnung auf die leichtere Ertragung von Unglücksfällen durch Generalpächter.	381:392	Für diese sprechen die Vorteile großer Landgüter ( §. 432. ) , die größere Fähigkeit großer Gutspächter zur Ertragung von Unglücksfällen ohne Staatsremissionen und die besondere Vereinfachung der Staatsdomänenverwaltung ; dagegen aber wird geltend gemacht die geringere Konkurrenz der Pächter für so große Güter , daher der Verlust der aus großer Konkurrenz erfolgenden Steigerung des Pachtzinses , die Schwierigkeit der Trennung und Aufhebung der bäuerlichen Lasten , der dem Pachter gegebene Spielraum zur Ausübung seiner Gewalt und Laune auf die Untertanen , die Unausführbarkeit einer gleichen Sorgfalt für alle , besonders die entfernteren , Gutsteile und die Ungegründetheit der Hoffnung auf die leichtere Ertragung von Unglücksfällen durch Generalpächter .
Pachtzins	baumstark_encyclopaedie_1835-17912-29	Wer in der Landwirthschaft sein Eigenthum bewirthet, ist für den ganzen reinen Gewerbsertrag steuerpflichtig; wer aber den Boden gepachtet hat, ist zu einem Abzuge des üblichen Pachtzinses vom Ertrage berechtigt.	177:188	Wer in der Landwirtschaft sein Eigentum bewirtet , ist für den ganzen reinen Gewerbesertrag steuerpflichtig ; wer aber den Boden gepachtet hat , ist zu einem Abzuge des üblichen Pachtzinses vom Ertrage berechtigt .
Pachtzins	26120215_1954_07_18_01_133.tcf.xml-7-22	Die Verwaltung dea sowjetischen Eigentums in Österreich (USIA) hat alle Hochwassergeschädigten Kleinpächter von Boden der USIA von der Bezahlung der Pachtzinsen für 1954 befreit	149:160	
Pachtzins	2532889X_1946-09-15_01_053.tcf.xml-11-28	Die aus dem Jahre 1J568 datierte Rechnung stellt fest, dati ein Fischer dem Rat der Stadt für die Berechtigung zur Fischerei und Bienenzucht in der Stadtheide einen Pachtzins von 1 Schock, 24 Groschen für die Fischereireohle und 32 Groschen für das Heidogeld bezahlen mußte.	165:174	
Pachtzins	26120215_1946_05_30_01_201.tcf.xml-10-41	Das Präsidium der Provjn? ialver * waltung Mark Brandenburg hat am 13. Mal eine Verordnung über Naturalien-Pachtverträge erlassen, in der bestimmt wird, daß Pachtverträge über landwirtschaftlich oder gärtnerisch nutzbaren Grundbesitz, in denen vereinbart ist. daß der Pachtzins ganz oder teilweise in Naturalien zu entrichten ist. nichtig sind.	268:277	
Pachtzins	2532889X_1964-01-08_01_095.tcf.xml-22-9	Mit dem Reis der Herbsternte müssen sie die hohen Pachtzinsen bezahlen: für Saatgut und Düngemittel borgen sie sich Geld bei Wucherern, deren Zinssätze nie unter la Prozent liegen.	50:61	
Pachtzins	2532889X_1981-06-13_01_198.tcf.xml-11-6	Fortwährendes Anziehen der Steuerschraube, erhöhte Pachtzinsen, gesteigerte Frondienste, zunehmende Teuerung und Einfrieren der Löhne für Handwerker und Gelegenheitsarbeiter lösten in Ost-und Südostengland spontane Widerstandsaktionen aus, die sich zumeist gegen königliche Steuereinnehmer richteten.	51:62	
Pachtzins	2532889X_1955-10-15_01_077.tcf.xml-12-10	In der Resolution lehnten die Delegierten einstimmig jede Erhöhung des Pachtzinses ab.	71:82	
Pachtzins	2532889X_1960-04-15_01_043.tcf.xml-65-11	So gifr ös W-h"," den Kampf gegen die Pachtzinsen und den Kampf gegen die Steuerlasten, gegen alle Arten der Ausbeutung und Ausraubung in breitester Front zu organisieren und zu führen.	38:49	
Pachtzins	2532889X_1958-10-03_01_255.tcf.xml-37-15	Früher war er alleiniger Besitzer des Bodens seines Landes, die Bauern mußten an ihn Pachtzins entrichten und eine Anzahl von Tagen Fronarbeit leisten.	85:94	
