lemma	pos	date	grouping	identifier	description	context	indexes_target_token	indexes_target_sentence	context_tokenized	indexes_target_token_tokenized	indexes_target_sentence_tokenized	context_lemmatized	context_pos	context_normalized
Tragfähigkeit	NN	1856	1	krane_reitpferd_1856-364-10	 	Eine hohe, kurze Niere wird stets das Zeichen grosser Tragfähigkeit, indess, wie überhaupt der kurze Rücken, wenn er nicht eine besondere Elastizität besitzt, für die Conservirung der Beine kein Vortheil sein.	54:67	0:209	Eine hohe , kurze Niere wird stets das Zeichen grosser Tragfähigkeit , indess , wie überhaupt der kurze Rücken , wenn er nicht eine besondere Elastizität besitzt , für die Conservirung der Beine kein Vortheil sein .	10	0:37	eine hoch , kurz Niere werden stets d Zeichen groß Tragfähigkeit , indes , wie überhaupt d kurz Rücken , wenn er nicht eine besondere Elastizität besitzen , für d Konservierung d Bein keine Vorteil sein .	ART ADJA $, ADJA NN VAFIN ADV ART NN ADJA NN $, ADV $, PWAV ADV ART ADJA NN $, KOUS PPER PTKNEG ART ADJA NN VVFIN $, APPR ART NN ART NN PIAT NN VAINF $.	Eine hohe , kurze Niere wird stets das Zeichen großer Tragfähigkeit , indes , wie überhaupt der kurze Rücken , wenn er nicht eine besondere Elastizität besitzt , für die Konservierung der Beine kein Vorteil sein .
Tragfähigkeit	NN	1885	1	treitschke_geschichte03_1885-6908-16	 	Im Jahre 1820 besaß Preußen nur noch 705 meist alte und baufällige Schiffe mit 72,435 Last Tragfähigkeit; vor den Kriegen hatte man an der Küste von Barth bis Memel ihrer 1102 gezählt.	91:104	0:184	Im Jahre 1820 beſaß Preußen nur noch 705 meiſt alte und baufällige Schiffe mit 72,435 Laſt Tragfähigkeit ; vor den Kriegen hatte man an der Küſte von Barth bis Memel ihrer 1102 gezählt .	16	0:34	im Jahr 1820 besitzen Preußen nur noch 705 meist alt und baufällig Schiff mit 72,435 Last Tragfähigkeit ; vor d Krieg haben man an d Küste von Barth bis Memel ihr 1102 zählen .	APPRART NN CARD VVFIN NE ADV ADV CARD ADV ADJA KON ADJA NN APPR CARD NN NN $. APPR ART NN VAFIN PIS APPR ART NN APPR NE KON NE PPOSAT CARD VVPP $.	Im Jahre 1820 besaß Preußen nur noch 705 meist alte und baufällige Schiffe mit 72,435 Last Tragfähigkeit ; vor den Kriegen hatte man an der Küste von Barth bis Memel ihrer 1102 gezählt .
Tragfähigkeit	NN	1877	1	wanderley_bauconstructionslehre01_1877-2804-9	 	Damit innerhalb der Werkstatt ein Laufkrahn von 120 Ctr. Tragfähigkeit hin und her bewegt werden kann, darf der Balken a nicht durch das ganze Gebäude reichen, und sind daher eiserne Säulen zur Unterstützung nöthig.	57:70	0:215	Damit innerhalb der Werkſtatt ein Laufkrahn von 120 Ctr. Tragfähigkeit hin und her bewegt werden kann , darf der Balken a nicht durch das ganze Gebäude reichen , und ſind daher eiſerne Säulen zur Unterſtützung nöthig .	9	0:37	damit innerhalb d Werkstatt eine Laufkran von 120 Ctr. Tragfähigkeit hin und her bewegen werden können , dürfen d Balken A nicht durch d ganz Gebäude reichen , und sein daher eisern Säule zur Unterstützung nötig .	PAV APPR ART NN ART NN APPR CARD NN NN PTKVZ KON ADV VVPP VAINF VMFIN $, VMFIN ART NN NE PTKNEG APPR ART ADJA NN VVFIN $, KON VAFIN PAV ADJA NN APPRART NN ADJD $.	Damit innerhalb der Werkstatt ein Laufkran von 120 Ctr. Tragfähigkeit hin und her bewegt werden kann , darf der Balken a nicht durch das ganze Gebäude reichen , und sind daher eiserne Säulen zur Unterstützung nötig .
Tragfähigkeit	NN	1878	1	wanderley_bauconstructionslehre02_1878-3289-33	 	Uebrigens kommt es häufig vor, daß anstatt der ansteigenden Gewölbe, viele kurze Bögen mit ansteigenden Kämpfern nebeneinander angeordnet werden, theils um die Ausführung zu erleichtern, theils zur Vermehrung der Tragfähigkeit.	213:226	0:227	Uebrigens kommt es häufig vor , daß anſtatt der anſteigenden Gewölbe , viele kurze Bögen mit anſteigenden Kämpfern nebeneinander angeordnet werden , theils um die Ausführung zu erleichtern , theils zur Vermehrung der Tragfähigkeit .	33	0:35	übrigens kommen es häufig vor , daß anstatt d ansteigend Gewölbe , viel kurz Bogen mit ansteigend Kämpfer nebeneinander anordnen werden , teils um d Ausführung zu erleichtern , teils zur Vermehrung d Tragfähigkeit .	ADV VVFIN PPER ADJD PTKVZ $, KOUS APPR ART ADJA NN $, PIAT ADJA NN APPR ADJA NN ADV VVPP VAINF $, ADV APPR ART NN PTKZU VVINF $, ADV APPRART NN ART NN $.	Übrigens kommt es häufig vor , daß anstatt der ansteigenden Gewölbe , viele kurze Bögen mit ansteigenden Kämpfern nebeneinander angeordnet werden , teils um die Ausführung zu erleichtern , teils zur Vermehrung der Tragfähigkeit .
Tragfähigkeit	NN	1896	1	samter_erfindungen_1896-11668-8	 	Die Summe des Eigengewichtes des Schiffes und der Tragfähigkeit oder Ladungsfähigkeit rc. ist gleich dem Deplacement.	50:63	0:117	Die Summe des Eigengewichtes des Schiffes und der Tragfähigkeit oder Ladungsfähigkeit ꝛc. iſt gleich dem Deplacement .	8	0:17	d Summe d Eigengewicht d Schiff und d Tragfähigkeit oder Ladungsfähigkeit etc. sein gleich d Deplacement .	ART NN ART NN ART NN KON ART NN KON NN ADV VAFIN ADV ART NN $.	Die Summe des Eigengewichtes des Schiffes und der Tragfähigkeit oder Ladungsfähigkeit etc. ist gleich dem Deplacement .
Tragfähigkeit	NN	1885	1	treitschke_geschichte03_1885-6911-18	 	Statt der unbrauchbaren alten Schiffe wurden neue gebaut, in geringerer Zahl, aber stärker und von größerer Tragfähigkeit; im Jahre 1830 zählte die Handelsflotte wieder 643 gute Schiffe mit 75,079 Last.	108:121	0:202	Statt der unbrauchbaren alten Schiffe wurden neue gebaut , in geringerer Zahl , aber ſtärker und von größerer Tragfähigkeit ; im Jahre 1830 zählte die Handelsflotte wieder 643 gute Schiffe mit 75,079 Laſt .	18	0:34	Stadt d unbrauchbar alt Schiff werden neu bauen , in gering Zahl , aber stark und von groß Tragfähigkeit ; im Jahr 1830 zählen d Handelsflotte wieder 643 gut Schiff mit 75,079 Last .	NN ART ADJA ADJA NN VAFIN ADJA VVPP $, APPR ADJA NN $, ADV ADJD KON APPR ADJA NN $. APPRART NN CARD VVFIN ART NN ADV CARD ADJA NN APPR CARD NN $.	Stadt der unbrauchbaren alten Schiffe wurden neue gebaut , in geringerer Zahl , aber stärker und von größerer Tragfähigkeit ; im Jahre 1830 zählte die Handelsflotte wieder 643 gute Schiffe mit 75,079 Last .
Tragfähigkeit	NN	1877	1	wanderley_bauconstructionslehre01_1877-1085-27	 	Nicht unbeachtet darf man lassen, daß der über mehrere Ständer reichende Träger mindestens an einem Ende als fest eingespannt gelten kann und somit eine noch größere Tragfähigkeit besitzt, als ein nur freiliegender; ferner unterstützt man den Träger mit Sattelhölzern (Fig. 146) und Kopfbändern oder Bügen, sodaß der Träger eigentlich 2m weniger freiliegt.	166:179	0:356	Nicht unbeachtet darf man laſſen , daß der über mehrere Ständer reichende Träger mindeſtens an einem Ende als feſt eingeſpannt gelten kann und ſomit eine noch größere Tragfähigkeit beſitzt , als ein nur freiliegender ; ferner unterſtützt man den Träger mit Sattelhölzern ( Fig. 146 ) und Kopfbändern oder Bügen , ſodaß der Träger eigentlich 2m weniger freiliegt .	27	0:59	nicht unbeachtet dürfen man lassen , daß d über mehrere Ständer reichend Träger mindestens an eine Ende als fest einspannen gelten können und somit eine noch groß Tragfähigkeit besitzen , als eine nur freiliegend ; ferner unterstützen man d Träger mit Sattelholz ( fig. 146 ) und Kopfband oder Bug , sodaß d Träger eigentlich 2m wenige freiliegen .	PTKNEG ADJD VMFIN PIS VVINF $, KOUS ART APPR PIAT NN ADJA NN ADV APPR ART NN KOKOM ADJD VVPP VVINF VMFIN KON ADV ART ADV ADJA NN VVFIN $, KOUS ART ADV ADJD $. ADV VVFIN PIS ART NN APPR NN $( XY CARD $( KON NN KON NN $, KOUS ART NN ADV CARD PIS VVFIN $.	Nicht unbeachtet darf man lassen , daß der über mehrere Ständer reichende Träger mindestens an einem Ende als fest eingespannt gelten kann und somit eine noch größere Tragfähigkeit besitzt , als ein nur freiliegender ; ferner unterstützt man den Träger mit Sattelhölzern ( Fig. 146 ) und Kopfbändern oder Bügen , sodaß der Träger eigentlich 2m weniger freiliegt .
Tragfähigkeit	NN	1877	1	wanderley_bauconstructionslehre01_1877-1250-7	 	Jedenfalls muß der ausführende Techniker von der Tragfähigkeit seiner Construction überzeugt sein, zumal Seitens der Behörden in zweifelhaften Fällen eine Probebelastung gesetzlich verlangt werden kann, deren Kosten der Bauherr zu tragen hat.	49:62	0:242	Jedenfalls muß der ausführende Techniker von der Tragfähigkeit ſeiner Conſtruction überzeugt ſein , zumal Seitens der Behörden in zweifelhaften Fällen eine Probebelaſtung geſetzlich verlangt werden kann , deren Koſten der Bauherr zu tragen hat .	7	0:35	jedenfalls müssen d ausführend Techniker von d Tragfähigkeit seine Konstruktion überzeugen sein , zumal seitens d Behörde in zweifelhaft Fall eine Probebelastung gesetzlich verlangen werden können , die Kosten d Bauherr zu tragen haben .	ADV VMFIN ART ADJA NN APPR ART NN PPOSAT NN VVPP VAINF $, KOUS APPR ART NN APPR ADJA NN ART NN ADJD VVPP VAINF VMFIN $, PRELAT NN ART NN PTKZU VVINF VAFIN $.	Jedenfalls muß der ausführende Techniker von der Tragfähigkeit seiner Konstruktion überzeugt sein , zumal Seitens der Behörden in zweifelhaften Fällen eine Probebelastung gesetzlich verlangt werden kann , deren Kosten der Bauherr zu tragen hat .
Tragfähigkeit	NN	1895	1	freud_hysterie_1895-2393-21	 	Auch der Hysterische wird ein gewisses Maass unerledigt beibehalten können; wächst dasselbe durch Summation bei ähnlichen Anlässen über die individuelle Tragfähigkeit hinaus, so ist der Anstoss zur Conversion gegeben.	153:166	0:217	Auch der Hysterische wird ein gewisses Maass unerledigt beibehalten können ; wächst dasselbe durch Summation bei ähnlichen Anlässen über die individuelle Tragfähigkeit hinaus , so ist der Anstoss zur Conversion gegeben .	21	0:32	auch d Hysterische werden eine gewiß Maß unerledigt beibehalten können ; wachsen dasselbe durch Summation bei ähnlich Anlaß über d individuell Tragfähigkeit hinaus , so sein d Anstoß zur Konversion geben .	ADV ART NN VAFIN ART ADJA NN ADJD VVINF VMINF $. VVFIN PDAT APPR NN APPR ADJA NN APPR ART ADJA NN APZR $, ADV VAFIN ART NN APPRART NN VVPP $.	Auch der Hysterische wird ein gewisses Maß unerledigt beibehalten können ; wächst dasselbe durch Summation bei ähnlichen Anlässen über die individuelle Tragfähigkeit hinaus , so ist der Anstoß zur Konversion gegeben .
Tragfähigkeit	NN	1891	1	lehnert_seehaefen01_1891-10630-1	 	Die Tragfähigkeit der angekommenen und abgegangenen Schiffe zusammen ist 1888 gegen 1876—80 für Dampfschiffe um 98 %, für Segelschiffe um 3·33 % gestiegen.	4:17	0:155	Die Tragfähigkeit der angekommenen und abgegangenen Schiffe zusammen ist 1888 gegen 1876—80 für Dampfschiffe um 98 % , für Segelschiffe um 3·33 % gestiegen .	1	0:25	d Tragfähigkeit d angekommen und abgegehen Schiff zusammen sein 1888 gegen 1876--80 für Dampfschiff um 98 % , für Segelschiff um 3·33 % steigen .	ART NN ART ADJA KON ADJA NN ADV VAFIN CARD APPR CARD APPR NN APPR CARD $( $, APPR NN APPR CARD $( VVPP $.	Die Tragfähigkeit der angekommenen und abgegangenen Schiffe zusammen ist 1888 gegen 1876--80 für Dampfschiffe um 98 % , für Segelschiffe um 3·33 % gestiegen .
Tragfähigkeit	NN	1841	1	moltke_zustaende_1841-2502-24	 	Wird nun der Schlauch aufgeblasen (was schnell und ohne den Mund unmittelbar daran zu bringen geschieht), so hat er eine große Tragfähigkeit und kann fast nicht zu Grunde gehen; vierzig bis sechzig werden dann unter ein leichtes Gerüste von Baumzweigen in vier oder fünf Reihen so zusammengebunden, daß das Floß vorn etwa acht, hinten achtzehn Schläuche breit ist; darüber wird etwas Laub, dann eine Matte und Teppiche gebreitet, und so fährt man ganz gemächlich den Fluß hinab.	127:140	0:478	Wird nun der Schlauch aufgeblaſen ( was ſchnell und ohne den Mund unmittelbar daran zu bringen geſchieht ) , ſo hat er eine große Tragfaͤhigkeit und kann faſt nicht zu Grunde gehen ; vierzig bis ſechzig werden dann unter ein leichtes Geruͤſte von Baumzweigen in vier oder fuͤnf Reihen ſo zuſammengebunden , daß das Floß vorn etwa acht , hinten achtzehn Schlaͤuche breit iſt ; daruͤber wird etwas Laub , dann eine Matte und Teppiche gebreitet , und ſo faͤhrt man ganz gemaͤchlich den Fluß hinab .	24	0:87	werden nun d Schlauch aufblasen ( was schnell und ohne d Mund unmittelbar daran zu bringen geschehen ) , so haben er eine groß Tragfähigkeit und können fast nicht zu Grund gehen ; vierzig bis sechzig werden dann unter eine leicht Gerüst von Baumzweig in vier oder fünf Reihe so zusammenbinden , daß d Floß vorn etwa acht , hinten achtzehn Schlauch breit sein ; darüber werden etwas Laub , dann eine Matte und Teppich breiten , und so fahren man ganz gemächlich d Fluß hinab .	VAFIN ADV ART NN VVPP $( PWS ADJD KON APPR ART NN ADJD PAV PTKZU VVINF VVFIN $( $, ADV VAFIN PPER ART ADJA NN KON VMFIN ADV PTKNEG APPR NN VVINF $. CARD APPR CARD VAFIN ADV APPR ART ADJA NN APPR NN APPR CARD KON CARD NN ADV VVPP $, KOUS ART NN ADV ADV CARD $, ADV CARD NN ADJD VAFIN $. PAV VAFIN PIAT NN $, ADV ART NN KON NN VVPP $, KON ADV VVFIN PIS ADV ADJD ART NN PTKVZ $.	Wird nun der Schlauch aufgeblasen ( was schnell und ohne den Mund unmittelbar daran zu bringen geschieht ) , so hat er eine große Tragfähigkeit und kann fast nicht zu Grunde gehen ; vierzig bis sechzig werden dann unter ein leichtes Gerüste von Baumzweigen in vier oder fünf Reihen so zusammengebunden , daß das Floß vorn etwa acht , hinten achtzehn Schläuche breit ist ; darüber wird etwas Laub , dann eine Matte und Teppiche gebreitet , und so fährt man ganz gemächlich den Fluß hinab .
Tragfähigkeit	NN	1877	1	wanderley_bauconstructionslehre01_1877-1060-8	 	Da der soeben angenommene Querschnitt nicht die größte Tragfähigkeit besitzt, so kann eine andere Frage lauten: wie groß würde bei der angegebenen Belastung der vortheilhafteste Querschnitt sein?	55:68	0:195	Da der ſoeben angenommene Querſchnitt nicht die größte Tragfähigkeit beſitzt , ſo kann eine andere Frage lauten : wie groß würde bei der angegebenen Belaſtung der vortheilhafteſte Querſchnitt ſein ?	8	0:30	da d soeben angenehmen Querschnitt nicht d groß Tragfähigkeit besitzen , so können eine ander Frage lauten : wie groß werden bei d angegeben Belastung d vorteilhaft Querschnitt sein ?	KOUS ART ADV ADJA NN PTKNEG ART ADJA NN VVFIN $, ADV VMFIN ART ADJA NN VVINF $. PWAV ADJD VAFIN APPR ART ADJA NN ART ADJA NN VAINF $.	Da der soeben angenommene Querschnitt nicht die größte Tragfähigkeit besitzt , so kann eine andere Frage lauten : wie groß würde bei der angegebenen Belastung der vorteilhafteste Querschnitt sein ?
Tragfähigkeit	NN	1891	1	lehnert_seehaefen01_1891-4855-36	 	So baute die bekannte Firma W. G. Armstrong Mitchell & Co. an der Bucht von Pozzuoli ein grossartiges Eisenwerk (Stabilimento Metallurgico Armstrong), in welchem bereits 13 Laufkrahne, zwei davon mit 70 t Tragfähigkeit, bestehen, und am Kopfe des Ausschiffungsdammes wird eben ein hydraulischer Krahn von 170 t Hebekraft montirt.	205:218	0:329	So baute die bekannte Firma W. G. Armstrong Mitchell & Co. an der Bucht von Pozzuoli ein grossartiges Eisenwerk ( Stabilimento Metallurgico Armstrong ) , in welchem bereits 13 Laufkrahne , zwei davon mit 70 t Tragfähigkeit , bestehen , und am Kopfe des Ausschiffungsdammes wird eben ein hydraulischer Krahn von 170 t Hebekraft montirt .	36	0:56	so bauen d bekannt Firma W. G. Armstrong Mitchell & Co. an d Bucht von Pozzuoli eine großartig Eisenwerk ( stabilimento metallurgico armstrong ) , in welche bereits 13 Laufkran , zwei davon mit 70 T Tragfähigkeit , bestehen , und am Kopf d Ausschiffungsdamm werden eben eine hydraulisch Kran von 170 T Hebekraft montieren .	ADV VVFIN ART ADJA NN NE NE NE NE $( NN APPR ART NN APPR NE ART ADJA NN $( FM FM FM $( $, APPR PRELS ADV CARD NN $, CARD PAV APPR CARD NN NN $, VVFIN $, KON APPRART NN ART NN VAFIN ADV ART ADJA NN APPR CARD NN NN VVPP $.	So baute die bekannte Firma W. G. Armstrong Mitchell & Co. an der Bucht von Pozzuoli ein großartiges Eisenwerk ( Stabilimento Metallurgico Armstrong ) , in welchem bereits 13 Laufkrane , zwei davon mit 70 t Tragfähigkeit , bestehen , und am Kopfe des Ausschiffungsdammes wird eben ein hydraulischer Kran von 170 t Hebekraft montiert .
Tragfähigkeit	NN	1876	1	krafft_landwirthschaft03_1876-4769-34	 	Die galizischen Pferde zeigen gleichfalls viele Uebereinstimmung mit dem ungarischen Pferde, zu den kleinsten Schlägen derselben zählt das Huzulenpferd, welches in den nördlichen und östlichen Ausläufern der Karpathen heimisch und wegen seiner Tragfähigkeit und seines sicheren Ganges besonders geschätzt ist.	244:257	0:309	Die galiziſchen Pferde zeigen gleichfalls viele Uebereinſtimmung mit dem ungariſchen Pferde , zu den kleinſten Schlägen derſelben zählt das Huzulenpferd , welches in den nördlichen und öſtlichen Ausläufern der Karpathen heimiſch und wegen ſeiner Tragfähigkeit und ſeines ſicheren Ganges beſonders geſchätzt iſt .	34	0:43	d galizisch Pferd zeigen gleichfalls viel Übereinstimmung mit d ungarisch Pferd , zu d klein Schlag dieselbe zählen d Huzulenpferd , welche in d nördlich und östlich Ausläufer d Karpathen heimisch und wegen seine Tragfähigkeit und seine sicher Gang besonders schätzen sein .	ART ADJA NN VVFIN ADV PIAT NN APPR ART ADJA NN $, APPR ART ADJA NN PDS VVFIN ART NN $, PRELS APPR ART ADJA KON ADJA NN ART NN ADJD KON APPR PPOSAT NN KON PPOSAT ADJA NN ADV VVPP VAFIN $.	Die galizischen Pferde zeigen gleichfalls viele Übereinstimmung mit dem ungarischen Pferde , zu den kleinsten Schlägen derselben zählt das Huzulenpferd , welches in den nördlichen und östlichen Ausläufern der Karpathen heimisch und wegen seiner Tragfähigkeit und seines sicheren Ganges besonders geschätzt ist .
Tragfähigkeit	NN	1899	1	chamberlain_grundlagen02_1899-2348-52	 	Trotz ihrer Leistungen auf dem Gebiete der Mathematik, der Grammatik u. s. w. übertraf die Kultur der Inder nicht allein ihre Civilisation, sondern auch ihr Wissen um ein Bedeutendes; daher waren die Inder was der Engländer top-heavy nennt, d. h. zu schwer in den oberen Teilen für die Tragfähigkeit der unteren, und das um so mehr, als ihre Wissenschaft eine fast lediglich formelle war, der das Element der » Entdeckung « — also das eigentliche Material, oder wenigstens die Herbeischaffung neuen Materials zur Ernährung der höheren Anlagen und zur fortgesetzten Übung ihrer Fähigkeiten — fehlte.	286:299	0:598	Trotz ihrer Leistungen auf dem Gebiete der Mathematik , der Grammatik u. s. w. übertraf die Kultur der Inder nicht allein ihre Civilisation , sondern auch ihr Wissen um ein Bedeutendes ; daher waren die Inder was der Engländer top-heavy nennt , d. h. zu schwer in den oberen Teilen für die Tragfähigkeit der unteren , und das um so mehr , als ihre Wissenschaft eine fast lediglich formelle war , der das Element der » Entdeckung « — also das eigentliche Material , oder wenigstens die Herbeischaffung neuen Materials zur Ernährung der höheren Anlagen und zur fortgesetzten Übung ihrer Fähigkeiten — fehlte .	52	0:104	trotz ihr Leistung auf d Gebiet d Mathematik , d Grammatik u. s. W. übertreffen d Kultur d Inder nicht allein ihr Zivilisation , sondern auch ihr Wissen um eine Bedeutende ; daher sein d Inder was d Engländer top-heavy nennen , d. h. zu schwer in d ober Teil für d Tragfähigkeit d unter , und die um so mehr , als ihr Wissenschaft eine fast lediglich formell sein , die d Element d " Entdeckung " -- also d eigentlich Material , oder wenigstens d Herbeischaffung neu Material zur Ernährung d hoch Anlage und zur fortgesetzt Übung ihr Fähigkeit -- fehlen .	APPR PPOSAT NN APPR ART NN ART NN $, ART NN APPR VVIMP NE VVFIN ART NN ART NN PTKNEG ADV PPOSAT NN $, KON ADV PPOSAT NN APPR ART NN $. PAV VAFIN ART NN PRELS ART NN ADJD VVFIN $, PDS VVFIN PTKA ADJD APPR ART ADJA NN APPR ART NN ART ADJA $, KON PDS APPR ADV PIS $, KOKOM PPOSAT NN ART ADV ADV ADJA VAFIN $, PRELS ART NN ART $( NN $( $( ADV ART ADJA NN $, KON ADV ART NN ADJA NN APPRART NN ART ADJA NN KON APPRART ADJA NN PPOSAT NN $( VVFIN $.	Trotz ihrer Leistungen auf dem Gebiete der Mathematik , der Grammatik u. s. w. übertraf die Kultur der Inder nicht allein ihre Zivilisation , sondern auch ihr Wissen um ein Bedeutendes ; daher waren die Inder was der Engländer top-heavy nennt , d. h. zu schwer in den oberen Teilen für die Tragfähigkeit der unteren , und das um so mehr , als ihre Wissenschaft eine fast lediglich formelle war , der das Element der " Entdeckung " -- also das eigentliche Material , oder wenigstens die Herbeischaffung neuen Materials zur Ernährung der höheren Anlagen und zur fortgesetzten Übung ihrer Fähigkeiten -- fehlte .
Tragfähigkeit	NN	1890	1	boeheim_waffenkunde_1890-5712-19	 	Damit konnte der Bogen entsprechend stärker und kräftiger gemacht werden, was gleichbedeutend war mit dem Erreichen einer grösseren Tragfähigkeit.	132:145	0:146	Damit konnte der Bogen entsprechend stärker und kräftiger gemacht werden , was gleichbedeutend war mit dem Erreichen einer gröſseren Tragfähigkeit .	19	0:21	damit können d Bogen entsprechend stark und kräftig machen werden , was gleichbedeutend sein mit d Erreichen eine groß Tragfähigkeit .	PAV VMFIN ART NN ADJD ADJD KON ADJD VVPP VAINF $, PWS ADJD VAFIN APPR ART NN ART ADJA NN $.	Damit konnte der Bogen entsprechend stärker und kräftiger gemacht werden , was gleichbedeutend war mit dem Erreichen einer größeren Tragfähigkeit .
Tragfähigkeit	NN	1878	1	laband_staatsrecht02_1878-6131-7	 	Abgesehen von denjenigen Deutschen Schiffen von geringer Tragfähigkeit, welche nach dem R.-G. v. 25. Oktob. 1867 (B.-G.-Bl. S. 35) nicht in das Schiffs-Register einzutragen sind, und von den nach dem abgekürzten Verfahren vorläufig vermessenen Schiffen.	57:70	0:253	Abgeſehen von denjenigen Deutſchen Schiffen von geringer Tragfähigkeit , welche nach dem R.-G. v. 25. Oktob. 1867 ( B.-G.-Bl. S. 35 ) nicht in das Schiffs-Regiſter einzutragen ſind , und von den nach dem abgekürzten Verfahren vorläufig vermeſſenen Schiffen .	7	0:40	absehen von diejenige deutsch Schiff von gering Tragfähigkeit , welche nach d R.-G. v. 25. Oktob. 1867 ( B.-G.-Bl. S. 35 ) nicht in d Schiffs-Register eintragen sein , und von d nach d abgekürzt Verfahren vorläufig vermessen Schiff .	VVPP APPR PDS ADJA NN APPR ADJA NN $, PRELS APPR ART NN APPRART ADJA NN CARD $( NN NN CARD $( PTKNEG APPR ART NN VVIZU VAFIN $, KON APPR ART APPR ART ADJA NN ADJD ADJA NN $.	Abgesehen von denjenigen Deutschen Schiffen von geringer Tragfähigkeit , welche nach dem R.-G. v. 25. Oktob. 1867 ( B.-G.-Bl. S. 35 ) nicht in das Schiffs-Register einzutragen sind , und von den nach dem abgekürzten Verfahren vorläufig vermessenen Schiffen .
Tragfähigkeit	NN	1878	1	wanderley_bauconstructionslehre02_1878-883-6	 	zweitens: besitzen sie keine große Tragfähigkeit, die Festigkeit des vollen Ziegels verhält sich zu der des Lochsteines wie 17: 11;	35:48	0:131	zweitens : beſitzen ſie keine große Tragfähigkeit , die Feſtigkeit des vollen Ziegels verhält ſich zu der des Lochſteines wie 17 : 11 ;	6	0:24	zweitens : besitzen sie keine groß Tragfähigkeit , d Festigkeit d voll Ziegel verhalten sich zu d d Lochstein wie 17 : 11 ;	ADV $. VVFIN PPER PIAT ADJA NN $, ART NN ART ADJA NN VVFIN PRF APPR ART ART NN KOKOM CARD $. CARD $.	zweitens : besitzen sie keine große Tragfähigkeit , die Festigkeit des vollen Ziegels verhält sich zu der des Lochsteines wie 17 : 11 ;
Tragfähigkeit	NN	1867	1	wundt_medizinische_1867-8690-3	 	Will man die Tragfähigkeit des Elektromagneten prüfen, so hängt man an dessen Pole ein Stück weiches Eisen, einen s. g. Anker (A Fig. 240), der eine Wagschale mit Gewichten tragen kann.	13:26	0:185	Will man die Tragfähigkeit des Elektromagneten prüfen , so hängt man an dessen Pole ein Stück weiches Eisen , einen s. g. Anker ( A Fig. 240 ) , der eine Wagschale mit Gewichten tragen kann .	3	0:37	wollen man d Tragfähigkeit d Elektromagnet prüfen , so hängen man an die Pole eine Stück weich Eisen , eine s. g. Anker ( a fig. 240 ) , die eine Waagschale mit Gewicht tragen können .	VMFIN PIS ART NN ART NN VVINF $, ADV VVFIN PIS APPR PRELAT NN ART NN ADJA NN $, ART VVIMP ADJA NN $( XY XY CARD $( $, PRELS ART NN APPR NN VVINF VMFIN $.	Will man die Tragfähigkeit des Elektromagneten prüfen , so hängt man an dessen Pole ein Stück weiches Eisen , einen s. g. Anker ( A Fig. 240 ) , der eine Waagschale mit Gewichten tragen kann .
Tragfähigkeit	NN	1896	1	samter_erfindungen_1896-11664-8	 	Die Größe eines Schiffes kennzeichnet sich durch seine Tragfähigkeit.	55:68	0:69	Die Größe eines Schiffes kennzeichnet ſich durch ſeine Tragfähigkeit .	8	0:10	d Größe eine Schiff kennzeichnen sich durch seine Tragfähigkeit .	ART NN ART NN VVFIN PRF APPR PPOSAT NN $.	Die Größe eines Schiffes kennzeichnet sich durch seine Tragfähigkeit .
