lemma	pos	date	grouping	identifier	description	context	indexes_target_token	indexes_target_sentence	context_tokenized	indexes_target_token_tokenized	indexes_target_sentence_tokenized	context_lemmatized	context_pos	context_normalized
Tragfähigkeit	NN	1863	1	fontane_brandenburg02_1863-3043-17	 	Thaer widmete ihr die größte Aufmerksamkeit, und die chemische Zusammensetzung der verschiedensten Bodenarten mit ihrer speciellen Tragfähigkeit oder Unfähigkeit vergleichend, glückte es ihm, seine speciellen Erfahrungen zu allgemeinen Gesetzen zu erheben.	131:144	0:256	Thaer widmete ihr die größte Aufmerkſamkeit , und die chemiſche Zuſammenſetzung der verſchiedenſten Bodenarten mit ihrer ſpeciellen Tragfähigkeit oder Unfähigkeit vergleichend , glückte es ihm , ſeine ſpeciellen Erfahrungen zu allgemeinen Geſetzen zu erheben .	17	0:35	Thaer widmen sie d groß Aufmerksamkeit , und d chemisch Zusammensetzung d verschieden Bodenart mit ihr speziell Tragfähigkeit oder Unfähigkeit vergleichen , glücken es er , seine speziell Erfahrung zu allgemein Gesetz zu erheben .	NE VVFIN PPER ART ADJA NN $, KON ART ADJA NN ART ADJA NN APPR PPOSAT ADJA NN KON NN VVPP $, VVFIN PPER PPER $, PPOSAT ADJA NN APPR ADJA NN PTKZU VVINF $.	Thaer widmete ihr die größte Aufmerksamkeit , und die chemische Zusammensetzung der verschiedensten Bodenarten mit ihrer speziellen Tragfähigkeit oder Unfähigkeit vergleichend , glückte es ihm , seine speziellen Erfahrungen zu allgemeinen Gesetzen zu erheben .
Tragfähigkeit	NN	1878	1	wanderley_bauconstructionslehre02_1878-1883-4	 	In Bezug auf die Tragfähigkeit dieses Windebaums ist zu berichten, daß 20 — 30 Centner schwere Werkstücke von zwei Männern in nicht allzu langer Zeit bis in die 6. Etage gehoben werden.	17:30	0:185	In Bezug auf die Tragfähigkeit dieſes Windebaums iſt zu berichten , daß 20 — 30 Centner ſchwere Werkſtücke von zwei Männern in nicht allzu langer Zeit bis in die 6. Etage gehoben werden .	4	0:34	in Bezug auf d Tragfähigkeit diese Windebaum sein zu berichten , daß 20 -- 30 Zentner schwer Werkstück von zwei Mann in nicht allzu lang Zeit bis in d 6. Etage heben werden .	APPR NN APPR ART NN PDAT NN VAFIN PTKZU VVINF $, KOUS CARD $( CARD NN ADJA NN APPR CARD NN APPR PTKNEG PTKA ADJA NN APPR APPR ART ADJA NN VVPP VAINF $.	In Bezug auf die Tragfähigkeit dieses Windebaums ist zu berichten , daß 20 -- 30 Zentner schwere Werkstücke von zwei Männern in nicht allzu langer Zeit bis in die 6. Etage gehoben werden .
Tragfähigkeit	NN	1889	1	nn_maehrisches17_1889-527-8	 	Im Allgemeinen nimmt man folgende Regel über die Tragfähigkeit des Eises an:	49:62	0:76	Im Allgemeinen nimmt man folgende Regel über die Tragfähigkeit des Eiſes an :	8	0:13	im allgemein nehmen man folgend Regel über d Tragfähigkeit d Eis an :	APPRART ADJA VVFIN PIS ADJA NN APPR ART NN ART NN PTKVZ $.	Im Allgemeinen nimmt man folgende Regel über die Tragfähigkeit des Eises an :
Tragfähigkeit	NN	1974	2	26120215_1974_10_14_01_021.tcf.xml-12-21	 	Das im Januar dieses Jahres gebildete neue Kombinat Seeverkehrs-und Hafenwirtschaft, zu dem 195 Schiffe mit rund 1.5 Millionen Tonnen Tragfähigkeit gehören, wird in diesem Jahr mehr als 12,5 Millionen Tonnen Güter transportieren.	134:147	0:229	Das im Januar dieses Jahres gebildete neue Kombinat Seeverkehrs- und Hafenwirtschaft , zu dem 195 Schiffe mit rund 1.5 Millionen Tonnen Tragfähigkeit gehören , wird in diesem Jahr mehr als 12,5 Millionen Tonnen Güter transportieren .	21	0:36	die im Januar diese Jahr gebildet neu Kombinat seeverkehrs- und Hafenwirtschaft , zu die 195 Schiff mit rund 1.5 Million Tonne Tragfähigkeit gehören , werden in diese Jahr mehr als 12,5 Million Tonne Gut transportieren .	PDS APPRART NN PDAT NN ADJA ADJA NN TRUNC KON NN $, APPR PRELS CARD NN APPR ADJD CARD NN NN NN VVFIN $, VAFIN APPR PDAT NN PIAT KOKOM CARD NN NN NN VVINF $.	
Tragfähigkeit	NN	1955	2	2532889X_1955-07-27_01_081.tcf.xml-17-11	 	Die feinen Drahtseile an den Aufzügen reißen öfter, obwohl die Tragfähigkeit laut Anschlag 50 Kilogramm betragen soll.	63:76	0:118	Die feinen Drahtseile an den Aufzügen reißen öfter , obwohl die Tragfähigkeit laut Anschlag 50 Kilogramm betragen soll .	11	0:19	d fein Drahtseil an d Aufzug reissen öfter , obwohl d Tragfähigkeit laut Anschlag 50 Kilogramm betragen sollen .	ART ADJA NN APPR ART NN VVFIN ADV $, KOUS ART NN APPR NN CARD NN VVINF VMFIN $.	
Tragfähigkeit	NN	1964	2	2532889X_1964-10-18_01_031.tcf.xml-2-48	 	Die Bölkow Entwicklungen KG in Ottobrunn bei München, eines der westdeutschen Rüstungsunternehmen, das in das Atom-und Raketenkomplott Bonns mit dem südafrikanischen Verwoerd-Reame eingeschaltet Ist, hat vom Kriegsministenum den Auftrag erhalten, einen Hubschrauber für militärische Zwecke mit einem Rotordurchmesser von 31 Metern und einer Tragfähigkeit von 20 Tonnen zu entwickeln.	341:354	0:383	Die Bölkow Entwicklungen KG in Ottobrunn bei München , eines der westdeutschen Rüstungsunternehmen , das in das Atom- und Raketenkomplott Bonns mit dem südafrikanischen Verwoerd-Reame eingeschaltet Ist , hat vom Kriegsministenum den Auftrag erhalten , einen Hubschrauber für militärische Zwecke mit einem Rotordurchmesser von 31 Metern und einer Tragfähigkeit von 20 Tonnen zu entwickeln .	48	0:55	d Bölkow Entwicklung KG in Ottobrunn bei München , eine d westdeutsch Rüstungsunternehmen , die in d atom- und Raketenkomplott Bonn mit d südafrikanisch Verwoerd-Reame einschalten sein , haben vom Kriegsministenum d Auftrag erhalten , eine Hubschrauber für militärisch Zwecke mit eine Rotordurchmesser von 31 Meter und eine Tragfähigkeit von 20 Tonne zu entwickeln .	ART NE NN NE APPR NE APPR NE $, ART ART ADJA NN $, PRELS APPR ART TRUNC KON NN NE APPR ART ADJA NN VVPP VAFIN $, VAFIN APPRART NN ART NN VVPP $, ART NN APPR ADJA NN APPR ART NN APPR CARD NN KON ART NN APPR CARD NN PTKZU VVINF $.	
Tragfähigkeit	NN	1978	2	2532889X_1978-04-22_01_237.tcf.xml-8-11	 	Jedes Schiff dieser für die sowjetische Fischfangflotte bestimmten Bauserie wird eine Tragfähigkeit von 11500tdw besitzen, 178 Meter lang und 24.6 Meter breit sein und über 8800 PS MotorenantriebsJeistung verfügen.	86:99	0:214	Jedes Schiff dieser für die sowjetische Fischfangflotte bestimmten Bauserie wird eine Tragfähigkeit von 11500tdw besitzen , 178 Meter lang und 24.6 Meter breit sein und über 8800 PS MotorenantriebsJeistung verfügen .	11	0:31	jede Schiff diese für d sowjetisch Fischfangflotte bestimmt Bauserie werden eine Tragfähigkeit von 11500tdw besitzen , 178 Meter lang und 24.6 Meter breit sein und über 8800 PS Motorenantriebsjeistung verfügen .	PIAT NN PDAT APPR ART ADJA NN ADJA NN VAFIN ART NN APPR CARD VVFIN $, CARD NN ADJD KON CARD NN ADJD VAINF KON APPR CARD NN NN VVINF $.	
Tragfähigkeit	NN	1981	2	2532889X_1981-06-18_01_109.tcf.xml-14-10	 	Mit den neuen Motoren sollen künftig die Kamas-LKW mit erhöhter Tragfähigkeit ausgerüstet werden.	64:77	0:97	Mit den neuen Motoren sollen künftig die Kamas-LKW mit erhöhter Tragfähigkeit ausgerüstet werden .	10	0:14	mit d neu Motor sollen künftig d Kamas-Lkw mit erhöht Tragfähigkeit ausrüsten werden .	APPR ART ADJA NN VMFIN ADJD ART NN APPR ADJA NN VVPP VAINF $.	
Tragfähigkeit	NN	1972	2	26120215_1972_06_30_01_291.tcf.xml-235-5	 	Cam-Lagerregale, 960X700X2500, Tragfähigkeit pro Boden 250 kg zu empfehlen 15 St. 9.-M: 30 St. 17,50 fische Schwarzmeerküste) vom 7. 7. Ber in Frau.	31:44	0:148	Cam- Lagerregale , 960X700X2500 , Tragfähigkeit pro Boden 250 kg zu empfehlen 15 St. 9.- M : 30 St. 17,50 fische Schwarzmeerküste ) vom 7. 7. Ber in Frau .	5	0:30	cam- Lagerregal , 960x700x2500 , Tragfähigkeit pro Boden 250 Kg zu empfehlen 15 St. 9.- M : 30 St. 17,50 fischen Schwarzmeerküste ) vom 7. 7. Ber in Frau .	TRUNC NN $, NE $, NN APPR NN CARD NN PTKZU VVINF CARD NE CARD NN $. CARD NE CARD VVFIN NN $( APPRART ADJA ADJA NE APPR NN $.	
Tragfähigkeit	NN	1970	2	26120215_1970_11_27_01_011.tcf.xml-22-24	 	Wesentlich geringerer Materialbedarf: Raumersparnis; rationelle Technologie; ein Fünftel weniger Kooperationsanteil und damit stabilere Produktion günstigere Platzausnutzung auf dem Schiff; mehr Tragfähigkeit	195:208	0:208	Wesentlich geringerer Materialbedarf : Raumersparnis ; rationelle Technologie ; ein Fünftel weniger Kooperationsanteil und damit stabilere Produktion günstigere Platzausnutzung auf dem Schiff ; mehr Tragfähigkeit	24	0:25	wesentlich gering Materialbedarf : Raumersparnis ; rationell Technologie ; eine Fünfteln wenige Kooperationsanteil und damit stabil Produktion günstig Platzausnutzung auf d Schiff ; mehr Tragfähigkeit	ADJD ADJA NN $. NN $. ADJA NN $. ART NN PIAT NN KON PAV ADJA NN ADJA NN APPR ART NN $. PIAT NN	
Tragfähigkeit	NN	1966	2	26120215_1966_02_04_01_049.tcf.xml-11-39	 	Vom 19000-BRT-Passagierschiff bis zum Sportboot reicht das Angebot der Schiffbauindustrie der DDR auf der Leipziger Frühjahrsmesse Auf dem Gelände der Technischen Messe werden in einer Halle Modelle von 20 Schiffstypen, darunter Motorfrachter von 3000 bis 12000 Tonnen Tragfähigkeit, Einblick in das umfangreiche Produktionsprogramm des Industriezweißes geben.	269:282	0:360	Vom 19000- BRT-Passagierschiff bis zum Sportboot reicht das Angebot der Schiffbauindustrie der DDR auf der Leipziger Frühjahrsmesse Auf dem Gelände der Technischen Messe werden in einer Halle Modelle von 20 Schiffstypen , darunter Motorfrachter von 3000 bis 12000 Tonnen Tragfähigkeit , Einblick in das umfangreiche Produktionsprogramm des Industriezweißes geben .	39	0:50	vom 19000- Brt-Passagierschiff bis zum Sportboot reichen d Angebot d Schiffbauindustrie d DDR auf d leipziger Frühjahrsmesse auf d Gelände d technisch Messe werden in eine Halle Modell von 20 Schiffstype , darunter Motorfrachter von 3000 bis 12000 Tonne Tragfähigkeit , Einblick in d umfangreich Produktionsprogramm d Industriezweißes geben .	APPRART ADJA NN APPR APPRART NN VVFIN ART NN ART NN ART NE APPR ART ADJA NN APPR ART NN ART ADJA NN VAFIN APPR ART NN NN APPR CARD NN $, PAV NN APPR CARD APPR CARD NN NN $, NN APPR ART ADJA NN ART NN VVINF $.	
Tragfähigkeit	NN	1977	2	2532889X_1977-03-24_01_072.tcf.xml-23-18	 	1924 wurden hier die ersten sowjetischen Lastkraftwagen hergestellt, gegenwärtig verlassen 200000 LKW von vier bis sechs Tonnen Tragfähigkeit die Montagebänder.	128:141	0:160	1924 wurden hier die ersten sowjetischen Lastkraftwagen hergestellt , gegenwärtig verlassen 200000 LKW von vier bis sechs Tonnen Tragfähigkeit die Montagebänder .	18	0:22	1924 werden hier d erst sowjetisch Lastkraftwagen herstellen , gegenwärtig verlassen 200000 LKW von vier bis sechs Tonne Tragfähigkeit d Montageband .	CARD VAFIN ADV ART ADJA ADJA NN VVPP $, ADJD VVPP CARD NN APPR CARD APPR CARD NN NN ART NN $.	
Tragfähigkeit	NN	1978	2	2532889X_1978-04-03_01_030.tcf.xml-3-22	 	Das 152 Meter lange und mehr als 22 Meter breite Schiff mit dem Namen des Rostocker Neubaugebietes „Lichtenhagen" hat eine Tragfähigkeit von mehr als 8000 Tonnen (tdw) und einen Aktionsradius von 12000 Seemeilen.	123:136	0:212	Das 152 Meter lange und mehr als 22 Meter breite Schiff mit dem Namen des Rostocker Neubaugebietes „ Lichtenhagen " hat eine Tragfähigkeit von mehr als 8000 Tonnen ( tdw ) und einen Aktionsradius von 12000 Seemeilen .	22	0:38	d 152 Meter lange und mehr als 22 Meter breit Schiff mit d Namen d Rostocker Neubaugebiet „ Lichtenhagen " haben eine Tragfähigkeit von mehr als 8000 Tonne ( Tdw ) und eine Aktionsradius von 12000 Seemeile .	ART CARD NN ADV KON PIAT KOKOM CARD NN ADJA NN APPR ART NN ART ADJA NN $( NE $( VAFIN ART NN APPR PIAT KOKOM CARD NN $( NE $( KON ART NN APPR CARD NN $.	
Tragfähigkeit	NN	1973	2	2532889X_1973-04-20_01_204.tcf.xml-22-17	 	Dieser Zuwachs allein würde für eine Antriebsanlage ausreichen, die einem normalen Stückgutfrachtschiff von etwa 10000 t Tragfähigkeit eine Geschwindigkeit von etwa 16 bis 17 kn verleiht.	121:134	0:187	Dieser Zuwachs allein würde für eine Antriebsanlage ausreichen , die einem normalen Stückgutfrachtschiff von etwa 10000 t Tragfähigkeit eine Geschwindigkeit von etwa 16 bis 17 kn verleiht .	17	0:28	diese Zuwachs allein werden für eine Antriebsanlage ausreichen , die eine normal Stückgutfrachtschiff von etwa 10000 T Tragfähigkeit eine Geschwindigkeit von etwa 16 bis 17 Kn verleihen .	PDAT NN ADV VAFIN APPR ART NN VVINF $, PRELS ART ADJA NN APPR ADV CARD NN NN ART NN APPR ADV CARD APPR CARD NN VVFIN $.	
Tragfähigkeit	NN	1990	2	2532889X_1990-08-11_01_083.tcf.xml-3-14	 	Wie am Freitag mitgeteilt wurde, haben die Ermittlungen ergeben, daß die zulässige Tragfähigkeit der beiden eingesetzten Krane beim Hub eines Dachbinders überschritten wurde.	83:96	0:174	Wie am Freitag mitgeteilt wurde , haben die Ermittlungen ergeben , daß die zulässige Tragfähigkeit der beiden eingesetzten Krane beim Hub eines Dachbinders überschritten wurde .	14	0:26	wie am Freitag mitteilen werden , haben d Ermittlung ergeben , daß d zulässig Tragfähigkeit d beide eingesetzt Kran beim Hub eine Dachbinder überschreiten werden .	PWAV APPRART NN VVPP VAFIN $, VAFIN ART NN VVPP $, KOUS ART ADJA NN ART PIAT ADJA NN APPRART NN ART NN VVPP VAFIN $.	
Tragfähigkeit	NN	1973	2	2532889X_1973-04-20_01_204.tcf.xml-13-17	 	Die Einführung des Containerverkehrs mit einer rapiden Verkürzung der Hafenliegezelten und der Entwicklung neuer Schiffstypen mit größeren Tragfähigkeiten, die Verbesserung der Antriebstechnik und die Steigerung der Leistung der einzelnen Antriebsmaschinen waren die wesentlichen technischen Voraussetzungen für Bau und Einsatz schneller Schiffe.	139:154	0:346	Die Einführung des Containerverkehrs mit einer rapiden Verkürzung der Hafenliegezelten und der Entwicklung neuer Schiffstypen mit größeren Tragfähigkeiten , die Verbesserung der Antriebstechnik und die Steigerung der Leistung der einzelnen Antriebsmaschinen waren die wesentlichen technischen Voraussetzungen für Bau und Einsatz schneller Schiffe .	17	0:43	d Einführung d Containerverkehr mit eine rapid Verkürzung d Hafenliegezelt und d Entwicklung neu Schiffstype mit groß Tragfähigkeit , d Verbesserung d Antriebstechnik und d Steigerung d Leistung d einzeln Antriebsmaschine sein d wesentlich technisch Voraussetzung für Bau und Einsatz schnell Schiff .	ART NN ART NN APPR ART ADJA NN ART NN KON ART NN ADJA NN APPR ADJA NN $, ART NN ART NN KON ART NN ART NN ART ADJA NN VAFIN ART ADJA ADJA NN APPR NN KON NN ADJD NN $.	
Tragfähigkeit	NN	1984	2	2532889X_1984-08-09_01_119.tcf.xml-1-29	 	Von fast 300 Schiffen für den Gütertransport im Jahre 1924 erhöhte sich der Bestand der sowjetischen Hochseeflotte in den 60 Jahren ihrer Existenz auf über 1800 Einheiten mit einer Tragfähigkeit von insgesamt rund 16 Millionen tdw.	181:194	0:231	Von fast 300 Schiffen für den Gütertransport im Jahre 1924 erhöhte sich der Bestand der sowjetischen Hochseeflotte in den 60 Jahren ihrer Existenz auf über 1800 Einheiten mit einer Tragfähigkeit von insgesamt rund 16 Millionen tdw .	29	0:37	von fast 300 Schiff für d Gutertransport im Jahr 1924 erhöhen sich d Bestand d sowjetisch Hochseeflotte in d 60 Jahr ihr Existenz auf über 1800 Einheit mit eine Tragfähigkeit von insgesamt rund 16 Million Tdw .	APPR ADV CARD NN APPR ART NN APPRART NN CARD VVFIN PRF ART NN ART ADJA NN APPR ART CARD NN PPOSAT NN APPR APPR CARD NN APPR ART NN APPR ADV ADJD CARD NN NE $.	
Tragfähigkeit	NN	1984	2	26120215_1984_11_01_01_181.tcf.xml-22-22	 	In 20 langen Wochen hatten also des Kapitäns Bauarbeiter hier in mühseliger Plackerei 1200 Holzpfähle eingerammt, um trotz ungünstiger Bodenbeschaffenheit und Tragfähigkeit das Bibliotheksgebäude errichten zu können.	159:172	0:216	In 20 langen Wochen hatten also des Kapitäns Bauarbeiter hier in mühseliger Plackerei 1200 Holzpfähle eingerammt , um trotz ungünstiger Bodenbeschaffenheit und Tragfähigkeit das Bibliotheksgebäude errichten zu können .	22	0:29	in 20 lang Woche haben also d Kapitän Bauarbeiter hier in mühselig Plackerei 1200 Holzpfahl einrammen , um trotz ungünstig Bodenbeschaffenheit und Tragfähigkeit d Bibliotheksgebäude errichten zu können .	APPR CARD ADJA NN VAFIN ADV ART NN NN ADV APPR ADJA NN CARD NN VVPP $, KOUI APPR ADJD NN KON NN ART NN VVINF PTKZU VMINF $.	
Tragfähigkeit	NN	1979	2	2532889X_1979-07-23_01_052.tcf.xml-28-11	 	Nach Vertiefung des Hafenbeckens können jetzt Tanker bis zu 45000 Tonnen Tragfähigkeit festmachen.	73:86	0:98	Nach Vertiefung des Hafenbeckens können jetzt Tanker bis zu 45000 Tonnen Tragfähigkeit festmachen .	11	0:14	nach Vertiefung d Hafenbecken können jetzt Tanker bis zu 45000 Tonne Tragfähigkeit festmachen .	APPR NN ART NN VMFIN ADV NN APPR APPR CARD NN NN VVINF $.	
Tragfähigkeit	NN	1970	2	26120215_1970_09_06_01_321.tcf.xml-6-2	 	Die durchschnittliche Tragfähigkeit der Schiffe in der Welt erhöhte sich im Zeitraum 1961—1968 um rund 60 Prozent und beträgt zur Zeit 30000 tdw.	22:35	0:145	Die durchschnittliche Tragfähigkeit der Schiffe in der Welt erhöhte sich im Zeitraum 1961—1968 um rund 60 Prozent und beträgt zur Zeit 30000 tdw .	2	0:24	d durchschnittlich Tragfähigkeit d Schiff in d Welt erhöhen sich im Zeitraum 1961—1968 um rund 60 Prozent und betragen zur Zeit 30000 Tdw .	ART ADJA NN ART NN APPR ART NN VVFIN PRF APPRART NN NE APPR ADJD CARD NN KON VVFIN APPRART NN CARD NN $.	
Tragfähigkeit	NN	1983	2	26120215_1983_03_08_01_249.tcf.xml-134-10	 	Erh. Suche zum Lieben: fähig, mögl. gebremst, Tragfähigkeit ca. tnren 1056 Bn PSF 286 1140 Bin Bärensteinstr 22190.-, Boucleteppich, 2,5 x 3,5, blau rot, Wünsche mir einen Mann u für Sohn, aufgeschl., phantasiev Partnerin.	46:59	0:222	Erh. Suche zum Lieben : fähig , mögl. gebremst , Tragfähigkeit ca. tnren 1056 Bn PSF 286 1140 Bin Bärensteinstr 22190 .- , Boucleteppich , 2,5 x 3,5 , blau rot , Wünsche mir einen Mann u für Sohn , aufgeschl . , phantasiev Partnerin .	10	0:46	Erh. Suche zum lieb : fähig , Mögl. bremsen , Tragfähigkeit ca. tnren 1056 bn psf 286 1140 sein Bärensteinstr 22190 .- , Boucleteppich , 2,5 x 3,5 , blau rot , Wunsch ich eine Mann u für Sohn , Aufgeschl . , phantasiev Partnerin .	NE NN APPRART ADJA $. ADJD $, NN VVPP $, NN ADV XY CARD XY XY CARD CARD VAFIN NE CARD $( $, NE $, CARD XY CARD $, ADJD ADJD $, NN PPER ART NN XY APPR NN $, NE $. $, FM NN $.	
Tragfähigkeit	NN	1965	2	26120215_1965_08_13_01_279.tcf.xml-8-4	 	Achtzehn Schiffe mit einer Tragfähigkeit von 100000 tdw haben die polnischen	27:40	0:76	Achtzehn Schiffe mit einer Tragfähigkeit von 100000 tdw haben die polnischen	4	0:11	achtzehn Schiff mit eine Tragfähigkeit von 100000 Tdw haben d polnisch	CARD NN APPR ART NN APPR CARD NN VAFIN ART ADJA	
Tragfähigkeit	NN	1972	2	2532889X_1972-12-31_01_015.tcf.xml-4-10	 	Das Ziel ist eine Jahresproduktion von 15000 LKW mit einer Tragfähigkeit von 12 t und darüber.	59:72	0:94	Das Ziel ist eine Jahresproduktion von 15000 LKW mit einer Tragfähigkeit von 12 t und darüber .	10	0:17	d Ziel sein eine Jahresproduktion von 15000 LKW mit eine Tragfähigkeit von 12 T und darüber .	ART NN VAFIN ART NN APPR CARD NN APPR ART NN APPR CARD NN KON PAV $.	
Tragfähigkeit	NN	1954	2	2532889X_1954-05-19_01_178.tcf.xml-2-7	 	Das dritte Hochseeschiff der CSR mit einer Tragfähigkeit von 8500 Tonnen ist am vergangenen Wochenende im finnischen Hafen Turku vom Stapel gelaufen.	43:56	0:149	Das dritte Hochseeschiff der CSR mit einer Tragfähigkeit von 8500 Tonnen ist am vergangenen Wochenende im finnischen Hafen Turku vom Stapel gelaufen .	7	0:23	d dritt Hochseeschiff d CSR mit eine Tragfähigkeit von 8500 Tonne sein am vergangen Wochenende im finnisch Hafen Turku vom Stapel laufen .	ART ADJA NN ART NN APPR ART NN APPR CARD NN VAFIN APPRART ADJA NN APPRART ADJA NN NE APPRART NN VVPP $.	
Tragfähigkeit	NN	1989	2	2532889X_1989-10-09_01_069.tcf.xml-14-12	 	Die neue Brücke übernimmt die Aufgaben einer 1911 übergebenen Stahlfachwerkbrücke, deren Tragfähigkeit auf zwölf Tonnen begrenzt war.	89:102	0:133	Die neue Brücke übernimmt die Aufgaben einer 1911 übergebenen Stahlfachwerkbrücke , deren Tragfähigkeit auf zwölf Tonnen begrenzt war .	12	0:19	d neu Brücke übernehmen d Aufgabe eine 1911 übergeben Stahlfachwerkbrücke , die Tragfähigkeit auf zwölf Tonne begrenzen sein .	ART ADJA NN VVFIN ART NN ART CARD ADJA NN $, PRELAT NN APPR CARD NN VVPP VAFIN $.	
Tragfähigkeit	NN	1987	2	26120215_1987_05_05_01_200.tcf.xml-263-12	 	Die Ausnutzung der Transportkapazitäten muß auf dem Wege der vollen Auslastung der Tragfähigkeit und der kontinuierlichen Inanspruchnahme verbessert werden.	83:96	0:156	Die Ausnutzung der Transportkapazitäten muß auf dem Wege der vollen Auslastung der Tragfähigkeit und der kontinuierlichen Inanspruchnahme verbessert werden .	12	0:20	d Ausnutzung d Transportkapazität müssen auf d Weg d voll Auslastung d Tragfähigkeit und d kontinuierlich Inanspruchnahme verbessern werden .	ART NN ART NN VMFIN APPR ART NN ART ADJA NN ART NN KON ART ADJA NN VVPP VAINF $.	
Tragfähigkeit	NN	1966	2	26120215_1966_12_11_01_490.tcf.xml-13-17	 	Es log im Wesen des aufstrebenden vormonopolistischen Kapitalismus beqründet, daß Siemens seinen Ideen die nötige materielle Tragfähigkeit in Gestalt eines kleinen Unternehmens gab, das er mit dem Mechaniker Halske als „Berliner Telegraphenanstalt" 1847 gründete, Diese sekundäre Seite im Leben des verdienstvollen Forschers nahmen die Vertreter des deutschen Monopolkapitals zum Anlaß, Werner von Siemens in einen „Repräsentanten deutschen Unternehmergeistes und Ahnherrn des Monopolkapitals umzufälschen.	125:138	0:506	Es log im Wesen des aufstrebenden vormonopolistischen Kapitalismus beqründet , daß Siemens seinen Ideen die nötige materielle Tragfähigkeit in Gestalt eines kleinen Unternehmens gab , das er mit dem Mechaniker Halske als „ Berliner Telegraphenanstalt " 1847 gründete , Diese sekundäre Seite im Leben des verdienstvollen Forschers nahmen die Vertreter des deutschen Monopolkapitals zum Anlaß , Werner von Siemens in einen „ Repräsentanten deutschen Unternehmergeistes und Ahnherrn des Monopolkapitals umzufälschen .	17	0:71	es lügen im Wesen d aufstrebend vormonopolistisch Kapitalismus Beqründet , daß Siemens seine Idee d nötig materiell Tragfähigkeit in Gestalt eine klein Unternehmen geben , die er mit d Mechaniker Halske als „ berliner Telegraphenanstalt " 1847 gründen , diese sekundär Seite im Leben d verdienstvoll Forscher nehmen d Vertreter d deutsch Monopolkapital zum Anlaß , Werner von Siemens in eine „ Repräsentant deutsch Unternehmergeist und Ahnherr d Monopolkapital umfälschen .	PPER VVFIN APPRART NN ART ADJA ADJA NN NE $, KOUS NE PPOSAT NN ART ADJA ADJA NN APPR NN ART ADJA NN VVFIN $, PRELS PPER APPR ART NN NE KOUS $( ADJA NN $( CARD VVFIN $, PDAT ADJA NN APPRART NN ART ADJA NN VVFIN ART NN ART ADJA NN APPRART NN $, NE APPR NE APPR ART $( NN ADJA NN KON NN ART NN VVIZU $.	
Tragfähigkeit	NN	1973	2	2532889X_1973-04-07_01_337.tcf.xml-12-18	 	Schlaglöcher verwandeln dann sehr schnell die Straße In eine Kraterlandschaft Seit Jahren sind die Straßenbauer dabei, die Tragfähigkeit zu verbessern und den Anteil der Straßen mit frostsicherem Unterbau zu erhöhen.	123:136	0:216	Schlaglöcher verwandeln dann sehr schnell die Straße In eine Kraterlandschaft Seit Jahren sind die Straßenbauer dabei , die Tragfähigkeit zu verbessern und den Anteil der Straßen mit frostsicherem Unterbau zu erhöhen .	18	0:32	Schlagloch verwandeln dann sehr schnell d Straße in eine Kraterlandschaft seit Jahr sein d Straßenbauer dabei , d Tragfähigkeit zu verbessern und d Anteil d Straße mit frostsicher Unterbau zu erhöhen .	NN VVFIN ADV ADV ADJD ART NN APPR ART NN APPR NN VAFIN ART NN PAV $, ART NN PTKZU VVINF KON ART NN ART NN APPR ADJA NN PTKZU VVINF $.	
Tragfähigkeit	NN	1987	2	26120215_1987_07_11_01_100.tcf.xml-25-16	 	Und Kammersängerin Uta Pnew (Deutsche Staatsoper) konnte dabei mit ihrem dunklen Stimmtimbre und überragender Tragfähigkeit wirklich schöne und eindringliche Melodiebögen entfalten.	110:123	0:181	Und Kammersängerin Uta Pnew ( Deutsche Staatsoper ) konnte dabei mit ihrem dunklen Stimmtimbre und überragender Tragfähigkeit wirklich schöne und eindringliche Melodiebögen entfalten .	16	0:24	und Kammersängerin Uta Pnew ( deutsch Staatsoper ) können dabei mit ihr dunkel Stimmetimbre und überragend Tragfähigkeit wirklich schön und eindringlich Melodiebogen entfalten .	KON NN NE NE $( ADJA NN $( VMFIN PAV APPR PPOSAT ADJA NN KON ADJA NN ADJD ADJA KON ADJA NN VVINF $.	
Tragfähigkeit	NN	1984	2	26120215_1984_11_03_01_365.tcf.xml-4-12	 	Das etwa 300 Meter lange und 30 Meter breite Schiff hat eine Tragfähigkeit von 33500 Tonnen.	61:74	0:92	Das etwa 300 Meter lange und 30 Meter breite Schiff hat eine Tragfähigkeit von 33500 Tonnen .	12	0:17	die etwa 300 Meter lange und 30 Meter breit Schiff haben eine Tragfähigkeit von 33500 Tonne .	PDS ADV CARD NN ADV KON CARD NN ADJA NN VAFIN ART NN APPR CARD NN $.	
