lemma	pos	date	grouping	identifier	description	context	indexes_target_token	indexes_target_sentence	context_tokenized	indexes_target_token_tokenized	indexes_target_sentence_tokenized	context_lemmatized	context_pos	context_normalized
Tragfähigkeit	NN	1967	2	2532889X_1967-08-12_01_139.tcf.xml-24-2	 	Seine imponierende Tragfähigkeit von 65 t stellt jedes bisherige Leistungsvermögen von Kippern in den Schatten. 520 PS eines 12-Zvlinder-Dieselmotors von 22.3 1 Hubraum bewegen den 39 t schweren Koloß vorwärts — wenn es sein muß im 60-km/h-Tempo.	19:32	0:246	Seine imponierende Tragfähigkeit von 65 t stellt jedes bisherige Leistungsvermögen von Kippern in den Schatten. 520 PS eines 12-Zvlinder-Dieselmotors von 22.3 1 Hubraum bewegen den 39 t schweren Koloß vorwärts — wenn es sein muß im 60-km/h-Tempo .	2	0:38	seine imponierend Tragfähigkeit von 65 T stellen jede bisherig Leistungsvermögen von Kipper in d Schatten. 520 PS eine 12-Zvlinder-Dieselmotors von 22.3 1 Hubraum bewegen d 39 T schwer Koloß vorwärts — wenn es sein müssen im 60-Km/h-Tempo .	PPOSAT ADJA NN APPR CARD NN VVFIN PIAT ADJA NN APPR NN APPR ART NN CARD NN ART NN APPR CARD CARD NN VVFIN ART CARD NN ADJA NN PTKVZ $( KOUS PPER VAINF VMFIN APPRART NN $.	
Tragfähigkeit	NN	1979	2	2532889X_1979-03-02_01_094.tcf.xml-27-19	 	Die großen Sorgen, die der sehr unterschiedliche Wasserstand bisher bereitete, entfallen dann, und Schiffe mit einer Tragfähigkeit von 1300 t können den Fluß befahren.	117:130	0:167	Die großen Sorgen , die der sehr unterschiedliche Wasserstand bisher bereitete , entfallen dann , und Schiffe mit einer Tragfähigkeit von 1300 t können den Fluß befahren .	19	0:28	d groß Sorge , die d sehr unterschiedlich Wasserstand bisher bereiten , entfallen dann , und Schiff mit eine Tragfähigkeit von 1300 T können d Fluß befahren .	ART ADJA NN $, PRELS ART ADV ADJA NN ADV VVFIN $, VVFIN ADV $, KON NN APPR ART NN APPR CARD NN VMFIN ART NN VVPP $.	
Tragfähigkeit	NN	1990	2	26120215_1990_01_27_01_218.tcf.xml-3-7	 	Insbesondere Kinder und Jugendliche versuchen, die Tragfähigkeit auf Bächen, Flüssen, Teichen und Seen auszuprobieren.	51:64	0:118	Insbesondere Kinder und Jugendliche versuchen , die Tragfähigkeit auf Bächen , Flüssen , Teichen und Seen auszuprobieren .	7	0:18	insbesondere Kind und Jugendliche versuchen , d Tragfähigkeit auf Bach , Fluß , Teich und See ausprobieren .	ADV NN KON NN VVINF $, ART NN APPR NN $, NN $, NN KON NN VVIZU $.	
Tragfähigkeit	NN	1983	2	26120215_1983_06_14_01_006.tcf.xml-7-6	 	Die neuen Schiffe, die eine Tragfähigkeit von 600 Tonnen haben, werden auf Wolga und Don Obst und Gemüse aus den südlichen Regionen in die nördlichen Unionsrepubliken bringen.	28:41	0:175	Die neuen Schiffe , die eine Tragfähigkeit von 600 Tonnen haben , werden auf Wolga und Don Obst und Gemüse aus den südlichen Regionen in die nördlichen Unionsrepubliken bringen .	6	0:30	d neu Schiff , die eine Tragfähigkeit von 600 Tonne haben , werden auf Wolga und Don Obst und Gemüse aus d südlich Region in d nördlich Unionsrepublik bringen .	ART ADJA NN $, PRELS ART NN APPR CARD NN VAFIN $, VAFIN APPR NE KON NE NN KON NN APPR ART ADJA NN APPR ART ADJA NN VVINF $.	
Tragfähigkeit	NN	1966	2	2532889X_1966-08-02_01_015.tcf.xml-4-4	 	Ferner befindet Passagierflugzeug mittlerer Tragfähigkeit, die JAK 40, im Bau.	44:57	0:78	Ferner befindet Passagierflugzeug mittlerer Tragfähigkeit , die JAK 40 , im Bau .	4	0:13	ferner befinden Passagierflugzeug mittel Tragfähigkeit , die Jak 40 , im Bau .	ADV VVFIN NN ADJA NN $, PRELS NE CARD $, APPRART NN $.	
Tragfähigkeit	NN	1950	2	2532889X_1950-02-18_01_162.tcf.xml-34-43	 	Liquifltjkoprttymhr' u&a datoren sind: Suche Schweißelektroden Or. VI des neuen Tarifvertrage », für ihre Hauptabteiluni 1. Krankenkassenangeiteuter Stah seile 10—20 mm Bau-Abwasserreinigung Albert Schulze, Berlin, Zahnstengen u, Spindel, Wineinige Tiefbau-2. Reichsbahnoberzugfuhrer den von 1O—30 t Tragfähigkeit. nleure mit Erfahrungen auf dem Willy e h m a n n Berlin.	300:313	0:371	Liquifltjkoprttymhr' u&a datoren sind : Suche Schweißelektroden Or. VI des neuen Tarifvertrage » , für ihre Hauptabteiluni 1. Krankenkassenangeiteuter Stah seile 10—20 mm Bau- Abwasserreinigung Albert Schulze , Berlin , Zahnstengen u , Spindel , Wineinige Tiefbau- 2. Reichsbahnoberzugfuhrer den von 1O—30 t Tragfähigkeit . nleure mit Erfahrungen auf dem Willy e h m a n n Berlin .	43	0:59	liquifltjkoprttymhr' u&a datoren sein : Suche Schweißelektrode or. vi d neu Tarifvertrag » , für ihr Hauptabteiluni 1. Krankenkassenangeiteuter Stah seilen 10—20 Mm bau- Abwasserreinigung Albert Schulze , Berlin , zahnstengen u , Spindel , Wineinige tiefbau- 2. Reichsbahnoberzugfuhrer d von 1o—30 T Tragfähigkeit . Nleure mit Erfahrung auf d Willy E H M a n n Berlin .	XY XY XY VAFIN $. NN NN XY XY ART ADJA NN $( $, APPR PPOSAT NN ADJA NE NE VVFIN CARD NN TRUNC NN NE NE $, NE $, XY XY $, NE $, NN TRUNC ADJA NN ART APPR CARD NN NN $. NN APPR NN APPR ART NE NE NE NN XY XY XY NE $.	
Tragfähigkeit	NN	1956	2	26120215_1956_09_25_01_192.tcf.xml-8-33	 	Dieser Gedanke ist jedoch nicht neu, denn Anfang August ist auf der Vickers-Armstrong-Werft in Barrow-on-Furness der vom griechischen Großreeder Niarchos in Auftrag gegebene Tanker „Evaenia Niarchos" mit 47 150 t Tragfähigkeit von Stapel gelaufen. der bei voller Ladung wegen seines Tiefsanßs den Suezkanal z. Zt. nicht durchfahren kann.	213:226	0:337	Dieser Gedanke ist jedoch nicht neu , denn Anfang August ist auf der Vickers-Armstrong-Werft in Barrow-on-Furness der vom griechischen Großreeder Niarchos in Auftrag gegebene Tanker „ Evaenia Niarchos " mit 47 150 t Tragfähigkeit von Stapel gelaufen . der bei voller Ladung wegen seines Tiefsanßs den Suezkanal z. Zt. nicht durchfahren kann .	33	0:53	diese Gedanke sein jedoch nicht neu , denn Anfang August sein auf d Vickers-Armstrong-Werft in Barrow-On-Furness d vom griechisch Großreeder Niarchos in Auftrag gegeben Tanker „ Evaenia Niarchos " mit 47 150 T Tragfähigkeit von Stapel laufen . d bei voll Ladung wegen seine Tiefsanßs d Suezkanal z. Zt. nicht durchfahren können .	PDAT NN VAFIN ADV PTKNEG ADJD $, KON NN NN VAFIN APPR ART NN APPR NE ART APPRART ADJA NN NE APPR NN ADJA NN $( NE NE $( APPR CARD CARD NN NN APPR NN VVPP $. ART APPR ADJA NN APPR PPOSAT NN ART NN APPRART NN PTKNEG VVINF VMFIN $.	
Tragfähigkeit	NN	1950	2	26120215_1950_01_29_01_014.tcf.xml-9-25	 	Gleichzeitig mit diesem Regierungsbcschluß wurde eine Verordnung des Ministeriums der Finanzen genehmigt, welche dem Fuhrleistungsgewerbe erlaubt, die höhere Belastung, je nach der Tragfähigkeit des Transportmittels nach dem Leistungsprinzip an die bisherigen Tarife anzuhängen.	181:194	0:278	Gleichzeitig mit diesem Regierungsbcschluß wurde eine Verordnung des Ministeriums der Finanzen genehmigt , welche dem Fuhrleistungsgewerbe erlaubt , die höhere Belastung , je nach der Tragfähigkeit des Transportmittels nach dem Leistungsprinzip an die bisherigen Tarife anzuhängen .	25	0:37	gleichzeitig mit diese Regierungsbcschluß werden eine Verordnung d Ministerium d Finanzen genehmigen , welche d Fuhrleistungsgewerbe erlauben , d hoch Belastung , je nach d Tragfähigkeit d Transportmittel nach d Leistungsprinzip an d bisherig Tarif anhängen .	ADJD APPR PDAT NN VAFIN ART NN ART NN ART NN VVPP $, PRELS ART NN VVPP $, ART ADJA NN $, ADV APPR ART NN ART NN APPR ART NN APPR ART ADJA NN VVIZU $.	
Tragfähigkeit	NN	1962	2	2532889X_1962-06-28_01_173.tcf.xml-10-30	 	Unser Fertigungsprogramm enthält: Gleiswaagen in moderner, entlastungsloser Schaltgewichtsbauart, Normalgrößen a) Wägefähigkeit 60-80 t, Tragfähigkeit 135 t, Brückenlänge 9 b) Wägefähigkeit 100 t, Tragfähigkeit 160 t, Brückenlänge 13 m und größer Verbund-Gleiswaagen Kombinierte Gleis-Straßenfahrzeug-Waage Straßenfahrzeugwaagen 20 und 30 t Wägefähigkeit.	197:210	0:355	Unser Fertigungsprogramm enthält : Gleiswaagen in moderner , entlastungsloser Schaltgewichtsbauart , Normalgrößen a ) Wägefähigkeit 60-80 t , Tragfähigkeit 135 t , Brückenlänge 9 b ) Wägefähigkeit 100 t , Tragfähigkeit 160 t , Brückenlänge 13 m und größer Verbund-Gleiswaagen Kombinierte Gleis-Straßenfahrzeug-Waage Straßenfahrzeugwaagen 20 und 30 t Wägefähigkeit .	30	0:49	unsere Fertigungsprogramm enthalten : Gleiswaage in modern , entlastungslos Schaltgewichtsbauart , Normalgröße A ) Wägefähigkeit 60-80 T , Tragfähigkeit 135 T , Brückenlänge 9 b ) Wägefähigkeit 100 T , Tragfähigkeit 160 T , Brückenlänge 13 M und groß Verbund-Gleiswaage kombiniert Gleis-Straßenfahrzeug-Waage Straßenfahrzeugwaage 20 und 30 T Wägefähigkeit .	PPOSAT NN VVFIN $. NN APPR ADJA $, ADJA NN $, NN NE $( NN CARD NE $, NN CARD NE $, NN CARD XY $( NN CARD NE $, NN CARD NE $, NN CARD NN KON ADJD NN ADJA NN NN CARD KON CARD NN NN $.	
Tragfähigkeit	NN	1968	2	26120215_1968_11_02_01_116.tcf.xml-10-4	 	Sie beschränkten auch die Tragfähigkeit ihrer künstlerischen Formen-6Prache und deren Ideenwelt und Aussage.	26:39	0:108	Sie beschränkten auch die Tragfähigkeit ihrer künstlerischen Formen- 6Prache und deren Ideenwelt und Aussage .	4	0:15	sie beschränken auch d Tragfähigkeit ihr künstlerisch Formen- 6prache und die Ideenwelt und Aussage .	PPER VVFIN ADV ART NN PPOSAT ADJA NN NE KON PRELAT NN KON NN $.	
Tragfähigkeit	NN	1979	2	2532889X_1979-08-31_01_161.tcf.xml-7-8	 	Bei der Entwicklung der „Mercur"-Vollcontainerfrachter mit einer Tragfähigkeit von fast 15000 Tonnen hatte sich die langfristige Zusammenarbeit Rostocker Schifübauer mit dem sowjetischen Auftraggeber und Konstruktionsbüros der UdSSR erneut bewährt.	65:78	0:248	Bei der Entwicklung der „Mercur"- Vollcontainerfrachter mit einer Tragfähigkeit von fast 15000 Tonnen hatte sich die langfristige Zusammenarbeit Rostocker Schifübauer mit dem sowjetischen Auftraggeber und Konstruktionsbüros der UdSSR erneut bewährt .	8	0:31	bei d Entwicklung d „mercur"- Vollcontainerfrachter mit eine Tragfähigkeit von fast 15000 Tonne haben sich d langfristig Zusammenarbeit Rostocker Schifübauer mit d sowjetisch Auftraggeber und Konstruktionsbüro d UdSSR erneut bewähren .	APPR ART NN ART TRUNC NN APPR ART NN APPR ADV CARD NN VAFIN PRF ART ADJA NN ADJA NN APPR ART ADJA NN KON NN ART NN ADJD VVPP $.	
Tragfähigkeit	NN	1948	2	2532889X_1948-02-10_01_197.tcf.xml-41-35	 	Zuzugsge ehmiaunz wird » icnst. Berlin W 8. ®.P. ER Die Fledermaus Berlin N 54, Postschließfach 37 /---*-Platterieröße etwa 1500 X 1500 mm, wpben wir Berlin N 65. Ostender Str; Tragfähigkeit mindestens 1000 kg, 1 Chemotechniker erwirkt.	177:190	0:236	Zuzugsge ehmiaunz wird » icnst . Berlin W 8. ®.P. ER Die Fledermaus Berlin N 54 , Postschließfach 37 /---*- Platterieröße etwa 1500 X 1500 mm , wpben wir Berlin N 65. Ostender Str ; Tragfähigkeit mindestens 1000 kg , 1 Chemotechniker erwirkt .	35	0:44	Zuzugsge Ehmiaunz werden » Icnst . Berlin W 8. ®.P. er d Fledermaus Berlin n 54 , Postschließfach 37 /---*- Platterieröße etwa 1500 x 1500 Mm , wpben wir Berlin n 65. Ostendeer Str ; Tragfähigkeit mindestens 1000 Kg , 1 Chemotechniker erwirken .	NE NE VAFIN $( NE $. NE NE ADJA NN PPER ART NN NE XY CARD $, NN CARD $( NE ADV CARD XY CARD NN $, VVFIN PPER NE XY ADJA NN NE $. NN ADV CARD NE $, CARD NN VVPP $.	
Tragfähigkeit	NN	1983	2	26120215_1983_05_17_01_056.tcf.xml-6-15	 	Jedes der zwei 36000-Tonnen-Schif fe von -Interlighter" karin 26 Leichter mit je 1100 Tonnen Tragfähigkeit an Bord nehmen.	93:106	0:122	Jedes der zwei 36000-Tonnen-Schif fe von -Interlighter " karin 26 Leichter mit je 1100 Tonnen Tragfähigkeit an Bord nehmen .	15	0:20	jede d zwei 36000-Tonnen-Schif Fe von -interlighter " Karin 26 leicht mit je 1100 Tonne Tragfähigkeit an Bord nehmen .	PIAT ART CARD NE NE APPR TRUNC $( NN CARD ADJD APPR ADV CARD NN NN APPR NN VVINF $.	
Tragfähigkeit	NN	1978	2	26120215_1978_05_19_01_259.tcf.xml-182-17	 	Int. Wirk Krs. m. Qualiflzle Junior de luie, 4,00 mal 1,04, erst 5 t Tragfähigkeit, f. 3000.— orange, m Wartb. -Heckmot.. 12 TM. runosmögl, bevori Stadtbez, bevori.	69:82	0:164	Int. Wirk Krs . m. Qualiflzle Junior de luie , 4,00 mal 1,04 , erst 5 t Tragfähigkeit , f. 3000 .— orange , m Wartb . -Heckmot .. 12 TM . runosmögl , bevori Stadtbez , bevori .	17	0:39	int. wirk krs . m. qualiflzle Junior de luie , 4,00 mal 1,04 , erst 5 T Tragfähigkeit , F. 3000 .— orange , M Wartb . -Heckmot .. 12 tm . runosmögl , bevori stadtbez , bevori .	XY XY XY $. FM FM NN FM FM $, CARD ADV CARD $, ADV CARD NN NN $, NN CARD $( ADJD $, NN NE $. NN $. CARD XY $. XY $, XY XY $, XY $.	
Tragfähigkeit	NN	1977	2	2532889X_1977-02-02_01_047.tcf.xml-5-10	 	Die 28 Besatzungsmitglieder des 122 m langen Schiffes mit einer Tragfähigkeit von über 4000 t unterstützten die Schiffbauer in den letzten Wochen vor der Auslieferung des Schiffes tatkräftig, damit trotz der winterlichen Temperaturen bei Schnee und Eis die Übergabe des Schiffes termin-und qualitätsgerecht erfolgen konnte.	64:77	0:323	Die 28 Besatzungsmitglieder des 122 m langen Schiffes mit einer Tragfähigkeit von über 4000 t unterstützten die Schiffbauer in den letzten Wochen vor der Auslieferung des Schiffes tatkräftig , damit trotz der winterlichen Temperaturen bei Schnee und Eis die Übergabe des Schiffes termin- und qualitätsgerecht erfolgen konnte .	10	0:48	d 28 Besatzungsmitglied d 122 M lang Schiff mit eine Tragfähigkeit von über 4000 T unterstützen d Schiffbauer in d letzte Woche vor d Auslieferung d Schiff tatkräftig , damit trotz d winterlich Temperatur bei Schnee und Eis d Übergabe d Schiff termin- und qualitätsgerecht erfolgen können .	ART CARD NN ART CARD NN ADJA NN APPR ART NN APPR APPR CARD NN VVFIN ART NN APPR ART ADJA NN APPR ART NN ART NN ADJD $, KOUS APPR ART ADJA NN APPR NN KON NN ART NN ART NN TRUNC KON ADJD VVINF VMFIN $.	
Tragfähigkeit	NN	1977	2	2532889X_1977-03-17_01_176.tcf.xml-3-1	 	• Tragfähigkeit 1000 kp • Außenabrnessungen der Ladeplattform 1650 x 1050 mm	2:15	0:76	• Tragfähigkeit 1000 kp • Außenabrnessungen der Ladeplattform 1650 x 1050 mm	1	0:12	• Tragfähigkeit 1000 kp • außenabrnessungen d Ladeplattform 1650 x 1050 Mm	$( NN CARD XY $( XY ART NN CARD XY CARD NN	
Tragfähigkeit	NN	1970	2	26120215_1970_06_24_01_059.tcf.xml-4-17	 	Er war beim Stapellauf Ende März auf den Namen Neubrandenbursi" getauft worcien Der I'rachter hat eine Tragfähigkeit von 10500 Tonnen und ist für dan 2-tstundigen wachfieien Maschinen -	103:116	0:185	Er war beim Stapellauf Ende März auf den Namen Neubrandenbursi " getauft worcien Der I'rachter hat eine Tragfähigkeit von 10500 Tonnen und ist für dan 2-tstundigen wachfieien Maschinen -	17	0:29	er sein beim Stapellauf Ende März auf d Namen Neubrandenbursi " taufen worcien d I'rachter haben eine Tragfähigkeit von 10500 Tonne und sein für Dan 2-Tstundigen Wachfieien Maschine -	PPER VAFIN APPRART NN NN NN APPR ART NN NE $( VVPP VAFIN ART NN VAFIN ART NN APPR CARD NN KON VAFIN APPR NE NE NE NN $(	
Tragfähigkeit	NN	1952	2	26120215_1952_10_04_01_023.tcf.xml-16-20	 	Das Walzwerk benötigt für die reibungslose Entladung der vom Stahl-und Walzwerk Brandenburg kommenden Brammen dringend einen Schienendampfkran mit einer Tragfähigkeit von fünf bis sieben Tonnen, der einen auseefallenen Kran vorübergehend ersetzen soll.	153:166	0:252	Das Walzwerk benötigt für die reibungslose Entladung der vom Stahl- und Walzwerk Brandenburg kommenden Brammen dringend einen Schienendampfkran mit einer Tragfähigkeit von fünf bis sieben Tonnen , der einen auseefallenen Kran vorübergehend ersetzen soll .	20	0:35	d Walzwerk benötigen für d reibungslos Entladung d vom stahl- und Walzwerk Brandenburg kommend Bramme dringend eine Schienendampfkran mit eine Tragfähigkeit von fünf bis sieben Tonne , die eine auseefallenen Kran vorübergehend ersetzen sollen .	ART NN VVFIN APPR ART ADJA NN ART APPRART TRUNC KON NN NE ADJA NN ADJD ART NN APPR ART NN APPR CARD APPR CARD NN $, PRELS ART ADJA NN ADJD VVINF VMFIN $.	
Tragfähigkeit	NN	1982	2	2532889X_1982-11-01_01_055.tcf.xml-15-11	 	Ein solches Fährschiff wird etwa hundert Waggons aufnehmen und über eine Tragfähigkeit von rund 11700 Tonnen verfügen.	73:86	0:118	Ein solches Fährschiff wird etwa hundert Waggons aufnehmen und über eine Tragfähigkeit von rund 11700 Tonnen verfügen .	11	0:18	eine solch Fähreschiff werden etwa hundert Waggon aufnehmen und über eine Tragfähigkeit von rund 11700 Tonne verfügen .	ART PIAT NN VAFIN ADV CARD NN VVINF KON APPR ART NN APPR ADJD CARD NN VVINF $.	
Tragfähigkeit	NN	1964	2	26120215_1964_11_12_01_053.tcf.xml-30-2	 	Die größere Tragfähigkeit der neuen Kräne erlaubt auch, fortschrittliche Montagetechnologien anzuwenden, jvie die Blockmontage.	12:25	0:127	Die größere Tragfähigkeit der neuen Kräne erlaubt auch , fortschrittliche Montagetechnologien anzuwenden , jvie die Blockmontage .	2	0:17	d groß Tragfähigkeit d neu Kran erlauben auch , fortschrittlich Montagetechnologie anwenden , jvie d Blockmontage .	ART ADJA NN ART ADJA NN VVFIN ADV $, ADJA NN VVIZU $, VVFIN ART NN $.	
Tragfähigkeit	NN	1973	2	2532889X_1973-09-08_01_092.tcf.xml-5-15	 	Im Jahre 1971 wurde auf der Georgi-Dimitroff-Werft in Warna ein Schiff von 23500 Tonnen Tragfähigkeit zu Wasser gelassen, bestellt von der Glasgower Firma „Harrison".	88:101	0:166	Im Jahre 1971 wurde auf der Georgi- Dimitroff-Werft in Warna ein Schiff von 23500 Tonnen Tragfähigkeit zu Wasser gelassen , bestellt von der Glasgower Firma „ Harrison " .	15	0:29	im Jahr 1971 werden auf d georgi- Dimitroff-Werft in Warna eine Schiff von 23500 Tonne Tragfähigkeit zu Wasser lassen , bestellen von d Glasgower Firma „ Harrison " .	APPRART NN CARD VAFIN APPR ART TRUNC NE APPR NE ART NN APPR CARD NN NN APPR NN VVPP $, VVPP APPR ART NN NN $( NE $( $.	
Tragfähigkeit	NN	1951	2	2532889X_1951-09-22_01_049.tcf.xml-3-14	 	Die „Belastungsprobe" des Autors Jan Rojewski erstreckt sich nicht nur auf die Tragfähigkeit einer nach neuen Gesichtspunkten errichteten Wohnbau-Decke, von der in den drei Akten die Rede ist.	79:92	0:192	Die „ Belastungsprobe " des Autors Jan Rojewski erstreckt sich nicht nur auf die Tragfähigkeit einer nach neuen Gesichtspunkten errichteten Wohnbau-Decke , von der in den drei Akten die Rede ist .	14	0:32	d „ Belastungsprobe " d Autor Jan Rojewski erstrecken sich nicht nur auf d Tragfähigkeit eine nach neu Gesichtspunkt errichtet Wohnbau-Decke , von die in d drei Akte d Rede sein .	ART $( NN $( ART NN NE NE VVFIN PRF PTKNEG ADV APPR ART NN ART APPR ADJA NN ADJA NN $, APPR PRELS APPR ART CARD NN ART NN VAFIN $.	
Tragfähigkeit	NN	1949	2	26120215_1949_03_27_01_023.tcf.xml-4-4	 	Der Kran hat eine Tragfähigkeit von 350 t und eine Wasserverdrängung von 5000 t. Seine Maschinenanlagen entwickeln 2700 PS.	18:31	0:123	Der Kran hat eine Tragfähigkeit von 350 t und eine Wasserverdrängung von 5000 t. Seine Maschinenanlagen entwickeln 2700 PS .	4	0:20	d Kran haben eine Tragfähigkeit von 350 T und eine Wasserverdrängung von 5000 T. seine Maschinenanlage entwickeln 2700 PS .	ART NN VAFIN ART NN APPR CARD NN KON ART NN APPR CARD NN PPOSAT NN VVFIN CARD NN $.	
Tragfähigkeit	NN	1983	2	2532889X_1983-07-15_01_149.tcf.xml-23-8	 	Länge 17,3 Meter, Breite 3,5 Meter, Tragfähigkeit 13 Tonnen.	36:49	0:60	Länge 17,3 Meter , Breite 3,5 Meter , Tragfähigkeit 13 Tonnen .	8	0:12	Länge 17,3 Meter , Breite 3,5 Meter , Tragfähigkeit 13 Tonne .	NN CARD NN $, NN CARD NN $, NN CARD NN $.	
Tragfähigkeit	NN	1977	2	2532889X_1977-07-30_01_213.tcf.xml-45-13	 	Eine besondere Rolle spielt dieses Verfahren beim Brandschutz von Stahlbauteilen, die ihre Tragfähigkeit recht schnell verlieren können, wenn sie im Brandfall auf Temperaturen von über 400 Grad erhitzt werden.	91:104	0:209	Eine besondere Rolle spielt dieses Verfahren beim Brandschutz von Stahlbauteilen , die ihre Tragfähigkeit recht schnell verlieren können , wenn sie im Brandfall auf Temperaturen von über 400 Grad erhitzt werden .	13	0:32	eine besondere Rolle spielen diese Verfahren beim Brandschutz von Stahlbauteil , die ihr Tragfähigkeit recht schnell verlieren können , wenn sie im Brandfall auf Temperatur von über 400 Grad erhitzen werden .	ART ADJA NN VVFIN PDAT NN APPRART NN APPR NN $, PRELS PPOSAT NN ADV ADJD VVINF VMINF $, KOUS PPER APPRART NN APPR NN APPR APPR CARD NN VVFIN VAINF $.	
Tragfähigkeit	NN	1975	2	2532889X_1975-01-01_01_048.tcf.xml-4-15	 	Die Querschnitte der neuen Träger wurden gegenüber der herkömmlichen Ausführung so verändert, daß gleiche Tragfähigkeit bei geringerem Walzstahleinsatz garantiert ist.	106:119	0:167	Die Querschnitte der neuen Träger wurden gegenüber der herkömmlichen Ausführung so verändert , daß gleiche Tragfähigkeit bei geringerem Walzstahleinsatz garantiert ist .	15	0:22	d Querschnitt d neu Träger werden gegenüber d herkömmlich Ausführung so verändern , daß gleich Tragfähigkeit bei gering Walzstahleinsatz garantieren sein .	ART NN ART ADJA NN VAFIN APPR ART ADJA NN ADV VVPP $, KOUS ADJA NN APPR ADJA NN VVPP VAFIN $.	
Tragfähigkeit	NN	1979	2	2532889X_1979-02-08_01_056.tcf.xml-20-4	 	Bei rund 20000 t Tragfähigkeit besitzen die Laderäume auch mobile Autohängedecks für den PKW-Transport.	17:30	0:103	Bei rund 20000 t Tragfähigkeit besitzen die Laderäume auch mobile Autohängedecks für den PKW- Transport .	4	0:16	bei rund 20000 T Tragfähigkeit besitzen d Laderaum auch mobil Autohängedeck für d pkw- Transport .	APPR ADJD CARD NN NN VVFIN ART NN ADV ADJA NN APPR ART TRUNC NN $.	
Tragfähigkeit	NN	1979	2	2532889X_1979-08-27_01_049.tcf.xml-14-7	 	Die „Poseidon" -Schiffe haben eine Tragfähigkeit von 7486 Tonnen, weitere Kennzeichen:	35:48	0:86	Die „ Poseidon " -Schiffe haben eine Tragfähigkeit von 7486 Tonnen , weitere Kennzeichen :	7	0:15	d „ Poseidon " -schiffe haben eine Tragfähigkeit von 7486 Tonne , weit Kennzeichen :	ART $( NE $( TRUNC VAFIN ART NN APPR CARD NN $, ADJA NN $.	
Tragfähigkeit	NN	1984	2	2532889X_1984-07-03_01_168.tcf.xml-75-18	 	In der MMM-Bewegung knobeln wi daran, den Einsatz von Mineralbeton beim Gleisverlegen zu erhöhen und gleichzeitig die Tragfähigkeit der Konstruktion zu steigern.	118:131	0:161	In der MMM-Bewegung knobeln wi daran , den Einsatz von Mineralbeton beim Gleisverlegen zu erhöhen und gleichzeitig die Tragfähigkeit der Konstruktion zu steigern .	18	0:24	in d Mmm-Bewegung knobeln Wi daran , d Einsatz von Mineralbeton beim Gleisverlegen zu erhöhen und gleichzeitig d Tragfähigkeit d Konstruktion zu steigern .	APPR ART NN VVFIN NE PAV $, ART NN APPR NN APPRART NN PTKZU VVINF KON ADJD ART NN ART NN PTKZU VVINF $.	
Tragfähigkeit	NN	1952	2	2532889X_1952-10-12_01_053.tcf.xml-88-27	 	Vorgesehen Ist ferner eirte beträchtliche Steigerung der Produktion von chemischen Ausrüstungen, von Hebezeugen Und Transportausrüstungen, ihsbesondere von Kränen für die Metallüräie Uhd Elbktrokräneh mit großer Tragfähigkeit, von Ergähzüngsausrüstungen für die Baustoff Produktion ] von automatischen Ausrüstungen für die Leicht-und Lebensmittelindustrie, und ihsbesondere von Webstühlen; von neuen Arten landwirtschaftlicher Maschinen sowie von Ausrüstungen für die Holzbeschaffung, die Zellulose-, papier-ürid die holzverarbeitende Industrie.	212:225	0:545	Vorgesehen Ist ferner eirte beträchtliche Steigerung der Produktion von chemischen Ausrüstungen , von Hebezeugen Und Transportausrüstungen , ihsbesondere von Kränen für die Metallüräie Uhd Elbktrokräneh mit großer Tragfähigkeit , von Ergähzüngsausrüstungen für die Baustoff Produktion ] von automatischen Ausrüstungen für die Leicht- und Lebensmittelindustrie , und ihsbesondere von Webstühlen ; von neuen Arten landwirtschaftlicher Maschinen sowie von Ausrüstungen für die Holzbeschaffung , die Zellulose- , papier- ürid die holzverarbeitende Industrie .	27	0:71	vorsehen sein ferner Eirte beträchtlich Steigerung d Produktion von chemisch Ausrüstung , von Hebezeuge und Transportausrüstung , Ihsbesondere von Kran für d Metallüräie Uhd Elbktrokräneh mit groß Tragfähigkeit , von Ergähzüngsausrüstungen für d Baustoff Produktion ] von automatisch Ausrüstung für d leicht- und Lebensmittelindustrie , und Ihsbesondere von Webstuhl ; von neu Art landwirtschaftlich Maschine sowie von Ausrüstung für d Holzbeschaffung , die zellulose- , papier- ürid d holzverarbeitend Industrie .	VVPP VAFIN ADV NE ADJA NN ART NN APPR ADJA NN $, APPR NN KON NN $, NE APPR NN APPR ART NN NE NE APPR ADJA NN $, APPR NE APPR ART NN NN $( APPR ADJA NN APPR ART TRUNC KON NN $, KON NE APPR NN $. APPR ADJA NN ADJA NN KON APPR NN APPR ART NN $, PRELS TRUNC $, TRUNC KON ART ADJA NN $.	
Tragfähigkeit	NN	1975	2	2532889X_1975-07-02_01_024.tcf.xml-3-21	 	Mittelmeerhäfen gehören seit 1963 zum festen Linienprogramm des VEB Deutfracht/Seereederei, der gegenwärtig vom Seehafen Wismar aus 23 Schiffe mit einer Tragfähigkeit bis zu 6000 Tonnen auf vier Routen einsetzt.	153:166	0:211	Mittelmeerhäfen gehören seit 1963 zum festen Linienprogramm des VEB Deutfracht/Seereederei , der gegenwärtig vom Seehafen Wismar aus 23 Schiffe mit einer Tragfähigkeit bis zu 6000 Tonnen auf vier Routen einsetzt .	21	0:31	Mittelmeerhafen gehören seit 1963 zum fest Linienprogramm d VEB Deutfracht/seereederei , die gegenwärtig vom Seehafen Wismar aus 23 Schiff mit eine Tragfähigkeit bis zu 6000 Tonne auf vier Route einsetzen .	NN VVFIN APPR CARD APPRART ADJA NN ART NN NE $, PRELS ADJD APPRART NN NE APPR CARD NN APPR ART NN APPR APPR CARD NN APPR CARD NN VVFIN $.	
