lemma	identifier	context	indexes_target_token	context_normalized
Naturschönheit	26120215_1984_08_27_01_028.tcf.xml-7-12	Während ihres Aufenthaltes unternahmen sie Ausflüge in das Schwarzatal und zu den Naturschönheiten rund um Neuhaus am Rennweg.	82:98	
Naturschönheit	2532889X_1974-09-29_01_082.tcf.xml-51-25	Wir erforschen alle Bezirke unserer Republik: Industrie, Landwirtschaft, historische und revolutionäre Stätten, kulturelle und wissenschaftliche Einrichtungen, Volksbildung, Gesundheitswesen, Naturschönheiten, Erholungsstätten und sonstige Besonderheiten.	192:208	
Naturschönheit	2532889X_1984-07-02_01_171.tcf.xml-2-8	Vom Göschenhaus aus erschließt ein stimmungsvoller Spaziergang landschaftstypische Naturschönheiten und stellt nahe gelegene Ausflugsziele wie den Grimmschen Markt, die Wassermühle Höfgen und das alte Fährhaus vor.	83:99	
Naturschönheit	2532889X_1976-08-07_01_256.tcf.xml-18-30	An Land und Leuten oder gar an sozialen Verhältnissen zeigten die „Kavaliere" kein Interesse, und mit geschlossenen Augen gingen sie auch an der Landschaft und an den Naturschönheiten vorüber.	167:183	
Naturschönheit	26120215_1983_03_10_01_050.tcf.xml-5-6	Dabei steht aber die Erhaltung der Naturschönheit des „rauchenden Donners" mit an erster Stelle, denn attraktiv wird der Sambesi vor allem nach den Victoria-Fällen, wenn er sich mit ihrem Schwung als nunmehr reißender Strom rund 150 Kilometer durch schmale Schluchten zwängt und dabei an mehreren Stellen weiter in die Tiefe fällt.	35:49	
Naturschönheit	26120215_1990_09_12_01_486.tcf.xml-7-6	Besucher finden hier die Ruhe und Naturschönheit eines kleinen botanischen Gartens, der rund ein Drittel der Grünen Scheune bewächst.	34:48	
Naturschönheit	2532889X_1957-03-10_01_065.tcf.xml-48-6	Anschließend werden die Moralritter sicher alle Naturschönheiten bewundern, die ihnen vielfältig unter kleinen Annoncen angeboten werden:	48:64	
Naturschönheit	26120215_1964_07_26_01_039.tcf.xml-135-9	Die Stadt Potsdam mit ihren historischen Sehenswürdigkeiten, den Naturschönheiten, die sie umgeben, entwickelt sich neben Berlin und Dresden zum dritten Touristenzentrum der DDR.	65:81	
Naturschönheit	2532889X_1947-11-19_01_044.tcf.xml-14-12	Auch seine Kunst Ist impressionistisch beeinflußt und widmet sich vor allem der Naturschönheit, der heimatlichen Landschaft und der Architektur.	80:94	
Naturschönheit	26120215_1951_06_26_01_188.tcf.xml-19-11	„Die Berliner Bevölkerung wird es nicht zulassen, daß die Naturschönheiten unserer Heimatstadt für miltärische Zwecke mißbraucht werden.	58:74	
Naturschönheit	26120215_1973_06_20_01_075.tcf.xml-10-14	Dieses Stück spielt in Kirgisien, am Berqsee Issyk-Kul, Aber nicht um die Naturschönheiten des Issvk-Kul zu beschreiben, wurde das Stuck qewahlt, sondern weil die hier aufgeworfenen Fragen überall in unserer sozialistischen Wirklichkeit zur Debatte stehen.	74:90	
Naturschönheit	2532889X_1980-09-05_01_070.tcf.xml-10-25	Die Gäste, zu denen in diesem Jahr auch mehr als 700 aus der DDR gehören, erleben während ihres Aufenthaltes viele Seiten dieser südmongolischen Naturschönheit.	145:159	
Naturschönheit	2532889X_1977-11-21_01_014.tcf.xml-11-9	Weiterhin informierte sich die Delegation über die Nutzung der Naturschönheiten des Vogtlandes als Urlauber-und Wintersportzentrum für Tausende Büre&r der Republik.	63:79	
Naturschönheit	26120215_1962_03_23_01_289.tcf.xml-4-10	Tn den buntgedruckten Fremden-■ führern liest man von den Naturschönheiten, dem guten Klima, den vielen Zeugen uralter Kultur und natürlich auch von den modernen Hotels, die dem Gast das Reisen auf Ceylon so bequem und angenehm wie möglich machen.	58:74	
Naturschönheit	26120215_1975_06_10_01_050.tcf.xml-32-24	Und schönstes Familien-Freizeiterlebnis fii' Christel Liebram sind Wanderungen per pedes oder mit dem Rad gemeinsam mit dem Mann und den drei Kindern durch die Naturschönheiten im Norden der Hauptstadt,	160:176	
Naturschönheit	26120215_1977_08_23_01_049.tcf.xml-5-13	Dies mag es erklären, warum ein Punkt ziemlich unbesucht bleibt, dessen Naturschönheiten nicht verächtlich und dessen historische Erinnerungen ersten Ranges sind.	72:88	
Naturschönheit	26120215_1987_03_30_01_273.tcf.xml-6-24	Großes Interesse fanden auch mehrere Ausstellungen; Zu sehen sind u. a. Großfotos, die mit der Entwicklung des befreundeten Nachbarlandes und mit seinen Naturschönheiten bekannt machen, Modelle von Lokomotiven von gestern und heute.	153:169	
Naturschönheit	2532889X_1954-05-18_01_055.tcf.xml-38-14	Ja China ist ein Land unermeßlicher oberirdischer und unterirdischer Reichtümer, ein Land herrlichster Naturschönheiten, zauberhaftester Kulturbnutcn und kostbarster Kunstschätze.	103:119	
Naturschönheit	26120215_1974_07_12_01_291.tcf.xml-18-42	Um die gewaltigen Touristenströme, die alljährlich nach Zakopane und in die umliegenden Tatra-Orte kommen, zu bewältigen, faßte Polens Ministerrat Ende 1972 einen Beschluß über die weitere Entwicklung der touristischen Basis und Maßnahmen zum Schutz der natürlichen Umwelt, der Naturschönheiten des Tatra-Gebirges für die Jahre bis 1980.	278:294	
Naturschönheit	26120215_1978_03_25_01_449.tcf.xml-2-42	Im Kreis Beeskow ist in den Jahren 1976 und 1977 etwas entstanden, was sich unmittelbar aus der sozialistischen Entwicklung unserer Landwirtschaft ergibt: eine bewußte und planmäßige Gestaltung der Landschaft, die die Bedürfnisse der industriemäßigen Agrarproduktion und die Erhaltung der Naturschönheiten berücksichtigt.	289:305	
Naturschönheit	2532889X_1986-05-17_01_233.tcf.xml-22-23	Die Revolution vom 25. April 1974 bedeutete auch für die Perola do Atläntico (Perle des Atlantik), wie Madeira wegen seiner Naturschönheiten genannt wird, eine Zäsur.	124:140	
Naturschönheit	2532889X_1963-05-10_01_146.tcf.xml-2-1	Den Naturschönheiten des freundlichen Vorortes und den Berlinern, -die sie sich nicht entgehen lassen wollten, verdankt Woltersdori das Bestehen seiner Straßenbahn.	4:20	
Naturschönheit	2532889X_1983-02-11_01_139.tcf.xml-17-16	formieren auf den Zeltplätzen Naturschützer die Urlauber über das richtige Verhalten im Wald, machen auf Naturschönheiten aufmerksam, und regen zu aktiver Mitarbeit im Naturschutz an.	105:121	
Naturschönheit	2532889X_1974-05-16_01_056.tcf.xml-6-12	Plastisch entfaltet Markow in diesem Abschnitt seines großen Gesellschaftsromans vor uns die Naturschönheiten und Reichtümer dieses unerschlossenen Gebietes,	93:109	
Naturschönheit	2532889X_1973-06-23_01_345.tcf.xml-2-17	Wer unseren Pavillon der Weidendammbrücke betritt, kann sozusagen in einem Buch über das Leben, die Naturschönheiten und Kunstschätze der CSSR lesen.	100:116	
Naturschönheit	2532889X_1986-08-09_01_105.tcf.xml-61-29	Unter ihren geschienen Händen entstand ein phantasievoller Wegweiser (hier ein Ausschnitt), der nicht nur über Ortschaften, Straßen und Gewässer Auskunft gibt, sondern auch auf Naturschönheiten der Umgebung aufmerksam macht Foto:ND/Wot	177:193	
Naturschönheit	2532889X_1950-05-24_01_101.tcf.xml-14-2	Die wilde Naturschönheit der Schluchten wird durch menschhenen Eingriff veredelt.	10:24	
Naturschönheit	26120215_1979_11_21_01_241.tcf.xml-2-10	Insgesamt erhielten 45 Gedenkstätten, Altertümer und Orte von außergewöhnlicher Naturschönheit in aller Welt dieses Prädikat. darunter die Königsgräber des antiken Theben, der Mount Everest und der Grand Canon in den USA	80:94	
Naturschönheit	26120215_1978_08_23_01_163.tcf.xml-6-20	Der Garten Eden Ich mach das, Chef Romantisch, pittoreske Reise durch CSSR. P14: 17. 30. 20 Uhr Naturschönheiten der Sächsischen Schweiz Fr— St «.	96:112	
Naturschönheit	26120215_1963_04_21_01_212.tcf.xml-16-6	Im Mai werden sechs Marken die Naturschönheiten der Tschechoslowakei vorführen.	31:47	
Naturschönheit	2532889X_1980-11-01_01_109.tcf.xml-25-1	Die Naturschönheit dieser „Perlen der Gebirge und Ebenen", wie es in poetischer Umschreibung heißt, zu erhalten, bleibt aus gutem Grund eine Forderung im Plan für die soziale und ökonomische Entwicklung des Landes.	4:18	
Naturschönheit	26120215_1969_01_31_01_390.tcf.xml-5-14	Geographischer Schauplatz der Handlung dieses Romans ist das sächsische Erzgebirge, das mit seinen Naturschönheiten, Bräuchen und Menschen vor über zwanzig Jahren unversehens und hier und da sich noch längere Zeit verwundernd die Augen reibend, zu einem wichtigen Posten in der großen Friedensstrategie des Sozialismus wurde.	99:115	
Naturschönheit	26120215_1988_04_21_01_285.tcf.xml-1-2	Zu den Naturschönheiten der Erde cehSrt fraglos der Baikal-See Im fernen Sibirien.	7:23	
Naturschönheit	2532889X_1970-02-28_01_251.tcf.xml-23-1	Die Naturschönheiten werden nicht beeinträchtigt, sondern vielmehr gepflegt und für die Erholung der Werktätigen nutzbar gemacht.	4:20	
Naturschönheit	26120215_1978_10_17_01_116.tcf.xml-45-7	Und eine „Romantisch-pittoreske Reise durch die Naturschönheiten der Sächsischen Schweiz" (Werner Kohlert) lädt kurzweiliger zu empfindungsvollem Zuschauen ein, als der lange Titel vermuten läßt.	48:64	
Naturschönheit	26120215_1974_08_21_01_258.tcf.xml-33-6	„Die einen suchen die ungestörte Naturschönheit vieler Gebirgstäler z. B. in der Großen Fatra und in der Kleinen ratra und selbstverständlich in der Niederen Tatra, unserem 80 km langen höchsten Gebirge, das immerhin im Dumbier 2046 m und im Chopok 2029 m Höhe erreicht.	33:47	
Naturschönheit	2532889X_1982-04-17_01_060.tcf.xml-2-26	Auf Schusters Rappen sind Gerhard Neef, die Gruppe Hackstock nebst Kameramann, Regisseur und was so alles zu einem Drehstab gehört, in unserem Land Naturschönheiten, reizvoller Architektur und interessanten Zeitgenossen auf der Spur.	148:164	
Naturschönheit	26120215_1954_04_27_01_030.tcf.xml-21-18	Nur darf man nicht übersehen, daß Goethe eine epische Dichtung plante, deren eigentlicher Gegenstand dir erhabene Naturschönheit der Schweizer Landschaft war.	114:128	
Naturschönheit	26120215_1986_03_19_01_154.tcf.xml-5-20	Wie uns Betriebsdirektor Paul Ettl mitteilte, bietet die Weiße Flotte auch über Ostern Gelegenheit, vom Wasser her die Naturschönheiten unserer Stadt zu erleben.	119:135	
Naturschönheit	26120215_1965_04_27_01_185.tcf.xml-5-8	In den Bergtälern Bananenplantagen und Palmenhaine, unvergeßliche Naturschönheiten.	66:82	
Naturschönheit	2532889X_1970-08-27_01_132.tcf.xml-4-23	Gezeigt und besprochen werden mit Hilfe von Film und Diapositiv verschiedene Sowjetrepubliken, Industriezentren der UdSSR, die Heldenstädte an der Wolga und Naturschönheiten des Landes.	157:173	
Naturschönheit	2532889X_1967-09-23_01_344.tcf.xml-3-13	Und so mancher entdeckt nur wenige Wegstunden von den eigenen vier Wänden entfernt Naturschönheiten und interessante Baudenkmäler.	83:99	
Naturschönheit	26120215_1981_12_31_01_253.tcf.xml-3-15	Die Ausstellung gibt Einblick in den Alltag und das Leben des bulgarischen Volkes und die Naturschönheiten des Landes.	90:106	
Naturschönheit	26120215_1988_06_18_01_394.tcf.xml-3-3	Andere entdecken die Naturschönheiten dieser Landschaft von Lübben und Burg aus.	21:37	
Naturschönheit	2532889X_1967-07-29_01_333.tcf.xml-49-27	Auf unserer Fahrt in die kas chiirnsehe Schweiz und zu den Großs tädten Szczecin und Gdansk lernten wir einen Teil unseres Nachbarlandes ken nett, in dem Naturschönheiten, Bauwerk e von einzigartigem Wert und Industrie werke zu bewundern sind.	154:170	
Naturschönheit	2532889X_1987-11-10_01_027.tcf.xml-9-5	Die Schüler lernen Kulturschätze und Naturschönheiten der Heimat näher kennen.	37:53	
Naturschönheit	26120215_1974_05_28_01_250.tcf.xml-2-3	Daß die an Naturschönheiten reiche Slowakei zugleich ein bedeutendes Industriegebiet der CSSR ist, wird in einer Ausstellung im Kulturzentrum des befreundeten Nachbarlandes in der Friedrichstraße anschaulich demonstriert.	11:27	
Naturschönheit	2532889X_1965-08-15_01_070.tcf.xml-5-8	Unsere Regierangsdelegation hat nur wenig Zeit; diese Naturschönheiten zu betrachten.	54:70	
Naturschönheit	26120215_1967_11_23_01_145.tcf.xml-26-9	Ungesagt legte sidi beiden über die Freude an der Naturschönheit der dunkle Gedanke an das Leid, unter dem die Menschen stöhnten.	50:64	
