lemma	pos	date	grouping	identifier	description	context	indexes_target_token	indexes_target_sentence	context_tokenized	indexes_target_token_tokenized	indexes_target_sentence_tokenized	context_lemmatized	context_pos	context_normalized
aufrechterhalten	VVIZU	1848	1	nn_nrhz213b_1849-70-26	 	Schließlich dankt sie Gott und ihrem Volke für den loyalen Geist der Nation und hofft, die Kammern würden ihr helfen, das Gerüst der Konstitution aufrechtzuerhalten, das auf Freiheit und Gleichheit basirt sei.	146:164	0:209	Schließlich dankt sie Gott und ihrem Volke für den loyalen Geist der Nation und hofft , die Kammern würden ihr helfen , das Gerüst der Konstitution aufrechtzuerhalten , das auf Freiheit und Gleichheit basirt sei .	26	0:36	schließlich danken sie Gott und ihr Volk für d loyal Geist d Nation und hoffen , d Kammer werden sie helfen , d Gerüst d Konstitution aufrechterhalten , die auf Freiheit und Gleichheit basieren sein .	ADV VVFIN PPER NN KON PPOSAT NN APPR ART ADJA NN ART NN KON VVFIN $, ART NN VAFIN PPER VVINF $, ART NN ART NN VVIZU $, PRELS APPR NN KON NN VVFIN VAFIN $.	Schließlich dankt sie Gott und ihrem Volke für den loyalen Geist der Nation und hofft , die Kammern würden ihr helfen , das Gerüst der Konstitution aufrechtzuerhalten , das auf Freiheit und Gleichheit basiert sei .
aufrechterhalten	VVIZU	1894	1	schwappach_forstpolitik_1894-4946-14	 	Die Fischerei auf offener See wird beiderseits durch Kreuzer beaufsichtigt, welche die Ordnung aufrechtzuerhalten und gegebenen Falls sofortige Untersuchung und Verhaftung vorzunehmen haben.	95:113	0:190	Die Fischerei auf offener See wird beiderseits durch Kreuzer beaufsichtigt , welche die Ordnung aufrechtzuerhalten und gegebenen Falls sofortige Untersuchung und Verhaftung vorzunehmen haben .	14	0:25	d Fischerei auf offen See werden beiderseits durch Kreuzer beaufsichtigen , welche d Ordnung aufrechterhalten und gegeben Fall sofortig Untersuchung und Verhaftung vornehmen haben .	ART NN APPR ADJA NN VAFIN ADV APPR NE VVPP $, PRELS ART NN VVIZU KON ADJA NN ADJA NN KON NN VVIZU VAFIN $.	Die Fischerei auf offener See wird beiderseits durch Kreuzer beaufsichtigt , welche die Ordnung aufrechtzuerhalten und gegebenen Falls sofortige Untersuchung und Verhaftung vorzunehmen haben .
aufrechterhalten	VVPP	1895	1	mayer_verwaltungsrecht01_1895-4564-18	 	Unsere Polizei, die Polizei im Rechtsstaate, hat eine solche allgemeine Pflicht nur in ganz beschränktem Masse aufrechterhalten; ihre Massregeln können nur denjenigen treffen, der verantwortlich ist für die Störung, von dem sie ausgeht.	111:127	0:236	Unsere Polizei , die Polizei im Rechtsstaate , hat eine solche allgemeine Pflicht nur in ganz beschränktem Maſse aufrechterhalten ; ihre Maſsregeln können nur denjenigen treffen , der verantwortlich ist für die Störung , von dem sie ausgeht .	18	0:39	unsere Polizei , d Polizei im Rechtsstaat , haben eine solch allgemein Pflicht nur in ganz beschränkt Maß aufrechterhalten ; ihr Maßregel können nur diejenige treffen , die verantwortlich sein für d Störung , von die sie ausgehen .	PPOSAT NN $, ART NN APPRART NN $, VAFIN ART PIAT ADJA NN ADV APPR ADV ADJA NN VVPP $. PPOSAT NN VMFIN ADV PDS VVINF $, PRELS ADJD VAFIN APPR ART NN $, APPR PRELS PPER VVFIN $.	Unsere Polizei , die Polizei im Rechtsstaate , hat eine solche allgemeine Pflicht nur in ganz beschränktem Maße aufrechterhalten ; ihre Massregeln können nur denjenigen treffen , der verantwortlich ist für die Störung , von dem sie ausgeht .
aufrechterhalten	VVINF	1879	1	treitschke_geschichte01_1879-8551-56	 	Noch stolzer forderte Gneisenau für sein Preußen das beste und volksthümlichste Heerwesen der Welt, dazu die Freiheit gründlicher wissenschaftlicher Bildung und eine verständige, die Nation zu einem lebendigen Ganzen vereinende Staatsverfassung: „der dreifache Primat der Waffen, der Constitution, der Wissenschaft ist es allein, der uns zwischen den mächtigeren Nachbarn aufrechterhalten kann.“	372:388	0:395	Noch ſtolzer forderte Gneiſenau für ſein Preußen das beſte und volksthümlichſte Heerweſen der Welt , dazu die Freiheit gründlicher wiſſenſchaftlicher Bildung und eine verſtändige , die Nation zu einem lebendigen Ganzen vereinende Staatsverfaſſung : „ der dreifache Primat der Waffen , der Conſtitution , der Wiſſenſchaft iſt es allein , der uns zwiſchen den mächtigeren Nachbarn aufrechterhalten kann . “	56	0:60	noch stolz fordern Gneisenau für sein Preuße d gut und volkstümlich Heerwesen d Welt , dazu d Freiheit gründlich wissenschaftlich Bildung und eine verständig , d Nation zu eine lebendig Ganze vereinend Staatsverfassung : " d dreifach Primat d Waffe , d Konstitution , d Wissenschaft sein es allein , die wir zwischen d mächtig Nachbar aufrechterhalten können . "	ADV ADJA VVFIN NE APPR PPOSAT NN ART ADJA KON ADJA NN ART NN $, PAV ART NN ADJD ADJA NN KON ART ADJA $, ART NN APPR ART ADJA NN ADJA NN $. $( ART ADJA NN ART NN $, ART NN $, ART NN VAFIN PPER ADV $, PRELS PPER APPR ART ADJA NN VVINF VMFIN $. $(	Noch stolzer forderte Gneisenau für sein Preußen das beste und volkstümlichste Heerwesen der Welt , dazu die Freiheit gründlicher wissenschaftlicher Bildung und eine verständige , die Nation zu einem lebendigen Ganzen vereinende Staatsverfassung : " der dreifache Primat der Waffen , der Konstitution , der Wissenschaft ist es allein , der uns zwischen den mächtigeren Nachbarn aufrechterhalten kann . "
aufrechterhalten	VVINF	1896	1	mayer_verwaltungsrecht02_1896-1034-58	 	In diesen Fällen verliert natürlich das Rücktrittsrecht, wenn es auch an sich rechtlich noch besteht und geübt werden kann, für den Unternehmer allen Vorteil; er wird sich dessen, wenn die Sachen einmal so weit sind, möglichst nur bedienen nach Verständigung mit den zu Enteignenden, damit sie die Entschädigungsansprüche nicht geltend machen oder aufrechterhalten.	348:364	0:365	In diesen Fällen verliert natürlich das Rücktrittsrecht , wenn es auch an sich rechtlich noch besteht und geübt werden kann , für den Unternehmer allen Vorteil ; er wird sich dessen , wenn die Sachen einmal so weit sind , möglichst nur bedienen nach Verständigung mit den zu Enteignenden , damit sie die Entschädigungsansprüche nicht geltend machen oder aufrechterhalten .	58	0:60	in diese Fall verlieren natürlich d Rücktrittsrecht , wenn es auch an sich rechtlich noch bestehen und üben werden können , für d Unternehmer alle Vorteil ; er werden sich die , wenn d Sache einmal so weit sein , möglichst nur bedienen nach Verständigung mit d zu enteignend , damit sie d Entschädigungsanspruch nicht geltend machen oder aufrechterhalten .	APPR PDAT NN VVFIN ADV ART NN $, KOUS PPER ADV APPR PRF ADJD ADV VVFIN KON VVPP VAINF VMFIN $, APPR ART NN PIAT NN $. PPER VAFIN PRF PDS $, KOUS ART NN ADV ADV ADJD VAFIN $, ADV ADV VVFIN APPR NN APPR ART PTKZU ADJA $, KOUS PPER ART NN PTKNEG ADJD VVINF KON VVINF $.	In diesen Fällen verliert natürlich das Rücktrittsrecht , wenn es auch an sich rechtlich noch besteht und geübt werden kann , für den Unternehmer allen Vorteil ; er wird sich dessen , wenn die Sachen einmal so weit sind , möglichst nur bedienen nach Verständigung mit den zu Enteignenden , damit sie die Entschädigungsansprüche nicht geltend machen oder aufrechterhalten .
aufrechterhalten	VVPP	1895	1	mayer_verwaltungsrecht01_1895-5288-41	 	Der Polizeistrafrechtssatz berührt sich darin mit dem Polizeizwang und steht im Gegensatz zu den bisher behandelten Rechtsinstituten des Befehls und der Erlaubnis, welche nur die rechtliche Ordnung selbst bestimmen, ohne noch das Mittel zu geben, mit welchem sie aufrechterhalten werden soll.	263:279	0:292	Der Polizeistrafrechtssatz berührt sich darin mit dem Polizeizwang und steht im Gegensatz zu den bisher behandelten Rechtsinstituten des Befehls und der Erlaubnis , welche nur die rechtliche Ordnung selbst bestimmen , ohne noch das Mittel zu geben , mit welchem sie aufrechterhalten werden soll .	41	0:45	d Polizeistraferechtssatz berühren sich darin mit d Polizeizwang und stehen im Gegensatz zu d bisher behandeln Rechtsinstitut d Befehl und d Erlaubnis , welche nur d rechtlich Ordnung selbst bestimmen , ohne noch d Mittel zu geben , mit welche sie aufrechterhalten werden sollen .	ART NN VVFIN PRF PAV APPR ART NN KON VVFIN APPRART NN APPR ART ADV VVFIN NN ART NN KON ART NN $, PRELS ADV ART ADJA NN ADV VVINF $, KOUI ADV ART NN PTKZU VVINF $, APPR PRELS PPER VVPP VAINF VMFIN $.	Der Polizeistrafrechtssatz berührt sich darin mit dem Polizeizwang und steht im Gegensatz zu den bisher behandelten Rechtsinstituten des Befehls und der Erlaubnis , welche nur die rechtliche Ordnung selbst bestimmen , ohne noch das Mittel zu geben , mit welchem sie aufrechterhalten werden soll .
aufrechterhalten	VVPP	1885	1	duehring_berufsbildung_1885-261-35	 	Da mögen denn allenfalls die Mädchen in den Zwanzigern zusehen, wie sie sich mit einem Schock Jungen, die grade in den besten Flegeljahren sind, abfinden und unter der Bande Fleiss und Zucht aufrechterhalten.	191:207	0:208	Da mögen denn allenfalls die Mädchen in den Zwanzigern zusehen , wie sie sich mit einem Schock Jungen , die grade in den besten Flegeljahren sind , abfinden und unter der Bande Fleiss und Zucht aufrechterhalten .	35	0:37	da mögen denn allenfalls d Mädchen in d Zwanziger zusehen , wie sie sich mit eine Schock Junge , die gerade in d gut Flegeljahr sein , abfinden und unter d Bande Fleiß und Zucht aufrechterhalten .	ADV VMFIN ADV ADV ART NN APPR ART NN VVINF $, PWAV PPER PRF APPR ART NN NN $, PRELS ADV APPR ART ADJA NN VAFIN $, VVINF KON APPR ART NN NN KON NN VVPP $.	Da mögen denn allenfalls die Mädchen in den Zwanzigern zusehen , wie sie sich mit einem Schock Jungen , die gerade in den besten Flegeljahren sind , abfinden und unter der Bande Fleiß und Zucht aufrechterhalten .
aufrechterhalten	VVPP	1879	1	treitschke_geschichte01_1879-1365-45	 	Wenn es nicht gelang die kriegerischen Kräfte dieses Volkes noch einmal zu kühnem Wagen zusammenzuraffen und dem heiligen Reiche durch Preußens Waffen eine neue Verfassung zu schaffen, so ließ sich die gewaltsame Vereinigung der gesammten Staatsgewalt in einer Hand nicht mehr für die Dauer aufrechterhalten.	291:307	0:308	Wenn es nicht gelang die kriegeriſchen Kräfte dieſes Volkes noch einmal zu kühnem Wagen zuſammenzuraffen und dem heiligen Reiche durch Preußens Waffen eine neue Verfaſſung zu ſchaffen , ſo ließ ſich die gewaltſame Vereinigung der geſammten Staatsgewalt in einer Hand nicht mehr für die Dauer aufrechterhalten .	45	0:47	wenn es nicht gelingen d kriegerisch Kraft diese Volk noch einmal zu kühn Wagen zusammenraffen und d heilig Reiche durch Preußen Waffe eine neu Verfassung zu schaffen , so lassen sich d gewaltsam Vereinigung d gesamt Staatsgewalt in eine Hand nicht mehr für d Dauer aufrechterhalten .	KOUS PPER PTKNEG VVFIN ART ADJA NN PDAT NN ADV ADV APPR ADJA NN VVIZU KON ART ADJA NE APPR NE NN ART ADJA NN PTKZU VVINF $, ADV VVFIN PRF ART ADJA NN ART ADJA NN APPR ART NN PTKNEG ADV APPR ART NN VVPP $.	Wenn es nicht gelang die kriegerischen Kräfte dieses Volkes noch einmal zu kühnem Wagen zusammenzuraffen und dem heiligen Reiche durch Preußens Waffen eine neue Verfassung zu schaffen , so ließ sich die gewaltsame Vereinigung der gesamten Staatsgewalt in einer Hand nicht mehr für die Dauer aufrechterhalten .
aufrechterhalten	ADJA	1885	1	duehring_berufsbildung_1885-1253-20	 	Es ist daher kein Wunder, wenn der mit allen Mitteln betriebene und, wenn verübt, mit allen Mitteln aufrechterhaltene Ehrendiebstahl und andere verwandte saubere Stückchen in der Gelehrtenclasse mehr grassiren, als in der ungelehrten der gemeine Diebstahl und die sonstigen Gaunerstreiche.	100:117	0:289	Es ist daher kein Wunder , wenn der mit allen Mitteln betriebene und , wenn verübt , mit allen Mitteln aufrechterhaltene Ehrendiebstahl und andere verwandte saubere Stückchen in der Gelehrtenclasse mehr grassiren , als in der ungelehrten der gemeine Diebstahl und die sonstigen Gaunerstreiche .	20	0:45	es sein daher keine Wunder , wenn d mit alle Mittel betreiben und , wenn verüben , mit alle Mittel aufrechterhalten Ehrendiebstahl und ander verwandt sauber Stückchen in d Gelehrtenklasse mehr grassieren , als in d ungelehrt d gemein Diebstahl und d sonstig Gaunerstreiche .	PPER VAFIN PAV PIAT NN $, KOUS ART APPR PIAT NN ADJA KON $, KOUS VVPP $, APPR PIAT NN ADJA NN KON ADJA ADJA ADJA NN APPR ART NN ADV VVINF $, KOKOM APPR ART ADJA ART ADJA NN KON ART ADJA NN $.	Es ist daher kein Wunder , wenn der mit allen Mitteln betriebene und , wenn verübt , mit allen Mitteln aufrechterhaltene Ehrendiebstahl und andere verwandte saubere Stückchen in der Gelehrtenklasse mehr grassieren , als in der ungelehrten der gemeine Diebstahl und die sonstigen Gaunerstreiche .
aufrechterhalten	ADJA	1848	1	nn_nrhz183_1848-129-14	 	Was wollt ihr denn mehr, als eine so fest garantirte, so streng aufrechterhaltene Ruhe?! —	64:81	0:90	Was wollt ihr denn mehr , als eine so fest garantirte , so streng aufrechterhaltene Ruhe ?! —	14	0:18	was wollen sie denn mehr , als eine so fest garantiert , so streng aufrechterhalten Ruhe ?! --	PWS VMFIN PPER ADV PIS $, KOKOM ART ADV ADJD ADJA $, ADV ADJD ADJA NN $. $(	Was wollt ihr denn mehr , als eine so fest garantierte , so streng aufrechterhaltene Ruhe ?! --
aufrechterhalten	VVPP	1895	1	mayer_verwaltungsrecht01_1895-5001-16	 	Die Versagung ist rechtsgültig, wenn nach dem Sinne des Rechtssatzes das Verbot für diesen Fall aufrechterhalten werden soll oder die Aufrechterhaltung dem Ermessen der Behörde überlassen ist.	96:112	0:192	Die Versagung ist rechtsgültig , wenn nach dem Sinne des Rechtssatzes das Verbot für diesen Fall aufrechterhalten werden soll oder die Aufrechterhaltung dem Ermessen der Behörde überlassen ist .	16	0:29	d Versagung sein rechtsgültig , wenn nach d Sinn d Rechtssatz d Verbot für diese Fall aufrechterhalten werden sollen oder d Aufrechterhaltung d Ermessen d Behörde überlassen sein .	ART NN VAFIN ADJD $, KOUS APPR ART NN ART NN ART NN APPR PDAT NN VVPP VAINF VMFIN KON ART NN ART NN ART NN VVPP VAFIN $.	Die Versagung ist rechtsgültig , wenn nach dem Sinne des Rechtssatzes das Verbot für diesen Fall aufrechterhalten werden soll oder die Aufrechterhaltung dem Ermessen der Behörde überlassen ist .
aufrechterhalten	VVIZU	1885	1	treitschke_geschichte03_1885-8467-21	 	Die drei Städte hatten sich einst, als der große Hansebund zerfiel, verpflichtet den alten Namen und die alte Verbindung aufrechtzuerhalten, sie hatten während des Befreiungskrieges durch gemeinsame rührige diplomatische Arbeit ihre Wiederherstellung durchgesetzt und hielten auch im Frieden freundnachbarlich zusammen.	121:139	0:319	Die drei Städte hatten ſich einſt , als der große Hanſebund zerfiel , verpflichtet den alten Namen und die alte Verbindung aufrechtzuerhalten , ſie hatten während des Befreiungskrieges durch gemeinſame rührige diplomatiſche Arbeit ihre Wiederherſtellung durchgeſetzt und hielten auch im Frieden freundnachbarlich zuſammen .	21	0:44	d drei Stadt haben sich einst , als d groß Hansebund zerfallen , verpflichten d alt Name und d alt Verbindung aufrechterhalten , sie haben während d Befreiungskrieg durch gemeinsam rührig diplomatisch Arbeit ihr Wiederherstellung durchsetzen und halten auch im Frieden freundnachbarlich zusammen .	ART CARD NN VAFIN PRF ADV $, KOKOM ART ADJA NN VVFIN $, VVFIN ART ADJA NN KON ART ADJA NN VVIZU $, PPER VAFIN APPR ART NN APPR ADJA ADJA ADJA NN PPOSAT NN VVPP KON VVFIN ADV APPRART NN ADJD PTKVZ $.	Die drei Städte hatten sich einst , als der große Hansebund zerfiel , verpflichtet den alten Namen und die alte Verbindung aufrechtzuerhalten , sie hatten während des Befreiungskrieges durch gemeinsame rührige diplomatische Arbeit ihre Wiederherstellung durchgesetzt und hielten auch im Frieden freundnachbarlich zusammen .
aufrechterhalten	VVPP	1896	1	mayer_verwaltungsrecht02_1896-4079-14	 	In gewissem Umfange sehen wir die freie Verfügung des Dienstherrn über das Amt schlechthin aufrechterhalten.	91:107	0:108	In gewissem Umfange sehen wir die freie Verfügung des Dienstherrn über das Amt schlechthin aufrechterhalten .	14	0:16	in gewiß Umfang sehen wir d frei Verfügung d Dienstherr über d Amt schlechthin aufrechterhalten .	APPR ADJA NN VVFIN PPER ART ADJA NN ART NN APPR ART NN ADV VVPP $.	In gewissem Umfange sehen wir die freie Verfügung des Dienstherrn über das Amt schlechthin aufrechterhalten .
aufrechterhalten	VVIZU	1879	1	zoeckler_lehre_1879-1642-38	 	Auch der aus der Hirnbildung von Jdioten oder Mikrocephalen entnommene Beweis für einen affenähnlichen Typus der Urmenschheit, in dessen Betonung K. Vogt sich eine Zeitlang gefiel und der noch immer von Häckel und einigen andren extremen Darwinisten aufrechtzuerhalten versucht wird, ist längst als nichtig dargethan worden.	250:268	0:324	Auch der aus der Hirnbildung von Jdioten oder Mikrocephalen entnommene Beweis für einen affenähnlichen Typus der Urmenſchheit , in deſſen Betonung K. Vogt ſich eine Zeitlang gefiel und der noch immer von Häckel und einigen andren extremen Darwiniſten aufrechtzuerhalten verſucht wird , iſt längſt als nichtig dargethan worden .	38	0:49	auch d aus d Hirnbildung von Idiot oder Mikrocephalen entnehmen Beweis für eine affenähnlich Typus d Urmenschheit , in die Betonung K. Vogt sich eine Zeitlang gefallen und die noch immer von Häckel und einige ander extrem Darwinist aufrechterhalten versuchen werden , sein längst als nichtig dartuen werden .	ADV ART APPR ART NN APPR NN KON NE ADJA NN APPR ART ADJA NN ART NN $, APPR PRELAT NN NE NE PRF ART NN VVFIN KON PRELS ADV ADV APPR NE KON PIAT ADJA ADJA NN VVIZU VVPP VAFIN $, VAFIN ADV KOKOM ADJD VVPP VAPP $.	Auch der aus der Hirnbildung von Idioten oder Mikrocephalen entnommene Beweis für einen affenähnlichen Typus der Urmenschheit , in dessen Betonung K. Vogt sich eine Zeitlang gefiel und der noch immer von Häckel und einigen anderen extremen Darwinisten aufrechtzuerhalten versucht wird , ist längst als nichtig dargetan worden .
aufrechterhalten	VVIZU	1882	1	treitschke_geschichte02_1882-3114-31	 	Nach zweijähriger Berathung legte die Commission dem Monarchen die „Resultate“ ihrer Verhandlungen vor: sie empfahl, das rheinische Recht vorläufig, bis zur Revision der preußischen Gesetzbücher, aufrechtzuerhalten und schilderte in einem ausführlichen Gutachten, wie das Schwurgericht die Rechtsidee im Volke lebendig erhalte, das Gesetz beliebt mache, die Beamtenwillkür beschränke, die Einseitigkeit der juristischen Fachbildung durch die freie Welt-und Menschenkenntniß der Laien ergänze.	196:214	0:492	Nach zweijähriger Berathung legte die Commiſſion dem Monarchen die „ Reſultate “ ihrer Verhandlungen vor : ſie empfahl , das rheiniſche Recht vorläufig , bis zur Reviſion der preußiſchen Geſetzbücher , aufrechtzuerhalten und ſchilderte in einem ausführlichen Gutachten , wie das Schwurgericht die Rechtsidee im Volke lebendig erhalte , das Geſetz beliebt mache , die Beamtenwillkür beſchränke , die Einſeitigkeit der juriſtiſchen Fachbildung durch die freie Welt- und Menſchenkenntniß der Laien ergänze .	31	0:73	nach zweijahrig Beratung legen d Kommission d Monarch d " Resultat " ihr Verhandlung vor : sie empfehlen , d rheinisch Recht vorläufig , bis zur Revision d preußisch Gesetzbuch , aufrechterhalten und schildern in eine ausführlich Gutachten , wie d Schwurgericht d Rechtsidee im Volk lebendig erhalten , d Gesetz beliebt machen , d Beamtenwillkür beschränken , d Einseitigkeit d juristisch Fachbildung durch d frei welt- und Menschenkenntnis d Laie ergänzen .	APPR ADJA NN VVFIN ART NN ART NN ART $( NN $( PPOSAT NN PTKVZ $. PPER VVFIN $, ART ADJA NN ADJD $, KOUS APPRART NN ART ADJA NN $, VVIZU KON VVFIN APPR ART ADJA NN $, PWAV ART NN ART NN APPRART NN ADJD VVFIN $, ART NN ADJD VVFIN $, ART NN VVFIN $, ART NN ART ADJA NN APPR ART ADJA TRUNC KON NN ART NN VVFIN $.	Nach zweijähriger Beratung legte die Kommission dem Monarchen die " Resultate " ihrer Verhandlungen vor : sie empfahl , das rheinische Recht vorläufig , bis zur Revision der preußischen Gesetzbücher , aufrechtzuerhalten und schilderte in einem ausführlichen Gutachten , wie das Schwurgericht die Rechtsidee im Volke lebendig erhalte , das Gesetz beliebt mache , die Beamtenwillkür beschränke , die Einseitigkeit der juristischen Fachbildung durch die freie Welt- und Menschenkenntnis der Laien ergänze .
aufrechterhalten	VVPP	1895	1	mayer_verwaltungsrecht01_1895-4445-8	 	Unter der guten Ordnung des Gemeinwesens, die aufrechterhalten werden soll, verstehen wir also einen allgemeinen Zustand der Gesellschaft, bei welchem die in ihr enthaltenen Kräfte durch Schädlichkeiten, die ihnen bereitet werden, möglichst wenig beeinträchtigt werden.	46:62	0:269	Unter der guten Ordnung des Gemeinwesens , die aufrechterhalten werden soll , verstehen wir also einen allgemeinen Zustand der Gesellschaft , bei welchem die in ihr enthaltenen Kräfte durch Schädlichkeiten , die ihnen bereitet werden , möglichst wenig beeinträchtigt werden .	8	0:41	unter d gut Ordnung d Gemeinwesen , die aufrechterhalten werden sollen , verstehen wir also eine allgemein Zustand d Gesellschaft , bei welchem d in ihr enthalten Kraft durch Schädlichkeit , die sie bereiten werden , möglichst wenig beeinträchtigen werden .	APPR ART ADJA NN ART NN $, PRELS VVPP VAINF VMFIN $, VVFIN PPER ADV ART ADJA NN ART NN $, APPR PWAT ART APPR PPOSAT ADJA NN APPR NN $, PRELS PPER VVPP VAINF $, ADV ADV VVPP VAINF $.	Unter der guten Ordnung des Gemeinwesens , die aufrechterhalten werden soll , verstehen wir also einen allgemeinen Zustand der Gesellschaft , bei welchem die in ihr enthaltenen Kräfte durch Schädlichkeiten , die ihnen bereitet werden , möglichst wenig beeinträchtigt werden .
aufrechterhalten	VVPP	1892	1	nn_maehrisches243_1892-189-33	 	Daraus ergebe sich, daß nach Ablauf des gegenwärtig zur Berathung stehenden Gesetzes die dreijährige Dienstzeit von selbst wieder aufleben würde, und daß die zweijährige nur durch rechtzeitige Vereinbarung eines neuen Gesetzes aufrechterhalten werden könnte.	227:243	0:258	Daraus ergebe ſich , daß nach Ablauf des gegenwärtig zur Berathung ſtehenden Geſetzes die dreijährige Dienſtzeit von ſelbſt wieder aufleben würde , und daß die zweijährige nur durch rechtzeitige Vereinbarung eines neuen Geſetzes aufrechterhalten werden könnte .	33	0:37	daraus ergeben sich , daß nach Ablauf d gegenwärtig zur Beratung stehend Gesetz d dreijahrig Dienstzeit von selbst wieder aufleben werden , und daß d zweijahrig nur durch rechtzeitig Vereinbarung eine neu Gesetz aufrechterhalten werden können .	PAV VVFIN PRF $, KOUS APPR NN ART ADJD APPRART NN ADJA NN ART ADJA NN APPR ADV ADV VVINF VAFIN $, KON KOUS ART ADJA ADV APPR ADJA NN ART ADJA NN VVPP VAINF VMFIN $.	Daraus ergebe sich , daß nach Ablauf des gegenwärtig zur Beratung stehenden Gesetzes die dreijährige Dienstzeit von selbst wieder aufleben würde , und daß die zweijährige nur durch rechtzeitige Vereinbarung eines neuen Gesetzes aufrechterhalten werden könnte .
aufrechterhalten	VVIZU	1848	1	nn_nrhz080_1848-105-8	 	man sagt vielleicht, die Disziplin sei nicht aufrechtzuerhalten, ‒ aber man weiß sie doch in entgegengesetzten Fällen so prächtig zu handhaben?	45:63	0:143	man sagt vielleicht , die Disziplin sei nicht aufrechtzuerhalten , ‒ aber man weiß sie doch in entgegengesetzten Fällen so prächtig zu handhaben ?	8	0:24	man sagen vielleicht , d Disziplin sein nicht aufrechterhalten , - aber man wissen sie doch in entgegengesetzt Fall so prächtig zu handhaben ?	PIS VVFIN ADV $, ART NN VAFIN PTKNEG VVIZU $, $( KON PIS VVFIN PPER ADV APPR ADJA NN ADV ADJD PTKZU VVINF $.	man sagt vielleicht , die Disziplin sei nicht aufrechtzuerhalten , - aber man weiß sie doch in entgegengesetzten Fällen so prächtig zu handhaben ?
aufrechterhalten	VVIZU	1889	1	treitschke_geschichte04_1889-1116-34	 	Die kaiserlichen Truppen zogen im Juli ab, aber zugleich schloß Graf Lützow mit der dankbaren Curie einen geheimen Vertrag, kraft dessen Oesterreich sich verpflichtete, die Souveränität des Papstes unter allen Umständen aufrechtzuerhalten, also beim nächsten Aufstande den Kirchenstaat sogleich wieder zu besetzen.	220:238	0:314	Die kaiſerlichen Truppen zogen im Juli ab , aber zugleich ſchloß Graf Lützow mit der dankbaren Curie einen geheimen Vertrag , kraft deſſen Oeſterreich ſich verpflichtete , die Souveränität des Papſtes unter allen Umſtänden aufrechtzuerhalten , alſo beim nächſten Aufſtande den Kirchenſtaat ſogleich wieder zu beſetzen .	34	0:47	d kaiserlich Truppe ziehen im Juli ab , aber zugleich schließen Graf Lützow mit d dankbar Kurie eine geheim Vertrag , Kraft die Österreich sich verpflichten , d Souveränität d Papst unter alle Umstand aufrechterhalten , also beim nächst Aufstand d Kirchenstaat sogleich wieder zu besetzen .	ART ADJA NN VVFIN APPRART NN PTKVZ $, KON ADV VVFIN NE NE APPR ART ADJA NN ART ADJA NN $, NN PDS NE PRF VVFIN $, ART NN ART NN APPR PIAT NN VVIZU $, ADV APPRART ADJA NN ART NN ADV ADV PTKZU VVINF $.	Die kaiserlichen Truppen zogen im Juli ab , aber zugleich schloß Graf Lützow mit der dankbaren Kurie einen geheimen Vertrag , Kraft dessen Österreich sich verpflichtete , die Souveränität des Papstes unter allen Umständen aufrechtzuerhalten , also beim nächsten Aufstande den Kirchenstaat sogleich wieder zu besetzen .
