lemma	pos	date	grouping	identifier	description	context	indexes_target_token	indexes_target_sentence	context_tokenized	indexes_target_token_tokenized	indexes_target_sentence_tokenized	context_lemmatized	context_pos	context_normalized
aufrechterhalten	ADJA	1895	1	mayer_verwaltungsrecht01_1895-5822-14	 	Dieses Handeln wird bestehen in einem thatsächlichen Ändern der von dem Gezwungenen geschaffenen oder aufrechterhaltenen Zustände gegen seinen Willen, in einem Verfügen über seine Sachen, seine Unternehmungen: Wegnahme, Zerstörung und Veränderung der Sachen, Schliessen des Gewerbebetriebes durch Versperrung der Thüre für die Kunden und Abweisung derselben, durch Verhinderung und Wegschicken der Arbeiter, Wegnahme und Unbenutzbarmachen der Gerätschaften und Maschinen.	102:120	0:471	Dieses Handeln wird bestehen in einem thatsächlichen Ändern der von dem Gezwungenen geschaffenen oder aufrechterhaltenen Zustände gegen seinen Willen , in einem Verfügen über seine Sachen , seine Unternehmungen : Wegnahme , Zerstörung und Veränderung der Sachen , Schlieſsen des Gewerbebetriebes durch Versperrung der Thüre für die Kunden und Abweisung derselben , durch Verhinderung und Wegschicken der Arbeiter , Wegnahme und Unbenutzbarmachen der Gerätschaften und Maschinen .	14	0:67	diese Handeln werden bestehen in eine tatsächlich Ändern d von d gezwingen geschaffen oder aufrechterhalten Zustand gegen seine Willen , in eine Verfügen über seine Sache , seine Unternehmung : Wegnahme , Zerstörung und Veränderung d Sache , Schließe d Gewerbebetrieb durch Versperrung d Türe für d Kunde und Abweisung dieselbe , durch Verhinderung und Wegschicken d Arbeiter , Wegnahme und Unbenutzbarmachen d Gerätschaft und Maschine .	PDAT NN VAFIN VVFIN APPR ART ADJA NN ART APPR ART ADJA ADJA KON ADJA NN APPR PPOSAT NN $, APPR ART NN APPR PPOSAT NN $, PPOSAT NN $. NN $, NN KON NN ART NN $, NN ART NN APPR NN ART NN APPR ART NN KON NN PDAT $, APPR NN KON NN ART NN $, NN KON NN ART NN KON NN $.	Dieses Handeln wird bestehen in einem tatsächlichen Ändern der von dem Gezwungenen geschaffenen oder aufrechterhaltenen Zustände gegen seinen Willen , in einem Verfügen über seine Sachen , seine Unternehmungen : Wegnahme , Zerstörung und Veränderung der Sachen , Schliessen des Gewerbebetriebes durch Versperrung der Türe für die Kunden und Abweisung derselben , durch Verhinderung und Wegschicken der Arbeiter , Wegnahme und Unbenutzbarmachen der Gerätschaften und Maschinen .
aufrechterhalten	VVPP	1892	1	brunner_rechtsgeschichte02_1892-7408-20	 	Nur in Streitigkeiten um Freiheit und Grundeigentum wurde die volksrechtliche Form der Ladung vor das echte Ding noch als Erfordernis aufrechterhalten; im übrigen war die Mannitio der überlegenen Konkurrenz der dem Kläger minder gefährlichen und minder beschwerlichen Bannitio preisgegeben, die denn auch jene schliesslich schlechthin verdrängte.	134:150	0:346	Nur in Streitigkeiten um Freiheit und Grundeigentum wurde die volksrechtliche Form der Ladung vor das echte Ding noch als Erfordernis aufrechterhalten ; im übrigen war die Mannitio der überlegenen Konkurrenz der dem Kläger minder gefährlichen und minder beschwerlichen Bannitio preisgegeben , die denn auch jene schlieſslich schlechthin verdrängte .	20	0:49	nur in Streitigkeit um Freiheit und Grundeigentum werden d volksrechtlich Form d Ladung vor d echt Ding noch als Erfordernis aufrechterhalten ; im übrig sein d Mannitio d überlegen Konkurrenz d d Kläger minder gefährlich und minder beschwerlich Bannitio preisgeben , die denn auch jene schließlich schlechthin verdrängen .	ADV APPR NN APPR NN KON NN VAFIN ART ADJA NN ART NN APPR ART ADJA NN ADV KOKOM NN VVPP $. APPRART ADJA VAFIN ART NN ART ADJA NN ART ART NN ADV ADJA KON ADV ADJA NN VVPP $, PRELS ADV ADV PDS ADV ADV VVFIN $.	Nur in Streitigkeiten um Freiheit und Grundeigentum wurde die volksrechtliche Form der Ladung vor das echte Ding noch als Erfordernis aufrechterhalten ; im übrigen war die Mannitio der überlegenen Konkurrenz der dem Kläger minder gefährlichen und minder beschwerlichen Bannitio preisgegeben , die denn auch jene schließlich schlechthin verdrängte .
aufrechterhalten	VVFIN	1895	1	mayer_verwaltungsrecht01_1895-5003-14	 	Die Versagung ist aber auch nur soweit ein Eingriff, als sie das Verbot aufrechterhält.	72:86	0:87	Die Versagung ist aber auch nur soweit ein Eingriff , als sie das Verbot aufrechterhält .	14	0:16	d Versagung sein aber auch nur soweit eine Eingriff , als sie d Verbot aufrechterhalten .	ART NN VAFIN ADV ADV ADV ADV ART NN $, KOUS PPER ART NN VVFIN $.	Die Versagung ist aber auch nur soweit ein Eingriff , als sie das Verbot aufrechterhält .
aufrechterhalten	VVPP	1895	1	mayer_verwaltungsrecht01_1895-3706-16	 	Die Gegenpartei hat also doch ein Recht darauf, dass die polizeiliche Disposition in dem Sinne aufrechterhalten werde, dass sie das Gesuch „zu der Zeit und in der Art“, d. h. rebus sic stantibus abweist.	95:111	0:203	Die Gegenpartei hat also doch ein Recht darauf , daſs die polizeiliche Disposition in dem Sinne aufrechterhalten werde , daſs sie das Gesuch „ zu der Zeit und in der Art “ , d. h. rebus sic stantibus abweist .	16	0:40	d Gegenpartei haben also doch eine Recht darauf , dass d polizeilich Disposition in d Sinn aufrechterhalten werden , dass sie d Gesuch " zu d Zeit und in d Art " , d. h. rebus sic stantibus abweisen .	ART NN VAFIN ADV ADV ART NN PAV $, KOUS ART ADJA NN APPR ART NN VVPP VAFIN $, KOUS PPER ART NN $( APPR ART NN KON APPR ART NN $( $, PDS VVFIN FM FM FM VVFIN $.	Die Gegenpartei hat also doch ein Recht darauf , dass die polizeiliche Disposition in dem Sinne aufrechterhalten werde , dass sie das Gesuch " zu der Zeit und in der Art " , d. h. rebus sic stantibus abweist .
aufrechterhalten	VVIZU	1889	1	treitschke_geschichte04_1889-891-45	 	Erst auf Schöler’s dringende Vorstellungen gestattete er endlich, daß Nesselrode in einem beschwichtigenden Rundschreiben an die Gesandtschaften den Ernst dieser Drohungen etwas abschwächte: die angeordneten Vorbereitungen, hieß es da, verfolgten nur die Absicht, den Frieden und die vertragsmäßige Ordnung Europas aufrechtzuerhalten; hoffentlich werde schon die Ankündigung genügen, um „diesen Zweck der Erhaltung“ zu erreichen.	315:333	0:429	Erſt auf Schöler’s dringende Vorſtellungen geſtattete er endlich , daß Neſſelrode in einem beſchwichtigenden Rundſchreiben an die Geſandtſchaften den Ernſt dieſer Drohungen etwas abſchwächte : die angeordneten Vorbereitungen , hieß es da , verfolgten nur die Abſicht , den Frieden und die vertragsmäßige Ordnung Europas aufrechtzuerhalten ; hoffentlich werde ſchon die Ankündigung genügen , um „ dieſen Zweck der Erhaltung “ zu erreichen .	45	0:64	erst auf Schöler dringend Vorstellung gestatten er endlich , daß Nesselrode in eine beschwichtigend Rundschreiben an d Gesandtschaft d Ernst diese Drohung etwas abschwächen : d angeordnet Vorbereitung , heißen es da , verfolgen nur d Absicht , d Frieden und d vertragsmäßig Ordnung Europa aufrechterhalten ; hoffentlich werden schon d Ankündigung genügen , um " diese Zweck d Erhaltung " zu erreichen .	ADV APPR NE ADJA NN VVFIN PPER ADV $, KOUS NE APPR ART ADJA NN APPR ART NN ART NN PDAT NN ADV VVFIN $. ART ADJA NN $, VVFIN PPER ADV $, VVFIN ADV ART NN $, ART NN KON ART ADJA NN NE VVIZU $. ADJD VAFIN ADV ART NN VVINF $, KOUI $( PDAT NN ART NN $( PTKZU VVINF $.	Erst auf Schöler's dringende Vorstellungen gestattete er endlich , daß Nesselrode in einem beschwichtigenden Rundschreiben an die Gesandtschaften den Ernst dieser Drohungen etwas abschwächte : die angeordneten Vorbereitungen , hieß es da , verfolgten nur die Absicht , den Frieden und die vertragsmäßige Ordnung Europas aufrechtzuerhalten ; hoffentlich werde schon die Ankündigung genügen , um " diesen Zweck der Erhaltung " zu erreichen .
aufrechterhalten	VVIZU	1899	1	natorp_sozialpaedagogik_1899-3579-18	 	Selbst wer sie zurückwünscht, sollte doch für ehrlicher erkennen, dass sie abliesse, Ansprüche zum Scheine aufrechtzuerhalten, die sie in Wahrheit schon längst nicht mehr durchsetzt.	107:125	0:182	Selbst wer sie zurückwünscht , sollte doch für ehrlicher erkennen , dass sie abliesse , Ansprüche zum Scheine aufrechtzuerhalten , die sie in Wahrheit schon längst nicht mehr durchsetzt .	18	0:30	selbst wer sie zurückwünschen , sollen doch für ehrlich erkennen , dass sie ablassen , Anspruch zum Schein aufrechterhalten , die sie in Wahrheit schon längst nicht mehr durchsetzen .	ADV PWS PPER VVFIN $, VMFIN ADV APPR ADJD VVINF $, KOUS PPER VVFIN $, NN APPRART NN VVIZU $, PRELS PPER APPR NN ADV ADV PTKNEG ADV VVPP $.	Selbst wer sie zurückwünscht , sollte doch für ehrlicher erkennen , dass sie abließe , Ansprüche zum Scheine aufrechtzuerhalten , die sie in Wahrheit schon längst nicht mehr durchsetzt .
aufrechterhalten	VVFIN	1889	1	conradi_adam_1889-1924-28	 	Und doch reizte ihn im Grunde ein Weib... jedes Weib nur so lange, als es sich ihm entzog, als es seine Selbstständigkeit mit starkem Nachdruck aufrechterhielt.	144:159	0:160	Und doch reizte ihn im Grunde ein Weib ... jedes Weib nur ſo lange , als es ſich ihm entzog , als es ſeine Selbſtſtändigkeit mit ſtarkem Nachdruck aufrechterhielt .	28	0:30	und doch reizen er im Grund eine Weib ... jede Weib nur so lange , als es sich er entziehen , als es seine Selbständigkeit mit stark Nachdruck aufrechterhalten .	KON ADV VVFIN PPER APPRART NN ART NN $( PIAT NN ADV ADV ADV $, KOUS PPER PRF PPER VVFIN $, KOUS PPER PPOSAT NN APPR ADJA NN VVFIN $.	Und doch reizte ihn im Grunde ein Weib ... jedes Weib nur so lange , als es sich ihm entzog , als es seine Selbständigkeit mit starkem Nachdruck aufrechterhielt .
aufrechterhalten	VVPP	1895	1	mayer_verwaltungsrecht01_1895-4756-21	 	Das Gericht erklärt die letztere Bestimmung auch für massgebend gegenüber jener Fabrik: „denn der Verwaltungsrichter kann keine polizeiliche Anordnung aufrechterhalten, welche das von ihm anzuwendende, d. h. eben das zur Zeit des Spruches bestehende Recht verletzt.“	151:167	0:266	Das Gericht erklärt die letztere Bestimmung auch für maſsgebend gegenüber jener Fabrik : „ denn der Verwaltungsrichter kann keine polizeiliche Anordnung aufrechterhalten , welche das von ihm anzuwendende , d. h. eben das zur Zeit des Spruches bestehende Recht verletzt . “	21	0:42	d Gericht erklären d letztere Bestimmung auch für massgebend gegenüber jen Fabrik : " denn d Verwaltungsrichter können keine polizeilich Anordnung aufrechterhalten , welche d von er anzuwendend , d. h. eben d zur Zeit d Spruch bestehend Recht verletzen . "	ART NN VVFIN ART ADJA NN ADV APPR ADJD APPR PDAT NN $. $( KON ART NN VMFIN PIAT ADJA NN VVPP $, PRELS ART APPR PPER ADJA $, PDS VVFIN ADV ART APPRART NN ART NN ADJA NN VVPP $. $(	Das Gericht erklärt die letztere Bestimmung auch für massgebend gegenüber jener Fabrik : " denn der Verwaltungsrichter kann keine polizeiliche Anordnung aufrechterhalten , welche das von ihm anzuwendende , d. h. eben das zur Zeit des Spruches bestehende Recht verletzt . "
aufrechterhalten	VVPP	1848	1	nn_nrhz047_1848-262-12	 	Heckscher und Schmerling erklären, sie würden vor Allem Ruhe im Innern aufrechterhalten.	71:87	0:88	Heckscher und Schmerling erklären , sie würden vor Allem Ruhe im Innern aufrechterhalten .	12	0:14	Hecksger und Schmerling erklären , sie werden vor alle Ruhe im Innere aufrechterhalten .	NN KON NN VVINF $, PPER VAFIN APPR PIAT NN APPRART NN VVPP $.	Hecksger und Schmerling erklären , sie würden vor Allem Ruhe im Inneren aufrechterhalten .
aufrechterhalten	ADJA	1858	1	avelallemant_gaunerthum02_1858-1740-96	 	Die auch noch heute andauernde Existenz derselben historisch nachgewiesenen Elemente ist nicht wegzuleugnen; diese sind von manchen trefflichen Einrichtungen der Polizei, namentlich von der Gensdarmerie, nur im offenen Treiben behindert, aber nicht aufgehoben, sondern nur versprengt; sie haben sich als Parasiten an das Bürgerthum gehängt, und haben für alle dessen Schwächen ihre augenblickliche Bereitschaft zum alten offenen Aufstand, sodaß man sich nicht wundern darf, wie rasch und wie nachhaltig die Räuberbanden vor unsern Augen zusammentreten, sobald irgendeine große oder stürmische Bewegung den mühsam und mit großen Opfern aufrechterhaltenen Gang der gewohnten Ordnung unterbricht.	635:653	0:693	Die auch noch heute andauernde Exiſtenz derſelben hiſtoriſch nachgewieſenen Elemente iſt nicht wegzuleugnen; dieſe ſind von manchen trefflichen Einrichtungen der Polizei , namentlich von der Gensdarmerie , nur im offenen Treiben behindert , aber nicht aufgehoben , ſondern nur verſprengt ; ſie haben ſich als Paraſiten an das Bürgerthum gehängt , und haben für alle deſſen Schwächen ihre augenblickliche Bereitſchaft zum alten offenen Aufſtand , ſodaß man ſich nicht wundern darf , wie raſch und wie nachhaltig die Räuberbanden vor unſern Augen zuſammentreten , ſobald irgendeine große oder ſtürmiſche Bewegung den mühſam und mit großen Opfern aufrechterhaltenen Gang der gewohnten Ordnung unterbricht .	96	0:103	d auch noch heute andauernd Existenz dieselbe historisch nachgeweisen Element sein nicht wegleugnen diese sein von manche trefflich Einrichtung d Polizei , namentlich von d Gendarmerie , nur im offen Treiben behindern , aber nicht aufheben , sondern nur versprengen ; sie haben sich als Parasit an d Bürgertum hängen , und haben für alle die Schwäche ihr augenblicklich Bereitschaft zum alt offen Aufstand , sodaß man sich nicht wundern dürfen , wie rasch und wie nachhaltig d Räuberbande vor unsere Auge zusammentreten , sobald irgendeine groß oder stürmisch Bewegung d mühsam und mit groß Opfer aufrechterhalten Gang d gewohnt Ordnung unterbrechen .	ART ADV ADV ADV ADJA NN PDAT ADJD ADJA NN VAFIN PTKNEG VVIZU PDS VAFIN APPR PIAT ADJA NN ART NN $, ADV APPR ART NN $, ADV APPRART ADJA NN VVPP $, ADV PTKNEG VVPP $, KON ADV VVPP $. PPER VAFIN PRF KOKOM NN APPR ART NN VVPP $, KON VAFIN APPR PIAT PDS NN PPOSAT ADJA NN APPRART ADJA ADJA NN $, KOUS PIS PRF PTKNEG VVINF VMFIN $, PWAV ADJD KON PWAV ADJD ART NN APPR PPOSAT NN VVINF $, KOUS PIAT ADJA KON ADJA NN ART ADJD KON APPR ADJA NN ADJA NN ART ADJA NN VVFIN $.	Die auch noch heute andauernde Existenz derselben historisch nachgewiesenen Elemente ist nicht wegzuleugnen diese sind von manchen trefflichen Einrichtungen der Polizei , namentlich von der Gendarmerie , nur im offenen Treiben behindert , aber nicht aufgehoben , sondern nur versprengt ; sie haben sich als Parasiten an das Bürgertum gehängt , und haben für alle dessen Schwächen ihre augenblickliche Bereitschaft zum alten offenen Aufstand , sodaß man sich nicht wundern darf , wie rasch und wie nachhaltig die Räuberbanden vor unseren Augen zusammentreten , sobald irgendeine große oder stürmische Bewegung den mühsam und mit großen Opfern aufrechterhaltenen Gang der gewohnten Ordnung unterbricht .
aufrechterhalten	VVPP	1848	1	nn_nrhz157b_1848-202-11	 	Das Eigenthum schützen, heißt die Unverletzlichkeit der Produkte aller Arbeiten aufrechterhalten, so wie die Unabhängigkeit und Zuverlässigkeit des Besitzthums, dieser unerläßlichen Grundlagen bürgerlicher Freiheit, gewährleisten.	80:96	0:230	Das Eigenthum schützen , heißt die Unverletzlichkeit der Produkte aller Arbeiten aufrechterhalten , so wie die Unabhängigkeit und Zuverlässigkeit des Besitzthums , dieser unerläßlichen Grundlagen bürgerlicher Freiheit , gewährleisten .	11	0:30	d Eigentum schützen , heißen d Unverletzlichkeit d Produkt alle Arbeit aufrechterhalten , so wie d Unabhängigkeit und Zuverlässigkeit d Besitztum , diese unerläßlich Grundlage bürgerlich Freiheit , gewährleisten .	ART NN VVINF $, VVFIN ART NN ART NN PIAT NN VVPP $, ADV KOKOM ART NN KON NN ART NN $, PDAT ADJA NN ADJA NN $, VVINF $.	Das Eigentum schützen , heißt die Unverletzlichkeit der Produkte aller Arbeiten aufrechterhalten , so wie die Unabhängigkeit und Zuverlässigkeit des Besitztums , dieser unerläßlichen Grundlagen bürgerlicher Freiheit , gewährleisten .
aufrechterhalten	VVPP	1883	1	dilthey_geisteswissenschaften_1883-1197-53	 	Diese Auffassung, welche von der im Begriff des Staats vollzogenen Abstraktion ausgeht, findet sich in Uebereinstimmung mit der aus besonnener Empirie, wie sie ihm eigen war, geschöpften Begriffsbestimmung Mohls: „Der Staat ist ein dauernder einheitlicher Organismus derjenigen Einrichtungen, welche, geleitet durch einen Gesammtwillen, sowie aufrechterhalten und durchgeführt durch eine Gesammtkraft, die Aufgabe haben, die jeweiligen erlaubten Lebenszwecke eines bestimmten und räumlich abgeschlossenen Volkes, und zwar vom Einzelnen bis zur Gesellschaft, zu fördern, soweit von den Betreffenden nicht dieselben mit eigenen Kräften befriedigt werden können und sie Gegenstand eines gemeinsamen Bedürfnisses sind.“	343:359	0:715	Dieſe Auffaſſung , welche von der im Begriff des Staats vollzogenen Abſtraktion ausgeht , findet ſich in Uebereinſtimmung mit der aus beſonnener Empirie , wie ſie ihm eigen war , geſchöpften Begriffsbeſtimmung Mohls : „ Der Staat iſt ein dauernder einheitlicher Organismus derjenigen Einrichtungen , welche , geleitet durch einen Geſammtwillen , ſowie aufrechterhalten und durchgeführt durch eine Geſammtkraft , die Aufgabe haben , die jeweiligen erlaubten Lebenszwecke eines beſtimmten und räumlich abgeſchloſſenen Volkes , und zwar vom Einzelnen bis zur Geſellſchaft , zu fördern , ſoweit von den Betreffenden nicht dieſelben mit eigenen Kräften befriedigt werden können und ſie Gegenſtand eines gemeinſamen Bedürfniſſes ſind . “	53	0:107	diese Auffaßung , welche von d im Begriff d Staat vollziehen Abstraktion ausgehen , finden sich in Übereinstimmung mit d aus besinnen Empirie , wie sie er eigen sein , geschöpft Begriffsbestimmung Mols : " d Staat sein eine dauernd einheitlich Organismus diejenige Einrichtung , welche , geleiten durch eine Gesamtwillen , sowie aufrechterhalten und durchführen durch eine Gesamtkraft , d Aufgabe haben , d jeweilig erlaubt Lebenszwecke eine bestimmt und räumlich abgeschließen Volk , und zwar vom Einzelne bis zur Gesellschaft , zu fördern , soweit von d Betreffende nicht dieselbe mit eigen Kraft befriedigen werden können und sie Gegenstand eine gemeinsam Bedürfnis sein . "	PDAT NN $, PRELS APPR ART APPRART NN ART NN ADJA NN VVFIN $, VVFIN PRF APPR NN APPR ART APPR ADJA NN $, PWAV PPER PPER ADJD VAFIN $, ADJA NN NE $. $( ART NN VAFIN ART ADJA ADJA NN PDS NN $, PRELS $, VVPP APPR ART NN $, KON VVPP KON VVPP APPR ART NN $, ART NN VAFIN $, ART ADJA ADJA NN ART ADJA KON ADJD ADJA NN $, KON ADV APPRART NN APPR APPRART NN $, PTKZU VVINF $, KOUS APPR ART NN PTKNEG ADJA APPR ADJA NN VVPP VAINF VMFIN KON PPER NN ART ADJA NN VAFIN $. $(	Diese Auffassung , welche von der im Begriff des Staats vollzogenen Abstraktion ausgeht , findet sich in Übereinstimmung mit der aus besonnener Empirie , wie sie ihm eigen war , geschöpften Begriffsbestimmung Mols : " Der Staat ist ein dauernder einheitlicher Organismus derjenigen Einrichtungen , welche , geleitet durch einen Gesamtwillen , sowie aufrechterhalten und durchgeführt durch eine Gesamtkraft , die Aufgabe haben , die jeweiligen erlaubten Lebenszwecke eines bestimmten und räumlich abgeschlossenen Volkes , und zwar vom Einzelnen bis zur Gesellschaft , zu fördern , soweit von den Betreffenden nicht dieselben mit eigenen Kräften befriedigt werden können und sie Gegenstand eines gemeinsamen Bedürfnisses sind . "
aufrechterhalten	VVPP	1876	1	krafft_landwirthschaft03_1876-729-25	 	Man bezeichnet sie daher als die plastischen Nährmittel, als Blutbildner, Fleischbildner, wenngleich sich auch diese Bezeichnung, strenge genommen, nicht mehr aufrechterhalten läßt, da Wasser, Fett, Aschenbestandtheile zur Bildung der Organe ebenso wenig zu entbehren sind, als die Eiweißstoffe.	159:175	0:295	Man bezeichnet ſie daher als die plaſtiſchen Nährmittel , als Blutbildner , Fleiſchbildner , wenngleich ſich auch dieſe Bezeichnung , ſtrenge genommen , nicht mehr aufrechterhalten läßt , da Waſſer , Fett , Aſchenbeſtandtheile zur Bildung der Organe ebenſo wenig zu entbehren ſind , als die Eiweißſtoffe .	25	0:48	man bezeichnen sie daher als d plastisch Nährmittel , als Blutbildner , Fleischbildner , wenngleich sich auch diese Bezeichnung , streng nehmen , nicht mehr aufrechterhalten lassen , da Wasser , Fett , Aschenbestandteil zur Bildung d Organ ebenso wenig zu entbehren sein , als d Eiweißstoff .	PIS VVFIN PPER PAV KOKOM ART ADJA NN $, KOKOM NN $, NN $, KOUS PRF ADV PDAT NN $, ADJA VVPP $, PTKNEG ADV VVPP VVFIN $, KOUS NN $, NN $, NN APPRART NN ART NN ADV PIS PTKZU VVINF VAFIN $, KOUS ART NN $.	Man bezeichnet sie daher als die plastischen Nährmittel , als Blutbildner , Fleischbildner , wenngleich sich auch diese Bezeichnung , strenge genommen , nicht mehr aufrechterhalten läßt , da Wasser , Fett , Aschenbestandteile zur Bildung der Organe ebenso wenig zu entbehren sind , als die Eiweißstoffe .
aufrechterhalten	ADJA	1896	1	mayer_verwaltungsrecht02_1896-516-32	 	Der Zwang besteht darin, daß auf die berechtigter Weise erhobene Forderung des Enteigneten hin die Enteignungsbehörde nur einen auf das Ganze gestellten Enteignungsantrag des Betreibenden zusprechen darf, den gestellten und aufrechterhaltenen Teilantrag aber von selbst als auf das Ganze erweitert anzusehen hat.	224:242	0:312	Der Zwang besteht darin , daß auf die berechtigter Weise erhobene Forderung des Enteigneten hin die Enteignungsbehörde nur einen auf das Ganze gestellten Enteignungsantrag des Betreibenden zusprechen darf , den gestellten und aufrechterhaltenen Teilantrag aber von selbst als auf das Ganze erweitert anzusehen hat .	32	0:45	d Zwang bestehen darin , daß auf d berechtigt Weise erheben Forderung d Enteignete hin d Enteignungsbehörde nur eine auf d ganz gestellt Enteignungsantrag d Betreibende zusprechen dürfen , d gestellt und aufrechterhalten Teilantrag aber von selbst als auf d Ganze erweitern ansehen haben .	ART NN VVFIN PAV $, KOUS APPR ART ADJA NN ADJA NN ART NN ADV ART NN ADV ART APPR ART ADJA ADJA NN ART NN VVINF VMFIN $, ART ADJA KON ADJA NN ADV APPR ADV KOKOM APPR ART NN VVFIN VVIZU VAFIN $.	Der Zwang besteht darin , daß auf die berechtigter Weise erhobene Forderung des Enteigneten hin die Enteignungsbehörde nur einen auf das Ganze gestellten Enteignungsantrag des Betreibenden zusprechen darf , den gestellten und aufrechterhaltenen Teilantrag aber von selbst als auf das Ganze erweitert anzusehen hat .
aufrechterhalten	VVPP	1883	1	dilthey_geisteswissenschaften_1883-5311-24	 	Die Dichtung hat seit der Herstellung der mechanischen Naturauffassung das in sich verschlossene, keiner Erklärung zugängliche große Gefühl des Lebens in der Natur aufrechterhalten, wie sie überall schützt, was erlebt wird, aber nicht begriffen werden kann, daß es nicht in den zerlegenden Operationen der abstrakten Wissenschaft sich verflüchtige.	164:180	0:348	Die Dichtung hat ſeit der Herſtellung der mechaniſchen Naturauffaſſung das in ſich verſchloſſene , keiner Erklärung zugängliche große Gefühl des Lebens in der Natur aufrechterhalten , wie ſie überall ſchützt , was erlebt wird , aber nicht begriffen werden kann , daß es nicht in den zerlegenden Operationen der abſtrakten Wiſſenſchaft ſich verflüchtige .	24	0:54	d Dichtung haben seit d Herstellung d mechanisch Naturauffaßung d in sich verschließen , keine Erklärung zugänglich groß Gefühl d Leben in d Natur aufrechterhalten , wie sie überall schützen , was erleben werden , aber nicht begreifen werden können , daß es nicht in d zerlegend Operation d abstrakt Wissenschaft sich verflüchtigen .	ART NN VAFIN APPR ART NN ART ADJA NN ART APPR PRF ADJA $, PIAT NN ADJA ADJA NN ART NN APPR ART NN VVPP $, PWAV PPER ADV VVFIN $, PWS VVPP VAFIN $, ADV PTKNEG VVPP VAINF VMFIN $, KOUS PPER PTKNEG APPR ART ADJA NN ART ADJA NN PRF VVFIN $.	Die Dichtung hat seit der Herstellung der mechanischen Naturauffassung das in sich verschlossene , keiner Erklärung zugängliche große Gefühl des Lebens in der Natur aufrechterhalten , wie sie überall schützt , was erlebt wird , aber nicht begriffen werden kann , daß es nicht in den zerlegenden Operationen der abstrakten Wissenschaft sich verflüchtige .
aufrechterhalten	VVPP	1895	1	mayer_verwaltungsrecht01_1895-743-9	 	Die Rechtsordnung, die auf diese Weise gewahrt und aufrechterhalten wird, weicht gegen das Ende mehr und mehr in die kleinen Territorien zurück; sie entlehnt ihre ganze Lebenskraft nur aus dem Fortbestande der Gerichtsbarkeit der Reichsgerichte.	51:67	0:245	Die Rechtsordnung , die auf diese Weise gewahrt und aufrechterhalten wird , weicht gegen das Ende mehr und mehr in die kleinen Territorien zurück ; sie entlehnt ihre ganze Lebenskraft nur aus dem Fortbestande der Gerichtsbarkeit der Reichsgerichte .	9	0:39	d Rechtsordnung , die auf diese Weise gewahren und aufrechterhalten werden , weichen gegen d Ende mehr und mehr in d klein Territorium zurück ; sie entlehnen ihr ganz Lebenskraft nur aus d Fortbestand d Gerichtsbarkeit d Reichsgericht .	ART NN $, PRELS APPR PDAT NN VVPP KON VVPP VAFIN $, VVFIN APPR ART NN ADV KON ADV APPR ART ADJA NN PTKVZ $. PPER VVPP PPOSAT ADJA NN ADV APPR ART NN ART NN ART NN $.	Die Rechtsordnung , die auf diese Weise gewahrt und aufrechterhalten wird , weicht gegen das Ende mehr und mehr in die kleinen Territorien zurück ; sie entlehnt ihre ganze Lebenskraft nur aus dem Fortbestande der Gerichtsbarkeit der Reichsgerichte .
