lemma	pos	date	grouping	identifier	description	context	indexes_target_token	indexes_target_sentence	context_tokenized	indexes_target_token_tokenized	indexes_target_sentence_tokenized	context_lemmatized	context_pos	context_normalized
aufrechterhalten	VVPP	1878	1	laband_staatsrecht02_1878-2647-45	 	Unterwirft sich der von der Verfügung Betroffene nicht freiwillig, was ihm im Allgemeinen unbenommen ist, so muß die höhere Verwaltungsbehörde, wenn ihr der Nachweis des mangelnden Rechtsgrundes erbracht ist, die Verfügung aufheben oder abändern; unzweckmäßige Verfügungen kann die höhere Behörde aufrechterhalten, wenn ihr die Aufhebung mit größeren Nachtheilen verbunden zu sein scheint, wie die Bestätigung.	297:313	0:410	Unterwirft ſich der von der Verfügung Betroffene nicht freiwillig , was ihm im Allgemeinen unbenommen iſt , ſo muß die höhere Verwaltungsbehörde , wenn ihr der Nachweis des mangelnden Rechtsgrundes erbracht iſt , die Verfügung aufheben oder abändern ; unzweckmäßige Verfügungen kann die höhere Behörde aufrechterhalten , wenn ihr die Aufhebung mit größeren Nachtheilen verbunden zu ſein ſcheint , wie die Beſtätigung .	45	0:63	unterwerfen sich d von d Verfügung Betroffene nicht freiwillig , was er im allgemein unbenommen sein , so müssen d hoch Verwaltungsbehörde , wenn sie d Nachweis d mangelnd Rechtsgrund erbringen sein , d Verfügung aufheben oder abändern ; unzweckmäßig Verfügung können d hoch Behörde aufrechterhalten , wenn sie d Aufhebung mit groß Nachteil verbinden zu sein scheinen , wie d Bestätigung .	VVFIN PRF ART APPR ART NN NN PTKNEG ADJD $, PWS PPER APPRART ADJA ADJD VAFIN $, ADV VMFIN ART ADJA NN $, KOUS PPER ART NN ART ADJA NN VVPP VAFIN $, ART NN VVINF KON VVINF $. ADJA NN VMFIN ART ADJA NN VVPP $, KOUS PPER ART NN APPR ADJA NN VVPP PTKZU VAINF VVFIN $, PWAV ART NN $.	Unterwirft sich der von der Verfügung Betroffene nicht freiwillig , was ihm im Allgemeinen unbenommen ist , so muß die höhere Verwaltungsbehörde , wenn ihr der Nachweis des mangelnden Rechtsgrundes erbracht ist , die Verfügung aufheben oder abändern ; unzweckmäßige Verfügungen kann die höhere Behörde aufrechterhalten , wenn ihr die Aufhebung mit größeren Nachteilen verbunden zu sein scheint , wie die Bestätigung .
aufrechterhalten	VVPP	1848	1	nn_nrhz244_1849-350-53	 	Insoferne aber in Ungarn, Siebenbürgen, Croatien und Slavonien, sammt dem croatischen Küstenlande und Fiume, für die eben angeführten Zweige der Gesetzgebung eigene, von jener für die übrigen Kronländer abweichende gesetzliche Normen und Einrichtungen bestehen, wird für diesen Theil der Gesetzgebung die Wirksamkeit der Landtageder zuerst genannten Kronländer aufrechterhalten.	361:377	0:378	Insoferne aber in Ungarn , Siebenbürgen , Croatien und Slavonien , sammt dem croatischen Küstenlande und Fiume , für die eben angeführten Zweige der Gesetzgebung eigene , von jener für die übrigen Kronländer abweichende gesetzliche Normen und Einrichtungen bestehen , wird für diesen Theil der Gesetzgebung die Wirksamkeit der Landtageder zuerst genannten Kronländer aufrechterhalten .	53	0:55	insofern aber in Ungarn , Siebenbürgen , Kroatien und Slavonien , samt d kroatisch Küstenland und Fiume , für d eben angeführt Zweig d Gesetzgebung eigen , von jen für d übrig Kronland abweichend gesetzlich Norm und Einrichtung bestehen , werden für diese Teil d Gesetzgebung d Wirksamkeit d Landtageder zuerst genennt Kronland aufrechterhalten .	ADV ADV APPR NE $, NE $, NE KON NE $, APPR ART ADJA NN KON NE $, APPR ART ADV ADJA NN ART NN ADJA $, APPR PDAT APPR ART ADJA NN ADJA ADJA NN KON NN VVFIN $, VAFIN APPR PDAT NN ART NN ART NN ART NN ADV ADJA NN VVPP $.	Insofern aber in Ungarn , Siebenbürgen , Kroatien und Slavonien , samt dem kroatischen Küstenlande und Fiume , für die eben angeführten Zweige der Gesetzgebung eigene , von jener für die übrigen Kronländer abweichende gesetzliche Normen und Einrichtungen bestehen , wird für diesen Teil der Gesetzgebung die Wirksamkeit der Landtageder zuerst genannten Kronländer aufrechterhalten .
aufrechterhalten	VVPP	1892	1	brunner_rechtsgeschichte02_1892-9290-10	 	Der Grundsatz der Unanfechtbarkeit wurde nach älterem Rechte selbst dann aufrechterhalten, wenn beide Prozessparteien Königsurkunden vorlegten, die sich gegenseitig widersprachen.	73:89	0:179	Der Grundsatz der Unanfechtbarkeit wurde nach älterem Rechte selbst dann aufrechterhalten , wenn beide Prozeſsparteien Königsurkunden vorlegten , die sich gegenseitig widersprachen .	10	0:23	d Grundsatz d Unanfechtbarkeit werden nach alt Rechte selbst dann aufrechterhalten , wenn beide Prozeßpartei Königsurkunde vorlegen , die sich gegenseitig widersprechen .	ART NN ART NN VAFIN APPR ADJA NN ADV ADV VVPP $, KOUS PIAT NN NN VVFIN $, PRELS PRF ADJD VVFIN $.	Der Grundsatz der Unanfechtbarkeit wurde nach älterem Rechte selbst dann aufrechterhalten , wenn beide Prozessparteien Königsurkunden vorlegten , die sich gegenseitig widersprachen .
aufrechterhalten	VVPP	1895	1	mayer_verwaltungsrecht01_1895-4826-19	 	Richtig ausgedrückt muss es heissen: der Befehl gilt schlechthin als rechtsverbindlich und muss als solcher obrigkeitlich durchgeführt und aufrechterhalten werden, soweit nicht Zuständigkeiten zur Nachprüfung seiner Gültigkeit begründet sind.	139:155	0:242	Richtig ausgedrückt muſs es heiſsen : der Befehl gilt schlechthin als rechtsverbindlich und muſs als solcher obrigkeitlich durchgeführt und aufrechterhalten werden , soweit nicht Zuständigkeiten zur Nachprüfung seiner Gültigkeit begründet sind .	19	0:32	richtig ausdrücken müssen es heissen : d Befehl gelten schlechthin als rechtsverbindlich und müssen als solch obrigkeitlich durchführen und aufrechterhalten werden , soweit nicht Zuständigkeit zur Nachprüfung seine Gültigkeit begründen sein .	ADJD VVPP VMFIN PPER VVINF $. ART NN VVFIN ADV KOKOM ADJD KON VMFIN KOKOM PIAT ADJD VVPP KON VVPP VAINF $, KOUS PTKNEG NN APPRART NN PPOSAT NN VVPP VAFIN $.	Richtig ausgedrückt muss es heissen : der Befehl gilt schlechthin als rechtsverbindlich und muss als solcher obrigkeitlich durchgeführt und aufrechterhalten werden , soweit nicht Zuständigkeiten zur Nachprüfung seiner Gültigkeit begründet sind .
aufrechterhalten	VVIZU	1889	1	treitschke_geschichte04_1889-821-49	 	Nikolaus fand es entsetzlich, daß der König der Barrikaden in den hohen Rath Europas eintreten solle; sein Diebitsch machte in Berlin den naiven Vorschlag, Frankreich dürfe nur zugelassen werden, wenn es sich verpflichte, die Verhältnisse Belgiens, wie sie vor der Revolution bestanden, aufrechtzuerhalten — worauf Friedrich Wilhelm kurzab erwiderte: „dies wird niemals erreicht werden können.“	287:305	0:394	Nikolaus fand es entſetzlich , daß der König der Barrikaden in den hohen Rath Europas eintreten ſolle ; ſein Diebitſch machte in Berlin den naiven Vorſchlag , Frankreich dürfe nur zugelaſſen werden , wenn es ſich verpflichte , die Verhältniſſe Belgiens , wie ſie vor der Revolution beſtanden , aufrechtzuerhalten — worauf Friedrich Wilhelm kurzab erwiderte : „ dies wird niemals erreicht werden können . “	49	0:66	Nikolaus finden es entsetzlich , daß d König d Barrikade in d hoch Rat Europa eintreten sollen ; sein Diebitsch machen in Berlin d naiv Vorschlag , Frankreich dürfen nur zulassen werden , wenn es sich verpflichten , d Verhältnis Belgien , wie sie vor d Revolution bestehen , aufrechterhalten -- worauf Friedrich Wilhelm Kurzab erwidern : " diese werden niemals erreichen werden können . "	NE VVFIN PPER ADJD $, KOUS ART NN ART NN APPR ART ADJA NN NE VVINF VMFIN $. PPOSAT NE VVFIN APPR NE ART ADJA NN $, NE VMFIN ADV VVPP VAINF $, KOUS PPER PRF VVFIN $, ART NN NE $, PWAV PPER APPR ART NN VVFIN $, VVIZU $( PWAV NE NE NE VVFIN $. $( PDS VAFIN ADV VVPP VAINF VMFIN $. $(	Nikolaus fand es entsetzlich , daß der König der Barrikaden in den hohen Rat Europas eintreten solle ; sein Diebitsch machte in Berlin den naiven Vorschlag , Frankreich dürfe nur zugelassen werden , wenn es sich verpflichte , die Verhältnisse Belgiens , wie sie vor der Revolution bestanden , aufrechtzuerhalten -- worauf Friedrich Wilhelm kurzab erwiderte : " dies wird niemals erreicht werden können . "
aufrechterhalten	VVINF	1951	2	2532889X_1951-05-27_01_082.tcf.xml-19-25	 	zu erörtern, so bedeutet das, daß sie die gegenwärtige Spannung in Europa nicht beseitigen, sondern sie weiterhin im Interesse ihrer aggressiven Ziele aufrechterhalten wollen.	151:167	0:175	zu erörtern , so bedeutet das , daß sie die gegenwärtige Spannung in Europa nicht beseitigen , sondern sie weiterhin im Interesse ihrer aggressiven Ziele aufrechterhalten wollen .	25	0:28	zu erörtern , so bedeuten die , daß sie d gegenwärtig Spannung in Europa nicht beseitigen , sondern sie weiterhin im Interesse ihr aggressiv Ziel aufrechterhalten wollen .	PTKZU VVINF $, ADV VVFIN PDS $, KOUS PPER ART ADJA NN APPR NE PTKNEG VVINF $, KON PPER ADV APPRART NN PPOSAT ADJA NN VVINF VMFIN $.	
aufrechterhalten	ADJA	1948	2	2532889X_1948-02-17_01_007.tcf.xml-9-16	 	Die Imperialistischen Ambitionen der amerikanischen Ruhrinteressenten widersprechen dem französischen Sicherheitsstreben und bringen die nur noch mühsam aufrechterhaltene Soralisierungsfassade der Labour-Minister zum Einsturz.	153:170	0:226	Die Imperialistischen Ambitionen der amerikanischen Ruhrinteressenten widersprechen dem französischen Sicherheitsstreben und bringen die nur noch mühsam aufrechterhaltene Soralisierungsfassade der Labour-Minister zum Einsturz .	16	0:23	d imperialistisch Ambition d amerikanisch Ruhrinteressent widersprechen d französisch Sicherheitsstrebe und bringen d nur noch mühsam aufrechterhalten Soralisierungsfassade d Labour-Minister zum Einsturz .	ART ADJA NN ART ADJA NN VVFIN ART ADJA NN KON VVFIN ART ADV ADV ADJD ADJA NN ART NN APPRART NN $.	
aufrechterhalten	VVIZU	1957	2	2532889X_1957-08-09_01_033.tcf.xml-195-40	 	Offensichtlich ist es nicht auf die günstige Position der gegenwärtigen Führer Westdeutschlands zurückzuführen, daß sie versuchen, ihre Politik auf so minderwertige Methoden aufzubauen offensichtlich rechnet Herr Adenauer damit, auf diese Weise seinen ständig sinkenden Einfluß im Lande aufrechtzuerhalten.	287:305	0:306	Offensichtlich ist es nicht auf die günstige Position der gegenwärtigen Führer Westdeutschlands zurückzuführen , daß sie versuchen , ihre Politik auf so minderwertige Methoden aufzubauen offensichtlich rechnet Herr Adenauer damit , auf diese Weise seinen ständig sinkenden Einfluß im Lande aufrechtzuerhalten .	40	0:42	offensichtlich sein es nicht auf d günstig Position d gegenwärtig Führer Westendeutschland zurückführen , daß sie versuchen , ihr Politik auf so minderwertig Methode aufbauen offensichtlich rechnen Herr Adenauer damit , auf diese Weise seine ständig sinkend Einfluß im Land aufrechterhalten .	ADJD VAFIN PPER PTKNEG APPR ART ADJA NN ART ADJA NN NN VVIZU $, KOUS PPER VVFIN $, PPOSAT NN APPR ADV ADJA NN VVIZU ADJD VVFIN NN NE PAV $, APPR PDAT NN PPOSAT ADJD ADJA NN APPRART NN VVIZU $.	
aufrechterhalten	VVFIN	1947	2	26120215_1947_04_04_01_156.tcf.xml-22-11	 	Die Fürsorgerin, die standig die Verbindung zu ihrem „Schützling aufrechterhielt, hatte das bald herausgefunden, und sie suchte nach einem neuen Weg.	65:80	0:149	Die Fürsorgerin , die standig die Verbindung zu ihrem „ Schützling aufrechterhielt , hatte das bald herausgefunden , und sie suchte nach einem neuen Weg .	11	0:26	d Fürsorgerin , d Standig d Verbindung zu ihr „ Schützling aufrechterhalten , haben die bald herausfinden , und sie suchen nach eine neu Weg .	ART NN $, ART NN ART NN APPR PPOSAT $( NN VVFIN $, VAFIN PDS ADV VVPP $, KON PPER VVFIN APPR ART ADJA NN $.	
aufrechterhalten	VVIZU	1976	2	26120215_1976_03_13_01_064.tcf.xml-12-18	 	Doch wird die Regierung große Schwierigkeiten haben, ihre Politik der Lohneinfrierung (mit Duldung der Gewerkschaftsführer) aufrechtzuerhalten, falls sie die Preisschlacht nicht gewinnt.	124:142	0:186	Doch wird die Regierung große Schwierigkeiten haben , ihre Politik der Lohneinfrierung ( mit Duldung der Gewerkschaftsführer ) aufrechtzuerhalten , falls sie die Preisschlacht nicht gewinnt .	18	0:27	doch werden d Regierung groß Schwierigkeit haben , ihr Politik d Lohneinfrierung ( mit Duldung d Gewerkschaftsführer ) aufrechterhalten , falls sie d Preisschlacht nicht gewinnen .	KON VAFIN ART NN ADJA NN VAFIN $, PPOSAT NN ART NN $( APPR NN ART NN $( VVIZU $, KOUS PPER ART NN PTKNEG VVFIN $.	
aufrechterhalten	VVPP	1973	2	2532889X_1973-03-13_01_026.tcf.xml-8-24	 	Die absolute Mehrheit, die sie im alten Parlament noch innehatte, kann sie in der neuen Nationalversammlung nur mit Hilfe verbündeter Parteien. aufrechterhalten.	144:160	0:161	Die absolute Mehrheit , die sie im alten Parlament noch innehatte , kann sie in der neuen Nationalversammlung nur mit Hilfe verbündeter Parteien . aufrechterhalten .	24	0:26	d absolut Mehrheit , die sie im alt Parlament noch innehaben , können sie in d neu Nationalversammlung nur mit Hilfe verbündet Partei . aufrechterhalten .	ART ADJA NN $, PRELS PPER APPRART ADJA NN ADV VVFIN $, VMFIN PPER APPR ART ADJA NN ADV APPR NN ADJA NN $. VVPP $.	
aufrechterhalten	VVINF	1954	2	26120215_1954_06_10_01_032.tcf.xml-9-16	 	Er war der Sohn eines reichert Pflanzers *— wenigstens hatte der Vater den Ruf der Wohlhabenheit aufrechterhalten können, so -	97:113	0:126	Er war der Sohn eines reichert Pflanzers *— wenigstens hatte der Vater den Ruf der Wohlhabenheit aufrechterhalten können , so -	16	0:21	er sein d Sohn eine reichern Pflanzer *— wenigstens haben d Vater d Ruf d Wohlhabenheit aufrechterhalten können , so -	PPER VAFIN ART NN ART VVFIN NN $( ADV VAFIN ART NN ART NN ART NN VVINF VMINF $, ADV $(	
aufrechterhalten	VVPP	1982	2	2532889X_1982-06-24_01_157.tcf.xml-72-15	 	Ginge es nach diesen Vorschlägen, könnten die USA nicht nur ihr strategisches Potential weitgehend aufrechterhalten, sondern auch ihr nukleares Hochrüstungsprogramm z. B. mit interkontinentalen „MX"-Raketen, strategischen Bombern vom Typ „B 1" sowie Raketenträgern des Typs „Trident" unbehelligt fortsetzen.	99:115	0:307	Ginge es nach diesen Vorschlägen , könnten die USA nicht nur ihr strategisches Potential weitgehend aufrechterhalten , sondern auch ihr nukleares Hochrüstungsprogramm z. B. mit interkontinentalen „MX "- Raketen , strategischen Bombern vom Typ „ B 1 " sowie Raketenträgern des Typs „ Trident " unbehelligt fortsetzen .	15	0:48	gehen es nach diese Vorschlag , können d Usa nicht nur ihr strategisch Potential weitgehend aufrechterhalten , sondern auch ihr nuklear Hochrüstungsprogramm z. B. mit interkontinental Mx "- Rakete , strategisch Bomber vom Typ „ b 1 " sowie Raketenträger d Typ „ Trident " unbehelligt fortsetzen .	VVFIN PPER APPR PDAT NN $, VMFIN ART NE PTKNEG ADV PPOSAT ADJA NN ADJD VVPP $, KON ADV PPOSAT ADJA NN APPRART NN APPR ADJA NN $( NN $, ADJA NN APPRART NN $( XY CARD $( KON NN ART NN $( NN $( ADJD VVINF $.	
aufrechterhalten	VVIZU	1978	2	2532889X_1978-04-01_01_099.tcf.xml-5-25	 	Jetzt, da Äthiopien der Aggression ein Ende gesetzt und sein Territorium gesäubert hat, versuchen die imperialistischen Mächte, die Spannung in diesem Raum aufrechtzuerhalten und auf diese Weise den Prozeß der Normalisierung der Beziehungen am Hörn von Afrika zu erschweren.	156:174	0:274	Jetzt , da Äthiopien der Aggression ein Ende gesetzt und sein Territorium gesäubert hat , versuchen die imperialistischen Mächte , die Spannung in diesem Raum aufrechtzuerhalten und auf diese Weise den Prozeß der Normalisierung der Beziehungen am Hörn von Afrika zu erschweren .	25	0:43	jetzt , da Äthiopien d Aggression eine Ende setzen und sein Territorium säubern haben , versuchen d imperialistisch Macht , d Spannung in diese Raum aufrechterhalten und auf diese Weise d Prozeß d Normalisierung d Beziehung am Hörn von Afrika zu erschwern .	ADV $, KOUS NE ART NN ART NN VVPP KON PPOSAT NN VVPP VAFIN $, VVFIN ART ADJA NN $, ART NN APPR PDAT NN VVIZU KON APPR PDAT NN ART NN ART NN ART NN APPRART NE APPR NE PTKZU VVINF $.	
aufrechterhalten	VVIZU	1969	2	2532889X_1969-07-29_01_140.tcf.xml-14-15	 	Im VEB Gasversorgung in Lichtenberg sind die Gaswerker bemüht, die Versorgung im vollen Umfange aufrechtzuerhalten.	96:114	0:115	Im VEB Gasversorgung in Lichtenberg sind die Gaswerker bemüht , die Versorgung im vollen Umfange aufrechtzuerhalten .	15	0:17	im VEB Gasversorgung in Lichtenberg sein d Gaswerker bemühen , d Versorgung im voll Umfang aufrechterhalten .	APPRART NN NN APPR NE VAFIN ART NN VVFIN $, ART NN APPRART ADJA NN VVIZU $.	
aufrechterhalten	VVIZU	1963	2	26120215_1963_06_01_01_068.tcf.xml-23-36	 	„Solange es keinen Weltkomnrunismus gab, solange in Kuba nicht Fidel Castro und der Kommunismus regierten, so lange war es denkbar, auf diesem Kontinent Regime und Methoden des 19. Jahrhunderts notfalls mit Gewalt aufrechtzuerhalten.	214:232	0:233	„ Solange es keinen Weltkomnrunismus gab , solange in Kuba nicht Fidel Castro und der Kommunismus regierten , so lange war es denkbar , auf diesem Kontinent Regime und Methoden des 19. Jahrhunderts notfalls mit Gewalt aufrechtzuerhalten .	36	0:38	„ solange es keine Weltkomnrunismus geben , solange in Kuba nicht Fidel Castro und d Kommunismus regieren , so lange sein es denkbar , auf diese Kontinent Regime und Methode d 19. Jahrhundert notfalls mit Gewalt aufrechterhalten .	$( KOUS PPER PIAT NN VVFIN $, KOUS APPR NE PTKNEG NE NE KON ART NN VVFIN $, ADV ADV VAFIN PPER ADJD $, APPR PDAT NN NN KON NN ART ADJA NN ADV APPR NN VVIZU $.	
aufrechterhalten	VVPP	1948	2	2532889X_1948-12-05_01_111.tcf.xml-2-16	 	Die geg « nwärtlee Brotration in der Blzone kann unter keinen Umständen bis zur nächsten Ernte aufrechterhalten werden.	95:111	0:119	Die geg « nwärtlee Brotration in der Blzone kann unter keinen Umständen bis zur nächsten Ernte aufrechterhalten werden .	16	0:19	d geg « nwärtlee Brotration in d Blzone können unter keine Umstand bis zur nächst Ernte aufrechterhalten werden .	ART XY $( XY NN APPR ART NE VMFIN APPR PIAT NN APPR APPRART ADJA NN VVPP VAINF $.	
aufrechterhalten	VVIZU	1967	2	2532889X_1967-08-09_01_101.tcf.xml-40-13	 	Die USA sahen sich nicht mehr imstande, eine Resolution zugunsten des Aggressors aufrechtzuerhalten, da sie allgemeiner Ablehnung verfallen wäre	81:99	0:144	Die USA sahen sich nicht mehr imstande , eine Resolution zugunsten des Aggressors aufrechtzuerhalten , da sie allgemeiner Ablehnung verfallen wäre	13	0:21	d Usa sehen sich nicht mehr imstande , eine Resolution zugunsten d Aggressor aufrechterhalten , da sie allgemein Ablehnung verfallen sein	ART NE VVFIN PRF PTKNEG ADV ADJD $, ART NN APPR ART NN VVIZU $, KOUS PPER ADJA NN VVINF VAFIN	
aufrechterhalten	VVPP	1960	2	2532889X_1960-01-20_01_096.tcf.xml-34-29	 	den der königlichen Reise an Jehte In der reaktionären Presse ein alter Gedanke wieder auf, nämlich die Idee einer belgisch-kongolesischen Gemeinschaft, die die dynastischen Verbindungen mit Belgien aufrechterhalten würde.	199:215	0:222	den der königlichen Reise an Jehte In der reaktionären Presse ein alter Gedanke wieder auf , nämlich die Idee einer belgisch-kongolesischen Gemeinschaft , die die dynastischen Verbindungen mit Belgien aufrechterhalten würde .	29	0:32	d d königlich Reise an Jehte in d reaktionär Presse eine alt Gedanke wieder auf , nämlich d Idee eine belgisch-kongolesisch Gemeinschaft , die d dynastisch Verbindung mit Belgien aufrechterhalten werden .	ART ART ADJA NN APPR NE APPR ART ADJA NN ART ADJA NN ADV PTKVZ $, ADV ART NN ART ADJA NN $, PRELS ART ADJA NN APPR NE VVPP VAFIN $.	
aufrechterhalten	VVPP	1952	2	2532889X_1952-11-06_01_003.tcf.xml-40-8	 	Wenn die Brigaden die im Wettbewerb erreichten Leistungen aufrechterhalten, so bedeutet dies, daß die Grobblechfertigung im II. Halbjahr 1952 um etwa 600000 DM billiger sein wird als im Jahre 1951.	58:74	0:197	Wenn die Brigaden die im Wettbewerb erreichten Leistungen aufrechterhalten , so bedeutet dies , daß die Grobblechfertigung im II. Halbjahr 1952 um etwa 600000 DM billiger sein wird als im Jahre 1951 .	8	0:33	wenn d Brigade d im Wettbewerb erreicht Leistung aufrechterhalten , so bedeuten diese , daß d Grobblechfertigung im ii. Halbjahr 1952 um etwa 600000 DM billig sein werden als im Jahr 1951 .	KOUS ART NN ART APPRART NN ADJA NN VVPP $, ADV VVFIN PDS $, KOUS ART NN APPRART ADJA NN CARD APPR ADV CARD NN ADJD VAINF VAFIN KOKOM APPRART NN CARD $.	
aufrechterhalten	ADJA	1962	2	2532889X_1962-09-12_01_019.tcf.xml-4-17	 	Mit diesem neuen Willkürakt entlarvte sich das in der Frontstadt Westberlin als illegaler Überrest des zweiten Weltkrieges aufrechterhaltene sogenannte „Alliierte Reiseamt" als eine Dienststelle der NATO, die auf Betreiben der westdeutschen Regierung dazu benutzt wird,, die friedliche Zusammenarbeit der Städte und ihrer Bürger zu stören und sich in die inneren Angelegenheiten und Souveränitätsrechte anderer Staaten einzumischen.	123:140	0:432	Mit diesem neuen Willkürakt entlarvte sich das in der Frontstadt Westberlin als illegaler Überrest des zweiten Weltkrieges aufrechterhaltene sogenannte „ Alliierte Reiseamt " als eine Dienststelle der NATO , die auf Betreiben der westdeutschen Regierung dazu benutzt wird , , die friedliche Zusammenarbeit der Städte und ihrer Bürger zu stören und sich in die inneren Angelegenheiten und Souveränitätsrechte anderer Staaten einzumischen .	17	0:62	mit diese neu Willkürakt entlarven sich d in d Frontstadt Westberlin als inlegal Überrest d zweit Weltkrieg aufrechterhalten sogenannt „ alliiert Reiseamt " als eine Dienststelle d NATO , die auf Betreiben d westdeutsch Regierung dazu benutzen werden , , d friedlich Zusammenarbeit d Stadt und ihr Bürger zu stören und sich in d inner Angelegenheit und Souveränitätsrechte ander Staat einmischen .	APPR PDAT ADJA NN VVFIN PRF ART APPR ART NN NE KOUS ADJA NN ART ADJA NN ADJA ADJA $( ADJA NN $( KOUS ART NN ART NE $, PRELS APPR NN ART ADJA NN PAV VVPP VAFIN $, $, ART ADJA NN ART NN KON PPOSAT NN PTKZU VVINF KON PRF APPR ART ADJA NN KON NN ADJA NN VVIZU $.	
aufrechterhalten	VVIZU	1976	2	2532889X_1976-06-26_01_031.tcf.xml-6-19	 	Die Sowjetunion, betonte Andrej Gromyko, trete dafür ein, den ¦ erreichten Stand der Beziehungen nicht nur aufrechtzuerhalten, sondern noch auszudehnen.	107:125	0:152	Die Sowjetunion , betonte Andrej Gromyko , trete dafür ein , den ¦ erreichten Stand der Beziehungen nicht nur aufrechtzuerhalten , sondern noch auszudehnen .	19	0:25	d Sowjetunion , betonen Andrej Gromyko , treten dafür ein , d ¦ erreicht Stand d Beziehung nicht nur aufrechterhalten , sondern noch ausdehnen .	ART NE $, VVFIN NE NE $, VVFIN PAV PTKVZ $, ART $( ADJA NN ART NN PTKNEG ADV VVIZU $, KON ADV VVIZU $.	
aufrechterhalten	VVPP	1957	2	26120215_1957_08_03_01_265.tcf.xml-29-20	 	Tatsache ist auch, daß Steuerflucht und die gesetzliche Umgehung von Steuern und Erbschaftssteuer die Ungleichheit zwischen reich und arm aufrechterhalten werden und daß die wirtschaftliche Macht unter dem Labour-Plan immer in Händen der Kapitalisten bleiben wird. B2S	138:154	0:268	Tatsache ist auch , daß Steuerflucht und die gesetzliche Umgehung von Steuern und Erbschaftssteuer die Ungleichheit zwischen reich und arm aufrechterhalten werden und daß die wirtschaftliche Macht unter dem Labour-Plan immer in Händen der Kapitalisten bleiben wird . B2S	20	0:39	Tatsache sein auch , daß Steuerflucht und d gesetzlich Umgehung von Steuer und Erbschaftssteuer d Ungleichheit zwischen reich und arm aufrechterhalten werden und daß d wirtschaftlich Macht unter d Labour-Plan immer in Hand d Kapitalist bleiben werden . b2s	NN VAFIN ADV $, KOUS NN KON ART ADJA NN APPR NN KON NN ART NN APPR ADJD KON ADJD VVPP VAFIN KON KOUS ART ADJA NN APPR ART NN ADV APPR NN ART NN VVINF VAFIN $. XY	
aufrechterhalten	VVPP	1977	2	26120215_1977_12_14_01_316.tcf.xml-5-18	 	Noch vor vier Jahren galt die Navigationsperiode auf dem Nördlichen Seeweg als lang, wenn sie bis September/Oktober aufrechterhalten werden konnte.	116:132	0:147	Noch vor vier Jahren galt die Navigationsperiode auf dem Nördlichen Seeweg als lang , wenn sie bis September/Oktober aufrechterhalten werden konnte .	18	0:22	noch vor vier Jahr gelten d Navigationsperiode auf d nördlich Seeweg als lang , wenn sie bis September/oktober aufrechterhalten werden können .	ADV APPR CARD NN VVFIN ART NN APPR ART ADJA NN KOKOM ADJD $, KOUS PPER APPR NE VVPP VAINF VMFIN $.	
aufrechterhalten	VVIZU	1956	2	2532889X_1956-05-29_01_091.tcf.xml-23-21	 	Mit diesem Manöver hofft er offensichtlich auch die wachsende sozialistisch-kommunistische Einheitsbewegung zur Beendigung des Krieges In Algerlen abzubremsen und die Spaltung aufrechtzuerhalten.	176:194	0:195	Mit diesem Manöver hofft er offensichtlich auch die wachsende sozialistisch-kommunistische Einheitsbewegung zur Beendigung des Krieges In Algerlen abzubremsen und die Spaltung aufrechtzuerhalten .	21	0:23	mit diese Manöver hoffen er offensichtlich auch d wachsend sozialistisch-kommunistisch Einheitsbewegung zur Beendigung d Krieg in algeerlen abbremsen und d Spaltung aufrechterhalten .	APPR PDAT NN VVFIN PPER ADJD ADV ART ADJA ADJA NN APPRART NN ART NN APPR ADJD VVIZU KON ART NN VVIZU $.	
aufrechterhalten	VVPP	1950	2	2532889X_1950-10-04_01_063.tcf.xml-20-9	 	Auch dieser Scheinbetrieb wurde lediglich zum TZwecK von Währungsmanipulationen aufrechterhalten.	80:96	0:97	Auch dieser Scheinbetrieb wurde lediglich zum TZwecK von Währungsmanipulationen aufrechterhalten .	9	0:11	auch diese Scheinbetrieb werden lediglich zum Tzweck von Währungsmanipulation aufrechterhalten .	ADV PDAT NN VAFIN ADV APPRART NN APPR NN VVPP $.	
