lemma	pos	date	grouping	identifier	description	context	indexes_target_token	indexes_target_sentence	context_tokenized	indexes_target_token_tokenized	indexes_target_sentence_tokenized	context_lemmatized	context_pos	context_normalized
Unentschlossenheit	NN	1989	2	2532889X_1989-04-14_01_061.tcf.xml-39-12	 	Verpackt ist dieser durchaus realistische Konflikt in eine Dreiecksgeschichte, die quälende Unentschlossenheit der Figuren in trägem Erzählfluß nachvollzieht und letztlich den Zuschauer nur langweilt.	92:110	0:200	Verpackt ist dieser durchaus realistische Konflikt in eine Dreiecksgeschichte , die quälende Unentschlossenheit der Figuren in trägem Erzählfluß nachvollzieht und letztlich den Zuschauer nur langweilt .	12	0:26	verpacken sein diese durchaus realistisch Konflikt in eine Dreiecksgeschichte , d quälend Unentschlossenheit d Figur in träge Erzählfluß nachvollziehen und letztlich d Zuschauer nur langweilen .	VVPP VAFIN PDAT ADV ADJA NN APPR ART NN $, ART ADJA NN ART NN APPR ADJA NN VVFIN KON ADV ART NN ADV VVFIN $.	
Unentschlossenheit	NN	1989	2	2532889X_1989-08-22_01_060.tcf.xml-18-32	 	Kontrapunktisch. dazu liefen die Bemühungen, ein Bündnis der kollektiven Sicherheit gegen die drohende Aggression zustande zu bringen, das vor allem von der Sowjetunion befürwortet wurde, aber an der Unentschlossenheit und der letztlich antikommunistischen Position der Regierungen in London und Paris scheiterte.	200:218	0:313	Kontrapunktisch . dazu liefen die Bemühungen , ein Bündnis der kollektiven Sicherheit gegen die drohende Aggression zustande zu bringen , das vor allem von der Sowjetunion befürwortet wurde , aber an der Unentschlossenheit und der letztlich antikommunistischen Position der Regierungen in London und Paris scheiterte .	32	0:46	Kontrapunktisch . dazu laufen d Bemühung , eine Bündnis d kollektiv Sicherheit gegen d drohend Aggression zustande zu bringen , die vor alle von d Sowjetunion befürworten werden , aber an d Unentschlossenheit und d letztlich antikommunistisch Position d Regierung in London und Paris scheitern .	NN $. PAV VVFIN ART NN $, ART NN ART ADJA NN APPR ART ADJA NN ADV PTKZU VVINF $, PRELS APPR PIS APPR ART NE VVPP VAFIN $, ADV APPR ART NN KON ART ADV ADJA NN ART NN APPR NE KON NE VVFIN $.	
Unentschlossenheit	NN	1953	2	26120215_1953_05_06_01_160.tcf.xml-3-7	 	Ajax verstund es durch schlechte Konzentration und Unentschlossenheit seiner Stürmer nicht, die Gunst der Stunde zu nutzen.	51:69	0:123	Ajax verstund es durch schlechte Konzentration und Unentschlossenheit seiner Stürmer nicht , die Gunst der Stunde zu nutzen .	7	0:19	Ajax Verstund es durch schlecht Konzentration und Unentschlossenheit seine Stürmer nicht , d Gunst d Stunde zu nutzen .	NE NE PPER APPR ADJA NN KON NN PPOSAT NN PTKNEG $, ART NN ART NN PTKZU VVINF $.	
Unentschlossenheit	NN	1953	2	26120215_1953_03_29_01_222.tcf.xml-9-4	 	Wie verschwenderisch ist die Unentschlossenheit I Man bedenke die ungeheure Anstrengung, die notwendig ist, um alle diese Verluste zuletzt wiedergutzumachen	29:47	0:156	Wie verschwenderisch ist die Unentschlossenheit I Man bedenke die ungeheure Anstrengung , die notwendig ist , um alle diese Verluste zuletzt wiedergutzumachen	4	0:22	wie verschwenderisch sein d Unentschlossenheit i man bedenken d ungeheuer Anstrengung , die notwendig sein , um alle diese Verlust zuletzt wiedergutmachen	PWAV ADJD VAFIN ART NN CARD PIS VVFIN ART ADJA NN $, PRELS ADJD VAFIN $, KOUI PIAT PDAT NN ADV VVIZU	
Unentschlossenheit	NN	1978	2	2532889X_1978-04-08_01_325.tcf.xml-13-8	 	Dreieinhalb Jahre danach sei das Abkommen infolge der Unentschlossenheit und Inkonsequenz der USA-Regierung noch immer nicht unterzeichnet.	54:72	0:139	Dreieinhalb Jahre danach sei das Abkommen infolge der Unentschlossenheit und Inkonsequenz der USA-Regierung noch immer nicht unterzeichnet .	8	0:18	dreieinhalb Jahr danach sein d Abkommen infolge d Unentschlossenheit und Inkonsequenz d Usa-Regierung noch immer nicht unterzeichnen .	CARD NN PAV VAFIN ART NN APPR ART NN KON NN ART NN ADV ADV PTKNEG VVPP $.	
Unentschlossenheit	NN	1953	2	26120215_1953_09_08_01_045.tcf.xml-19-0	 	Unentschlossenheit beim Wegschlagen des Leders nutzte Mordarski (der Nationalspieler hielt nicht, was sein Name versprach!) zur schnellen Kombination mit Ko'aba. der in-7 wisihon für den Ball' indler Piechaczek hereingekommen war.	0:18	0:230	Unentschlossenheit beim Wegschlagen des Leders nutzte Mordarski ( der Nationalspieler hielt nicht , was sein Name versprach ! ) zur schnellen Kombination mit Ko'aba . der in- 7 wisihon für den Ball' indler Piechaczek hereingekommen war .	0	0:37	Unentschlossenheit beim Wegschlagen d Leder nutzen Mordarski ( d Nationalspieler halten nicht , was sein Name versprechen ! ) zur schnell Kombination mit Ko'aba . d in- 7 Wisihon für d Ball' Indler Piechaczek hereinkommen sein .	NN APPRART NN ART NN VVFIN NE $( ART NN VVFIN PTKNEG $, PWS PPOSAT NN VVFIN $. $( APPRART ADJA NN APPR NE $. ART TRUNC CARD NN APPR ART NN NE NE VVPP VAFIN $.	
Unentschlossenheit	NN	1961	2	26120215_1961_10_25_01_086.tcf.xml-26-0	 	Unentschlossenheit und Feigheit können niemals die Charakterzüge eines klugen Menschen sein.	0:18	0:92	Unentschlossenheit und Feigheit können niemals die Charakterzüge eines klugen Menschen sein .	0	0:12	Unentschlossenheit und Feigheit können niemals d Charakterzug eine klug Mensch sein .	NN KON NN VMFIN ADV ART NN ART ADJA NN VAINF $.	
Unentschlossenheit	NN	1990	2	26120215_1990_03_14_01_042.tcf.xml-41-1	 	Eine Unentschlossenheit, die sicher schwerer wiegt als die Frage, ob man sich nun einen schmucken ausrangierten Panzer oder lieber einen brandneuen Lada anschafft.	5:23	0:163	Eine Unentschlossenheit , die sicher schwerer wiegt als die Frage , ob man sich nun einen schmucken ausrangierten Panzer oder lieber einen brandneuen Lada anschafft .	1	0:26	eine Unentschlossenheit , die sicher schwer wiegen als d Frage , ob man sich nun eine schmuck ausrangiert Panzer oder lieber eine brandneu Lada anschaffen .	ART NN $, PRELS ADJD ADJD VVFIN KOKOM ART NN $, KOUS PIS PRF ADV ART ADJA ADJA NN KON ADV ART ADJA NE VVFIN $.	
Unentschlossenheit	NN	1977	2	2532889X_1977-12-31_01_043.tcf.xml-8-23	 	In der jüngsten Inszenierung „Twel Gauner to Besök" unternehmen zwei dem Gefängnis entwichene Schwindler als „Agenten" den Versuch, Unentschlossenheit und Wankelmut der Dorfbewohner nach dem Krieg zu nutzen, um ihre eigenen Schäfchen ins trockene zu bringen.	132:150	0:258	In der jüngsten Inszenierung „ Twel Gauner to Besök " unternehmen zwei dem Gefängnis entwichene Schwindler als „ Agenten " den Versuch , Unentschlossenheit und Wankelmut der Dorfbewohner nach dem Krieg zu nutzen , um ihre eigenen Schäfchen ins trockene zu bringen .	23	0:43	in d jung Inszenierung „ twel Gauner to besök " unternehmen zwei d Gefängnis entweichen Schwindler als „ Agent " d Versuch , Unentschlossenheit und Wankelmut d Dorfbewohner nach d Krieg zu nutzen , um ihr eigen Schäfchen ins trocken zu bringen .	APPR ART ADJA NN $( FM NN FM FM $( VVFIN CARD ART NN ADJA NN KOUS $( NN $( ART NN $, NN KON NN ART NN APPR ART NN PTKZU VVINF $, KOUI PPOSAT ADJA NN APPRART ADJA PTKZU VVINF $.	
Unentschlossenheit	NN	1951	2	2532889X_1951-03-02_01_048.tcf.xml-40-5	 	schaftlichen Übermacht und durch die Unentschlossenheit der europäischen herrschenden Kreise letzt Westeuropa vollkommen in die Gewalt bekommen hat und sich anschickt, die restlichen Teile Europas unter seine Herrschaft zu bringen.	37:55	0:231	schaftlichen Übermacht und durch die Unentschlossenheit der europäischen herrschenden Kreise letzt Westeuropa vollkommen in die Gewalt bekommen hat und sich anschickt , die restlichen Teile Europas unter seine Herrschaft zu bringen .	5	0:32	schaftlich Übermacht und durch d Unentschlossenheit d europäisch herrschend Kreis letzt Westeuropa vollkommen in d Gewalt bekommen haben und sich anschicken , d restlich Teil Europa unter seine Herrschaft zu bringen .	ADJA NN KON APPR ART NN ART ADJA ADJA NN ADV NE ADJD APPR ART NN VVPP VAFIN KON PRF VVFIN $, ART ADJA NN NE APPR PPOSAT NN PTKZU VVINF $.	
Unentschlossenheit	NN	1973	2	26120215_1973_12_08_01_055.tcf.xml-15-36	 	Zwar stand der lange verletzt gewesene Thomas wieder zur Verfügung, doch er fand mit Slapke und Bielas nicht die nötige Bindung, wie auch der junge Müller den mangelnden Druck der Berliner Reihe durch seine Unentschlossenheit nicht erhöhte.	207:225	0:240	Zwar stand der lange verletzt gewesene Thomas wieder zur Verfügung , doch er fand mit Slapke und Bielas nicht die nötige Bindung , wie auch der junge Müller den mangelnden Druck der Berliner Reihe durch seine Unentschlossenheit nicht erhöhte .	36	0:40	zwar stehen d lang verletzen gewesen Thomas wieder zur Verfügung , doch er finden mit Slapke und Bielas nicht d nötig Bindung , wie auch d jung Müller d mangelnd Druck d berliner Reihe durch seine Unentschlossenheit nicht erhöhen .	ADV VVFIN ART ADJA VVPP ADJA NE ADV APPRART NN $, KON PPER VVFIN APPR NE KON NE PTKNEG ART ADJA NN $, PWAV ADV ART ADJA NE ART ADJA NN ART ADJA NN APPR PPOSAT NN PTKNEG VVFIN $.	
Unentschlossenheit	NN	1953	2	2532889X_1953-11-27_01_147.tcf.xml-7-8	 	Englands ununterbrochener Heimrekord schwand in einer Woge von Unentschlossenheit gegen die beste Fußballmannschaft dahin, die bisher unser Land besuchte."	63:81	0:155	Englands ununterbrochener Heimrekord schwand in einer Woge von Unentschlossenheit gegen die beste Fußballmannschaft dahin , die bisher unser Land besuchte . "	8	0:22	England ununterbrechen Heimrekord schwinden in eine Woge von Unentschlossenheit gegen d gut Fußballmannschaft dahin , die bisher unsere Land besuchen . "	NE ADJA NN VVFIN APPR ART NN APPR NN APPR ART ADJA NN PAV $, PRELS ADV PPOSAT NN VVFIN $. $(	
Unentschlossenheit	NN	1989	2	2532889X_1989-05-31_01_050.tcf.xml-344-34	 	Die Hauptschlußfolgerung ist, daß die strategische Idee der Reform und ihre Hauptrichtungen richtig festgelegt wurden., Doch bei der praktischen Verwirklichung der Reform kommt es auf allen Ebenen zu viel Inkonsequenz, Unentschlossenheit, Halbheiten, Zickzackbewegungen und sogar Rückwärtsbewegungen.	219:237	0:300	Die Hauptschlußfolgerung ist , daß die strategische Idee der Reform und ihre Hauptrichtungen richtig festgelegt wurden . , Doch bei der praktischen Verwirklichung der Reform kommt es auf allen Ebenen zu viel Inkonsequenz , Unentschlossenheit , Halbheiten , Zickzackbewegungen und sogar Rückwärtsbewegungen .	34	0:43	d Hauptschlußfolgerung sein , daß d strategisch Idee d Reform und ihr Hauptrichtung richtig festlegen werden . , doch bei d praktisch Verwirklichung d Reform kommen es auf alle Ebene zu viel Inkonsequenz , Unentschlossenheit , Halbheit , Zickzackbewegung und sogar Rückwärtsbewegung .	ART NN VAFIN $, KOUS ART ADJA NN ART NN KON PPOSAT NN ADJD VVPP VAFIN $. $, KON APPR ART ADJA NN ART NN VVFIN PPER APPR PIAT NN APPR PIAT NN $, NN $, NN $, NN KON ADV NN $.	
Unentschlossenheit	NN	1968	2	2532889X_1968-12-14_01_252.tcf.xml-32-24	 	Der von Richard Müller vorgetragene Bericht des Vollzugsrates war nicht die tief durchdachte politische Rechenschaftslegung eines revolutionären Machtorgans; der Bericht war vielmehr durch Unentschlossenheit und Inkonsequenz gekennzeichnet, wie sie für den Vollzugsrat charakteristisch waren.	189:207	0:292	Der von Richard Müller vorgetragene Bericht des Vollzugsrates war nicht die tief durchdachte politische Rechenschaftslegung eines revolutionären Machtorgans ; der Bericht war vielmehr durch Unentschlossenheit und Inkonsequenz gekennzeichnet , wie sie für den Vollzugsrat charakteristisch waren .	24	0:37	d von Richard Müller vorgetragen Bericht d Vollzugsrat sein nicht d tief durchdenkt politisch Rechenschaftslegung eine revolutionär Machtorgan ; d Bericht sein vielmehr durch Unentschlossenheit und Inkonsequenz kennzeichnen , wie sie für d Vollzugsrat charakteristisch sein .	ART APPR NE NE ADJA NN ART NN VAFIN PTKNEG ART ADJD ADJA ADJA NN ART ADJA NN $. ART NN VAFIN ADV APPR NN KON NN VVPP $, PWAV PPER APPR ART NN ADJD VAFIN $.	
Unentschlossenheit	NN	1983	2	26120215_1983_06_16_01_056.tcf.xml-11-20	 	Hier haben wir noch viel zu lernen, und unsere größten Feinde auf diesem Weg sind Formalismus, Schematismus, Unentschlossenheit und manchmal auch geistige Trägheit.	109:127	0:164	Hier haben wir noch viel zu lernen , und unsere größten Feinde auf diesem Weg sind Formalismus , Schematismus , Unentschlossenheit und manchmal auch geistige Trägheit .	20	0:27	hier haben wir noch viel zu lernen , und unsere groß Feind auf diese Weg sein Formalismus , Schematismus , Unentschlossenheit und manchmal auch geistig Trägheit .	ADV VAFIN PPER ADV PIS PTKZU VVINF $, KON PPOSAT ADJA NN APPR PDAT NN VAFIN NN $, NN $, NN KON ADV ADV ADJA NN $.	
Unentschlossenheit	NN	1977	2	26120215_1977_01_10_01_141.tcf.xml-12-20	 	„Als wir Neuer und Winkler nochmal angreifen sahen, waren wir so verdutzt, daß schon dieser Augenblick der Unentschlossenheit genügte, uns den Sieg zu entreißen", meinte. hinterher Gerald Mortag.	107:125	0:195	„ Als wir Neuer und Winkler nochmal angreifen sahen , waren wir so verdutzt , daß schon dieser Augenblick der Unentschlossenheit genügte , uns den Sieg zu entreißen " , meinte . hinterher Gerald Mortag .	20	0:36	„ als wir neu und Winkeler nochmal angreifen sehen , sein wir so verdutzt , daß schon diese Augenblick d Unentschlossenheit genügen , wir d Sieg zu entreissen " , meinen . hinterher Gerald Mortag .	$( KOUS PPER ADJA KON NN ADV VVINF VVFIN $, VAFIN PPER ADV ADJD $, KOUS ADV PDAT NN ART NN VVFIN $, PPER ART NN PTKZU VVINF $( $, VVFIN $. ADV NE NE $.	
Unentschlossenheit	NN	1956	2	2532889X_1956-05-01_01_025.tcf.xml-192-8	 	Erst die energische Intervention des Lokführers macht der Unentschlossenheit ein Ende.	58:76	0:86	Erst die energische Intervention des Lokführers macht der Unentschlossenheit ein Ende .	8	0:12	erst d energisch Intervention d Lokführer machen d Unentschlossenheit eine Ende .	ADV ART ADJA NN ART NN VVFIN ART NN ART NN $.	
Unentschlossenheit	NN	1961	2	2532889X_1961-02-25_01_054.tcf.xml-5-1	 	Die Unentschlossenheit der Zustandigen in diesem wie in anderen Fällen erinnert zwangsläufig an das philosophische ' Denkmodell von „Buridans Esel Zur Veranschaulichung einer in der Wirklichkeit nicht existierenden absoluten Willensfreiheit stellt man sich ein langohriges Tier vor, das zwischen zwei gleich weit von ihm entfernten Bündeln Heu verhungern muß, weil es sich vor lauter Willensfreiheit nicht für das eine oder das andere entscheiden kann.	4:22	0:452	Die Unentschlossenheit der Zustandigen in diesem wie in anderen Fällen erinnert zwangsläufig an das philosophische ' Denkmodell von „ Buridans Esel Zur Veranschaulichung einer in der Wirklichkeit nicht existierenden absoluten Willensfreiheit stellt man sich ein langohriges Tier vor , das zwischen zwei gleich weit von ihm entfernten Bündeln Heu verhungern muß , weil es sich vor lauter Willensfreiheit nicht für das eine oder das andere entscheiden kann .	1	0:68	d Unentschlossenheit d Zustandigen in diese wie in ander Fall erinnern zwangsläufig an d philosophisch ' Denkmodell von „ Buridan Esel zur Veranschaulichung eine in d Wirklichkeit nicht existierend absolut Willensfreiheit stellen man sich eine langohrig Tier vor , die zwischen zwei gleich weit von er entfernt Bündel Heu verhungern müssen , weil es sich vor lauter Willensfreiheit nicht für d eine oder d andere entscheiden können .	ART NN ART NN APPR PDAT KON APPR ADJA NN VVFIN ADJD APPR ART ADJA $( NN APPR $( NE NN APPRART NN ART APPR ART NN PTKNEG ADJA ADJA NN VVFIN PIS PRF ART ADJA NN PTKVZ $, PRELS APPR CARD ADV ADJD APPR PPER ADJA NN NN VVFIN VMFIN $, KOUS PPER PRF APPR PIAT NN PTKNEG APPR ART ART KON ART PIS VVINF VMFIN $.	
Unentschlossenheit	NN	1976	2	26120215_1976_06_14_01_111.tcf.xml-21-1	 	Die Unentschlossenheit bei Göbels Nachschuß zum Vorwärts-l:0 setzte sich fort.	4:22	0:78	Die Unentschlossenheit bei Göbels Nachschuß zum Vorwärts-l:0 setzte sich fort .	1	0:11	d Unentschlossenheit bei Göbel Nachschuß zum Vorwärts-L:0 setzen sich fort .	ART NN APPR NE NN APPRART NN VVFIN PRF PTKVZ $.	
Unentschlossenheit	NN	1988	2	2532889X_1988-12-31_01_244.tcf.xml-8-11	 	Der „Held" der Erzählung leidet an einem Übermaß an Unentschlossenheit, das auch seine Wegsucherprobleme nivelliert.	52:70	0:116	Der „ Held " der Erzählung leidet an einem Übermaß an Unentschlossenheit , das auch seine Wegsucherprobleme nivelliert .	11	0:19	d „ Held " d Erzählung leiden an eine Übermaß an Unentschlossenheit , die auch seine Wegsucherproblem nivellieren .	ART $( NN $( ART NN VVFIN APPR ART NN APPR NN $, PRELS ADV PPOSAT NN VVPP $.	
Unentschlossenheit	NN	1982	2	26120215_1982_07_03_01_080.tcf.xml-15-17	 	Im Treffen mit der BRD-Vertretung traten die Schwächen vorangegangener Spiele in Spaniens Elf wieder auf: Unentschlossenheit, Schußschwächen und ein Rückstand, wenn auch erst nach der Pause.	106:124	0:190	Im Treffen mit der BRD- Vertretung traten die Schwächen vorangegangener Spiele in Spaniens Elf wieder auf : Unentschlossenheit , Schußschwächen und ein Rückstand , wenn auch erst nach der Pause .	17	0:31	im Treffen mit d brd- Vertretung treten d Schwäche vorangegehen Spiel in Spanien Elf wieder auf : Unentschlossenheit , Schußschwäche und eine Rückstand , wenn auch erst nach d Pause .	APPRART NN APPR ART TRUNC NN VVFIN ART NN ADJA NN APPR NE NE ADV APPR $. NN $, NN KON ART NN $, KOUS ADV ADV APPR ART NN $.	
Unentschlossenheit	NN	1973	2	26120215_1973_09_23_01_058.tcf.xml-16-8	 	Nach torloser erster Hälfte, in der die Unentschlossenheit des Gastgebers bei Torschüssen wieder einmal auffiel, ergab ein krasser Fehler der rechten	40:58	0:149	Nach torloser erster Hälfte , in der die Unentschlossenheit des Gastgebers bei Torschüssen wieder einmal auffiel , ergab ein krasser Fehler der rechten	8	0:23	nach torlos erst Hälfte , in die d Unentschlossenheit d Gastgeber bei Torschuß wieder einmal auffallen , ergeben eine kraß Fehler d recht	APPR ADJA ADJA NN $, APPR PRELS ART NN ART NN APPR NN ADV ADV VVFIN $, VVFIN ART ADJA NN ART ADJA	
Unentschlossenheit	NN	1965	2	2532889X_1965-09-10_01_148.tcf.xml-9-26	 	In der Tat habe ich zugleich mit dem Sicherheitswerben der Parteien auch noch nie soviel Unsicherheit unter großen Teilen der westdeutschen Bevölkerung, soviel Unbehagen und Unentschlossenheit vorgefunden wie in diesen Tagen.	174:192	0:225	In der Tat habe ich zugleich mit dem Sicherheitswerben der Parteien auch noch nie soviel Unsicherheit unter großen Teilen der westdeutschen Bevölkerung , soviel Unbehagen und Unentschlossenheit vorgefunden wie in diesen Tagen .	26	0:33	in d Tat haben ich zugleich mit d Sicherheitswerben d Partei auch noch nie soviel Unsicherheit unter groß Teil d westdeutsch Bevölkerung , soviel Unbehagen und Unentschlossenheit vorfinden wie in diese Tag .	APPR ART NN VAFIN PPER ADV APPR ART NN ART NN ADV ADV ADV PIAT NN APPR ADJA NN ART ADJA NN $, PIAT NN KON NN VVPP KOKOM APPR PDAT NN $.	
Unentschlossenheit	NN	1961	2	2532889X_1961-04-10_01_051.tcf.xml-5-19	 	daß man sein Glück nicht finden wird, wenn man es vom Gluck der Gesellschaft absondert begreift, daß Unentschlossenheit im persönlichen Leben stets gesellschaftliche Konsequenzen in sich bergen wird, die zur Lawine werden, ja, ein ganzes Leben verschütten können.	101:119	0:263	daß man sein Glück nicht finden wird , wenn man es vom Gluck der Gesellschaft absondert begreift , daß Unentschlossenheit im persönlichen Leben stets gesellschaftliche Konsequenzen in sich bergen wird , die zur Lawine werden , ja , ein ganzes Leben verschütten können .	19	0:44	daß man sein Glück nicht finden werden , wenn man es vom Gluck d Gesellschaft absondern begreifen , daß Unentschlossenheit im persönlich Leben stets gesellschaftlich Konsequenz in sich bergen werden , die zur Lawine werden , ja , eine ganz Leben verschütten können .	KOUS PIS PPOSAT NN PTKNEG VVINF VAFIN $, KOUS PIS PPER APPRART NN ART NN VVFIN VVFIN $, KOUS NN APPRART ADJA NN ADV ADJA NN APPR PRF VVINF VAFIN $, PRELS APPRART NN VAINF $, PTKANT $, ART ADJA NN VVINF VMINF $.	
Unentschlossenheit	NN	1989	2	2532889X_1989-11-11_01_069.tcf.xml-9-3	 	Die Zeit der Unentschlossenheit, der Unehrlichkeit und der Sprachlosigkeit unserer Partei arbeitet gegen uns und ist im Bewußtsein unserer Genossen	13:31	0:147	Die Zeit der Unentschlossenheit , der Unehrlichkeit und der Sprachlosigkeit unserer Partei arbeitet gegen uns und ist im Bewußtsein unserer Genossen	3	0:21	d Zeit d Unentschlossenheit , d Unehrlichkeit und d Sprachelosigkeit unsere Partei arbeiten gegen wir und sein im Bewußtsein unsere Genosse	ART NN ART NN $, ART NN KON ART NN PPOSAT NN VVFIN APPR PPER KON VAFIN APPRART NN PPOSAT NN	
Unentschlossenheit	NN	1968	2	2532889X_1968-08-31_01_122.tcf.xml-8-4	 	Seinerzeit ist infolge der Unentschlossenheit ihrer Führer die Pariser Kommune untergegangen.	27:45	0:93	Seinerzeit ist infolge der Unentschlossenheit ihrer Führer die Pariser Kommune untergegangen .	4	0:12	seinerzeit sein infolge d Unentschlossenheit ihr Führer d Pariser Kommune untergehen .	ADV VAFIN APPR ART NN PPOSAT NN ART ADJA NN VVPP $.	
Unentschlossenheit	NN	1986	2	2532889X_1986-11-24_01_158.tcf.xml-31-13	 	Zahlreiche technische Fehler, Ungenauigkeiten im Zuspiel, zu durchsichtig angelegte Angriffe sowie Unentschlossenheit im Abschluß ließen den Spielfaden gegen einen relativ schwachen Gegner immer wieder, reißen.	99:117	0:210	Zahlreiche technische Fehler , Ungenauigkeiten im Zuspiel , zu durchsichtig angelegte Angriffe sowie Unentschlossenheit im Abschluß ließen den Spielfaden gegen einen relativ schwachen Gegner immer wieder , reißen .	13	0:29	zahlreich technisch Fehler , Ungenauigkeit im Zuspiel , zu durchsichtig angelegt Angriff sowie Unentschlossenheit im Abschluß lassen d Spielfaden gegen eine relativ schwach Gegner immer wieder , reissen .	ADJA ADJA NN $, NN APPRART NN $, PTKA ADJD ADJA NN KON NN APPRART NN VVFIN ART NN APPR ART ADJD ADJA NN ADV ADV $, VVFIN $.	
Unentschlossenheit	NN	1965	2	26120215_1965_02_20_01_108.tcf.xml-66-20	 	Natürlich trifft man auch in unserer heutigen Gesellschaft hoch zuweilen den Typ des Feiglings, der durch seine Passivität und Unentschlossenheit nicht in genügendem Maße dem sozialistischen Aufbau dient.	127:145	0:204	Natürlich trifft man auch in unserer heutigen Gesellschaft hoch zuweilen den Typ des Feiglings , der durch seine Passivität und Unentschlossenheit nicht in genügendem Maße dem sozialistischen Aufbau dient .	20	0:30	natürlich treffen man auch in unsere heutig Gesellschaft hoch zuweilen d Typ d Feigling , die durch seine Passivität und Unentschlossenheit nicht in genügend Maß d sozialistisch Aufbau dienen .	ADV VVFIN PIS ADV APPR PPOSAT ADJA NN ADJD ADV ART NN ART NN $, PRELS APPR PPOSAT NN KON NN PTKNEG APPR ADJA NN ART ADJA NN VVFIN $.	
Unentschlossenheit	NN	1979	2	2532889X_1979-06-13_01_045.tcf.xml-14-29	 	Dieser Stepan ist im Bekenntnis zu seiner Liebe um einiges kleiner als die Kira, er windet sich eher als daß er kämpft, er bäumt sich auf aus Unentschlossenheit.	142:160	0:161	Dieser Stepan ist im Bekenntnis zu seiner Liebe um einiges kleiner als die Kira , er windet sich eher als daß er kämpft , er bäumt sich auf aus Unentschlossenheit .	29	0:31	diese Stepan sein im Bekenntnis zu seine Liebe um einiges klein als d Kira , er winden sich eher als daß er kämpfen , er bäumen sich auf aus Unentschlossenheit .	PDAT NE VAFIN APPRART NN APPR PPOSAT NN APPR PIS ADJD KOKOM ART NE $, PPER VVFIN PRF ADV KOKOM KOUS PPER VVFIN $, PPER VVFIN PRF APPR APPR NN $.	
Unentschlossenheit	NN	1988	2	2532889X_1988-08-23_01_082.tcf.xml-63-3	 	Als sie die Unentschlossenheit eines Teils der Führung erkannte und sich davon überzeugt hatte, daß sie Dubcek zu ihrem Aushängeschild machen kann, ging sie zu einem breit organisierten Aufmarsch über.	12:30	0:201	Als sie die Unentschlossenheit eines Teils der Führung erkannte und sich davon überzeugt hatte , daß sie Dubcek zu ihrem Aushängeschild machen kann , ging sie zu einem breit organisierten Aufmarsch über .	3	0:33	als sie d Unentschlossenheit eine Teil d Führung erkennen und sich davon überzeugen haben , daß sie Dubcek zu ihr Aushängeschild machen können , gehen sie zu eine breit organisiert Aufmarsch über .	KOUS PPER ART NN ART NN ART NN VVFIN KON PRF PAV VVPP VAFIN $, KOUS PPER NE APPR PPOSAT NN VVINF VMFIN $, VVFIN PPER APPR ART ADJD ADJA NN APPR $.	
Unentschlossenheit	NN	1984	2	26120215_1984_04_02_01_178.tcf.xml-15-16	 	Das nutzte Hansa mit kämpferischer Steigerung noch zum Sieg, wobei Rillich (2:1) die Unentschlossenheit Grapenthins nutzte.	85:103	0:123	Das nutzte Hansa mit kämpferischer Steigerung noch zum Sieg , wobei Rillich ( 2:1 ) die Unentschlossenheit Grapenthins nutzte .	16	0:20	die nutzen Hansa mit kämpferisch Steigerung noch zum Sieg , wobei Rilleich ( 2:1 ) d Unentschlossenheit Grapenthin nutzen .	PDS VVFIN NE APPR ADJA NN ADV APPRART NN $, KOUS NN $( CARD $( ART NN NE VVFIN $.	
Unentschlossenheit	NN	1987	2	26120215_1987_08_27_01_094.tcf.xml-24-17	 	So glaubten die Berliner sich schon am Ziel aller Wünsche, als Seier in halbrechter Position eine Unentschlossenheit in der Jenaer Hintermannschaft zum Ausgleich nutzte.	98:116	0:169	So glaubten die Berliner sich schon am Ziel aller Wünsche , als Seier in halbrechter Position eine Unentschlossenheit in der Jenaer Hintermannschaft zum Ausgleich nutzte .	17	0:26	so glauben d berliner sich schon am Ziel alle Wunsch , als Seier in halbrecht Position eine Unentschlossenheit in d jenaer Hintermannschaft zum Ausgleich nutzen .	ADV VVFIN ART ADJA PRF ADV APPRART NN PIAT NN $, KOUS NE APPR ADJA NN ART NN APPR ART ADJA NN APPRART NN VVFIN $.	
