lemma	pos	date	grouping	identifier	description	context	indexes_target_token	indexes_target_sentence	context_tokenized	indexes_target_token_tokenized	indexes_target_sentence_tokenized	context_lemmatized	context_pos
attack_nn	nn1	1835	1	fic_1835_7134.txt-2235-79	 	A day was appointed, but being unacquainted with the art of writing, or the use of numbers, the period was designated by a bundle of sticks, every stick representing a day; each of the confederated chiefs prepared a bundle corresponding in number with those of his associates, one of which was to be burned daily; and the committing of the last to the flames, was to be the signal for the attack. "	389:395	0:398	A day was appointed , but being unacquainted with the art of writing , or the use of numbers , the period was designated by a bundle of sticks , every stick representing a day ; each of the confederated chiefs prepared a bundle corresponding in number with those of his associates , one of which was to be burned daily ; and the committing of the last to the flames , was to be the signal for the attack . "	79	0:82	a day be appoint , but be unacquainted with the art of writing , or the use of number , the period be designate by a bundle of stick , every stick represent a day ; each of the confederated chief prepare a bundle correspond in number with those of his associate , one of which be to be burn daily ; and the commit of the last to the flame , be to be the signal for the attack . "	at1 nnt1 vbdz vvn y ccb vbg jj iw at nn1 io nn1_vvg y cc at nn1 io nn2 y at nn1 vbdz vvn ii at1 nn1 io nn2 y at1 nn1 vvg at1 nnt1 y dd1 io at jj@ nn2 vvn_vvd@ at1 nn1 vvg ii nn1 iw dd2 io appge nn2 y mc1 io ddq vbdz to vbi vvn rr_jj y cc at nn1% io at md ii at nn2 y vbdz to vbi at nn1 if at nn1 y "
attack_nn	nn1	1856	1	fic_1856_9779.txt-7652-36	 	In this belief, and that Coates had marched out to give him battle, the American partisan withdrew to a defile in the rear of his then position, and quietly prepared to receive the attack.	181:187	0:188	In this belief , and that Coates had marched out to give him battle , the American partisan withdrew to a defile in the rear of his then position , and quietly prepared to receive the attack .	36	0:38	in this belief , and that coates have march out to give him battle , the american partisan withdraw to a defile in the rear of his then position , and quietly prepare to receive the attack .	ii dd1 nn1 y cc cst np1 vhd vvn rp to vvi ppho1 nn1_vv0@ y at jj nn1 vvd ii at1 nn1@ ii at nn1 io ppge@_appge rt_jj% vv0@_nn1 y cc rr vvn to vvi at nn1 y
attack_nn	nn1_vv0	1844	1	nf_1844_749098.txt-536-37	 	on either side, crowned most commonly by dense and intricate masses of forest, through which and without a guide, our little army was compelled to pass, -- presented opportunities for frequent ambush and attack, in which, very inferior forces, if properly commanded, might, with little danger to themselves, overwhelm and utterly destroy an advancing enemy.	204:210	0:357	on either side , crowned most commonly by dense and intricate masses of forest , through which and without a guide , our little army was compelled to pass , -- presented opportunities for frequent ambush and attack , in which , very inferior forces , if properly commanded , might , with little danger to themselves , overwhelm and utterly destroy an advancing enemy .	37	0:66	on either side , crown most commonly by dense and intricate mass of forest , through which and without a guide , our little army be compel to pass , -- present opportunity for frequent ambush and attack , in which , very inferior force , if properly command , might , with little danger to themselves , overwhelm and utterly destroy an advancing enemy .	ii dd1 nn1 y vvd_vvn rgt rr ii jj cc jj nn2 io nn1 y ii ddq cc iw at1 nn1 y appge jj nn1 vbdz vvn to vvi y zz jj@_vvd_vvn nn2 if jj nn1 cc nn1_vv0 y ii ddq y rg jj nn2 y cs rr vvn_vvd y vm y iw da1_jj nn1 ii ppx2 y nn1_vv0 cc rr vv0 at1 jj nn1 y
attack_nn	nn1	1848	1	fic_1848_1279.txt-1511-47	 	It is rather a singular thing for a street musician to sing such songs as you do, and in such a manner, " -- then, after a pause, during which she did not volunteer any information on the subject, he renewed the attack, with, " You must have had some instruction.	212:218	0:263	It is rather a singular thing for a street musician to sing such songs as you do , and in such a manner , " -- then , after a pause , during which she did not volunteer any information on the subject , he renewed the attack , with , " You must have had some instruction .	47	0:59	it be rather a singular thing for a street musician to sing such song as you do , and in such a manner , " -- then , after a pause , during which she do not volunteer any information on the subject , he renew the attack , with , " you must have have some instruction .	pph1 vbz rg at1 jj_nn1 nn1 if at1 nn1 nn1 to vvi da nn2 csa ppy vd0 y cc ii da at1 nn1 y " z rt y cs_ii at1 nn1 y ii ddq pphs1 vdd xx vvi dd nn1 ii at nn1 y pphs1 vvd at nn1 y iw y " ppy vm vhi vhn@ dd nn1 y
attack_nn	nn1	1835	1	fic_1835_7142.txt-807-41	 	They were collected, when I came up to them, on a small knoll, or rocky hillock, on the very edge of the marsh, and were engaged in loud and wordy argument concerning the propriety of another attack upon the Frondeurs; which counsel was strenuously advocated by some, while others as violently demanded that they should wait the arrival of a reinforcement, which had been already summoned from Pont Mousson.	192:198	0:407	They were collected , when I came up to them , on a small knoll , or rocky hillock , on the very edge of the marsh , and were engaged in loud and wordy argument concerning the propriety of another attack upon the Frondeurs ; which counsel was strenuously advocated by some , while others as violently demanded that they should wait the arrival of a reinforcement , which had been already summoned from Pont Mousson .	41	0:78	they be collect , when i come up to them , on a small knoll , or rocky hillock , on the very edge of the marsh , and be engage in loud and wordy argument concerning the propriety of another attack upon the frondeurs ; which counsel be strenuously advocate by some , while other as violently demand that they should wait the arrival of a reinforcement , which have be already summon from pont mousson .	pphs2 vbdr vvn y cs_rrq ppis1 vvd ii21 ii22 ppho2 y ii at1 jj nn1 y cc jj nn1 y ii at jj nn1 io at nn1 y cc vbdr vvn ii jj cc jj nn1 ii_vvg at nn1 io dd1 nn1 ii at nn2_np1 y ddq nn1_vv0 vbdz rr vvn ii dd y cs nn2 csa_rg@ rr vvn_vvd cst pphs2 vm vvi at nn1 io at1 nn1 y ddq vhd vbn rr vvn_vvd ii np1 np1_<sub> y
attack_nn	nn1	1848	1	fic_1848_7009.txt-1181-32	 	I gathered from him enough to convince me that my fears, which I have already spoken of, were true; and as I afterwards heard the facts of that fatal attack, I will here relate them to you. "	150:156	0:191	I gathered from him enough to convince me that my fears , which I have already spoken of , were true ; and as I afterwards heard the facts of that fatal attack , I will here relate them to you . "	32	0:43	i gather from him enough to convince me that my fear , which i have already speak of , be true ; and as i afterwards hear the fact of that fatal attack , i will here relate them to you . "	ppis1 vvd ii ppho1 rr to vvi ppio1 cst appge nn2 y ddq ppis1 vh0 rr vvn io y vbdr jj y cc csa ppis1 rt vvd_vvn at nn2 io dd1 jj nn1 y ppis1 vv0%_vm rl vvi ppho2 ii ppy y "
attack_nn	nn1	1856	1	fic_1856_2655.txt-4746-13	 	The public felt this event the more that its proximate cause was an attack made upon his brother's house by Paradisi, now imprisoned in the Castle of St. Angelo, pending a law process for proof of his accusations.	68:74	0:213	The public felt this event the more that its proximate cause was an attack made upon his brother 's house by Paradisi , now imprisoned in the Castle of St. Angelo , pending a law process for proof of his accusations .	13	0:42	the public feel this event the more that its proximate cause be an attack make upon his brother 's house by paradisi , now imprison in the castle of <nul> angelo , pending a law process for proof of his accusation .	at nn1 vvd_vvn dd1 nn1 at rrr cst appge jj nn1 vbdz at1 nn1 vvn ii appge nn1 ge nn1 ii np1_nn1 y rt vvn ii at nn1 io np1 np1 y ii at1 nn1 nn1_vv0 if nn1 io appge nn2 y
attack_nn	nn1	1845	1	fic_1845_7170.txt-10436-6	 	When our troops went to the attack of Louisburg, Whitfield gave them this motto, " Nil desperandum, Christo Duce; " an admirable one for our own flag.	28:34	0:150	When our troops went to the attack of Louisburg , Whitfield gave them this motto , " Nil desperandum , Christo Duce ; " an admirable one for our own flag .	6	0:32	when our troop go to the attack of louisburg , whitfield give them this motto , " nil desperandum , christo duce ; " an admirable one for our own flag .	cs appge nn2 vvd ii at nn1 io np1 y np1 vvd ppho2 dd1 nn1 y " pn1 nn1 y np1 np1 y " at1 jj pn1 if appge da nn1 y
attack_nn	nn1	1856	1	fic_1856_9779.txt-7124-6	 	Still the worst of his present attack was passed, and it was only what the physicians facetiously call the " tail of the gout " that gave him any inconveniences.	31:37	0:161	Still the worst of his present attack was passed , and it was only what the physicians facetiously call the " tail of the gout " that gave him any inconveniences .	6	0:32	still the bad of his present attack be pass , and it be only what the physician facetiously call the " tail of the gout " that give him any inconvenience .	rr at jjt io appge jj_nn1 nn1 vbdz vvn y cc pph1 vbdz rr_jj ddq at nn2 rr vv0 at " nn1 io at nn1 " cst vvd ppho1 dd nn2 y
attack_nn	nn1	1834	1	mag_1834_554263.txt-216-17	 	An idea prevailed, that Hawley had only retired for a time, and would renew the attack next morning; but the true state of the armies was soon understood, and after being exposed to the storm for five hours, Charles Edward entered Falkirk, and took possession of the cannon, baggage, and all the military stores of Hawley.	80:86	0:322	An idea prevailed , that Hawley had only retired for a time , and would renew the attack next morning ; but the true state of the armies was soon understood , and after being exposed to the storm for five hours , Charles Edward entered Falkirk , and took possession of the cannon , baggage , and all the military stores of Hawley .	17	0:65	an idea prevail , that hawley have only retire for a time , and would renew the attack next morning ; but the true state of the army be soon understand , and after be expose to the storm for five hour , charles edward enter falkirk , and take possession of the cannon , baggage , and all the military store of hawley .	at1 nn1 vvd_vvn y cst_dd1 np1_nn1@ vhd rr vvn if at1 nnt1 y cc vm vvi at nn1 md nnt1 y ccb at jj nn1 io at nn2 vbdz rr vvn_vvd y cc ii vbg vvn ii at nn1 if mc nnt2 y np1 np1 vvd np1 y cc vvd nn1 io at nn y nn1 y cc db at jj nn2 io np1 y
attack_nn	nn1	1857	1	fic_1857_9075.txt-4573-21	 	deeds of Christian charity, and by the time it was concluded, the boys awoke, eager to make an attack upon the luncheon.	95:101	0:120	deeds of Christian charity , and by the time it was concluded , the boys awoke , eager to make an attack upon the luncheon .	21	0:26	deed of christian charity , and by the time it be conclude , the boy awake , eager to make an attack upon the luncheon .	nn2 io jj nn1 y cc ii at nnt1 pph1 vbdz vvn y at nn2 vvd y jj to vvi at1 nn1 ii at nn1 y
attack_nn	nn1	1845	1	fic_1845_622.txt-11178-62	 	In executing this duty, friends and fellow-citizens, you are to use courage and discretion; courage, that you may not be daunted by any lawless attempt that this man may make with his rifle and his dogs to oppose you; and discretion, which here means caution and prudence, that he may not escape from this sudden attack?	313:319	0:320	In executing this duty , friends and fellow-citizens , you are to use courage and discretion ; courage , that you may not be daunted by any lawless attempt that this man may make with his rifle and his dogs to oppose you ; and discretion , which here means caution and prudence , that he may not escape from this sudden attack ?	62	0:64	in execute this duty , friend and fellow-citizen , you be to use courage and discretion ; courage , that you may not be daunt by any lawless attempt that this man may make with his rifle and his dog to oppose you ; and discretion , which here mean caution and prudence , that he may not escape from this sudden attack ?	ii vvg dd1 nn1 y nn2 cc nn2 y ppy vbr to vvi nn1 cc nn1 y nn1 y cst ppy vm xx vbi vvn ii dd jj nn1 cst dd1 nn1 vm vvi iw appge nn1 cc appge nn2 to vvi ppy y cc nn1 y ddq rl vvz nn1 cc nn1 y cst pphs1 vm xx vvi ii dd1 jj nn1 y
attack_nn	nn1	1840	1	mag_1840_586497.txt-150-6	 	This is the first point of attack, the only immediate palliative which there seems any hope of applying.	27:33	0:104	This is the first point of attack , the only immediate palliative which there seems any hope of applying .	6	0:20	this be the first point of attack , the only immediate palliative which there seem any hope of apply .	dd1 vbz at md nn1 io nn1 y at jj jj jj_nn1% ddq ex vvz dd nn1 io vvg y
attack_nn	nn1	1845	1	mag_1845_555245.txt-299-1	 	The attack of the Boston Teachers upon the Board of Education and its Secretary has failed, - signally and disgracefully failed.	4:10	0:128	The attack of the Boston Teachers upon the Board of Education and its Secretary has failed , - signally and disgracefully failed .	1	0:23	the attack of the boston teacher upon the board of education and its secretary have fail , - signally and disgracefully fail .	at nn1 io at np1 nn2 ii at nn1 io nn1 cc appge nn1 vhz vvn y - rr cc rr vvn_vvd y
attack_nn	nn1	1843	1	fic_1843_7166.txt-1590-9	 	Upon meeting my friends, they commenced a simultaneous attack upon me for having, as they averred, left them in a most eccentric manner the day before.	55:61	0:151	Upon meeting my friends , they commenced a simultaneous attack upon me for having , as they averred , left them in a most eccentric manner the day before .	9	0:30	upon meet my friend , they commence a simultaneous attack upon me for have , as they aver , leave them in a most eccentric manner the day before .	ii vvg appge nn2 y pphs2 vvd at1 jj nn1 ii ppio1 if vhg y csa pphs2 vvd y vvd ppho2 ii_rp@ at1 rgt jj nn1 at nnt1 rt y
attack_nn	nn2	1845	1	nf_1845_747928.txt-826-66	 	Such are some of the disadvantages of a light sandy soil; and, in thoroughly examining many of the fruit gardens of the middle states the last few seasons, we could not fail to be struck with the fact that in nine cases out of ten, where a variety of fruit was unusually liable to disease, to blight, or to the attacks of	311:318	0:321	Such are some of the disadvantages of a light sandy soil ; and , in thoroughly examining many of the fruit gardens of the middle states the last few seasons , we could not fail to be struck with the fact that in nine cases out of ten , where a variety of fruit was unusually liable to disease , to blight , or to the attacks of	66	0:68	such be some of the disadvantage of a light sandy soil ; and , in thoroughly examine many of the fruit garden of the middle state the last few season , we could not fail to be strike with the fact that in nine case out of ten , where a variety of fruit be unusually liable to disease , to blight , or to the attack of	da vbr dd io at nn2 io at1 jj jj nn1 y cc y ii_rp@ rr vvg da2 io at nn nn2 io at nn1 vvz at md da2 nnt2 y ppis2 vm xx vvi to vbi vvn iw at nn1 cst ii mc nn2 ii21 ii22 mc y cs_rrq at1 nn1 io nn vbdz rr jj ii nn1 y to vvi y cc ii at nn2 io
attack_nn	nn1	1846	1	mag_1846_524014.txt-26-2	 	species of attack against which - we protest is too mean-spirited to deserve refutation.	11:17	0:88	species of attack against which - we protest is too mean-spirited to deserve refutation .	2	0:15	species of attack against which - we protest be too mean-spirited to deserve refutation .	nn io nn1 ii ddq y_<sub> prp_<sub> vv0 vbz rg jj to vvi nn1 y
attack_nn	nn1	1859	1	nf_1859_747415.txt-25-18	 	The defences of our common Christianity have been compelled into new dispositions, by the altered methods of attack employed by adversaries.	109:115	0:140	The defences of our common Christianity have been compelled into new dispositions , by the altered methods of attack employed by adversaries .	18	0:23	the defence of our common christianity have be compel into new disposition , by the alter method of attack employ by adversary .	at nn2 io appge jj nn1 vh0 vbn vvn ii jj nn2 y ii at jj nn2 io nn1 vvn ii nn2 y
attack_nn	nn1	1850	1	mag_1850_589167.txt-126-1	 	The attack here alluded to relates not to the public works, but to the whig policy of burrowing thirteen hundred thousand dollars, in violation of the constitution.	4:10	0:164	The attack here alluded to relates not to the public works , but to the whig policy of burrowing thirteen hundred thousand dollars , in violation of the constitution .	1	0:30	the attack here allude to relate not to the public work , but to the whig policy of burrow thirteen hundred thousand dollar , in violation of the constitution .	at nn1 rl vvd_vvn@ to_ii vvz xx ii at jj_nn1 nn_vvz y ccb ii at nn1 nn1 io vvg mc m m nnu2 y ii nn1 io at nn1 y
attack_nn	nn1	1853	1	mag_1853_590234.txt-200-60	 	The good people of England were not so enlightened at the * " The old jealousies of which it " (a standing army) " was the object, no longer exist, and there can be no doubt that the establishment of a properly trained military force is not only indispensable to guaranty the national independence from hostile attack, but that it is the best force that can be employed to maintain internal tranquillity and order. "	311:317	0:416	The good people of England were not so enlightened at the * " The old jealousies of which it " ( a standing army ) " was the object , no longer exist , and there can be no doubt that the establishment of a properly trained military force is not only indispensable to guaranty the national independence from hostile attack , but that it is the best force that can be employed to maintain internal tranquillity and order . "	60	0:81	the good people of england be not so enlighten at the * " the old jealousy of which it " ( a stand army ) " be the object , no long exist , and there can be no doubt that the establishment of a properly train military force be not only indispensable to guaranty the national independence from hostile attack , but that it be the best force that can be employ to maintain internal tranquillity and order . "	at jj nn io np1 vbdr xx rr_rg vvn_jj_vvd ii at fu " at jj nn2 io ddq pph1 " y at1 nn1_jj@ nn1 y " vbdz at nn1 y rr21 rr22 vv0 y cc ex vm vbi at nn1 cst at nn1 io at1 rr vvn jj nn1 vbz xx rr_jj jj ii nn1_jj at jj nn1 ii jj nn1 y ccb cst pph1 vbz at jjt_rrt nn1_vv0@ cst_dd1 vm vbi vvn to vvi jj nn1 cc nn1 y "
attack_nn	nn1	1846	1	fic_1846_544.txt-3481-11	 	But he rejected the compromise indignantly, and still continued his attack on my face, as though nothing short of that would satisfy him.	68:74	0:137	But he rejected the compromise indignantly , and still continued his attack on my face , as though nothing short of that would satisfy him .	11	0:26	but he reject the compromise indignantly , and still continue his attack on my face , as though nothing short of that would satisfy him .	ccb pphs1 vvd at nn1 rr y cc rr vvd_vvn appge nn1 ii appge nn1 y cs21 cs22 pn1 jj_rr@ io dd1 vm vvi ppho1 y
attack_nn	nn1	1821	1	nf_1821_749178.txt-186-12	 	One half of these, under Col. Campbell, immediately made an attack upon the town.	60:66	0:81	One half of these , under Col. Campbell , immediately made an attack upon the town .	12	0:17	one half of these , under <nul> campbell , immediately make an attack upon the town .	mc1 nn1@_db io dd2 y ii nnb np1 y rr vvn_vvd at1 nn1 ii at nn1 y
attack_nn	nn1	1838	1	mag_1838_586203.txt-253-10	 	Mr. Calhoun has had to sustain a tremendous battery of attack, at the present session, from the two great leaders of the Opposition, Mr. Clay and Mr. Webster; and these encounters of intellect-whatever may be thought of the propriety of time and place-have presented scenes of an	55:61	0:279	Mr. Calhoun has had to sustain a tremendous battery of attack , at the present session , from the two great leaders of the Opposition , Mr. Clay and Mr. Webster ; and these encounters of intellect-whatever may be thought of the propriety of time and place-have presented scenes of an	10	0:51	mr.- calhoun have have to sustain a tremendous battery of attack , at the present session , from the two great leader of the opposition , mr.- clay and mr.- webster ; and these encounter of intellect-whatever may be think of the propriety of time and place-have present scene of an	nnb np1 vhz vhn to vvi at1 jj nn1 io nn1 y ii at jj_nn1 nnt1 y ii at mc jj nn2 io at nn1 y nnb np1 cc nnb np1 y cc dd2 nn2 io nn1_<sub> vm vbi vvn io at nn1 io nnt1 cc nn1_<sub> vvn nn2 io at1
attack_nn	nn1	1831	1	fic_1831_7210.txt-1507-8	 	If it be such as will warrant an attack, I am seized with a strong desire to carry it, either by surprise or by storm.	33:39	0:118	If it be such as will warrant an attack , I am seized with a strong desire to carry it , either by surprise or by storm .	8	0:28	if it be such as will warrant an attack , i be seize with a strong desire to carry it , either by surprise or by storm .	cs pph1 vbi ii21 ii22 vm vvi at1 nn1 y ppis1 vbm vvn iw at1 jj nn1 to vvi pph1 y rr ii nn1 cc ii nn1 y
attack_nn	nn1	1855	1	mag_1855_556039.txt-57-39	 	It is within the memory of a large portion of the profession, that typhoid fever was supposed to be a disease which, in its early stages at least, might be so far counteracted by a bold attack as to reduce to a few days ' duration a siege which otherwise might be continued for weeks, exposing the patient to	186:192	0:308	It is within the memory of a large portion of the profession , that typhoid fever was supposed to be a disease which , in its early stages at least , might be so far counteracted by a bold attack as to reduce to a few days ' duration a siege which otherwise might be continued for weeks , exposing the patient to	39	0:63	it be within the memory of a large portion of the profession , that typhoid fever be supposed to be a disease which , in its early stage at least , might be so far counteract by a bold attack as to reduce to a few day ' duration a siege which otherwise might be continue for week , expose the patient to	pph1 vbz ii at nn1 io at1 jj nn1 io at nn1 y dd1_cst jj_nn1 nn1 vbdz jj to vbi at1 nn1 ddq y ii appge jj nn2 rr21 rr22 y vm vbi rg rr vvn ii at1 jj nn1 ii21_csa ii22_to vv0 ii at1 da2 nnt2 ge nn1 at1 nn1 ddq rr vm vbi vvn if nnt2 y vvg at nn1_jj ii
attack_nn	nn1	1860	1	fic_1860_9817.txt-2290-22	 	The two congenial spirits then together went to a loop-hole which commanded the whole ground, and speedily arranged a plan of attack, and the different parts which each of their companies should take in carrying it into execution.	126:132	0:230	The two congenial spirits then together went to a loop-hole which commanded the whole ground , and speedily arranged a plan of attack , and the different parts which each of their companies should take in carrying it into execution .	22	0:41	the two congenial spirit then together go to a loop-hole which command the whole ground , and speedily arrange a plan of attack , and the different part which each of their company should take in carry it into execution .	at mc jj nn2 rt rl vvd ii at1 nn1 ddq vvd at jj nn1 y cc rr vvn_vvd at1 nn1 io nn1 y cc at jj nn2 ddq dd1 io appge nn2 vm vvi ii_rp@ vvg pph1 ii nn1 y
attack_nn	nn1	1824	1	fic_1824_7212.txt-597-16	 	Many of our men immediately fled; but the greater number rushed on to the intended attack. "	83:89	0:92	Many of our men immediately fled ; but the greater number rushed on to the intended attack . "	16	0:19	many of our man immediately flee ; but the great number rush on to the intend attack . "	da2 io appge nn2 rr vvn_vvd y ccb at jjr nn1 vvn_vvd ii21_rp ii22_ii at jj@ nn1 y "
attack_nn	nn1	1832	1	mag_1832_564307.txt-140-16	 	While places situated in the interior and on navigable streams have been the favorite objects of attack, the sea-board, in almost all countries, has been nearly exempt.	97:103	0:168	While places situated in the interior and on navigable streams have been the favorite objects of attack , the sea-board , in almost all countries , has been nearly exempt .	16	0:31	while place situate in the interior and on navigable stream have be the favorite object of attack , the sea-board , in almost all country , have be nearly exempt .	cs nn2 vvn ii at nn1_jj cc ii jj nn2 vh0 vbn at jj_nn1 nn2 io nn1 y at nn1_<sub> y ii_rp@ rr db nn2 y vhz vbn rr vv0_jj y
attack_nn	nn1	1854	1	mag_1854_555935.txt-131-30	 	18* // The development of Comte's system, after the outlines of it had been completed in his own mind, was delayed, in 1826, by an attack of mental disease, from which, if it had been left to take its own course, he thinks he should have speedily recovered.	131:137	0:257	18* // The development of Comte 's system , after the outlines of it had been completed in his own mind , was delayed , in 1826 , by an attack of mental disease , from which , if it had been left to take its own course , he thinks he should have speedily recovered .	30	0:57	18* // the development of comte 's system , after the outline of it have be complete in his own mind , be delay , in 1826 , by an attack of mental disease , from which , if it have be leave to take its own course , he think he should have speedily recover .	fo db_<sub> at nn1 io np1 ge nn1 y cs_ii at nn2 io pph1 vhd vbn vvn ii appge da nn1 y vbdz vvn y ii mc y ii at1 nn1 io jj nn1 y ii ddq y cs pph1 vhd vbn vvn to vvi appge da nn1 y pphs1 vvz pphs1 vm vhi rr vvn_vvd y
