lemma	pos	date	grouping	identifier	description	context	indexes_target_token	indexes_target_sentence	context_tokenized	indexes_target_token_tokenized	indexes_target_sentence_tokenized	context_lemmatized	context_pos
attack_nn	nn1	1838	1	mag_1838_554586.txt-186-30	 	But if the policy of the Anglo-Americans was sufficient to destroy so powerful a rival as the French, what can be expected from the unconcerted, ill-advised resistance or attack of the aborigines, unskilled in military tactics, and not sufficiently strong, on any one point,	171:177	0:274	But if the policy of the Anglo-Americans was sufficient to destroy so powerful a rival as the French , what can be expected from the unconcerted , ill-advised resistance or attack of the aborigines , unskilled in military tactics , and not sufficiently strong , on any one point ,	30	0:50	but if the policy of the anglo-americans be sufficient to destroy so powerful a rival as the french , what can be expect from the unconcerted , ill-advised resistance or attack of the aborigine , unskilled in military tactic , and not sufficiently strong , on any one point ,	ccb cs at nn1 io at nn2 vbdz jj to vvi rg jj at1 nn1_jj ii_csa at nn1_jj y ddq vm vbi vvn ii at jj y jj nn1 cc nn1 io at nn2 y jj ii jj nn2 y cc xx rr jj y ii dd mc1 nn1 y
attack_nn	nn1	1855	1	fic_1855_2965.txt-376-3	 	He witnessed the attack, but knew nothing of its cause.	17:23	0:55	He witnessed the attack , but knew nothing of its cause .	3	0:12	he witness the attack , but know nothing of its cause .	pphs1 vvd at nn1 y ccb vvd pn1 io appge nn1 y
attack_nn	nn1	1824	1	fic_1824_7211.txt-3045-8	 	, which should be the signal of an attack having been made there.	35:41	0:65	, which should be the signal of an attack having been made there .	8	0:14	, which should be the signal of an attack have be make there .	y ddq vm vbi at nn1 io at1 nn1 vhg vbn vvn rl y
attack_nn	nn1	1853	1	fic_1853_1170.txt-2289-22	 	I examined the boy's feet, and found them red, shining and tumefied, with other indications of a severe attack of chilblains. "	104:110	0:127	I examined the boy 's feet , and found them red , shining and tumefied , with other indications of a severe attack of chilblains . "	22	0:27	i examine the boy 's foot , and find them red , shine and tumefied , with other indication of a severe attack of chilblain . "	ppis1 vvd at nn1 ge nn2 y cc vvd ppho2 jj_nn1 y vvg_jj cc vvd y iw jj nn2 io at1 jj nn1 io nn2 y "
attack_nn	nn2	1860	1	fic_1860_8118.txt-4037-43	 	I dreamed in a dream, I saw a city invincible to the attacks of the whole of the rest of the earth from Leaves of grass (1860-61) I dreamed in a dream, I saw a city invincible to the attacks of the whole of the rest of the earth, I dreamed that was the new City of Friends, Nothing was greater there than the quality of robust love -- it led the rest, It was seen every hour in the actions of the men of that city,	183:190	0:414	I dreamed in a dream , I saw a city invincible to the attacks of the whole of the rest of the earth from Leaves of grass ( 1860-61 ) I dreamed in a dream , I saw a city invincible to the attacks of the whole of the rest of the earth , I dreamed that was the new City of Friends , Nothing was greater there than the quality of robust love -- it led the rest , It was seen every hour in the actions of the men of that city ,	43	0:95	i dream in a dream , i see a city invincible to the attack of the whole of the rest of the earth from leave of grass ( 1860-61 ) i dream in a dream , i see a city invincible to the attack of the whole of the rest of the earth , i dream that be the new city of friend , nothing be great there than the quality of robust love -- it lead the rest , it be see every hour in the action of the man of that city ,	ppis1 vvd ii_rp@ at1 nn1 y ppis1 vvd at1 nn1 jj ii at nn2 io at nn1 io at nn1 io at nn1 ii nn2 io nn1 y mcmc y ppis1 vvd ii_rp@ at1 nn1 y ppis1 vvd at1 nn1 jj ii at nn2 io at nn1 io at nn1 io at nn1 y ppis1 vvd dd1_cst vbdz at jj nn1 io nn2 y pn1 vbdz jjr rl csn at nn1 io jj nn1 z pph1 vvd at nn1 y pph1 vbdz vvn at1 nnt1 ii at nn2 io at nn2 io dd1 nn1 y
attack_nn	nn1	1841	1	nf_1841_762742.txt-2458-9	 	The general doubted, however, whether any serious attack was meditated against the place.	50:56	0:89	The general doubted , however , whether any serious attack was meditated against the place .	9	0:16	the general doubt , however , whether any serious attack be meditate against the place .	at nn1 vvd_vvn y rr y csw dd jj nn1 vbdz vvn@ ii at nn1 y
attack_nn	nn1	1832	1	mag_1832_564345.txt-180-28	 	In a merely military point of view, this is sufficiently proper; for it can not be supposed that either grammar or Latin is necessary to the attack and defence of fortified places, or that the graces of composition are necessary to the art of castrametation.	141:147	0:258	In a merely military point of view , this is sufficiently proper ; for it can not be supposed that either grammar or Latin is necessary to the attack and defence of fortified places , or that the graces of composition are necessary to the art of castrametation .	28	0:49	in a merely military point of view , this be sufficiently proper ; for it can not be suppose that either grammar or latin be necessary to the attack and defense of fortify place , or that the grace of composition be necessary to the art of castrametation .	ii at1 rr jj nn1 io nn1 y dd1 vbz rr jj y if_cs% pph1 vm xx vbi vvn cst_dd1 rr nn1 cc nn1 vbz jj ii at nn1 cc nn1 io jj nn2 y cc cst at nn2 io nn1 vbr jj ii at nn1 io nn1_<sub> y
attack_nn	nn1	1823	1	mag_1823_553456.txt-249-22	 	Schiller appears to have resigned his professorship, or at least to have suspended his attention to its duties, after the attack of illness above mentioned, although the fact is not precisely stated by the biographer, and was thus deprived of his ordinary means of living.	122:128	0:272	Schiller appears to have resigned his professorship , or at least to have suspended his attention to its duties , after the attack of illness above mentioned , although the fact is not precisely stated by the biographer , and was thus deprived of his ordinary means of living .	22	0:50	schiller appear to have resign his professorship , or at least to have suspend his attention to its duty , after the attack of illness above mention , although the fact be not precisely state by the biographer , and be thus deprive of his ordinary mean of living .	np1 vvz to vhi vvn appge nn1 y cc rr21 rr22 to vhi vvn appge nn1 ii appge nn2 y cs_ii at nn1 io nn1 rl vvd_vvn y cs at nn1 vbz xx rr vvn ii at nn1 y cc vbdz rr vvn_jj_vvd io appge jj nn io nn1_vvg_jj y
attack_nn	nn1	1835	1	fic_1835_7172.txt-6030-11	 	Here they delayed a few minutes, as if expecting an attack; until finding that the object of their solicitude had safely crossed the field and plunged into the distant woods, they rode away at a rapid pace in the same direction.	52:58	0:228	Here they delayed a few minutes , as if expecting an attack ; until finding that the object of their solicitude had safely crossed the field and plunged into the distant woods , they rode away at a rapid pace in the same direction .	11	0:45	here they delay a few minute , as if expect an attack ; until find that the object of their solicitude have safely cross the field and plunge into the distant wood , they ride away at a rapid pace in the same direction .	rl pphs2 vvd at1 da2 nnt2 y cs21 cs22 vvg at1 nn1 y cs vvg cst at nn1 io appge nn1 vhd rr vvn at nn1 cc vvn ii at jj nn2 y pphs2 vvd rl ii at1 jj nn1 ii at da nn1 y
attack_nn	nn1	1845	1	fic_1845_7170.txt-4861-9	 	A single instance of discipline sprang from a rude attack made by one of the larger boys, Consider Gisborne, on one whose helplessness appealed strongly to the teacher's sensibilities, Job Luce.	51:57	0:194	A single instance of discipline sprang from a rude attack made by one of the larger boys , Consider Gisborne , on one whose helplessness appealed strongly to the teacher 's sensibilities , Job Luce .	9	0:36	a single instance of discipline spring from a rude attack make by one of the large boy , consider gisborne , on one whose helplessness appeal strongly to the teacher 's sensibility , job luce .	at1_zz1 jj nn1 io nn1 vvd ii at1 jj nn1 vvn ii mc1 io at jjr nn2 y vv0 np1 y ii pn1 ddqge nn1 vvd_vvn rr ii at nn1 ge nn2 y nn1 np1 y
attack_nn	nn1	1828	1	mag_1828_553929.txt-364-34	 	Abandoned by all but the Jesuits, whose alliance was even more fatal than the enmity of the other parties, M. de VilliAe at length became satisfied that he could not stand the attack of the press, and must either silence it or retire.	176:182	0:234	Abandoned by all but the Jesuits , whose alliance was even more fatal than the enmity of the other parties , M. de VilliAe at length became satisfied that he could not stand the attack of the press , and must either silence it or retire .	34	0:47	abandon by all but the jesuit , whose alliance be even more fatal than the enmity of the other party , <nul> de villiae at length become satisfied that he could not stand the attack of the press , and must either silence it or retire .	vvn ii db_rr21 ii_rr22_ccb at nn2 y ddqge nn1 vbdz rr rgr jj csn at nn1 io at jj nn2 y nn1 np1 np1_<sub> rr21 rr22 vvd jj cst pphs1 vm xx vvi at nn1 io at nn1 y cc vm rr vvi pph1 cc vv0 y
attack_nn	nn1	1858	1	mag_1858_506134.txt-148-19	 	It was during the Captain's absence at headquarters that some of the traitor Arnold's soldiers made an attack on the mansion.	103:109	0:125	It was during the Captain 's absence at headquarters that some of the traitor Arnold 's soldiers made an attack on the mansion .	19	0:24	it be during the captain 's absence at headquarters that some of the traitor arnold 's soldier make an attack on the mansion .	pph1 vbdz ii at nn1 ge nn1 ii nn cst dd io at nn1 np1 ge nn2 vvd_vvn at1 nn1 ii at nn1 y
attack_nn	nn2	1845	1	nf_1845_748321.txt-2041-23	 	Its sympathy for my brethren in bonds -- its scathing denunciations of slaveholders -- its faithful exposures of slavery -- and its powerful attacks upon the upholders of the institution -- sent a thrill of joy through my soul, such as I had never felt before!	141:148	0:260	Its sympathy for my brethren in bonds -- its scathing denunciations of slaveholders -- its faithful exposures of slavery -- and its powerful attacks upon the upholders of the institution -- sent a thrill of joy through my soul , such as I had never felt before !	23	0:48	its sympathy for my brother in bond -- its scathing denunciation of slaveholder -- its faithful exposure of slavery -- and its powerful attack upon the upholder of the institution -- send a thrill of joy through my soul , such as i have never feel before !	appge nn1 if appge nn2 ii nn2 nn1_jj appge jj nn2 io nn2 nn1_jj appge jj nn2 io nn1 nn1 cc appge jj nn2 ii at nn2 io at nn1 nn1 vvd_vvn at1 nn1 io nn1 ii appge nn1 y ii21 ii22 ppis1 vhd rr vvn rt@_ii !
attack_nn	nn1	1829	1	nf_1829_751465.txt-2786-42	 	Among the cities granted to the latter Loxa was particularly specified, with a condition that he should immediately take command of it in person, for the council thought the favor he enjoyed with the Castilian monarchs might avert the threatened attack.	246:252	0:253	Among the cities granted to the latter Loxa was particularly specified , with a condition that he should immediately take command of it in person , for the council thought the favor he enjoyed with the Castilian monarchs might avert the threatened attack .	42	0:44	among the city grant to the latter loxa be particularly specify , with a condition that he should immediately take command of it in person , for the council think the favor he enjoy with the castilian monarch might avert the threaten attack .	ii at nn2 vvn_vvd ii at da np1_nn1@ vbdz rr vvn_vvd y iw at1 nn1 cst pphs1 vm rr vvi nn1 io pph1 ii nn1 y if at nn1 vvd_vvn at nn1 pphs1 vvd iw at jj nn2 vm vvi at jj@ nn1 y
attack_nn	nn1	1839	1	fic_1839_7024.txt-2377-9	 	I thought I had just awoke, after the attack which was made upon me by the assassin, when I was on my way to Mr. Marisett's house.	38:44	0:130	I thought I had just awoke , after the attack which was made upon me by the assassin , when I was on my way to Mr. Marisett 's house .	9	0:31	i think i have just awake , after the attack which be make upon me by the assassin , when i be on my way to mr.- marisett 's house .	ppis1 vvd ppis1 vhd rr vvn y cs_ii at nn1 ddq vbdz vvn ii ppio1 ii at nn1 y cs_rrq ppis1 vbdz ii appge nn1 ii nnb np1_<sub> ge nn1 y
attack_nn	nn1	1854	1	fic_1854_9193.txt-8301-13	 	But then, the work itself, with the exception of a feeble attack now and then from the prolific pen of Skimmer, (who wrote for several publications,) was noticed by the press with favour.	58:64	0:187	But then , the work itself , with the exception of a feeble attack now and then from the prolific pen of Skimmer , ( who wrote for several publications , ) was noticed by the press with favour .	13	0:40	but then , the work itself , with the exception of a feeble attack now and then from the prolific pen of skimmer , ( who write for several publication , ) be notice by the press with favour .	ccb rt y at nn1 ppx1 y iw at nn1 io at1 jj nn1 rt cc rt ii at jj nn1 io nn1 y y pnqs vvd if da2 nn2 y y vbdz vvn ii at nn1 iw nn1 y
attack_nn	nn1	1838	1	fic_1838_7086.txt-2732-33	 	being protected by the batteries of New-York, Governor's Island, and Red Hook; that, on the arrival of their fleet through the Sound, instead of making a direct attack on New-York, they should land at Kingsbridge, and take up a position across the island of New-York, cut off all communication with the mainland, and, blockading General Washington by land and water, compel him to capitulate on their own terms. "	161:167	0:413	being protected by the batteries of New-York , Governor 's Island , and Red Hook ; that , on the arrival of their fleet through the Sound , instead of making a direct attack on New-York , they should land at Kingsbridge , and take up a position across the island of New-York , cut off all communication with the mainland , and , blockading General Washington by land and water , compel him to capitulate on their own terms . "	33	0:82	be protect by the battery of new-york , governor 's island , and red hook ; that , on the arrival of their fleet through the sound , instead of make a direct attack on new-york , they should land at kingsbridge , and take up a position across the island of new-york , cut off all communication with the mainland , and , blockade general washington by land and water , compel him to capitulate on their own term . "	vbg vvn ii at nn2 io np1 y np1 ge nnl1 y cc jj nn1@_np1 y dd1_cst y ii at nn1 io appge nn1 ii at nn1 y ii21 ii22 vvg at1 jj nn1 ii np1 y pphs2 vm vvi ii np1 y cc vvi rp at1 nn1 ii at nn1 io np1 y vv0_vvn_vvd@ rp_ii db nn1 iw at nn1 y cc y vvg nnb np1 ii nn1 cc nn1 y vv0 ppho1 to vvi ii_rp@ appge da nn2 y "
attack_nn	nn1_vv0	1832	1	nf_1832_758144.txt-1353-3	 	In his first attack he used the arms, which in general have been considered as belonging to the other side of the question.	13:19	0:123	In his first attack he used the arms , which in general have been considered as belonging to the other side of the question .	3	0:25	in his first attack he use the arm , which in general have be consider as belong to the other side of the question .	ii appge md nn1_vv0 pphs1 vvd at nn2 y ddq rr21 rr22 vh0 vbn vvn csa_ii@ vvg ii at jj nn1 io at nn1 y
attack_nn	nn1	1858	1	fic_1858_1282.txt-1444-24	 	Indeed such was the shattered condition of the little tenement, that you might easily have imagined it suffering from a forty years ' attack of chronic disease, and quite unfit for the habitation of so great a military hero.	134:140	0:224	Indeed such was the shattered condition of the little tenement , that you might easily have imagined it suffering from a forty years ' attack of chronic disease , and quite unfit for the habitation of so great a military hero .	24	0:42	indeed such be the shattered condition of the little tenement , that you might easily have imagine it suffer from a forty year ' attack of chronic disease , and quite unfit for the habitation of so great a military hero .	rr da vbdz at jj nn1 io at jj nn1 y cst ppy vm rr vhi vvn pph1 vvg_jj ii at1 mc nnt2 ge nn1 io jj nn1 y cc rg jj if at nn1 io rg jj_rr% at1 jj nn1 y
attack_nn	nn1	1840	1	nf_1840_768793.txt-1045-33	 	Though Kemp declares here that his " imployment for the pageant was utterly spent, " yet Anthony furnished the city shows for 1605, 1611, and (in spite of an attack made on him by Middleton in 1613 -- see my ed.	158:164	0:211	Though Kemp declares here that his " imployment for the pageant was utterly spent , " yet Anthony furnished the city shows for 1605 , 1611 , and ( in spite of an attack made on him by Middleton in 1613 -- see my ed.	33	0:45	though kemp declare here that his " imployment for the pageant be utterly spend , " yet anthony furnish the city show for 1605 , 1611 , and ( in spite of an attack make on him by middleton in 1613 -- see my <nul>	cs np1 vvz rl cst appge " nn1 if at nn1 vbdz rr vvn_vvd y " rr np1 vvd at nn1 vvz_nn2 if mc y mc y cc y ii31 ii32 ii33 at1 nn1 vvn_vvd ii ppho1 ii np1 ii mc nn1_jj vv0 appge nn1
attack_nn	nn1	1845	1	fic_1845_7162.txt-3298-53	 	trampling of Old Tom might be heard on the stair-case, as in vociferous converse with our host he came down from the chamber, wherein, by some strange process of persuasion assuredly peculiar to himself, Harry had forced him to go through the ceremony of ablution, previous to his attack upon the viands, which were in truth not likely to be dealt with more mercifully in consequence of this delay.	281:287	0:398	trampling of Old Tom might be heard on the stair-case , as in vociferous converse with our host he came down from the chamber , wherein , by some strange process of persuasion assuredly peculiar to himself , Harry had forced him to go through the ceremony of ablution , previous to his attack upon the viands , which were in truth not likely to be dealt with more mercifully in consequence of this delay .	53	0:76	trample of old tom might be hear on the stair-case , as in vociferous converse with our host he come down from the chamber , wherein , by some strange process of persuasion assuredly peculiar to himself , harry have force him to go through the ceremony of ablution , previous to his attack upon the viands , which be in truth not likely to be deal with more mercifully in consequence of this delay .	nn1@ io jj np1 vm vbi vvn ii at nn1 y csa ii jj nn1_jj iw appge nn1 pphs1 vvd rp ii at nn1 y rrq y ii dd jj nn1 io nn1 rr jj ii ppx1 y np1 vhd vvn ppho1 to vvi ii at nn1 io nn1 y jj ii appge nn1 ii at nn2 y ddq vbdr ii nn1 xx jj_rr@ to vbi vvn iw rgr_dar rr ii nn1 io dd1 nn1 y
attack_nn	nn2	1844	1	fic_1844_800.txt-2479-17	 	I can not afford to be irritable and captious, nor to waste all my time in attacks.	75:82	0:83	I can not afford to be irritable and captious , nor to waste all my time in attacks .	17	0:19	i can not afford to be irritable and captious , nor to waste all my time in attack .	ppis1 vm xx vvi to vbi jj cc jj y cc to vvi db appge nnt1 ii nn2 y
attack_nn	nn2_vvz@	1833	1	nf_1833_747463.txt-2020-14	 	It knots, that it may unravel, itself; one of its slopes attacks, the other relieves.	57:64	0:85	It knots , that it may unravel , itself ; one of its slopes attacks , the other relieves .	14	0:20	it knot , that it may unravel , itself ; one of its slope attack , the other relieve .	nn1% nn2 y cst pph1 vm vvi y ppx1 y mc1 io appge nn2 nn2_vvz@ y at nn1@_jj vvz y
attack_nn	nn1	1830	1	mag_1830_554067.txt-275-32	 	Now, supposing even that Dr. Channing had in some degree mistaken the character of Bonaparte, we can not admit that this would at all justify the critic in his outrageous attack; but, independently of this consideration, we must also remark, that, according to our judgment	171:177	0:273	Now , supposing even that Dr. Channing had in some degree mistaken the character of Bonaparte , we can not admit that this would at all justify the critic in his outrageous attack ; but , independently of this consideration , we must also remark , that , according to our judgment	32	0:52	now , supposing even that dr.-i channing have in some degree mistake the character of bonaparte , we can not admit that this would at all justify the critic in his outrageous attack ; but , independently of this consideration , we must also remark , that , according to our judgment	rt y cs_vvg rr cst nnb np1 vhd ii dd nn1 vvn at nn1 io np1_nn1 y ppis2 vm xx vvi cst dd1 vm rr21 rr22 vvi at nn1 ii appge jj nn1 y ccb y rr io dd1 nn1 y ppis2 vm rr vvi y dd1_cst y ii21 ii22 appge nn1
attack_nn	nn1	1829	1	nf_1829_747740.txt-792-23	 	But how do we know, but that for the strength gained by the journey, my frame could not have stood this attack.	104:110	0:111	But how do we know , but that for the strength gained by the journey , my frame could not have stood this attack .	23	0:25	but how do we know , but that for the strength gain by the journey , my frame could not have stand this attack .	ccb rrq vd0 ppis2 vvi y ccb dd1 if at nn1 vvn ii at nn1 y appge nn1 vm xx vhi vvn@ dd1 nn1 y
attack_nn	nn1	1840	1	mag_1840_586558.txt-356-49	 	In the spring of 1821, he accompanied his wife to Hartford, Connecticut, to obtain, medical assistance for her relief from a cancer; which was removed, with some hopes of a permanent cure; but in the summer of 1822, it renewed its attack and in a few weeks carried her to the grave.	231:237	0:282	In the spring of 1821 , he accompanied his wife to Hartford , Connecticut , to obtain , medical assistance for her relief from a cancer ; which was removed , with some hopes of a permanent cure ; but in the summer of 1822 , it renewed its attack and in a few weeks carried her to the grave .	49	0:61	in the spring of 1821 , he accompany his wife to hartford , connecticut , to obtain , medical assistance for her relief from a cancer ; which be remove , with some hope of a permanent cure ; but in the summer of 1822 , it renew its attack and in a few week carry her to the grave .	ii at nn1 io mc y pphs1 vvd appge nn1 ii np1 y np1 y to vvi y jj nn1 if appge nn1 ii at1 nn1 y ddq vbdz vvn y iw dd nn2 io at1 jj nn1 y ccb ii at nnt1 io mc y pph1 vvd appge nn1 cc ii at1 da2 nnt2 vvd_vvn ppho1 ii at nn1_jj y
attack_nn	nn1	1825	1	mag_1825_553609.txt-140-54	 	On the 5th of October, 1778, the legion was ordered to Little Egg Harbour, with a body of Jersey and Pennsylvania militia, and a field piece from colonel Proctor's regiment of artillery, the whole under the command of Pulaski, for the defence of the place against an attack, which was expected from the enemy then on that coast.	267:273	0:328	On the 5th of October , 1778 , the legion was ordered to Little Egg Harbour , with a body of Jersey and Pennsylvania militia , and a field piece from colonel Proctor 's regiment of artillery , the whole under the command of Pulaski , for the defence of the place against an attack , which was expected from the enemy then on that coast .	54	0:67	on the 5th of october , 1778 , the legion be order to little egg harbour , with a body of jersey and pennsylvania militia , and a field piece from colonel proctor 's regiment of artillery , the whole under the command of pulaski , for the defense of the place against an attack , which be expect from the enemy then on that coast .	ii at md io npm1 y mc y at nn1 vbdz vvn ii jj_da1 nn1 nn1 y iw at1 nn1 io np1 cc np1 nn y cc at1 nn1 nn1 ii nn1 np1 ge nn1 io nn1 y at nn1_jj ii at nn1 io np1_nn1_jj y if at nn1 io at nn1 ii at1 nn1 y ddq vbdz vvn ii at nn1 rt ii dd1 nn1 y
attack_nn	nn1	1855	1	fic_1855_1209.txt-770-29	 	They had become somewhat accustomed to small arms, and though they had a dread of them, yet it was not sufficient to deter them from making the attack after having congregated in such numbers, and having become so wrought up by each other.	144:150	0:239	They had become somewhat accustomed to small arms , and though they had a dread of them , yet it was not sufficient to deter them from making the attack after having congregated in such numbers , and having become so wrought up by each other .	29	0:47	they have become somewhat accustom to small arm , and though they have a dread of them , yet it be not sufficient to deter them from make the attack after have congregate in such number , and have become so work up by each other .	pphs2 vhd vvn@ rr vvn@_jj_vvd@ ii jj nn2 y cc cs pphs2 vhd at1 nn1 io ppho2 y rr pph1 vbdz xx jj to vvi ppho2 ii vvg at nn1 ii vhg vvn ii da nn2 y cc vhg vvn@ rr vvn rp ii ppx221 ppx222 y
attack_nn	nn1	1840	1	mag_1840_586558.txt-81-14	 	His private character, integrity, and professional attainments offered no feasible point of attack, nothing upon which to found an imputation.	92:98	0:142	His private character , integrity , and professional attainments offered no feasible point of attack , nothing upon which to found an imputation .	14	0:24	his private character , integrity , and professional attainment offer no feasible point of attack , nothing upon which to find an imputation .	appge jj nn1 y nn1 y cc jj nn2 vvd_vvn at jj nn1 io nn1 y pn1 ii ddq ii_to vvd_vv0% at1 nn1 y
attack_nn	nn1	1838	1	fic_1838_7250.txt-1095-10	 	He shifts his position continually, and never hazards an attack.	57:63	0:64	He shifts his position continually , and never hazards an attack .	10	0:12	he shift his position continually , and never hazard an attack .	pphs1 vvz appge nn1 rr y cc rr nn2 at1 nn1 y
