lemma	pos	date	grouping	identifier	description	context	indexes_target_token	indexes_target_sentence	context_tokenized	indexes_target_token_tokenized	indexes_target_sentence_tokenized	context_lemmatized	context_pos
lass_nn	nn2	1832	1	mag_1832_564115.txt-87-35	 	The daughters of the Clergyman, the Doctor, and the Merchant, (to give every man his title,) are not so graceful, so pretty, or so polite as the lasses of the farm.	145:151	0:164	The daughters of the Clergyman , the Doctor , and the Merchant , ( to give every man his title , ) are not so graceful , so pretty , or so polite as the lasses of the farm .	35	0:40	the daughter of the clergyman , the doctor , and the merchant , ( to give every man his title , ) be not so graceful , so pretty , or so polite as the lass of the farm .	at nn2 io at nn1 y at nn1 y cc at nn1 y y to vvi at1 nn1 appge nn1 y y vbr xx rg_rr jj y rg_rr jj y cc rg_rr jj ii_csa at nn2 io at nn1 y
lass_nn	nn1	1824	1	fic_1824_7211.txt-1161-4	 	Hoot, Peggy, lass, " said he, in an endearing tone, " dinna be sae flirted.	13:17	0:75	Hoot , Peggy , lass , " said he , in an endearing tone , " dinna be sae flirted .	4	0:21	hoot , peggy , lass , " say he , in an endearing tone , " dinna be sae flirt .	vv0_nn1_np1@ y np1 y nn1 y " vvd pphs1 y ii at1 jj nn1 y " nn1 vbi nn1 vvd y
lass_nn	nn2	1832	1	fic_1832_8862.txt-1103-4	 	I espied two buxom lasses just now, Jack; they would greatly add to the repast.	19:25	0:79	I espied two buxom lasses just now , Jack ; they would greatly add to the repast .	4	0:18	i espy two buxom lass just now , jack ; they would greatly add to the repast .	ppis1 vvd mc jj nn2 rr rt y np1 y pphs2 vm rr vvi ii at nn1 y
lass_nn	nn1	1854	1	fic_1854_9826.txt-1896-19	 	" I ' m afraid our acquaintance is going to be broke off for a little while, my lass, " replied the captain. "	80:84	0:110	" I ' m afraid our acquaintance is going to be broke off for a little while , my lass , " replied the captain . "	19	0:27	" i ' m afraid our acquaintance be go to be break off for a little while , my lass , " reply the captain . "	" zz1@_mc1@ ge zz1_mc@ jj appge nn1 vbz vvgk to vbi vvn% rp if at1 jj nnt1 y appge nn1 y " vvd at nn1 y "
lass_nn	nn2	1846	1	fic_1846_544.txt-2641-14	 	Whilst he was doing this, I caught sight of a knot of young lasses, who were sitting near us on the grass surrounded by heaps of flowers which they were forming into garlands.	60:66	0:175	Whilst he was doing this , I caught sight of a knot of young lasses , who were sitting near us on the grass surrounded by heaps of flowers which they were forming into garlands .	14	0:36	while he be do this , i catch sight of a knot of young lass , who be sit near us on the grass surround by heap of flower which they be form into garland .	cs pphs1 vbdz vdg dd1 y ppis1 vvd nn1 io at1 nn1 io jj nn2 y pnqs vbdr vvg ii ppio2 ii at nn1 vvn ii nn2 io nn2 ddq pphs2 vbdr vvg ii nn2 y
lass_nn	nn1	1844	1	fic_1844_7081.txt-1867-11	 	Well, then, I believe that I did see the lass, mon!	41:45	0:51	Well , then , I believe that I did see the lass , mon !	11	0:15	well , then , i believe that i do see the lass , mon !	rr y rt y ppis1 vv0 cst ppis1 vdd vvi at nn1 y npd1 !
lass_nn	nn1	1824	1	fic_1824_7211.txt-752-15	 	Besides, ye maun grant that it was na very creditable for a poor bonny lass, like her, to be ta'en notice to by a rich lookin ' gentleman sa far abune her, in the market.	71:75	0:170	Besides , ye maun grant that it was na very creditable for a poor bonny lass , like her , to be ta'en notice to by a rich lookin ' gentleman sa far abune her , in the market .	15	0:40	besides , ye maun grant that it be na very creditable for a poor bonny lass , like her , to be ta'en notice to by a rich look ' gentleman sa far abune her , in the market .	rr y ppy vv0 vv0_nn1 cst pph1 vbdz uh rg jj if at1 jj jj nn1 y ii_vv0@ ppho1 y to vbi jj nn1 ii ii at1 jj nn1 ge nn1 nn1 jj vvz_<sub> ppho1 y ii at nn1 y
lass_nn	nn2	1824	1	fic_1824_7211.txt-2276-17	 	The morning rose that ushered in the potato digging-day, in which numerous throngs of lads and lasses dressed in their best attire, with light and merry hearts came from all parts of the adjacent country, into the town of Larne; the lads to march to the work of charity and benevolence, the lasses to witness the procession, and reward their lovers as they passed them with their smiles.	95:101	0:387	The morning rose that ushered in the potato digging-day , in which numerous throngs of lads and lasses dressed in their best attire , with light and merry hearts came from all parts of the adjacent country , into the town of Larne ; the lads to march to the work of charity and benevolence , the lasses to witness the procession , and reward their lovers as they passed them with their smiles .	17	0:75	the morning rise that usher in the potato digging-day , in which numerous throng of lad and lass dress in their best attire , with light and merry heart come from all part of the adjacent country , into the town of larne ; the lad to march to the work of charity and benevolence , the lass to witness the procession , and reward their lover as they pass them with their smile .	at nnt1 vvd_nn1 cst vvd rp at nn1 nn1_<sub> y ii ddq jj nn2 io nn2 cc nn2 vvn ii appge jjt nn1 y iw jj_nn1 cc jj nn2 vvd ii db nn2 io at jj nn1 y ii at nn1 io np1 y at nn2 to vvi ii at nn1 io nn1 cc nn1 y at nn2 to vvi at nn1 y cc vvi appge nn2 csa pphs2 vvd ppho2 iw appge nn2 y
lass_nn	nn2	1824	1	nf_1824_747448.txt-1941-90	 	The lyrical ballads, jaco " binical and puling with affectation of simplicity as they " were, had undoubtedly a certain merit *: and Wordsworth, " though occasionally a writer for the nursery-masters and " misses, ' Who took theii ' little porringer, And ate their porridge there, ' " now and then expressed ideas worth miitating; but, like " brother Southey, he had his price; and since he is turned " tax-gatherer, is only fit to rhyme about lasses and wag ' ' goners.	444:450	0:470	The lyrical ballads , jaco " binical and puling with affectation of simplicity as they " were , had undoubtedly a certain merit * : and Wordsworth , " though occasionally a writer for the nursery-masters and " misses , ' Who took theii ' little porringer , And ate their porridge there , ' " now and then expressed ideas worth miitating ; but , like " brother Southey , he had his price ; and since he is turned " tax-gatherer , is only fit to rhyme about lasses and wag ' ' goners .	90	0:97	the lyrical ballad , jaco " binical and puling with affectation of simplicity as they " be , have undoubtedly a certain merit * : and wordsworth , " though occasionally a writer for the nursery-masters and " miss , ' who take theii ' little porringer , and eat their porridge there , ' " now and then express idea worth miitating ; but , like " brother southey , he have his price ; and since he be turn " tax-gatherer , be only fit to rhyme about lass and wag ' ' goner .	at jj nn2 y nn1 " nn1_<sub> cc vvg iw nn1 io nn1 csa pphs2 " vbdr y vhd rr at1 jj nn1_<sub> nn1_<sub> y cc np1 y " cs rr at1 nn1 if at nn2_<sub> cc " nn2_vvz y "@_ge pnqs vvd nn2 ge jj nn1 y cc vvd appge nn1 rl y "@_ge " rt cc rt vvd_vvn_jj@ nn2 ii nn1_<sub> y ccb y ii_jj@ " nn1 np1_nn1@ y pphs1 vhd appge nn1 y cc cs pphs1 vbz vvn " nn1_<sub> y vbz rr vv0_jj to vvi ii_rp@ nn2 cc nn1 ge_"@ ge nn2 y
lass_nn	nn2	1834	1	mag_1834_564618.txt-134-9	 	said they did; then says I, the lasses are the more fools to let them.	32:38	0:70	said they did ; then says I , the lasses are the more fools to let them .	9	0:18	say they do ; then say i , the lass be the more fool to let them .	vvd pphs2 vdd y rt vvz ppis1_mc1%_zz1% y at nn2 vbr at dar nn2 to vvi ppho2 y
lass_nn	nn2	1823	1	fic_1823_7213.txt-1732-5	 	the lads an ' the lasses, an ' the sports o ' a simmer evening, an ' the jokes an ' mirth o ' a lang winter's nicht -- ah!	18:24	0:122	the lads an ' the lasses , an ' the sports o ' a simmer evening , an ' the jokes an ' mirth o ' a lang winter 's nicht -- ah !	5	0:34	the lad an ' the lass , an ' the sport o ' a simmer evening , an ' the joke an ' mirth o ' a lang winter 's nicht -- ah !	at nn2 at1 ge_"@ at nn2 y at1 ge_"@ at nn2 zz1 ge at1 vv0 nnt1 y at1 ge_"@ at nn2 at1 ge nn1 zz1 ge at1 nn1 nnt1 ge fw z uh !
lass_nn	nn1	1849	1	fic_1849_583.txt-2574-50	 	He wears a broad-brimmed, low-crowned hat; a huge roll of colored handkerchief about his neck, knowingly knotted and tucked in at the bosom; and has in summer-time a large bouquet of flowers in his buttonhole, the present, most probably, of some enamored country lass.	263:267	0:268	He wears a broad-brimmed , low-crowned hat ; a huge roll of colored handkerchief about his neck , knowingly knotted and tucked in at the bosom ; and has in summer-time a large bouquet of flowers in his buttonhole , the present , most probably , of some enamored country lass .	50	0:52	he wear a broad-brimmed , low-crowned hat ; a huge roll of color handkerchief about his neck , knowingly knot and tuck in at the bosom ; and have in summer-time a large bouquet of flower in his buttonhole , the present , most probably , of some enamor country lass .	pphs1 vvz at1 jj_nn1@ y jj_nn1 nn1 y at1 jj nn1 io jj@ nn1 ii appge nn1 y rr vvn_jj_vvd cc vvn rp@ ii at nn1 y cc vhz ii nnt1 at1 jj nn1 io nn2 ii appge nn1 y at nn1_jj y rgt rr y io dd jj@ nn1 nn1 y
lass_nn	nn2	1849	1	fic_1849_583.txt-4641-7	 	Not those of the bevy of buxom lasses with their luxurious display of red and white, but the ample charms of a genuine Dutch country tea-table in the sumptuous time of autumn.	31:37	0:175	Not those of the bevy of buxom lasses with their luxurious display of red and white , but the ample charms of a genuine Dutch country tea-table in the sumptuous time of autumn .	7	0:34	not those of the bevy of buxom lass with their luxurious display of red and white , but the ample charm of a genuine dutch country tea-table in the sumptuous time of autumn .	xx dd2 io at nn1 io jj nn2 iw appge jj nn1 io jj_nn1 cc jj_nn1@ y ccb at jj nn2 io at1 jj jj nn1 nn1 ii at jj nnt1 io nnt1 y
lass_nn	nn1	1846	1	fic_1846_544.txt-333-4	 	But courage, old lass, I hope to see thee soon within a biscuit's toss of the merry land, riding snugly at anchor in some green cove, and sheltered from the boisterous winds.	17:21	0:174	But courage , old lass , I hope to see thee soon within a biscuit 's toss of the merry land , riding snugly at anchor in some green cove , and sheltered from the boisterous winds .	4	0:38	but courage , old lass , i hope to see thee soon within a biscuit 's toss of the merry land , ride snugly at anchor in some green cove , and shelter from the boisterous wind .	ccb nn1 y jj nn1 y ppis1 vv0 to vvi ppy rr ii at1 nn1 ge nn1 io at jj nn1 y vvg rr ii nn1 ii dd jj nn1 y cc jj_vvn@_vvd@ ii at jj nn2 y
lass_nn	nn2	1824	1	fic_1824_7211.txt-745-21	 	But I hope his honour an ' you will oblige me, by comin ' wi ' Peggy and these ither lasses, to tak share o ' half a pint, an mak ' up the matter. "	85:91	0:148	But I hope his honour an ' you will oblige me , by comin ' wi ' Peggy and these ither lasses , to tak share o ' half a pint , an mak ' up the matter . "	21	0:40	but i hope his honor an ' you will oblige me , by come ' wi ' peggy and these ither lass , to tak share o ' half a pint , an mak ' up the matter . "	ccb ppis1 vv0 appge nn1 at1 "@ ppy vm vvi ppio1 y ii vvg ge nn2 ge np1 cc dd2 vv0_nn1 nn2 y to vvi nn1_vv0 zz1 ge db_nn1@_rr@ at1 nnu1 y at1 nn1 ge rp_ii@ at nn1 y "
lass_nn	nn1	1859	1	nf_1859_749190.txt-1021-9	 	(" Thu mir zurecht, Bottgher, sonst lass ich dich hangen ").	36:40	0:60	( " Thu mir zurecht , Bottgher , sonst lass ich dich hangen " ) .	9	0:16	( " thu mir zurecht , bottgher , sonst lass ich dich hangen " ) .	y " npd1 nn1 nn1_<sub> y np1_<sub> y vv0_nn1 nn1 nn1_vv0 nn1_vv0 nn1 " y y
lass_nn	nn1	1859	1	mag_1859_506372.txt-189-19	 	But the girl of Tower Hill, who hung on Jack's neck before he departed; and the lass at Quimper, who gave the Frenchman his brdle-gueule and tobaccobox before he departed on	80:84	0:173	But the girl of Tower Hill , who hung on Jack 's neck before he departed ; and the lass at Quimper , who gave the Frenchman his brdle-gueule and tobaccobox before he departed on	19	0:35	but the girl of tower hill , who hang on jack 's neck before he depart ; and the lass at quimper , who give the frenchman his brdle-gueule and tobaccobox before he depart on	ccb at nn1 io np1 nnl1 y pnqs vvd rp np1 ge nn1 cs pphs1 vvd y cc at nn1 ii np1_nn1 y pnqs vvd at nn1 appge nn1_<sub> cc nn1_<sub> cs pphs1 vvd ii
lass_nn	nn1	1857	1	fic_1857_2618.txt-4212-39	 	" I suppose I am foolish, " replied the dame, wiping a tear away, " but I feared, lest the girl might derive some encouragement from it, though otherwise, Prudence is a good lass, and obedient, and I have no other fault to find with her; but I recollect now, when I was a girl, how	174:178	0:281	" I suppose I am foolish , " replied the dame , wiping a tear away , " but I feared , lest the girl might derive some encouragement from it , though otherwise , Prudence is a good lass , and obedient , and I have no other fault to find with her ; but I recollect now , when I was a girl , how	39	0:67	" i suppose i be foolish , " reply the dame , wipe a tear away , " but i fear , lest the girl might derive some encouragement from it , though otherwise , prudence be a good lass , and obedient , and i have no other fault to find with her ; but i recollect now , when i be a girl , how	" ppis1 vv0 ppis1 vbm jj y " vvd at nn1 y vvg at1 nn1 rl y " ccb ppis1 vvd y cs at nn1 vm vvi dd nn1 ii pph1 y cs rr y nn1 vbz at1 jj nn1 y cc jj y cc ppis1 vh0 at jj nn1 to vvi iw ppho1 y ccb ppis1 vv0 rt y cs_rrq ppis1 vbdz at1 nn1 y rrq
lass_nn	nn2	1823	1	fic_1823_7213.txt-1671-48	 	Here Gilbert, pleased with this generosity of Nancy, as if his heart misgave him for having said any thing to hurt her feelings, arose and, catching both her and Maria by the hand, said -- " Ye are baith my bairns -- gude lasses to yere father, an ' I hae na ' fan't to find wi	222:228	0:277	Here Gilbert , pleased with this generosity of Nancy , as if his heart misgave him for having said any thing to hurt her feelings , arose and , catching both her and Maria by the hand , said -- " Ye are baith my bairns -- gude lasses to yere father , an ' I hae na ' fa n't to find wi	48	0:64	here gilbert , pleased with this generosity of nancy , as if his heart misgive him for have say any thing to hurt her feeling , arise and , catch both her and maria by the hand , say -- " ye be baith my bairn -- gude lass to yere father , an ' i hae na ' fa n't to find wi	rl np1 y jj iw dd1 nn1 io np1 y cs21 cs22 appge nn1 vv0_<sub> ppho1 if vhg vvn dd nn1 to vvi appge nn2 y vvd cc y vvg rr_db2 ppho1_appge cc np1 ii at nn1 y vvd z " ppy vbr jj_<sub> appge nn2 z vv0 nn2 ii jj_nn1 nn1 y at1 "@_ge zz1%_mc1% nn2 fw ge nn1 xx to vvi nn2
lass_nn	nn2	1847	1	fic_1847_8919.txt-686-4	 	Come, lads and lasses, sing, dance and be merry.	15:21	0:48	Come , lads and lasses , sing , dance and be merry .	4	0:13	come , lad and lass , sing , dance and be merry .	vv0 y nn2 cc nn2 y vv0 y nn1_vv0 cc vbi jj y
lass_nn	nn2	1844	1	fic_1844_7081.txt-543-12	 	intelligence offices, of which, in common with all other country lasses living in the neighborhood of the city, she had heard much; and like them, thought she had only to go there to get employment at once.	65:71	0:206	intelligence offices , of which , in common with all other country lasses living in the neighborhood of the city , she had heard much ; and like them , thought she had only to go there to get employment at once .	12	0:43	intelligence office , of which , in common with all other country lass live in the neighborhood of the city , she have hear much ; and like them , think she have only to go there to get employment at once .	nn1 nn2 y io ddq y ii31 ii32 ii33 db jj nn1 nn2 vvg ii at nn1 io at nn1 y pphs1 vhd vvn rr y cc vv0@_ii ppho2 y vvd pphs1 vhd rr to_ii vvi rl to vvi nn1 rr21 rr22 y
lass_nn	nn1	1843	1	fic_1843_7155.txt-1237-67	 	as he entered; and as the negro sentinel thrust in his turbaned head, at the half-opened door -- " jump up on deck, and clear away my pinnace; bring it round to the starboard gangway, and after we shall have left the ship -- I and the gentlemen -- do thou and Charon lead down the lady there, and the black lass, and row them straight to the sallyport, entering the covered way: I will be there to meet ye; and hark, sirrah, in your ear -- do thou, or thy swart	307:311	0:461	as he entered ; and as the negro sentinel thrust in his turbaned head , at the half-opened door -- " jump up on deck , and clear away my pinnace ; bring it round to the starboard gangway , and after we shall have left the ship -- I and the gentlemen -- do thou and Charon lead down the lady there , and the black lass , and row them straight to the sallyport , entering the covered way : I will be there to meet ye ; and hark , sirrah , in your ear -- do thou , or thy swart	67	0:105	as he enter ; and as the negro sentinel thrust in his turbaned head , at the half-opened door -- " jump up on deck , and clear away my pinnace ; bring it round to the starboard gangway , and after we shall have leave the ship -- i and the gentleman -- do thou and charon lead down the lady there , and the black lass , and row them straight to the sallyport , enter the cover way : i will be there to meet ye ; and hark , sirrah , in your ear -- do thou , or thy swart	csa pphs1 vvd y cc ii_csa at nn1 nn1 vvn_vvd_nn1 ii appge jj@ nn1 y ii at jj_nn1 nn1 z " vv0_nn1 rp ii nn1 y cc vv0@_jj_rr@ rl appge nn1 y vv0 pph1 rp ii at nn1 nn1 y cc cs ppis2 vm vhi vvn at nn1 z zz1%_mc1%_ppis1 cc at nn2 z vd0 ppy cc np1 vv0_vvd@ rp_ii@ at nn1 rl y cc at jj nn1 y cc vv0 ppho2 rr ii at nn1 y vvg at jj@ nn1 y ppis1 vm vbi rl to vvi ppy y cc nn1_vv0 y nn1 y ii appge nn1 z vd0 ppy y cc appge nn1
lass_nn	nn1	1847	1	fic_1847_7149.txt-2014-29	 	Sir Edward, " answered the fellow, with a cunning grin, clearly perceiving the drift of his master's question, " there was a very pretty lass upon his arm, wasn't there, sir? "	137:141	0:176	Sir Edward , " answered the fellow , with a cunning grin , clearly perceiving the drift of his master 's question , " there was a very pretty lass upon his arm , was n't there , sir ? "	29	0:41	sir edward , " answer the fellow , with a cunning grin , clearly perceive the drift of his master 's question , " there be a very pretty lass upon his arm , be n't there , sir ? "	nnb np1 y " vvd_vvn at nn1_jj y iw at1 jj nn1 y rr vvg at nn1 io appge nn1 ge nn1 y " ex vbdz at1 rg jj nn1 ii appge nn1 y vbdz xx rl y nn1 y "
lass_nn	nn2	1837	1	fic_1837_7395.txt-1589-33	 	Especially was he beloved by the pretty girls along the Connecticut, whose favor he used to court by presents of the best smoking-tobacco in his stock; knowing well that the country lasses of New England are generally great performers	182:188	0:234	Especially was he beloved by the pretty girls along the Connecticut , whose favor he used to court by presents of the best smoking-tobacco in his stock ; knowing well that the country lasses of New England are generally great performers	33	0:41	especially be he beloved by the pretty girl along the connecticut , whose favor he use to court by present of the best smoking-tobacco in his stock ; know well that the country lass of new england be generally great performer	rr vbdz pphs1 jj ii at jj nn2 ii at np1 y ddqge nn1 pphs1 vvd ii nn1 ii nn2 io at jjt nn1_<sub> ii appge nn1 y vvg rr cst at nn1 nn2 io np1 np1 vbr rr jj nn2
lass_nn	nn1	1823	1	fic_1823_7213.txt-551-14	 	" God bless you, my gude bairn -- you were aye a gude lass, a gude dauchter to me.	54:58	0:82	" God bless you , my gude bairn -- you were aye a gude lass , a gude dauchter to me .	14	0:22	" god bless you , my gude bairn -- you be aye a gude lass , a gude dauchter to me .	" np1 vv0 ppy y appge vv0 nn1 z ppy vbdr uh at1 vv0 nn1 y at1 vv0 nn1_<sub> ii ppio1 y
lass_nn	nn1	1846	1	mag_1846_565490.txt-312-31	 	Says Mr. Jones " As the children could not make use of books, and being the only teacher, I was compelled to throw the whole school into one (lass, and to teach them all together on the inthnt schoot plan.	142:146	0:205	Says Mr. Jones " As the children could not make use of books , and being the only teacher , I was compelled to throw the whole school into one ( lass , and to teach them all together on the inthnt schoot plan .	31	0:45	say mr.- jones " as the child could not make use of book , and be the only teacher , i be compel to throw the whole school into one ( lass , and to teach theni all together on the inthnt schoot plan .	vvz nnb np1 " ii_csa at nn2 vm xx vvi nn1 io nn2 y cc vbg at jj nn1 y ppis1 vbdz vvn ii vv0_<sub> at jj nn1 ii mc1 y nn1 y cc to vvi nn2 db_rr@ rl ii at jj_<sub> nn1_<sub> nn1 y
lass_nn	nn1	1845	1	fic_1845_7103.txt-24-29	 	-- He was a regular lad-seaman in his appearance and dress, and a foul anchor imprinted with India ink into his wrist, and the initials of some lass ashore done upon his fair white neck, rendered visible by the gaping of his	144:148	0:224	-- He was a regular lad-seaman in his appearance and dress , and a foul anchor imprinted with India ink into his wrist , and the initials of some lass ashore done upon his fair white neck , rendered visible by the gaping of his	29	0:45	-- he be a regular lad-seaman in his appearance and dress , and a foul anchor imprint with india ink into his wrist , and the initial of some lass ashore do upon his fair white neck , render visible by the gaping of his	z pphs1 vbdz at1 jj nn1_<sub> ii appge nn1 cc nn1_vv0 y cc at1 jj_nn1 nn1 vvn_vvd iw np1 nn1 ii appge nn1 y cc at nn2 io dd nn1 rl vdn ii appge jj jj nn1 y vvn_vvd@ jj ii at jj io appge
lass_nn	nn1	1835	1	fic_1835_7334.txt-1483-49	 	In a few minutes more another made a kind of circuit round the room, and passing near him, dropped a small piece of paper into his hand, and scarcely had he put away the first before another billet was dropped at his feet as a gay lass brushed by him, saying she was going to peep out the door to see if papa was coming.	231:235	0:320	In a few minutes more another made a kind of circuit round the room , and passing near him , dropped a small piece of paper into his hand , and scarcely had he put away the first before another billet was dropped at his feet as a gay lass brushed by him , saying she was going to peep out the door to see if papa was coming .	49	0:70	in a few minute more another make a kind of circuit round the room , and pass near him , drop a small piece of paper into his hand , and scarcely have he put away the first before another billet be drop at his foot as a gay lass brush by him , say she be go to peep out the door to see if papa be come .	ii at1 da2 nnt2 rrr dd1 vvd_vvn at1 nn1 io nn1 ii at nn1 y cc vvg_nn1_jj ii ppho1 y vvd_vvn at1 jj nn1 io nn1 ii appge nn1 y cc rr vhd pphs1 vvn rl at md ii_cs dd1 nn1 vbdz vvn ii appge nn2 ii_csa at1 jj nn1 vvn ii ppho1 y vvg pphs1 vbdz vvgk to vvi ii at nn1 to vvi csw@_cs nn1 vbdz vvg y
lass_nn	nn1	1835	1	mag_1835_565217.txt-61-8	 	Perfection whispered, passing by, Behold the Lass of Ballochmyle. '	45:49	0:67	Perfection whispered , passing by , Behold the Lass of Ballochmyle . '	8	0:13	perfection whisper , pass by , behold the lass of ballochmyle . '	nn1 vvd y vvg rp%_ii y vv0 at nn1 io np1_<sub> y "@_ge
lass_nn	nn1	1843	1	fic_1843_7325.txt-795-1	 	merry lass, who broke the crockery, burned the dinner, tore the clothes in ironing, and knocked down everything that stood in her way about the house, without at all discomposing herself about the matter.	6:10	0:204	merry lass , who broke the crockery , burned the dinner , tore the clothes in ironing , and knocked down everything that stood in her way about the house , without at all discomposing herself about the matter .	1	0:40	merry lass , who break the crockery , burn the dinner , tear the clothes in ironing , and knock down everything that stand in her way about the house , without at all discomposing herself about the matter .	jj nn1 y pnqs vvd at nn1 y vvd_vvn at nn1 y vvd at nn2 ii nn1_vvg y cc vvd_vvn rp pn1 cst vvd ii_rp@ appge nn1 ii at nn1 y iw_rr% ii db vvg ppx1 ii at nn1 y
