lemma	pos	date	grouping	identifier	description	context	indexes_target_token	indexes_target_sentence	context_tokenized	indexes_target_token_tokenized	indexes_target_sentence_tokenized	context_lemmatized	context_pos
lass_nn	nn2	1815	1	fic_1815_8613.txt-100-9	 	So So, rural damsels; what my pretty lasses, do you attack in ambuscade?	37:43	0:72	So So , rural damsels ; what my pretty lasses , do you attack in ambuscade ?	9	0:17	so so , rural damsel ; what my pretty lass , do you attack in ambuscade ?	rr rr y jj nn2 y ddq appge jj nn2 y vd0 ppy vvi ii_rp@ nn1 y
lass_nn	nn1	1824	1	fic_1824_8753.txt-828-7	 	Give me but a friend and a lass, boys, To drive dull care away.	27:31	0:63	Give me but a friend and a lass , boys , To drive dull care away .	7	0:17	give me but a friend and a lass , boy , to drive dull care away .	vv0 ppio1 ccb at1 nn1 cc at1 nn1 y nn2 y to vvi jj nn1 rl y
lass_nn	nn1	1860	1	fic_1860_9791.txt-1410-4	 	She was a proud lass, but they bowed even her spirit, and at last she yielded.	16:20	0:78	She was a proud lass , but they bowed even her spirit , and at last she yielded .	4	0:19	she be a proud lass , but they bow even her spirit , and at last she yield .	pphs1 vbdz at1 jj nn1 y ccb pphs2 vvd rr appge nn1 y cc rr21 rr22 pphs1 vvd y
lass_nn	nn1	1824	1	fic_1824_7211.txt-2316-18	 	I 'm tauld that Jenny Davis is amaist wud aboot you; an ' she's a nice lass; an ' her father can gie her twa hunner pun ' ony day.	71:75	0:130	I 'm tauld that Jenny Davis is amaist wud aboot you ; an ' she 's a nice lass ; an ' her father can gie her twa hunner pun ' ony day .	18	0:34	i be tauld that jenny davis be amaist wud aboot you ; an ' she be a nice lass ; an ' her father can gie her twa hunner pun ' ony day .	ppis1 vbm jj_<sub> cst np1 np1 vbz jj_<sub> nn1_vv0 vv0 ppy y at1 "@ pphs1 vbz at1 jj nn1 y at1 "@_ge appge nn1 vm vvi appge nn1 nn1_jjr nn1 ge nn1 nnt1 y
lass_nn	nn1	1814	1	fic_1814_8564.txt-739-3	 	What a comely lass thou hast gotten for me here!	14:18	0:48	What a comely lass thou hast gotten for me here !	3	0:11	what a comely lass thou hast get for me here !	ddq at1 jj nn1 ppy vh0 vvn if ppio1 rl !
lass_nn	nn2	1844	1	fic_1844_7114.txt-736-14	 	' Ah, Ben, I see you have an understanding eye to the lasses.	54:60	0:61	' Ah , Ben , I see you have an understanding eye to the lasses .	14	0:16	' ah , ben , i see you have an understanding eye to the lass .	"@_ge uh y np1 y ppis1 vv0 ppy vhi at1 nn1_jj@ nn1 ii at nn2 y
lass_nn	nn2	1846	1	fic_1846_4464.txt-1316-28	 	from the country, and to stare at the uncouth and sturdy forms of the farmers, or admire the black eyes and merry faces of the country lasses.	135:141	0:142	from the country , and to stare at the uncouth and sturdy forms of the farmers , or admire the black eyes and merry faces of the country lasses .	28	0:30	from the country , and to stare at the uncouth and sturdy form of the farmer , or admire the black eye and merry face of the country lass .	ii at nn1 y cc to vvi ii at jj cc jj nn2 io at nn2 y cc vv0 at jj nn2 cc jj nn2 io at nn1 nn2 y
lass_nn	nn1	1852	1	nf_1852_752548.txt-2830-27	 	He's from Lancashire, in England, and came to this country some twenty years ago, with his wife, who was a pretty young lass in those days, and slim enough then, though she's so awful fleshy now.	120:124	0:195	He 's from Lancashire , in England , and came to this country some twenty years ago , with his wife , who was a pretty young lass in those days , and slim enough then , though she 's so awful fleshy now .	27	0:45	he be from lancashire , in england , and come to this country some twenty year ago , with his wife , who be a pretty young lass in those day , and slim enough then , though she be so awful fleshy now .	pphs1 vbz ii np1 y ii np1 y cc vvd ii dd1 nn1 dd mc nnt2 ra y iw appge nn1 y pnqs vbdz at1 rg_jj jj nn1 ii dd2 nnt2 y cc jj_vv0@ rr rt y cs pphs1 vbz rg_rr jj jj rt y
lass_nn	nn2	1823	1	fic_1823_9628.txt-498-19	 	Finale, to Act I Air -- Harriet Sweet the hour, when freed from labour, Lads and lasses thus convene, To the merry pipe and tabor, Dancing gayly on the green.	81:87	0:158	Finale , to Act I Air -- Harriet Sweet the hour , when freed from labour , Lads and lasses thus convene , To the merry pipe and tabor , Dancing gayly on the green .	19	0:36	finale , to act i air -- harriet sweet the hour , when free from labour , lad and lass thus convene , to the merry pipe and tabor , dance gayly on the green .	nn1 y ii nn1 mc1% nn1 z np1 np1@_jj_nn1@ at nnt1 y cs_rrq vvn ii nn1 y nn2 cc nn2 rr vv0 y ii at jj nn1 cc nn1 y vvg rr ii at nn1_jj y
lass_nn	nn1	1832	1	nf_1832_758144.txt-421-17	 	A kind friend, however, exerted herself so effectually for me, that a tall stately lass soon presented herself, saying, " I be come to help you. "	83:87	0:146	A kind friend , however , exerted herself so effectually for me , that a tall stately lass soon presented herself , saying , " I be come to help you . "	17	0:33	a kind friend , however , exert herself so effectually for me , that a tall stately lass soon present herself , say , " i be come to help you . "	at1_zz1 nn1_jj@ nn1 y rr y vvd ppx1 rg_rr rr if ppio1 y cst at1 jj jj nn1 rr vvd_vvn ppx1 y vvg y " ppis1 vbi vvn@ to vvi ppy y "
lass_nn	nn2	1829	1	fic_1829_7072.txt-2468-38	 	He was transferred at once from the formal routine and rigid rules of a college life, where no flirting with the ladies was permitted to be thought of, except the ethereal flirtation of wooing those shy lasses, the sweet and sacred Nine, ' and where nothing in this round world was considered so important, as to have the first appointment in the class, or be able to write the best ode to Hope, or sonnet to Despair, ' and introduced into the society of elegant and, as he thought, the most enchanting people on earth, and to the bustle and business of a large city.	203:209	0:567	He was transferred at once from the formal routine and rigid rules of a college life , where no flirting with the ladies was permitted to be thought of , except the ethereal flirtation of wooing those shy lasses , the sweet and sacred Nine , ' and where nothing in this round world was considered so important , as to have the first appointment in the class , or be able to write the best ode to Hope , or sonnet to Despair , ' and introduced into the society of elegant and , as he thought , the most enchanting people on earth , and to the bustle and business of a large city .	38	0:117	he be transfer at once from the formal routine and rigid rule of a college life , where no flirt with the lady be permit to be think of , except the ethereal flirtation of woo those shy lass , the sweet and sacred nine , ' and where nothing in this round world be consider so important , as to have the first appointment in the class , or be able to write the best ode to hope , or sonnet to despair , ' and introduce into the society of elegant and , as he think , the most enchanting people on earth , and to the bustle and business of a large city .	pphs1 vbdz vvn rr21 rr22 ii at jj nn1 cc jj nn2 io at1 nn1 nn1 y cs_rrq at nn1@_jj@_vvg iw at nn2 vbdz vvn to vbi vvn io y cs_ii at jj nn1 io vvg dd2 jj nn2 y at jj_nn1@ cc jj mc y ge cc cs_rrq pn1 ii dd1 jj nn1 vbdz vvn rg_rr jj y csa to vhi at md nn1 ii at nn1 y cc vbi jk to vvi at jjt_rrt nn1_vv0 ii np1_nn1 y cc nn1 ii nn1 y ge cc vvn_vvd ii at nn1 io jj cc y csa pphs1 vvd y at rgt jj nn ii nn1 y cc ii at nn1%_vv0 cc nn1 io at1 jj nn1 y
lass_nn	nn1	1824	1	fic_1824_8753.txt-829-11	 	Yes, to drive dull care away, nothing like a lass and a glass -- nothing like it.	45:49	0:81	Yes , to drive dull care away , nothing like a lass and a glass -- nothing like it .	11	0:20	yes , to drive dull care away , nothing like a lass and a glass -- nothing like it .	uh y to vvi jj nn1 rl y pn1 ii at1 nn1 cc at1 nn1 z pn1 ii pph1 y
lass_nn	nn1	1818	1	fic_1818_8861.txt-495-8	 	Why like any stout lad that loves a lass and liberty, I'll clear her out and myself too, some way or other; so	36:40	0:110	Why like any stout lad that loves a lass and liberty , I 'll clear her out and myself too , some way or other ; so	8	0:27	why like any stout lad that love a lass and liberty , i will clear her out and myself too , some way or other ; so	rrq ii_vv0@ dd jj_nn1 nn1 cst_dd1 vvz at1 nn1 cc nn1 y ppis1 vm vvi ppho1 rp cc ppx1 rr@ y dd nn1 cc jj_nn1@ y rr
lass_nn	nn2	1851	1	mag_1851_555722.txt-216-7	 	From her I learned to love " lasses candy; " from her I learned to bate Tom Jefferson.	29:35	0:86	From her I learned to love " lasses candy ; " from her I learned to bate Tom Jefferson .	7	0:20	from her i learn to love " lass candy ; " from her i learn to bate tom jefferson .	ii ppho1 ppis1 vvd to vvi " nn2 nn1 y " ii ppho1 ppis1 vvd to vvi np1 np1 y
lass_nn	nn1	1849	1	fic_1849_7333.txt-432-11	 	So here's to the lad who can talk to his lass, And here's	41:45	0:57	So here 's to the lad who can talk to his lass , And here 's	11	0:16	so here be to the lad who can talk to his lass , and here be	rr rl vbz ii at nn1 pnqs vm vvi ii appge nn1 y cc rl vbz
lass_nn	nn2	1854	1	fic_1854_3384.txt-4392-16	 	" And what so useful as to make my Annie look gayest of all the village lasses? "	72:78	0:81	" And what so useful as to make my Annie look gayest of all the village lasses ? "	16	0:19	" and what so useful as to make my annie look gay of all the village lass ? "	" cc ddq rg jj csa to vvi appge np1 nn1 jjt io db at nn1 nn2 y "
lass_nn	nn2	1859	1	fic_1859_9220.txt-669-14	 	where Bessie and he talked it all over afresh, before the gaping Irish lasses and sneering mulattos, till they were found to agree in every particular about the " nasty Yankees, " and their ignorance of what's what, and their uppishness. "	71:77	0:239	where Bessie and he talked it all over afresh , before the gaping Irish lasses and sneering mulattos , till they were found to agree in every particular about the " nasty Yankees , " and their ignorance of what 's what , and their uppishness . "	14	0:48	where bessie and he talk it all over afresh , before the gaping irish lass and sneer mulatto , till they be find to agree in every particular about the " nasty yankee , " and their ignorance of what be what , and their uppishness . "	cs_rrq np1 cc pphs1 vvd pph1 rr ii_rp@ rr y cs_ii at jj jj nn2 cc vvg_jj@ nn2 y cs pphs2 vbdr vvn to vvi ii_rp@ at1 jj_nn1@ ii at " jj nn2 y " cc appge nn1 io ddq vbz ddq y cc appge nn1_<sub> y "
lass_nn	nn1	1815	1	fic_1815_8719.txt-718-15	 	Dorriville Well, well, don't despair, Robert, you shall lead your lass to the altar yet.	66:70	0:88	Dorriville Well , well , do n't despair , Robert , you shall lead your lass to the altar yet .	15	0:21	dorriville well , well , do n't despair , robert , you shall lead your lass to the altar yet .	np1_<sub> rr y rr y vd0 xx vvi y np1 y ppy vm vvi appge nn1 ii at nn1 rr y
lass_nn	nn1	1838	1	fic_1838_7085.txt-2447-18	 	if you don't give ear, he will wind you long stories -- than of the prettiest lass for whom youthful knight ever put lance in rest.	78:82	0:131	if you do n't give ear , he will wind you long stories -- than of the prettiest lass for whom youthful knight ever put lance in rest .	18	0:29	if you do n't give ear , he will wind you long story -- than of the pretty lass for whom youthful knight ever put lance in rest .	cs ppy vd0 xx vvi nn1 y pphs1 vm vvi ppy jj nn2 z csn io at jjt nn1 if pnqo jj nn1 rr vv0_vvn_vvd nn1 ii nn1 y
lass_nn	nn1	1843	1	fic_1843_8764.txt-2502-60	 	Hypolito All gentle quarrels in the pastoral poets, All passionate love scenes in the best romances, All chaste embraces on the public stage, All soft adventures, which the liberal stars Have winked at, as the natural course of things, Have been surpassed here by my friend, the student, And this sweet Gipsy lass, fair Preciosa!	309:313	0:329	Hypolito All gentle quarrels in the pastoral poets , All passionate love scenes in the best romances , All chaste embraces on the public stage , All soft adventures , which the liberal stars Have winked at , as the natural course of things , Have been surpassed here by my friend , the student , And this sweet Gipsy lass , fair Preciosa !	60	0:65	hypolito all gentle quarrel in the pastoral poet , all passionate love scene in the best romance , all chaste embrace on the public stage , all soft adventure , which the liberal star have wink at , as the natural course of thing , have be surpass here by my friend , the student , and this sweet gipsy lass , fair preciosa !	np1_<sub> db_rr@ jj nn2 ii at jj nn2 y db_rr@ jj nn1 nn2 ii at jjt nn2 y db_rr@ jj nn2 ii at jj_nn1 nn1 y db_rr@ jj nn2 y ddq at jj nn2 vh0 vvn ii y csa_ii at jj nn1 io nn2 y vh0 vbn vvn rl ii appge nn1 y at nn1 y cc dd1 jj jj_nn1 nn1 y jj nn1@_np1 !
lass_nn	nn2	1849	1	fic_1849_7230.txt-2481-6	 	Though differing widely from the buxom lasses of England, their prototypes upon this occasion, yet there was something far from disagreeable in these lithe and graceful creatures, with their bright, savage eyes, supple limbs, and elastic movements.	39:45	0:248	Though differing widely from the buxom lasses of England , their prototypes upon this occasion , yet there was something far from disagreeable in these lithe and graceful creatures , with their bright , savage eyes , supple limbs , and elastic movements .	6	0:44	though differ widely from the buxom lass of england , their prototype upon this occasion , yet there be something far from disagreeable in these lithe and graceful creature , with their bright , savage eye , supple limb , and elastic movement .	cs vvg rr ii at jj nn2 io np1 y appge nn2 ii dd1 nn1 y rr ex vbdz pn1 rg21 rg22 jj ii dd2 jj cc jj nn2 y iw appge jj y jj_nn1 nn2 y jj nn2 y cc jj_nn1 nn2 y
lass_nn	nn1	1847	1	fic_1847_7149.txt-2762-9	 	replied Harbottle, " every lad to his own lass.	42:46	0:47	replied Harbottle , " every lad to his own lass .	9	0:11	reply harbottle , " every lad to his own lass .	vvd np1_nn1 y " at1 nn1 ii appge da nn1 y
lass_nn	nn1	1818	1	fic_1818_8860.txt-1186-12	 	We sailors love old England, Our king -- our grog and lass -- And for this precious Island, Won'd fight the world en maise.	54:58	0:123	We sailors love old England , Our king -- our grog and lass -- And for this precious Island , Won 'd fight the world en maise .	12	0:28	we sailor love old england , our king -- our grog and lass -- and for this precious island , win have fight the world en maise .	ppis2 nn2 vv0 jj np1 y appge nn1 z appge nn1 cc nn1 z cc if dd1 jj nn1 y vvn_vvd vm vvi at nn1 fw nn1_vv0 y
lass_nn	nn2	1860	1	fic_1860_8725.txt-8-2	 	Lads, Lasses, Police, &c.,; &c; Costume BRIAN O'LINN.	6:12	0:53	Lads , Lasses , Police , &c., ; &c ; Costume BRIAN O'LINN.	2	0:13	lad , lass , police , <temp> ; &c ; costume brian <nul>	nn2 y nn2 y nn2 y <temp> y_<sub> np1_<sub> y_<sub> nn1 np1 np1
lass_nn	nn2	1849	1	fic_1849_7333.txt-1254-39	 	(I am ashamed to write it, for I have not pronounced one for a long time,) at the Captain for breaking his word with me and leaving before the hour, one of these Scotch lasses said to me imploringly, for our boat had gotten immediately under the stern of the steamer, where she stood, " Oh!	169:175	0:290	( I am ashamed to write it , for I have not pronounced one for a long time , ) at the Captain for breaking his word with me and leaving before the hour , one of these Scotch lasses said to me imploringly , for our boat had gotten immediately under the stern of the steamer , where she stood , " Oh !	39	0:65	( i be ashamed to write it , for i have not pronounce one for a long time , ) at the captain for break his word with me and leave before the hour , one of these scotch lass say to me imploringly , for our boat have get immediately under the stern of the steamer , where she stand , " oh !	y ppis1 vbm jj to vvi pph1 y cs ppis1 vh0 xx vvn pn1_mc1 if at1 jj nnt1 y y ii at nn1 if vvg appge nn1 iw ppio1 cc vvg ii at nnt1 y mc1 io dd2 jj nn2 vvd_vvn@ ii ppio1 rr y if appge nn1 vhd vvn rr ii at nn1 io at nn1 y cs_rrq pphs1 vvd y " uh !
lass_nn	nn2	1849	1	fic_1849_583.txt-4636-79	 	at the castle of the Heer Van Tassel, which he found thronged with the pride and flower of the adjacent country -- old farmers, a spare leathern-faced race, in homespun coats and breeches, blue stockings, huge shoes, and magnificent pewter buckles; their brisk withered little dames, in close crimped caps, long-waisted shortgowns, homespun petticoats, with scissors and pincushions and gay calico pockets hanging on the outside; buxom lasses, almost as antiquated as their mothers, excepting where a straw hat, a fine ribbon, or perhaps a white frock, gave symptoms of city innovation; the sons, in short square-skirted coats with rows of stupendous brass buttons, and their hair generally queued in the fashion of the times, especially if they could procure an eel-skin for the purpose, it being esteemed throughout the country as a potent nourisher and strengthener of the hair.	436:442	0:881	at the castle of the Heer Van Tassel , which he found thronged with the pride and flower of the adjacent country -- old farmers , a spare leathern-faced race , in homespun coats and breeches , blue stockings , huge shoes , and magnificent pewter buckles ; their brisk withered little dames , in close crimped caps , long-waisted shortgowns , homespun petticoats , with scissors and pincushions and gay calico pockets hanging on the outside ; buxom lasses , almost as antiquated as their mothers , excepting where a straw hat , a fine ribbon , or perhaps a white frock , gave symptoms of city innovation ; the sons , in short square-skirted coats with rows of stupendous brass buttons , and their hair generally queued in the fashion of the times , especially if they could procure an eel-skin for the purpose , it being esteemed throughout the country as a potent nourisher and strengthener of the hair .	79	0:163	at the castle of the heer van tassel , which he find throng with the pride and flower of the adjacent country -- old farmer , a spare leathern-faced race , in homespun coat and breech , blue stocking , huge shoe , and magnificent pewter buckle ; their brisk wither little dame , in close crimped cap , long-waisted shortgowns , homespun petticoat , with scissors and pincushion and gay calico pocket hang on the outside ; buxom lass , almost as antiquated as their mother , except where a straw hat , a fine ribbon , or perhaps a white frock , give symptom of city innovation ; the son , in short square-skirted coat with row of stupendous brass button , and their hair generally queue in the fashion of the time , especially if they could procure an eel-skin for the purpose , it be esteem throughout the country as a potent nourisher and strengthener of the hair .	ii at nn1 io at np1 np1 np1 y ddq pphs1 vvd vvn iw at nn1 cc nn1 io at jj nn1_<sub> y_<sub> jj_<sub> nn2 y at1 jj jj_<sub> nn1 y ii nn1 nn2 cc nn2_vvz y jj nn2 y jj nn2 y cc jj nn1 nn2_vvz y appge jj jj@_vvd jj nn2 y ii jj jj@_vvd nn2 y jj nn2_<sub> y vv0_nn1 nn2 y iw nn2 cc nn2_vvz cc jj nn1 nn2 vvg rp at jj_nn1@ y jj nn2 y rr rg jj csa appge nn2 y vvg_ii rrq_cs at1 nn1 nn1 y at1 jj nn1 y cc rr at1 jj nn1 y vvd nn2 io nn1 nn1 y at nn2 y rr21 rr22 jj_<sub> nn2 iw nn2 io jj nn1 nn2 y cc appge nn1 rr vvd_vvn@ ii at nn1 io at nnt2 y rr cs pphs2 vm vvi at1 nn1_jj if at nn1 y pph1 vbg vvn@ ii at nn1 ii_csa at1 jj nn1 cc nn1 io at nn1 y
lass_nn	nn1	1838	1	fic_1838_7086.txt-2825-11	 	but you are a father, with a tight, pretty lass of your own; what cares an old widower for bright een and sunny hair?	43:47	0:117	but you are a father , with a tight , pretty lass of your own ; what cares an old widower for bright een and sunny hair ?	11	0:28	but you be a father , with a tight , pretty lass of your own ; what care an old widower for bright een and sunny hair ?	ccb ppy vbr at1 nn1 y iw at1 jj_rr y jj nn1 io appge da y ddq vvz at1 jj nn1 if jj nn1_jj cc jj nn1 y
lass_nn	nn1	1843	1	fic_1843_7208.txt-10532-32	 	But when, as he got accustomed to the place, he accosted them with a gentle voice, said a complimentary word for their sign-board, with its full-length sailor's lass -- Hope upon her anchor, or sturdy Strength, standing square upon his pins -- they began at once to have a fancy for the old man.	161:165	0:295	But when , as he got accustomed to the place , he accosted them with a gentle voice , said a complimentary word for their sign-board , with its full-length sailor 's lass -- Hope upon her anchor , or sturdy Strength , standing square upon his pins -- they began at once to have a fancy for the old man .	32	0:62	but when , as he get accustom to the place , he accost them with a gentle voice , say a complimentary word for their sign-board , with its full-length sailor 's lass -- hope upon her anchor , or sturdy strength , stand square upon his pin -- they begin at once to have a fancy for the old man .	ccb cs y csa pphs1 vvd jj_vvn@ ii at nn1 y pphs1 vvd ppho2 iw at1 jj nn1 y vvd at1 jj nn1 if appge nn1_jj y iw appge jj nn1 ge nn1 z nn1_vv0 ii appge nn1 y cc jj nn1 y vvg nn1_jj_rr@ ii appge nn2 z pphs2 vvd rr21 rr22 to vhi at1 nn1_jj if at jj nn1 y
lass_nn	nn2	1832	1	fic_1832_7177.txt-3501-37	 	Thence, he came back, by another route, to Florence, to Mantua, to Padua, and to Venice; visiting gay cities; consorting with cavaliers and choice spirits; romping with rustic lasses; outfacing bluff bandits; and tuning himself up to the key of that wayward, disorderly time, in the best humour of a bon-camarado who wore silken doublet and trusty Toledo.	176:182	0:355	Thence , he came back , by another route , to Florence , to Mantua , to Padua , and to Venice ; visiting gay cities ; consorting with cavaliers and choice spirits ; romping with rustic lasses ; outfacing bluff bandits ; and tuning himself up to the key of that wayward , disorderly time , in the best humour of a bon-camarado who wore silken doublet and trusty Toledo .	37	0:72	thence , he come back , by another route , to florence , to mantua , to padua , and to venice ; visit gay city ; consort with cavalier and choice spirit ; romp with rustic lass ; outface bluff bandit ; and tune himself up to the key of that wayward , disorderly time , in the best humour of a bon-camarado who wear silken doublet and trusty toledo .	rr y pphs1 vvd rp y ii dd1 nn1 y ii np1 y ii np1 y ii np1 y cc ii np1 y vvg_jj jj nn2 y vvg iw nn2 cc nn1_jj@ nn2 y vvg iw jj nn2 y vvg_jj@ nn1 nn2_vvz y cc vvg ppx1 ii21 ii22 at nn1 io dd1 jj y jj nnt1 y ii at jjt nn1 io at1 nn1_<sub> pnqs vvd jj nn1 cc jj np1 y
lass_nn	nn1	1837	1	fic_1837_7395.txt-2970-13	 	Both are young, both are pretty; but methinks the left hand lass is	60:64	0:67	Both are young , both are pretty ; but methinks the left hand lass is	13	0:15	both be young , both be pretty ; but methinks the left hand lass be	db2 vbr jj y db2 vbr jj y ccb fu at jj nn1 nn1 vbz
lass_nn	nn1	1848	1	fic_1848_7193.txt-13264-28	 	And the Man with the motionless form and corpse-like visage, uttered a burst of hollow laughter as he replied: " Gilbert had spoken of the pretty lass named Madeline.	146:150	0:166	And the Man with the motionless form and corpse-like visage , uttered a burst of hollow laughter as he replied : " Gilbert had spoken of the pretty lass named Madeline .	28	0:32	and the man with the motionless form and corpse-like visage , utter a burst of hollow laughter as he reply : " gilbert have speak of the pretty lass name madeline .	cc at nn1 iw at jj nn1 cc jj nn1 y vvd_vvn at1 nn1 io jj_nn1 nn1 csa pphs1 vvd y " np1 vhd vvn io at jj nn1 vvd np1 y
lass_nn	nn1	1835	1	fic_1835_7063.txt-1748-31	 	A coof cam in wi ' rowth o ' gear, And I hae tint my dearest dear; But woman is but warld's gear, Sae let the bonnie lass gang. "	117:121	0:129	A coof cam in wi ' rowth o ' gear , And I hae tint my dearest dear ; But woman is but warld 's gear , Sae let the bonnie lass gang . "	31	0:35	a coof cam in wi ' rowth o ' gear , and i hae tint my dear dear ; but woman be but warld 's gear , sae let the bonnie lass gang . "	at1_zz1 nn1 nn1 ii nn2 ge nn1 zz1 ge nn1 y cc zz1% nn2 vv0@ appge jjt nn1_jj y ccb nn1 vbz ccb nn1_<sub> ge nn1 y nn1 vv0_vvd@ at nn1 nn1 nn1 y "
lass_nn	nn2	1829	1	fic_1829_7072.txt-2505-39	 	from her father; but the symmetry, so gracefully elegant, the rounded arm, taper fingers and slender foot, were not quite so strictly Vermontese; though these perfections are much oftener possessed by your rural lasses, than the city belle, or the more fastidious city beau, who is usually a perfect Chinese in his admiration of small feet, imagines possible.	212:218	0:359	from her father ; but the symmetry , so gracefully elegant , the rounded arm , taper fingers and slender foot , were not quite so strictly Vermontese ; though these perfections are much oftener possessed by your rural lasses , than the city belle , or the more fastidious city beau , who is usually a perfect Chinese in his admiration of small feet , imagines possible .	39	0:69	from her father ; but the symmetry , so gracefully elegant , the rounded arm , taper finger and slender foot , be not quite so strictly vermontese ; though these perfection be much often possess by your rural lass , than the city belle , or the more fastidious city beau , who be usually a perfect chinese in his admiration of small foot , imagine possible .	ii appge nn1 y ccb at nn1 y rg_rr rr jj y at jj nn1 y nn1 nn2 cc jj nn1 y vbdr xx rg rg_rr rr jj_<sub> y cs dd2 nn2 vbr rr rrr vvn ii appge jj nn2 y csn at nn1 nn1 y cc at rgr jj nn1 nn1 y pnqs vbz rr at1 jj nn1@_jj ii appge nn1 io jj nn2 y vvz jj y
lass_nn	nn2	1857	1	fic_1857_8225.txt-230-6	 	Clink your glasses, toast your lasses, set the table in a roar!	31:37	0:63	Clink your glasses , toast your lasses , set the table in a roar !	6	0:15	clink your glass , toast your lass , set the table in a roar !	vv0 appge nn2 y vv0 appge nn2 y vvd_vv0 at nn1 ii at1 nn1 !
