lemma	pos	date	grouping	identifier	description	context	indexes_target_token	indexes_target_sentence	context_tokenized	indexes_target_token_tokenized	indexes_target_sentence_tokenized	context_lemmatized	context_pos	context_normalized
Manschette	NN	1966	2	2532889X_1966-08-17_01_030.tcf.xml-28-21	 	Es wurde eine neue Paste entwickelt, die sich zur Pflege aller synthetischen Fasern eignet, speziell aber die Kragen und Manschetten an synthetischen Hemden und Blusen mühelos säubert.	121:132	0:184	Es wurde eine neue Paste entwickelt , die sich zur Pflege aller synthetischen Fasern eignet , speziell aber die Kragen und Manschetten an synthetischen Hemden und Blusen mühelos säubert .	21	0:30	es werden eine neu Paste entwickeln , die sich zur Pflege alle synthetisch Faser eignen , speziell aber d Kragen und Manschette an synthetisch Hemd und Bluse mühelos säubern .	PPER VAFIN ART ADJA NN VVPP $, PRELS PRF APPRART NN PIAT ADJA NN VVFIN $, ADJD ADV ART NN KON NN APPR ADJA NN KON NN ADJD VVFIN $.	
Manschette	NN	1971	2	26120215_1971_06_25_01_347.tcf.xml-248-17	 	4020-Biesenthal 1017 Berlin, Lange Transp. Garage 4 x 2,20 Stahlgerüst m. verk, Kragen und Manschetten Horst Schüler 1058 Berlin, Verk.	91:102	0:135	4020- Biesenthal 1017 Berlin , Lange Transp. Garage 4 x 2,20 Stahlgerüst m. verk , Kragen und Manschetten Horst Schüler 1058 Berlin , Verk .	17	0:25	4020- Biesenthal 1017 Berlin , Lange Transp. Garage 4 x 2,20 Stahlgerüst m. verk , Kragen und Manschette Horst Schüler 1058 Berlin , Verk .	ADJA NE CARD NE $, NE NE NN CARD XY CARD NN FM FM $, NN KON NN NE NN CARD NE $, NE $.	
Manschette	NN	1990	2	2532889X_1990-08-10_01_274.tcf.xml-49-10	 	Und auch die Dichtungen an Motor und Getriebe sowie die Manschetten an den Antriebswellen halten dem Straßeneinsatz stand.	56:67	0:122	Und auch die Dichtungen an Motor und Getriebe sowie die Manschetten an den Antriebswellen halten dem Straßeneinsatz stand .	10	0:19	und auch d Dichtung an Motor und Getriebe sowie d Manschette an d Antriebswelle halten d Straßeneinsatz stehen .	KON ADV ART NN APPR NN KON NN KON ART NN APPR ART NN VVFIN ART NN VVFIN $.	
Manschette	NN	1953	2	26120215_1953_12_25_02_110.tcf.xml-43-13	 	Dann kam ein Päckchen mit feiner gestickter Wäsche zum Vorschein, Tücher und Manschetten, zuletzt Briefe von der Mutter und von Elisabeth.	77:88	0:138	Dann kam ein Päckchen mit feiner gestickter Wäsche zum Vorschein , Tücher und Manschetten , zuletzt Briefe von der Mutter und von Elisabeth .	13	0:24	dann kommen eine Päckchen mit fein gestickt Wäsche zum Vorschein , Tuch und Manschette , zuletzt Brief von d Mutter und von Elisabeth .	ADV VVFIN ART NN APPR ADJA ADJA NN APPRART NN $, NN KON NN $, ADV NN APPR ART NN KON APPR NE $.	
Manschette	NN	1965	2	26120215_1965_09_17_01_405.tcf.xml-6-9	 	Man mißt den Blutdruck am Patienten durch Zusammenpressen einer Manschette am Oberarm und Ablesen des Manometerdrucks beim ersten Auftreten und beim Aufhören des Geräusches, welches das	64:74	0:185	Man mißt den Blutdruck am Patienten durch Zusammenpressen einer Manschette am Oberarm und Ablesen des Manometerdrucks beim ersten Auftreten und beim Aufhören des Geräusches , welches das	9	0:27	man missen d Blutdruck am Patient durch Zusammenpreßen eine Manschette am Oberarm und Ablesen d Manometerdruck beim erst Auftreten und beim aufhören d Geräusch , welche d	PIS VVFIN ART NN APPRART NN APPR NN ART NN APPRART NN KON NN ART NN APPRART ADJA NN KON APPRART VVINF ART NN $, PRELS ART	
Manschette	NN	1968	2	26120215_1968_03_31_01_226.tcf.xml-48-44	 	Herr Arnold aus Düsseldorf — wir haben; ilk miteinander.; ils uns da am 1. Juli 1941t die Miiiläryouverneurc das Dokument iibei gilben, wonach wir die Möglichkeit h.'ülon. die Bundesrepublik zu begründen, wir haben alle miteinander, auch ich. wirklieh Manschetten davor schabt, einen deutschen Beitrag zur Teilung Deutschlands /u le steiv	252:263	0:338	Herr Arnold aus Düsseldorf — wir haben; ilk miteinander .; ils uns da am 1. Juli 1941t die Miiiläryouverneurc das Dokument iibei gilben , wonach wir die Möglichkeit h.'ülon . die Bundesrepublik zu begründen , wir haben alle miteinander , auch ich . wirklieh Manschetten davor schabt , einen deutschen Beitrag zur Teilung Deutschlands /u le steiv	44	0:57	Herr Arnold aus Düsseldorf — wir Haben; Ilk miteinander .; Ils wir da am 1. Juli 1941t d Miiiläryouverneurc d Dokument Iibei gilben , wonach wir d Möglichkeit H.'ülon . d Bundesrepublik zu begründen , wir haben alle miteinander , auch ich . wirklieh Manschette davor schaben , eine deutsch Beitrag zur Teilung Deutschland /u Le Steiv	NN NE APPR NE $( PPER NE NE ADV $( NE PPER ADV APPRART ADJA NN CARD ART NN ART NN NE VVINF $, PWAV PPER ART NN NE $. ART NN PTKZU VVINF $, PPER VAFIN PIS ADV $, ADV PPER $. ADJA NN PAV VVFIN $, ART ADJA NN APPRART NN NE NE NE NE	
Manschette	NN	1967	2	26120215_1967_04_14_01_237.tcf.xml-1-13	 	Einen finanziellen Nutzen von 20000 Mark erbringt eine Vakuumspannvorrichtung. zum Schneiden von Manschetten dem VEB Gummiwerke Berlin.	97:108	0:135	Einen finanziellen Nutzen von 20000 Mark erbringt eine Vakuumspannvorrichtung . zum Schneiden von Manschetten dem VEB Gummiwerke Berlin .	13	0:19	eine finanziell Nutzen von 20000 Mark erbringen eine Vakuumspannvorrichtung . zum Schneide von Manschette d VEB Gummiwerk Berlin .	ART ADJA NN APPR CARD NN VVFIN ART NN $. APPRART NN APPR NN ART NN NN NE $.	
Manschette	NN	1955	2	2532889X_1955-10-23_01_135.tcf.xml-40-11	 	Modischer schwarzer Dame nmantel mit weißen Noppen Blickfang bilden die großen Manschetten am Ärmel und der schmeichelnde, angeschnittene Schal (206 DM).	79:90	0:153	Modischer schwarzer Dame nmantel mit weißen Noppen Blickfang bilden die großen Manschetten am Ärmel und der schmeichelnde , angeschnittene Schal (206 DM ) .	11	0:24	Modische schwarz Dame Nmantel mit weiß Noppe Blickfang bilden d groß Manschette am Ärmel und d schmeichelnd , angeschneiden Schal (206 DM ) .	NN ADJA NN NE APPR ADJA NN NN VVFIN ART ADJA NN APPRART NN KON ART ADJA $, ADJA NN ADJA NN $( $.	
Manschette	NN	1960	2	26120215_1960_08_21_01_550.tcf.xml-1-12	 	Ich habe auf meinem Laubengrundstück eine Pumpe, für die ich neue Manschetten und Scheiben brauche.	66:77	0:99	Ich habe auf meinem Laubengrundstück eine Pumpe , für die ich neue Manschetten und Scheiben brauche .	12	0:17	ich haben auf meine Laubengrundstück eine Pumpe , für die ich neu Manschette und Scheibe brauchen .	PPER VAFIN APPR PPOSAT NN ART NN $, APPR PRELS PPER ADJA NN KON NN VVFIN $.	
Manschette	NN	1951	2	26120215_1951_08_16_01_217.tcf.xml-48-22	 	Kunstqläser, Bern w. Berl Treptow he «" Umsatz krank. steinketten hüb Moosdorfs. traßs 12 holtshilber verkft. sehe Manschetten Wel 2654 Berliner Kauft Seqelboot BUvarkaal Kaulsknörto Tabaks Zeitung. Fi Wel. etwa 20—30 gm mit dorf, massives Wo. ßensee Berliner dosen, Porzellans H.lfsmotor oder chenendhäuschen guren, Wandtellei Alles 10 Welienbinder nur Ste ndach Dauer Wertqeqenstände bester Zustand pachtland Obst leder Art. Diskrete 9402.	115:126	0:441	Kunstqläser , Bern w. Berl Treptow he « " Umsatz krank . steinketten hüb Moosdorfs . traßs 12 holtshilber verkft . sehe Manschetten Wel 2654 Berliner Kauft Seqelboot BUvarkaal Kaulsknörto Tabaks Zeitung. Fi Wel . etwa 20—30 gm mit dorf , massives Wo . ßensee Berliner dosen , Porzellans H.lfsmotor oder chenendhäuschen guren , Wandtellei Alles 10 Welienbinder nur Ste ndach Dauer Wertqeqenstände bester Zustand pachtland Obst leder Art. Diskrete 9402 .	22	0:72	Kunstqläser , Bern W. Berl Treptow He « " Umsatz krank . Steinketten Hüb Moosdorf . traßs 12 holtshilber verkft . sehen Manschette Wel 2654 berliner kaufen seqelboot buvarkaal kaulsknörto tabaks Zeitung. fi wel . etwa 20—30 Gm mit Dorf , massiv wo . SSensee berliner dosen , Porzellan H.lfsmotor oder Chenendhäuschen Guren , Wandtellei alle 10 Welienbinder nur Ste Ndach Dauer Wertqeqenstände gut Zustand Pachtland Obst ledern Art. Diskrete 9402 .	NE $, NE NE NE NE NE $( $( NN ADJD $. NE NE NE $. XY CARD XY XY $. VVFIN NN NE CARD ADJA VVFIN FM FM FM FM NN FM FM $. ADV CARD NN APPR NE $, ADJA PWAV $. NE ADJA VVINF $, NN NE KON NE NE $, NN PIAT CARD NN ADV NE NE NN NE ADJA NN NE NN VVFIN NN NN CARD $.	
Manschette	NN	1982	2	26120215_1982_06_07_01_116.tcf.xml-12-31	 	und 2,32 m. fassen", deuten an, ' daß sie selbst vor dem Weltrekord des immer noch nicht wieder wettkampf aktiven Gerd Wessig (2,36 m) keine Manschetten haben.	141:152	0:159	und 2,32 m . fassen " , deuten an , ' daß sie selbst vor dem Weltrekord des immer noch nicht wieder wettkampf aktiven Gerd Wessig ( 2,36 m ) keine Manschetten haben .	31	0:34	und 2,32 M . fassen " , deuten an , ' daß sie selbst vor d Weltrekord d immer noch nicht wieder Wettkampf aktiv Gerd Wessig ( 2,36 M ) keine Manschette haben .	KON CARD NN $. VVINF $( $, VVFIN PTKVZ $, $( KOUS PPER ADV APPR ART NN ART ADV ADV PTKNEG ADV NE ADJA NE NE $( CARD NN $( PIAT NN VAINF $.	
Manschette	NN	1966	2	26120215_1966_03_13_01_422.tcf.xml-131-14	 	35. Tel. 42 31 57, Dop-Anz Kraske 110 Berlin, Ossietzkystr und Manschetten 23,20 6806 Anz.-Kraske. 110 Bln.. Ossietzkystr.	63:74	0:122	35. Tel. 42 31 57 , Dop- Anz Kraske 110 Berlin , Ossietzkystr und Manschetten 23,20 6806 Anz.-Kraske. 110 Bln.. Ossietzkystr .	14	0:22	35. Tel. 42 31 57 , Dop- Anz Kraske 110 Berlin , Ossietzkystr und Manschette 23,20 6806 anz.-kraske. 110 bln.. ossietzkystr .	ADJA NN CARD CARD CARD $, NN NE NE CARD NE $, NE KON NN CARD CARD XY CARD XY XY $.	
Manschette	NN	1966	2	26120215_1966_10_17_01_079.tcf.xml-3-147	 	* AKTUELLES ANGEBOT Herrenwintermantel, dunkelgrau, Raglanform 175.-Herrenwintermantel, Raglanform mit Rückengurt, braun 182,-Herrenwintermantel, grau,, hochmodisch, verdeckte Leiste, Rückengurt 231,-Herrenmantel, auf Nerzilla-Kanin gefüttert, Oberstoff reine Wolle M8.-Herrenwintermantel, fischgrät, mit Nutria-Kragen, grau 434.-Herrenwintermantel, mit Rückengurt, braun, strapazierfähig 222.-Herrenanzug. feiner Tropical, Streifenmuster 119,-Herrenanzug, festgezwirntes Materiell kleine Karomusterung 143.— Herrenanzug, hochmodisch, mit Seitenschlitzen, braun 197,-Herrenanzug, schwarz, auf 2 oder 3 Knöpfe geschlossen Hosen und Sakkos in großer Auswahl in verschiedenen Fassons ob 54,— Herrenhosen, mit Rundbund oder in Sportform mit Gürtel ab",-Anzughemden, Baumwolle, weiß, bügelfrei, in al en Größen 41-Polycon-Anzughemden, pflegeleicht, weiß, in allen Großen 43,50 Anzughemden, blau-grau gestreift, mit versteiftem Kragen und Manschetten 19.85 Sporthemden, Baumwolle, kariert, in vielan Farben und allen Größen. ab 20.-Trainingsanzuge, Dederon, vollelastisch, in 4 Farben, Gr. 4 — 154,15 Herrenbademäntel, frottier urrd velour, dezente Muster, Gr. 46-56 ab 66,30 Grobgestrickte Pullover, mit spitzem Ausschnitt. Wolpryla ab 71.89 ♦♦♦♦♦♦♦♦ »♦♦♦♦♦♦♦♦♦♦♦♦♦ «♦♦♦♦♦♦ ♦ MORGEN EMPFIEHLT SICH DAS kontex-KAUFHAUS „CITYTEX	933:944	0:1321	* AKTUELLES ANGEBOT Herrenwintermantel , dunkelgrau , Raglanform 175.- Herrenwintermantel , Raglanform mit Rückengurt , braun 182,- Herrenwintermantel , grau , , hochmodisch , verdeckte Leiste , Rückengurt 231,- Herrenmantel , auf Nerzilla-Kanin gefüttert , Oberstoff reine Wolle M8 .- Herrenwintermantel , fischgrät , mit Nutria- Kragen , grau 434.- Herrenwintermantel , mit Rückengurt , braun , strapazierfähig 222.- Herrenanzug . feiner Tropical , Streifenmuster 119,- Herrenanzug , festgezwirntes Materiell kleine Karomusterung 143.— Herrenanzug , hochmodisch , mit Seitenschlitzen , braun 197,- Herrenanzug , schwarz , auf 2 oder 3 Knöpfe geschlossen Hosen und Sakkos in großer Auswahl in verschiedenen Fassons ob 54,— Herrenhosen , mit Rundbund oder in Sportform mit Gürtel ab " ,- Anzughemden , Baumwolle , weiß , bügelfrei , in al en Größen 41- Polycon-Anzughemden , pflegeleicht , weiß , in allen Großen 43,50 Anzughemden , blau-grau gestreift , mit versteiftem Kragen und Manschetten 19.85 Sporthemden , Baumwolle , kariert , in vielan Farben und allen Größen . ab 20.- Trainingsanzuge , Dederon , vollelastisch , in 4 Farben , Gr. 4 — 154,15 Herrenbademäntel , frottier urrd velour , dezente Muster , Gr. 46-56 ab 66,30 Grobgestrickte Pullover , mit spitzem Ausschnitt . Wolpryla ab 71.89 ♦♦♦♦♦♦♦♦ »♦♦♦♦♦♦♦♦♦♦♦♦♦ «♦♦♦♦♦♦ ♦ MORGEN EMPFIEHLT SICH DAS kontex-KAUFHAUS „CITYTEX	147	0:211	* aktuell Angebot Herrenwintermantel , dunkelgrau , Raglanform 175.- Herrenwintermantel , Raglanform mit Rückengurt , braun 182,- Herrenwintermantel , grau , , hochmodisch , verdeckt Leiste , Rückengurt 231,- Herrenmantel , auf Nerzilla-Kanin füttern , Oberstoff rein Wolle M8 .- Herrenwintermantel , Fischgrät , mit nutria- Kragen , grau 434.- Herrenwintermantel , mit Rückengurt , braun , strapazierfähig 222.- Herrenanzug . fein Tropical , Streifenmuster 119,- Herrenanzug , festgezwirnt materiell klein Karomusterung 143.— Herrenanzug , hochmodisch , mit Seitenschlitz , braun 197,- Herrenanzug , schwarz , auf 2 oder 3 Knopf schließen Hose und Sakko in groß Auswahl in verschieden Fasson ob 54,— Herrenhose , mit Rundbund oder in Sportform mit Gürtel ab " ,- Anzughemd , Baumwolle , wissen , bügelfrei , in al en Größe 41- Polycon-Anzughemden , pflegeleicht , wissen , in alle groß 43,50 Anzughemd , blau-grau streifen , mit versteift Kragen und Manschette 19.85 Sporthemd , Baumwolle , karieren , in Vielan Farbe und alle Größe . ab 20.- Trainingsanzug , Dederon , vollelastisch , in 4 Farbe , Gr. 4 — 154,15 Herrenbademantel , frottieren Urrd Velour , dezent Muster , Gr. 46-56 ab 66,30 Grobgestrickte Pullover , mit spitz Ausschnitt . Wolpryla ab 71.89 ♦♦♦♦♦♦♦♦ »♦♦♦♦♦♦♦♦♦♦♦♦♦ «♦♦♦♦♦♦ ♦ Morgen empfehlen SICH d Kontex-Kaufhaus „citytex	XY ADJA NN NN $, ADJD $, NN CARD NN $, NN APPR NN $, ADJD CARD NN $, ADJD $, $, ADJD $, ADJA NN $, NN CARD NN $, APPR NN VVPP $, NN ADJA NN NE $( NN $, NE $, APPR TRUNC NN $, ADJD CARD NN $, APPR NN $, ADJD $, ADJD CARD NN $. ADJA NN $, NN CARD NN $, ADJA ADJD ADJA NN CARD NN $, ADJD $, APPR NN $, ADJD CARD NN $, ADJD $, APPR CARD KON CARD NN VVPP NN KON NN APPR ADJA NN APPR ADJA NN KOUS ADJA NN $, APPR NN KON APPR NN APPR NN PTKVZ $( $( NN $, NE $, VVFIN $, ADJD $, APPR FM FM NN ADJA NN $, ADJD $, VVFIN $, APPR PIAT ADJA CARD NN $, ADJD VVPP $, APPR ADJA NN KON NN CARD NN $, NE $, VVPP $, APPR NE NN KON PIAT NN $. APPR CARD NN $, NN $, ADJD $, APPR CARD NN $, NN CARD $( CARD NN $, VVFIN NE NE $, ADJA NN $, NN CARD APPR CARD NN NN $, APPR ADJA NN $. NN APPR CARD XY XY XY $( NN VVFIN NN ART NE NE	
Manschette	NN	1979	2	2532889X_1979-04-21_01_337.tcf.xml-26-29	 	Häufige Ursache für das Ablaufen des zu Beginn eingefüllten Wassers oder nicht genügender Sog der Handpumpe sind auch verhärtete (weil trockene) oder durch Rost im Zylinder zerfurchte Manschetten, die aus Leder oder Plast bestehen.	184:195	0:231	Häufige Ursache für das Ablaufen des zu Beginn eingefüllten Wassers oder nicht genügender Sog der Handpumpe sind auch verhärtete ( weil trockene ) oder durch Rost im Zylinder zerfurchte Manschetten , die aus Leder oder Plast bestehen .	29	0:38	häufig Ursache für d Ablaufen d zu Beginn eingefüllt Wasser oder nicht genügend Sog d Handpumpe sein auch verhärten ( weil trocken ) oder durch Rost im Zylinder zerfurcht Manschette , die aus Leder oder Plast bestehen .	ADJA NN APPR ART NN ART APPR NN ADJA NN KON PTKNEG ADJA NN ART NN VAFIN ADV VVFIN $( KOUS ADJA $( KON APPR NN APPRART NN ADJA NN $, PRELS APPR NN KON NN VVINF $.	
Manschette	NN	1964	2	26120215_1964_08_25_01_077.tcf.xml-19-5	 	„Darum hatte Calloway solche Manschetten, was? —	29:40	0:48	„ Darum hatte Calloway solche Manschetten , was ? —	5	0:10	„ darum haben Calloway solch Manschette , was ? —	$( PAV VAFIN NE PIAT NN $, PWS $. $(	
Manschette	NN	1967	2	26120215_1967_02_05_01_409.tcf.xml-29-0	 	Manschetten, Farbe Herrenausstatter, Prenzlauer Straße 47 od. eig. Grundst., zw. spät. Heir. it. zw. Hcir.it RSO1 RZ-Pavil on 108 Berlin Ro 04329 Dewaq.	0:11	0:152	Manschetten , Farbe Herrenausstatter , Prenzlauer Straße 47 od. eig. Grundst. , zw. spät. Heir. it. zw. Hcir .it RSO1 RZ-Pavil on 108 Berlin Ro 04329 Dewaq .	0	0:28	Manschette , Farbe Herrenausstatter , Prenzlauer Straße 47 od. eig. grundst. , zw. spät. heir. it. zw. hcir .it rso1 rz-pavil on 108 Berlin Ro 04329 Dewaq .	NN $, NN NN $, NN NN CARD XY XY XY $, XY XY XY XY XY XY XY XY FM FM CARD NE NE CARD NN $.	
Manschette	NN	1969	2	26120215_1969_02_23_01_418.tcf.xml-16-7	 	Wir bieten Ihnen hoch-Verhandlungen Kragen und Manschetten mit Dauersteife wertige Industriewaren, CENTRUM-und Dienstleistungen Spezialartikel und Importe, sind stets Neuanfertigung von Bettwasche bereit, Sie umfassend zu beraten und im Zusammenhang rrit Grundstücksem-und » verkaufen aus Kundenmateria wünschen Ihnen Büro ftir Grundstücks-FREUDE BEIM EINKAUF IM Vermittlungen GroB-Beriin Auftragserteilung in unseren Annahmestellen 102 Bariin.	47:58	0:444	Wir bieten Ihnen hoch- Verhandlungen Kragen und Manschetten mit Dauersteife wertige Industriewaren , CENTRUM- und Dienstleistungen Spezialartikel und Importe , sind stets Neuanfertigung von Bettwasche bereit , Sie umfassend zu beraten und im Zusammenhang rrit Grundstücksem- und » verkaufen aus Kundenmateria wünschen Ihnen Büro ftir Grundstücks- FREUDE BEIM EINKAUF IM Vermittlungen GroB-Beriin Auftragserteilung in unseren Annahmestellen 102 Bariin .	7	0:59	wir bieten sie hoch- Verhandlung Kragen und Manschette mit Dauersteife wertig Industrieware , centrum- und Dienstleistung Spezialartikel und Importe , sein stets Neuanfertigung von Bettwasche bereit , sie umfaßend zu beraten und im Zusammenhang Rrit grundstücksem- und » verkaufen aus Kundenmateria wünschen sie Büro Ftir grundstücks- Freude beim Einkauf IM Vermittlung grob-beriin Auftragserteilung in unsere Annahmestelle 102 Bariin .	PPER VVFIN PPER TRUNC NN NN KON NN APPR NN ADJA NN $, TRUNC KON NN NN KON NN $, VAFIN ADV NN APPR NE PTKVZ $, PPER ADJD PTKZU VVINF KON APPRART NN NE TRUNC KON $( VVFIN APPR NN VVFIN PPER NN NE TRUNC NN APPRART NN APPR NN ADJA NN APPR PPOSAT NN CARD NN $.	
Manschette	NN	1947	2	26120215_1947_05_29_01_177.tcf.xml-71-15	 	Ich wie « ihn auf den Üaistand hin. den Sie übe-isehen haben ddfl seine Manschetten s!s-man ihn fand, nicht sichtbar, sondern in die Rockärme) hinaufgezogen waten, a's hatte «r etl'.g seinen Rock angezogen ohne » le hmunlerzoziehe-n.	72:83	0:233	Ich wie « ihn auf den Üaistand hin . den Sie übe-isehen haben ddfl seine Manschetten s !s- man ihn fand , nicht sichtbar , sondern in die Rockärme ) hinaufgezogen waten , a's hatte «r etl' .g seinen Rock angezogen ohne » le hmunlerzoziehe-n .	15	0:46	ich wie « er auf d Üaistand hin . d sie Übe-Isehen haben Ddfl seine Manschette s !s- man er finden , nicht sichtbar , sondern in d Rockärme ) hinaufziehen waten , As haben «r Etl' .g seine Rock anziehen ohne » le hmunlerzoziehe-n .	PPER PWAV $( PPER APPR ART NN PTKVZ $. ART PPER NE VAFIN NE PPOSAT NN ART TRUNC PIS PPER VVFIN $, PTKNEG ADJD $, KON APPR ART NE $( VVPP VVINF $, NE VAFIN NE NE NE PPOSAT NN VVPP APPR $( FM FM $.	
Manschette	NN	1965	2	2532889X_1965-10-24_01_236.tcf.xml-10-3	 	Es gibt karierte Manschetten zu einfarbigen Kleidern, es gibt Spitze auf Tuch, Pelz auf Tweed, Perlen auf Seide.	17:28	0:112	Es gibt karierte Manschetten zu einfarbigen Kleidern , es gibt Spitze auf Tuch , Pelz auf Tweed , Perlen auf Seide .	3	0:22	es geben kariert Manschette zu einfarbeig Kleid , es geben Spitze auf Tuch , Pelz auf Tweed , Perle auf Seide .	PPER VVFIN ADJA NN APPR ADJA NN $, PPER VVFIN NN APPR NN $, NN APPR NN $, NN APPR NE $.	
Manschette	NN	1961	2	2532889X_1961-10-07_01_080.tcf.xml-175-12	 	An der Hydraulik eines Kippers vom Tvp S 4000 gingen Ring und Manschette kaputt.	62:72	0:80	An der Hydraulik eines Kippers vom Tvp S 4000 gingen Ring und Manschette kaputt .	12	0:15	an d Hydraulik eine Kipper vom Tvp s 4000 gehen Ring und Manschette kaputt .	APPR ART NN ART NN APPRART NN XY CARD VVFIN NN KON NN PTKVZ $.	
Manschette	NN	1975	2	26120215_1975_11_20_01_143.tcf.xml-25-36	 	Toscanamtl. m. Kapuze, 950,— M, schw. Imp.-Lederimitat.-Kostüm m. synth. Fell. 190,-M, beides Gr. 38 / 40, ungetr., weiß. eleg. Morgenmtl., Imp. m. Marabukrg. u. Manschetten, Gr. 40—46 zu tragen, 200-M. div.	162:173	0:207	Toscanamtl. m. Kapuze , 950,— M , schw. Imp.-Lederimitat .-Kostüm m. synth. Fell . 190 ,- M , beides Gr. 38 / 40 , ungetr . , weiß. eleg. Morgenmtl . , Imp. m. Marabukrg. u. Manschetten , Gr. 40—46 zu tragen , 200- M. div .	36	0:47	Toscanamtl. m. Kapuze , 950,— M , schw. imp.-lederimitat .-kostüm m. synth. Fell . 190 ,- m , beide Gr. 38 / 40 , Ungetr . , weiß. eleg. morgenmtl . , Imp. m. Marabukrg. u. Manschette , Gr. 40—46 zu tragen , 200- M. div .	NN APPR NN $, CARD NE $, XY XY XY FM ADJA NN $. CARD XY XY $, PIS NN CARD $( CARD $, NE $. $, XY XY XY $. $, NN APPR NN APPR NN $, NN CARD PTKZU VVINF $, ADJA NE XY $.	
Manschette	NN	1953	2	2532889X_1953-12-23_01_030.tcf.xml-60-9	 	Eine kleine Drehung an dem großen Rad, die Manschette senkt sich, der Strom	43:53	0:75	Eine kleine Drehung an dem großen Rad , die Manschette senkt sich , der Strom	9	0:15	eine klein Drehung an d groß Rad , d Manschette senken sich , d Strom	ART ADJA NN APPR ART ADJA NN $, ART NN VVFIN PRF $, ART NN	
Manschette	NN	1951	2	26120215_1951_02_14_01_184.tcf.xml-15-10	 	große überhängende Passe, der hochstehende Kragen und die aufgeschlagenen Manschetten geben der Bluse eine strenge Note.	74:85	0:120	große überhängende Passe , der hochstehende Kragen und die aufgeschlagenen Manschetten geben der Bluse eine strenge Note .	10	0:18	groß überhängend Passe , d hochstehend Kragen und d aufgeschlagen Manschette geben d Bluse eine streng Note .	ADJA ADJA NN $, ART ADJA NN KON ART ADJA NN VVFIN ART NN ART ADJA NN $.	
Manschette	NN	1965	2	2532889X_1965-04-03_01_126.tcf.xml-112-12	 	Vorsichtshalber holen sie noch einen, der zwar nicht so schneidig weiße Manschetten über den Uniformärmeln wie der Posten, dafür aber offensichtlich mehr Verantwortung tragt.	72:83	0:174	Vorsichtshalber holen sie noch einen , der zwar nicht so schneidig weiße Manschetten über den Uniformärmeln wie der Posten , dafür aber offensichtlich mehr Verantwortung tragt .	12	0:27	vorsichtshalber holen sie noch eine , die zwar nicht so schneidig weiß Manschette über d Uniformärmel wie d Posten , dafür aber offensichtlich mehr Verantwortung tragen .	ADV VVFIN PPER ADV PIS $, PRELS ADV PTKNEG ADV ADJD ADJA NN APPR ART NN KOKOM ART NN $, PAV ADV ADJD PIAT NN VVFIN $.	
Manschette	NN	1981	2	2532889X_1981-07-31_01_055.tcf.xml-4-8	 	Sie verarbeiten zum Beispiel Schweinshäute zu Arbeitsschutzartikeln, Manschetten für den Fahrzeugbau und zu vielen begehrten Ballhüllen Kaninchenfelle werden zu Fensterledern und Kuhhäute unter anderem zu Sohlenleder für die Schuhindustrie.	69:80	0:240	Sie verarbeiten zum Beispiel Schweinshäute zu Arbeitsschutzartikeln , Manschetten für den Fahrzeugbau und zu vielen begehrten Ballhüllen Kaninchenfelle werden zu Fensterledern und Kuhhäute unter anderem zu Sohlenleder für die Schuhindustrie .	8	0:31	sie verarbeiten zum Beispiel Schweinshaut zu Arbeitsschutzartikel , Manschette für d Fahrzeugbau und zu viel begehrt Ballhülle Kaninchenfell werden zu Fensterleder und Kuhhaut unter ander zu Sohlenleder für d Schuhindustrie .	PPER VVINF APPRART NN NN APPR NN $, NN APPR ART NN KON APPR PIAT ADJA NN NN VAFIN APPR NN KON NN APPR PIS APPR NN APPR ART NN $.	
Manschette	NN	1974	2	26120215_1974_02_10_01_419.tcf.xml-25-15	 	Bei normaler Belastung kann es also unter der Entzündung zum Verlust der den Zahn umschließenden Manschette kommen.	97:107	0:115	Bei normaler Belastung kann es also unter der Entzündung zum Verlust der den Zahn umschließenden Manschette kommen .	15	0:18	bei normal Belastung können es also unter d Entzündung zum Verlust d d Zahn umschließend Manschette kommen .	APPR ADJA NN VMFIN PPER ADV APPR ART NN APPRART NN ART ART NN ADJA NN VVINF $.	
