lemma	pos	date	grouping	identifier	description	context	indexes_target_token	indexes_target_sentence	context_tokenized	indexes_target_token_tokenized	indexes_target_sentence_tokenized	context_lemmatized	context_pos
ounce_nn	nnu1	1850	1	mag_1850_525559.txt-209-13	 	He supposes that the average earnings of the gold diggers axe about an ounce, or seventeen dollars the day; which will give an amount of $40,000,000, collected during the gold digging season of 48, 49; one half of which was probably collected and carried out of the country by foreigners.	71:76	0:288	He supposes that the average earnings of the gold diggers axe about an ounce , or seventeen dollars the day ; which will give an amount of $40,000,000 , collected during the gold digging season of 48 , 49 ; one half of which was probably collected and carried out of the country by foreigners .	13	0:56	he suppose that the average earnings of the gold digger axe about an ounce , or seventeen dollar the day ; which will give an amount of $40,000,000 , collect during the gold dig season of 48 , 49 ; one half of which be probably collect and carry out of the country by foreigner .	pphs1 vvz cst at jj_nn1 nn2 io at nn1_jj@ nn2 vv0 ii_rp@ at1 nnu1 y cc mc nnu2 at nnt1 y ddq vm vvi at1 nn1 io nnu y vvn_vvd ii at nn1_jj@ jj_nn1_vvg nnt1 io mc y mc y mc1 nn1@_db io ddq vbdz rr vvn_vvd cc vvn_vvd ii21 ii22 at nn1 ii nn2 y
ounce_nn	nnu2	1853	1	nf_1853_748464.txt-824-40	 	-- Mix half an ounce of slacked lime (hydrate of lime) with six ounces of water, and conduct into this milk of lime, with frequent agitation, as much chlorine gas as will evolve from two ounces of muriatic acid and half an ounce of black oxide of manganese.	187:193	0:257	-- Mix half an ounce of slacked lime ( hydrate of lime ) with six ounces of water , and conduct into this milk of lime , with frequent agitation , as much chlorine gas as will evolve from two ounces of muriatic acid and half an ounce of black oxide of manganese .	40	0:54	-- mix half an ounce of slack lime ( hydrate of lime ) with six ounce of water , and conduct into this milk of lime , with frequent agitation , as much chlorine gas as will evolve from two ounce of muriatic acid and half an ounce of black oxide of manganese .	zz nn1_vv0 db_rr@ at1 nnu1 io jj@ nn1 y nn1 io nn1 y iw mc nnu2 io nn1 y cc vv0_nn1 ii dd1 nn1 io nn1 y iw jj nn1 y rg da1 nn1 nn1 csa vm vvi ii mc nnu2 io jj nn1 cc db_rr@ at1 nnu1 io jj nn1 io nn1 y
ounce_nn	nnu2	1834	1	nf_1834_747938.txt-1181-12	 	Tiie large male, they said, yielded from five to six ounces, and the females only two ounces a piece.	53:59	0:101	Tiie large male , they said , yielded from five to six ounces , and the females only two ounces a piece .	12	0:23	tiie large male , they say , yield from five to six ounce , and the female only two ounce a piece .	np1@_nn1 jj nn1_jj y pphs2 vvd y vvn_vvd ii mc ii mc nnu2 y cc at nn2 rr mc nnu2 at1 nn1 y
ounce_nn	nnu2	1850	1	mag_1850_525559.txt-166-53	 	Under the head of " commercial resources, " Mr. King takes notice that the precious metals are the only products of California; a state of things that must remain as long as the pursuit of gold continues profitable The gold, as it is taken from the earth, weighed in ounces, is the medium of domestic and foreign exchange Vessels departing from all other ports 1850.	267:273	0:366	Under the head of " commercial resources , " Mr. King takes notice that the precious metals are the only products of California ; a state of things that must remain as long as the pursuit of gold continues profitable The gold , as it is taken from the earth , weighed in ounces , is the medium of domestic and foreign exchange Vessels departing from all other ports 1850.	53	0:70	under the head of " commercial resource , " mr.- king take notice that the precious metal be the only product of california ; a state of thing that must remain as long as the pursuit of gold continue profitable the gold , as it be take from the earth , weigh in ounce , be the medium of domestic and foreign exchange vessel depart from all other port <nul>	ii at nn1 io " jj nn2 y " nnb np1 vvz nn1_vv0 cst at jj nn2 vbr at jj nn2 io np1 y at1 nn1 io nn2 cst_dd1 vm vvi cs31 cs32 cs33 at nn1 io nn1 vvz jj at nn1 y csa pph1 vbz vvn ii at nn1 y vvn_vvd ii nnu2 y vbz at nn1 io jj_nn1@ cc jj nn1 nn2 vvg ii db jj nn2 mc
ounce_nn	nnu1	1843	1	fic_1843_7208.txt-2803-15	 	solitary confinement's dry work as the gad-fly thought when he was corked in an ounce vial! "	80:85	0:93	solitary confinement 's dry work as the gad-fly thought when he was corked in an ounce vial ! "	15	0:19	solitary confinement 's dry work as the gad-fly think when he be cork in an ounce vial ! "	jj nn1 ge jj nn1 ii_csa at nn1_<sub> vvn_vvd_nn1 cs_rrq pphs1 vbdz vvn@ ii at1 nnu1 nn1 ! "
ounce_nn	nnu2	1848	1	nf_1848_747893.txt-3340-8	 	of Muscats, of two pounds, nine ounces, to one of the same kind weighing two pounds, three ounces, -- and such are the differences between Mr. Hutchison's Castle Malgwjn grapes and those of Eshton Hall, -- we must retain our opinion, that grapes are not improved by being fed on carrion.	32:38	0:287	of Muscats , of two pounds , nine ounces , to one of the same kind weighing two pounds , three ounces , -- and such are the differences between Mr. Hutchison 's Castle Malgwjn grapes and those of Eshton Hall , -- we must retain our opinion , that grapes are not improved by being fed on carrion .	8	0:60	of muscats , of two pound , nine ounce , to one of the same kind weigh two pound , three ounce , -- and such be the difference between mr.- hutchison 's castle malgwjn grape and those of eshton hall , -- we must retain our opinion , that grape be not improve by be feed on carrion .	io np1_<sub> y io mc nn2 y mc nnu2 y ii mc1 io at da nn1_jj@ nn1_vvg mc nn2 y mc nnu2 y zz cc da vbr at nn2_<sub> ii nnb np1 ge nn1 np1_<sub> nn2 cc dd2 io np1_<sub> nn1 y nn1_jj ppis2 vm vvi appge nn1 y cst nn2 vbr xx vvn ii vbg vvn ii nn1 y
ounce_nn	nnu1	1839	1	nf_1839_747610.txt-1995-19	 	, the aforesaid sum of in coined silver of sterling alloy, at six shillings and eight pence per ounce, or in Spanish milled dollars of full weight, at six shillings each, with interest annually, at the rate of six per cent, per annum.	96:101	0:234	, the aforesaid sum of in coined silver of sterling alloy , at six shillings and eight pence per ounce , or in Spanish milled dollars of full weight , at six shillings each , with interest annually , at the rate of six per cent , per annum .	19	0:50	, the aforesaid sum of in coin silver of sterling alloy , at six shilling and eight pence per ounce , or in spanish mill dollar of full weight , at six shilling each , with interest annually , at the rate of six per cent , per annum .	y at jj@ nn1 io ii jj@ nn1 io nn1_jj@ nn1 y ii mc nn2 cc mc nnu ii nnu1 y cc ii jj_nn1@ jj@_vvd nnu2 io jj nn1 y ii mc nn2 dd1 y iw nn1 rr y ii at nn1 io mc nnu21 nnu22 y ra21 ra22 y
ounce_nn	nnu1	1831	1	mag_1831_554110.txt-108-4	 	But, as an ounce of gold is really worth a little more than fifteen and a half ounces of silver, payments are made in preference in the latter metal, which is generally employed in France as money.	11:16	0:197	But , as an ounce of gold is really worth a little more than fifteen and a half ounces of silver , payments are made in preference in the latter metal , which is generally employed in France as money .	4	0:41	but , as an ounce of gold be really worth a little more than fifteen and a half ounce of silver , payment be make in preference in the latter metal , which be generally employ in france as money .	ccb y csa_ii at1 nnu1 io nn1 vbz rr ii rr21 rr22 dar csn mc cc at1 rr@_nn1@ nnu2 io nn1 y nn2 vbr vvn ii nn1 ii at da nn1 y ddq vbz rr vvn_vvd ii np1 csa_ii@ nn1 y
ounce_nn	nnu2	1855	1	nf_1855_750257.txt-2426-35	 	The essential oil of cinnamon is usually made from the refuse of the crop; but the quantity produced, in proportion to the weight of cinnamon, is exceedingly small, being about five ounces of oil to half a hundred-weight of the spice.	182:188	0:234	The essential oil of cinnamon is usually made from the refuse of the crop ; but the quantity produced , in proportion to the weight of cinnamon , is exceedingly small , being about five ounces of oil to half a hundred-weight of the spice .	35	0:46	the essential oil of cinnamon be usually make from the refuse of the crop ; but the quantity produce , in proportion to the weight of cinnamon , be exceedingly small , be about five ounce of oil to half a hundred-weight of the spice .	at jj nn1 io nn1 vbz rr vvn_vvd ii at nn1 io at nn1 y ccb at nn1 vvd_vvn y ii31 ii32 ii33 at nn1 io nn1 y vbz rr jj y vbg rg mc nnu2 io nn1 ii db at1 nn1_<sub> io at nn1 y
ounce_nn	nnu1	1824	1	nf_1824_747448.txt-3494-10	 	Between the pericardium and the heart there was about an ounce of lymph, and the heart itself was of greater size than usual; but its muscular substance was extremely flaccid.	57:62	0:175	Between the pericardium and the heart there was about an ounce of lymph , and the heart itself was of greater size than usual ; but its muscular substance was extremely flaccid .	10	0:33	between the pericardium and the heart there be about an ounce of lymph , and the heart itself be of great size than usual ; but its muscular substance be extremely flaccid .	ii at nn1 cc at nn1 ex_rl vbdz ii at1 nnu1 io nn1 y cc at nn1 ppx1 vbdz io jjr nn1 csn jj y ccb appge jj nn1 vbdz rr jj y
ounce_nn	nnu1	1849	1	nf_1849_748465.txt-1241-18	 	quite, dry, dip it into a solution of twenty-five grains of iodide of potassium to one ounce of distilled water, drain it, wash it in distilled water and again drain it.	87:92	0:169	quite , dry , dip it into a solution of twenty-five grains of iodide of potassium to one ounce of distilled water , drain it , wash it in distilled water and again drain it .	18	0:36	quite , dry , dip it into a solution of twenty-five grain of iodide of potassium to one ounce of distilled water , drain it , wash it in distilled water and again drain it .	rr@_rg y jj_vv0@ y vv0 pph1 ii at1 nn1 io mc nn2 io nn1 io nn1 ii mc1 nnu1 io jj nn1 y vv0 pph1 y vv0 pph1 ii_rp@ jj nn1 cc rt vv0 pph1 y
ounce_nn	nnu2	1843	1	nf_1843_752682.txt-548-9	 	i. p.136), a horse consumes 79 1/10 ounces of carbon in twenty-four hours, a milch cow 70 3/4 ounces; so that the horse requires 13 pounds 3 1/2 ounces, and the cow 11 pounds 10 3/4 ounces of oxygen	36:42	0:198	i. p.136 ) , a horse consumes 79 1/10 ounces of carbon in twenty-four hours , a milch cow 70 3/4 ounces ; so that the horse requires 13 pounds 3 1/2 ounces , and the cow 11 pounds 10 3/4 ounces of oxygen	9	0:44	i.- p.136 ) , a horse consume 79 1/10 ounce of carbon in twenty-four hour , a milch cow 70 3/4 ounce ; so that the horse require 13 pound 3 1/2 ounce , and the cow 11 pound 10 3/4 ounce of oxygen	mc fo y y at1 nn1 vvz mc mf nnu2 io nn1 ii mc nnt2 y at1 nn1 nn1 mc mf nnu2 y cs21 cs22 at nn1 vvz mc nn2 mc mf nnu2 y cc at nn1 mc nn2 mc mf nnu2 io nn1
ounce_nn	nnu2	1811	1	fic_1811_8637.txt-1910-2	 	Four hundred ounces, paid to you in gold. '	13:19	0:43	Four hundred ounces , paid to you in gold . '	2	0:11	four hundred ounce , pay to you in gold . '	mc m nnu2 y vvn_vvd ii ppy ii nn1 y "@
ounce_nn	nnu2	1849	1	nf_1849_748465.txt-1205-47	 	-- In order to fix the picture thus obtained, first dip it into water; then partly dry it with bibulous paper, and wash it with a solution of bromide of potassium -- containing one hundred grains of that salt dissolved in eight or ten ounces of distilled water.	235:241	0:261	-- In order to fix the picture thus obtained , first dip it into water ; then partly dry it with bibulous paper , and wash it with a solution of bromide of potassium -- containing one hundred grains of that salt dissolved in eight or ten ounces of distilled water .	47	0:52	-- in order to fix the picture thus obtain , first dip it into water ; then partly dry it with bibulous paper , and wash it with a solution of bromide of potassium -- contain one hundred grain of that salt dissolve in eight or ten ounce of distilled water .	nn1_jj bcl21 bcl22 to vvi at nn1 rr vvn_vvd y md vv0 pph1 ii nn1 y rt rr vv0@_jj pph1 iw jj nn1 y cc vv0 pph1 iw at1 nn1 io nn1 io nn1 nn1 vvg mc1 m nn2 io dd1 nn1 vvn_vvd ii mc cc mc nnu2 io jj nn1 y
ounce_nn	nnu2	1855	1	fic_1855_1280.txt-1010-7	 	But you have promised me the fifty ounces. "	35:41	0:44	But you have promised me the fifty ounces . "	7	0:10	but you have promise me the fifty ounce . "	ccb ppy vh0 vvn ppio1 at mc nnu2 y "
ounce_nn	nnu1	1979	2	news_1979_734241.txt-6-41	 	// From page 1 China, USSR grain In February, March, and April of this year, the specialist said, gold in world markets was selling in a " very narrow margin " of $230 to $250 an ounce.	179:184	0:185	// From page 1 China , USSR grain In February , March , and April of this year , the specialist said , gold in world markets was selling in a " very narrow margin " of $230 to $250 an ounce .	41	0:43	// from page 1 china , ussr grain in february , march , and april of this year , the specialist say , gold in world market be sell in a " very narrow margin " of $230 to $250 an ounce .	nn1_<sub> ii nn1 mc1 np1_nn1@ y np1 nn1 ii npm1 y npm1_np1@ y cc npm1 io dd1 nnt1 y at nn1 vvd y nn1 ii nn1 nn2 vbdz vvg ii_rp@ at1 " rg jj nn1 " io nnu ii nnu at1 nnu1 y
ounce_nn	nnu1	2006	2	fic_2006_28074.txt-156-5	 	In an instant, every ounce of cool air was sucked out and replaced with this blast of summer air - a hot, wet slap in the face.	21:26	0:127	In an instant , every ounce of cool air was sucked out and replaced with this blast of summer air - a hot , wet slap in the face .	5	0:30	in an instant , every ounce of cool air be suck out and replace with this blast of summer air - a hot , wet slap in the face .	ii at1 nnt1_jj y at1 nnu1 io jj nn1 vbdz vvn rp cc vvn_vvd iw dd1 nn1 io nnt1 nn1 - at1 jj y jj nn1_rr ii at nn1 y
ounce_nn	nnu2	2001	2	mag_2001_416328.txt-35-6	 	A serving of meat is 3 ounces, about the size of a deck of cards.	23:29	0:65	A serving of meat is 3 ounces , about the size of a deck of cards .	6	0:17	a serve of meat be 3 ounce , about the size of a deck of card .	at1_zz1 nn1@ io nn1 vbz mc nnu2 y ii at nn1 io at1 nn1 io nn2 y
ounce_nn	nnu2	2000	2	mag_2000_412355.txt-132-8	 	That is, a shell that weighs 20 ounces or less, has thin fabric, and	32:38	0:68	That is , a shell that weighs 20 ounces or less , has thin fabric , and	8	0:17	that be , a shell that weigh 20 ounce or less , have thin fabric , and	rex21 rex22 y at1 nn1 cst_dd1 vvz mc nnu2 cc rrr_dar y vhz jj nn1 y cc
ounce_nn	nnu1	2006	2	news_2006_607692.txt-94-5	 	I didn't have one ounce of fun there, " he said.	18:23	0:48	I did n't have one ounce of fun there , " he said .	5	0:14	i do n't have one ounce of fun there , " he say .	ppis1 vdd xx vhi mc1 nnu1 io nn1_jj rl y " pphs1 vvd y
ounce_nn	nnu2	1976	2	news_1976_732580.txt-11-19	 	He was followed by Trisha at 2 pounds 91,9 ounces and 15 inches; Erin, 3 pounds 5 ounces and 161/2 inches; and finally Maureen, 3 pounds 9 ounces and 17 inches.	82:88	0:160	He was followed by Trisha at 2 pounds 91,9 ounces and 15 inches ; Erin , 3 pounds 5 ounces and 161/2 inches ; and finally Maureen , 3 pounds 9 ounces and 17 inches .	19	0:36	he be follow by trisha at 2 pound 91,9 ounce and 15 inch ; erin , 3 pound 5 ounce and 161/2 inch ; and finally maureen , 3 pound 9 ounce and 17 inch .	pphs1 vbdz vvn ii np1 ii mc nn2 mc_<sub> nnu2 cc mc nnu2_vvz% y np1 y mc nn2 mc nnu2 cc mf nnu2 y cc rr np1 y mc nn2 mc nnu2 cc mc nnu2 y
ounce_nn	nnu2	2005	2	mag_2005_418108.txt-33-5	 	each), rinsed 8 ounces dried Asian wheat noodles (see " Four Types of Noodles, " at left) 3 tablespoons sesame seeds 1 teaspoon vegetable oil 1 tablespoon minced garlic cup rice vinegar 1/3 cup soy sauce 2 tablespoons sugar teaspoon cayenne 2 carrots (6 oz.	16:22	0:257	each ) , rinsed 8 ounces dried Asian wheat noodles ( see " Four Types of Noodles , " at left ) 3 tablespoons sesame seeds 1 teaspoon vegetable oil 1 tablespoon minced garlic cup rice vinegar 1/3 cup soy sauce 2 tablespoons sugar teaspoon cayenne 2 carrots ( 6 oz.	5	0:51	each ) , rinse 8 ounce dried asian wheat noodle ( see " four type of noodle , " at leave ) 3 tablespoon sesame seed 1 teaspoon vegetable oil 1 tablespoon mince garlic cup rice vinegar 1/3 cup soy sauce 2 tablespoon sugar teaspoon cayenne 2 carrot ( 6 <nul>	dd1 y y vvd_vvn mc nnu2 jj jj nn1 nn2_vvz y vv0 " mc nn2 io np1_nn2 y " ii jj_nn1@ y mc nn2 vv0 nn2 mc1 nn1 nn1 nn1 mc1 nn1 jj_vvn nn1 nn1 nn1 nn1 mf nn1_vv0% jj nn1 mc nn2 nn1_vv0% nn1 nn1 mc nn2 y mc nnu
ounce_nn	nnu1	1966	2	mag_1966_217503.txt-11-21	 	Because of redistricting, the Tenth District now has more registered Democrats than Republicans, and Peggy Heckler will need every ounce of her vigor to hold the constituency for the Republican Party.	131:136	0:200	Because of redistricting , the Tenth District now has more registered Democrats than Republicans , and Peggy Heckler will need every ounce of her vigor to hold the constituency for the Republican Party .	21	0:34	because of redistricting , the tenth district now have more register democrat than republican , and peggy heckler will need every ounce of her vigor to hold the constituency for the republican party .	ii21 ii22 vvg_nn1@ y at md nn1 rt vhz dar vvn nn2 csn nn2 y cc np1 np1_nn1 vm vvi at1 nnu1 io appge nn1 to vvi at nn1 if at nn1_jj@ nn1 y
ounce_nn	nnu2	1985	2	news_1985_671502.txt-122-17	 	Cucumber Sandwiches #8 thin slices white bread 1/2 cup mayonnaise, approximately #1 cucumber, about 6 ounces Salt to taste if desired Freshly ground pepper to taste.	102:108	0:165	Cucumber Sandwiches #8 thin slices white bread 1/2 cup mayonnaise , approximately #1 cucumber , about 6 ounces Salt to taste if desired Freshly ground pepper to taste.	17	0:28	cucumber sandwich #8 thin slice white bread 1/2 cup mayonnaise , approximately #1 cucumber , about 6 ounce salt to taste if desire freshly ground pepper to <nul>	nn1 nn2 nnu jj nn2 jj nn1 mf nn1 nn1_vv0 y rr nnu nn1 y rg mc nnu2 nn1 to vvi cs_csw@ vvn rr jj@_nn1_vvn@ nn1 ii nnu
ounce_nn	nnu2	2006	2	mag_2006_427857.txt-556-27	 	PAM All Natural Olive Oil Cooking Spray 1 (13.8-ounce) can refrigerated pizza crust teaspoon ground cumin 1 cup black bean-and-corn salsa 1 cup (4 ounces) shredded sharp Cheddar CHEESE 1 cup diced cooked PILGRIM 'S PRIDE Boneless, Skinless Chicken Breasts 4 slices OSCAR MAYER Ready To Serve Bacon, diced red onion, thinly sliced and separated into rings cup diced seeded plum tomatoes 1 cup (4 ounces) shredded Mexican FOUR-CHEESE BLEND 2 small jalapeo peppers, sliced and seeded 1 ripe avocado 1 lime, halved Sour cream Chopped fresh cilantro 1.	147:153	0:547	PAM All Natural Olive Oil Cooking Spray 1 ( 13.8-ounce ) can refrigerated pizza crust teaspoon ground cumin 1 cup black bean-and-corn salsa 1 cup ( 4 ounces ) shredded sharp Cheddar CHEESE 1 cup diced cooked PILGRIM 'S PRIDE Boneless , Skinless Chicken Breasts 4 slices OSCAR MAYER Ready To Serve Bacon , diced red onion , thinly sliced and separated into rings cup diced seeded plum tomatoes 1 cup ( 4 ounces ) shredded Mexican FOUR-CHEESE BLEND 2 small jalapeo peppers , sliced and seeded 1 ripe avocado 1 lime , halved Sour cream Chopped fresh cilantro 1 .	27	0:101	pam all natural olive oil cook spray 1 ( 13.8-ounce ) can refrigerate pizza crust teaspoon ground cumin 1 cup black bean-and-corn salsa 1 cup ( 4 ounce ) shred sharp cheddar cheese 1 cup dice cook pilgrim 's pride boneless , skinless chicken breast 4 slice oscar mayer ready to serve bacon , dice red onion , thinly slice and separate into ring cup dice seed plum tomato 1 cup ( 4 ounce ) shred mexican four-cheese blend 2 small jalapeo pepper , sliced and seed 1 ripe avocado 1 lime , halve sour cream chop fresh cilantro 1 .	np1 db_rr@ jj jj@_nn1@_np1 nn1 nn1_vvg nn1 mc1 y nnu1_jj y vm_vv0% jj@_vvd nn1 nn1 nn1 nn1 nn1 mc1 nn1 jj jj_nn1 nn1 mc1 nn1 y mc nnu2 y vvd_jj jj np1 nn1 mc1 nn1 vvd jj nn1 ge nn1_np1@ np1_jj y jj_np1 nn1 nn2 mc nn2_vvz@ np1 np1 jj_rr@ to_ii vv0 np1 y vvd jj nn1 y rr vvn_jj_vvd cc vvn_jj ii nn2 nn1 vvd jj@ nn1 nn2 mc1 nn1 y mc nnu2 y vvd_jj jj jj_nn1 nn1 mc jj nn1 nn2 y jj_vvn_vvd cc vvd mc1 jj nn1 mc1 nn1 y vvn_vvd@_jj@ jj nn1 vvd_vvn_jj jj nn1 mc1 y
ounce_nn	nnu2	1992	2	mag_1992_409436.txt-13-23	 	Arthur Lawton laid claim to the then-new muskie world record with that fish, which he claimed weighed in at 69 pounds 15 ounces and measured 64.5 inches.	121:127	0:153	Arthur Lawton laid claim to the then-new muskie world record with that fish , which he claimed weighed in at 69 pounds 15 ounces and measured 64.5 inches .	23	0:29	arthur lawton lay claim to the then-new muskie world record with that fish , which he claim weigh in at 69 pound 15 ounce and measure 64.5 inch .	np1 np1 vvd nn1 ii at jj nn1 nn1 nn1 iw dd1 nn y ddq pphs1 vvd vvn_vvd rp@ ii mc nn2 mc nnu2 cc vvd_vvn mc nnu2 y
ounce_nn	nnu2	2002	2	mag_2002_387865.txt-18-12	 	SIERRA DESIGNS ORION AST FINAL GRADE: 3.8 For a few extra ounces, this sturdy shelter will let you sleep comfortably in any weather.	58:64	0:132	SIERRA DESIGNS ORION AST FINAL GRADE : 3.8 For a few extra ounces , this sturdy shelter will let you sleep comfortably in any weather .	12	0:26	sierra design orion ast final grade : 3.8 for a few extra ounce , this sturdy shelter will let you sleep comfortably in any weather .	np1 nn2 np1 np1_vv0 jj_nn1 nn1 y mc if at1 da2 jj nnu2 y dd1 jj nn1 vm vvi ppy vvi rr ii dd nn1 y
ounce_nn	nnu1	1981	2	fic_1981_10686.txt-851-4	 	If she had an ounce of strength they would not be put in the ranks of the despised and forgotten.	14:19	0:97	If she had an ounce of strength they would not be put in the ranks of the despised and forgotten .	4	0:21	if she have an ounce of strength they would not be put in the rank of the despise and forget .	cs pphs1 vhd at1 nnu1 io nn1 pphs2 vm xx vbi vvn ii at nn2 io at jj cc vvn_jj@ y
ounce_nn	nnu1	1961	2	mag_1961_431636.txt-52-16	 	Unhappily the weight limits in the capsule were critical, and we dared not add another ounce.	87:92	0:93	Unhappily the weight limits in the capsule were critical , and we dared not add another ounce .	16	0:18	unhappily the weight limit in the capsule be critical , and we dare not add another ounce .	rr at nn1 vvz_nn2 ii at nn1 vbdr jj y cc ppis2 vvd xx vvi dd1 nnu1 y
ounce_nn	nnu2	2004	2	news_2004_640227.txt-90-2	 	Ingredients 4 ounces feta cheese 3 tablespoons honey 1/2 teaspoon salt 1/2 cup all-purpose flour, plus more as needed Olive oil or vegetable oil Directions In a large bowl, mash feta, honey and salt with a fork until well-combined.	14:20	0:231	Ingredients 4 ounces feta cheese 3 tablespoons honey 1/2 teaspoon salt 1/2 cup all-purpose flour , plus more as needed Olive oil or vegetable oil Directions In a large bowl , mash feta , honey and salt with a fork until well-combined .	2	0:43	ingredient 4 ounce feta cheese 3 tablespoon honey 1/2 teaspoon salt 1/2 cup all-purpose flour , plus more as need olive oil or vegetable oil direction in a large bowl , mash feta , honey and salt with a fork until well-combined .	nn2 mc nnu2 nn1 nn1 mc nn2 nn1 mf nn1 nn1 mf nn1_vv0% nn1_jj nn1 y ii_cc%_rr% dar_rrr_rgr ii@_csa jj@_vvn jj_np1 nn1 cc nn1 nn1 nn2 ii at1 jj nn1 y vv0_nn1 nn1 y nn1 cc nn1 iw at1 nn1 cs_ii@ nn1_jj y
ounce_nn	nnu1	1998	2	fic_1998_43217.txt-5-16	 	With the announcement Crichton IV intended to make today, he knew he'd need every ounce of shielding.	82:87	0:101	With the announcement Crichton IV intended to make today , he knew he 'd need every ounce of shielding .	16	0:20	with the announcement crichton iv intend to make today , he know he have need every ounce of shield .	iw at nn1 np1_nn1@ mc vvd_vvn to vvi rt y pphs1 vvd pphs1 vm vvi at1 nnu1 io vvg_nn1@ y
