lemma	pos	date	grouping	identifier	description	context	indexes_target_token	indexes_target_sentence	context_tokenized	indexes_target_token_tokenized	indexes_target_sentence_tokenized	context_lemmatized	context_pos
ounce_nn	nnu1	1985	2	nf_1985_774316.txt-1799-114	 	To have some idea of what amount of duty you can be expected to pay, telephone your nearest customs department, or write for a customs duty brochure for the latest information to: Office of Information and Publications Bureau of Customs Treasury Department Washington, D.C. 20026 | MAINTENANCE A while back I received in the mail a book to review called Crinolines and Crimping Irons: Victorian Clothes, How They Were Cleaned and Cared For, by Christina Walkley and Vanda Foster, and looking through it I was struck by how far we have come from the days when one would pop into his local department store for an ounce of Dragon's Blood, a gram or two of Gregory Powder, or a vial of Black Draught Acid.	612:617	0:702	To have some idea of what amount of duty you can be expected to pay , telephone your nearest customs department , or write for a customs duty brochure for the latest information to : Office of Information and Publications Bureau of Customs Treasury Department Washington , D.C. 20026 | MAINTENANCE A while back I received in the mail a book to review called Crinolines and Crimping Irons : Victorian Clothes , How They Were Cleaned and Cared For , by Christina Walkley and Vanda Foster , and looking through it I was struck by how far we have come from the days when one would pop into his local department store for an ounce of Dragon 's Blood , a gram or two of Gregory Powder , or a vial of Black Draught Acid .	114	0:136	to have some idea of what amount of duty you can be expect to pay , telephone your nearest custom department , or write for a custom duty brochure for the late information to : office of information and publication bureau of custom treasury department washington , d.c.-the 20026 p172 maintenance a while back i receive in the mail a book to review call crinoline and crimp iron : victorian clothes , how they be clean and care for , by christina walkley and vanda foster , and look through it i be strike by how far we have come from the day when one would pop into his local department store for an ounce of dragon 's blood , a gram or two of gregory powder , or a vial of black draught acid .	to vhi dd nn1 io ddq nn1 io nn1 ppy vm vbi vvn to vvi y vv0 appge jjt nn2 nn1 y cc vv0 if at1 nn2 nn1 nn1 if at jjt nn1 ii y nn1 io nn1 cc nn2 nn1 io nn2 nn1 nn1 np1 y np1 mc_<sub> fo nn1 zz1 cs_vv0% nn1_rp ppis1 vvd ii at nn1 at1 nn1 to vvi jj%_vvn np2_nn2@ cc vvg_np1_jj@ nn2 y jj nn2 y rrq pphs2 vbdr vvn cc vvn_vvd if y ii np1 np1 cc np1 np1 y cc vvg ii pph1 ppis1 vbdz vvn ii rgq@_rrq rr ppis2 vh0 vvn ii at nnt2 rrq pn1 vm vvi ii appge jj nn1 nn1 if at1 nnu1 io nn1 ge nn1 y at1 nnu1 cc mc io np1 nn1 y cc at1 nn1 io jj jj_nn1 nn1 y
ounce_nn	nnu1	1999	2	news_1999_653858.txt-31-6	 	Gold managed to top $400 an ounce when Iraq invaded Kuwait in August 1990 and again when the United States and its allies started a land war in January 1991 to force Saddam Hussein's army out of Kuwait.	28:33	0:202	Gold managed to top $400 an ounce when Iraq invaded Kuwait in August 1990 and again when the United States and its allies started a land war in January 1991 to force Saddam Hussein 's army out of Kuwait .	6	0:40	gold manage to top $400 an ounce when iraq invade kuwait in august 1990 and again when the united state and its ally start a land war in january 1991 to force saddam hussein 's army out of kuwait .	nn1 vvd_vvn to vvi nnu at1 nnu1 rrq_cs np1 vvd np1 ii npm1 mc cc rt cs_rrq at np1 np1 cc appge nn2 vvd at1 nn1 nn1 ii npm1 mc to vvi np1 np1 ge nn1 ii21 ii22 np1 y
ounce_nn	nnu2	1987	2	nf_1987_773961.txt-1309-4	 	To this add 4 ounces of bay rum and 1 ounce of castile soap shavings.	14:20	0:69	To this add 4 ounces of bay rum and 1 ounce of castile soap shavings .	4	0:16	to this add 4 ounce of bay rum and 1 ounce of castile soap shaving .	ii dd1 vv0 mc nnu2 io nn1_jj@ nn1 cc mc1 nnu1 io jj nn1 nn2 y
ounce_nn	nnu2	1995	2	nf_1995_773497.txt-168-33	 	Plain inner liners: You can also purchase simple bag liners made of flannel, cotton, breathable nylon, synthetics, and down costing anywhere from $5 to $100 and weighing three ounces to two pounds.	176:182	0:197	Plain inner liners : You can also purchase simple bag liners made of flannel , cotton , breathable nylon , synthetics , and down costing anywhere from $5 to $100 and weighing three ounces to two pounds .	33	0:38	plain inner liner : you can also purchase simple bag liner make of flannel , cotton , breathable nylon , synthetics , and down cost anywhere from $5 to $100 and weigh three ounce to two pound .	jj_rr@ jj nn2 y ppy vm rr vvi jj nn1 nn2 vvn_vvd io nn1 y nn1 y jj nn1 y nn2_nn1 y cc rp_ii@ vvg rl ii nnu ii nnu cc vvg_nn1 mc nnu2 ii mc nn2 y
ounce_nn	nnu2	2004	2	mag_2004_413914.txt-8-10	 	Corking the bat makes it lighter by one to two ounces and moves the center of gravity closer to the batter's hands for a quicker swing.	47:53	0:135	Corking the bat makes it lighter by one to two ounces and moves the center of gravity closer to the batter 's hands for a quicker swing .	10	0:28	cork the bat make it lighter by one to two ounce and move the center of gravity closer to the batter 's hand for a quicker swing .	vvg at nn1 vvz pph1 jjr ii mc1 ii mc nnu2 cc vvz at nn1 io nn1 rrr ii at nn1 ge nn2 if at1 jjr nn1 y
ounce_nn	nnu1	1960	2	nf_1960_773896.txt-315-1	 	one ounce of Cheddar cheese furnishes about the same amount of calcium as do six ounces of milk.	4:9	0:96	one ounce of Cheddar cheese furnishes about the same amount of calcium as do six ounces of milk .	1	0:19	one ounce of cheddar cheese furnish about the same amount of calcium as do six ounce of milk .	mc1 nnu1 io np1 nn1 vvz ii at da nn1 io nn1 csa vd0 mc nnu2 io nn1 y
ounce_nn	nnu2	1987	2	fic_1987_780057.txt-4-23	 	I went round behind the shielding with him as I explained, so he could crack his helmet enough to get about eighteen ounces of water into him.	117:123	0:142	I went round behind the shielding with him as I explained , so he could crack his helmet enough to get about eighteen ounces of water into him .	23	0:29	i go round behind the shield with him as i explain , so he could crack his helmet enough to get about eighteen ounce of water into him .	ppis1 vvd rp ii at nn1@_jj@_vvg iw ppho1 csa ppis1 vvd y cs@_rr pphs1 vm vvi appge nn1 rr to vvi rg mc nnu2 io nn1 ii ppho1 y
ounce_nn	nnu2	2006	2	news_2006_636106.txt-135-91	 	MAKES 8 SIDE-DISH SERVINGS DRESSING o small onion, peeled and cut in pieces cup vegetable juice, such as V-8 2 tablespoons red wine vinegar 1 tablespoon olive oil 1 teaspoon Dijon mustard teaspoon ground black pepper or to taste SALAD 1 cup frozen corn kernels 2 (15-ounce) cans black-eyed peas, rinsed and drained, or 1 cup dry-packaged black-eyes, cooked and drained 1 medium green bell pepper, cored, seeded and diced 2 ribs celery, diced 1 cup cubed ham (about 6 ounces) Make the dressing: Fit a food processor with a steel blade or use a blender.	467:473	0:551	MAKES 8 SIDE-DISH SERVINGS DRESSING o small onion , peeled and cut in pieces cup vegetable juice , such as V-8 2 tablespoons red wine vinegar 1 tablespoon olive oil 1 teaspoon Dijon mustard teaspoon ground black pepper or to taste SALAD 1 cup frozen corn kernels 2 ( 15-ounce ) cans black-eyed peas , rinsed and drained , or 1 cup dry-packaged black-eyes , cooked and drained 1 medium green bell pepper , cored , seeded and diced 2 ribs celery , diced 1 cup cubed ham ( about 6 ounces ) Make the dressing : Fit a food processor with a steel blade or use a blender .	91	0:110	make 8 side-dish serving dress o small onion , peel and cut in piece cup vegetable juice , such as v-8 2 tablespoon red wine vinegar 1 tablespoon olive oil 1 teaspoon dijon mustard teaspoon ground black pepper or to taste salad 1 cup frozen corn kernel 2 ( 15-ounce ) can black-eyed pea , rinse and drain , or 1 cup dry-packaged black-eyes , cook and drain 1 medium green bell pepper , core , seed and dice 2 rib celery , dice 1 cup cube ham ( about 6 ounce ) make the dressing : fit a food processor with a steel blade or use a blender .	vvz mc jj nn2 vvg_nn1@ zz1_uh jj nn1 y vvn_jj@ cc vvn_vv0_nn1 ii_rp@ nn2 nn1 nn1 nn1 y ii21 ii22 fo mc nn2 jj nn1 nn1 mc1 nn1 nn1_jj nn1 mc1 nn1 np1 nn1 nn1 nn1_vvd@ jj nn1 cc to vvi nn1 mc1 nn1 jj_vvn nn1 nn2_vvz mc y nnu1_jj y vvz@_nn2 jj nn2 y jj_vvn_vvd cc vvd_jj_vvn y cc mc1 nn1 nn1_jj nn2 y jj_vvn_vvd cc vvd_jj_vvn mc1 jj_nn1 jj_nn1 nn1 nn1 y vvd y vvd_jj@ cc vvd mc nn2 nn1 y vvd mc1 nn1 vvn_jj@ nn1 y rg mc nnu2 y vv0 at nn1@ y vv0 at1 nn1 nn1 iw at1 nn1 nn1 cc vv0 at1 nn1 y
ounce_nn	nnu1	1979	2	fic_1979_16029.txt-54-3	 	consuming every last ounce of energy in her being.	21:26	0:50	consuming every last ounce of energy in her being .	3	0:10	consume every last ounce of energy in her be .	vvg at1 md nnu1 io nn1 ii appge_ppho1 nn1%_vbg y
ounce_nn	nnu1	1994	2	mag_1994_352087.txt-4-12	 	THE BAD NEWS -- When it comes to prostate cancer, an ounce of prevention may lead to too much cure.	53:58	0:99	THE BAD NEWS -- When it comes to prostate cancer , an ounce of prevention may lead to too much cure .	12	0:22	the bad news -- when it come to prostate cancer , an ounce of prevention may lead to too much cure .	at jj nn1 nn1_jj cs_rrq pph1 vvz ii nn1 nn1 y at1 nnu1 io nn1 vm vvi ii rg da1 nn1 y
ounce_nn	nnu2	1977	2	nf_1977_774125.txt-6-11	 	Make a hole in the middle, and put in two ounces of butter warmed in a pint of milk, a	42:48	0:86	Make a hole in the middle , and put in two ounces of butter warmed in a pint of milk , a	11	0:22	make a hole in the middle , and put in two ounce of butter warm in a pint of milk , a	vv0 at1 nn1 ii at nn1_jj y cc vvn_vvd_vv0 ii mc nnu2 io nn1 vvn_vvd ii_rp@ at1 nnu1 io nn1 y at1
ounce_nn	nnu2	1994	2	news_1994_620115.txt-167-13	 	INGREDIENTS: * 4 Granny Smith apples * 3/4 cup sugar * 5 ounces Roquefort (or other high-quality blue cheese) GASTRIQUE: * 3/4 cup champagne vinegar * 1 tablespoon cracked black pepper * 2 tablespoons butter, softened * Kosher salt INSTRUCTIONS: Slice apples in half lengthwise; remove seeds and tough center.	57:63	0:309	INGREDIENTS : * 4 Granny Smith apples * 3/4 cup sugar * 5 ounces Roquefort ( or other high-quality blue cheese ) GASTRIQUE : * 3/4 cup champagne vinegar * 1 tablespoon cracked black pepper * 2 tablespoons butter , softened * Kosher salt INSTRUCTIONS : Slice apples in half lengthwise ; remove seeds and tough center .	13	0:58	ingredient : * 4 granny smith apple * 3/4 cup sugar * 5 ounce roquefort ( or other high-quality blue cheese ) gastrique : * 3/4 cup champagne vinegar * 1 tablespoon crack black pepper * 2 tablespoon butter , soften * kosher salt instruction : slice apple in half lengthwise ; remove seed and tough center .	nn2 y fu mc nn1 np1 nn2 fu mf nn1 nn1 fu mc nnu2 nn1_vv0 y cc jj jj jj nn1 y np1 y fu mf nn1 nn1 nn1 fu mc1 nn1 vvd_vvn_jj jj nn1 fu mc nn2 nn1_vv0% y vvn_jj fu jj nn1 nn2 y vv0_nn1 nn2 ii db jj_rr y vv0 nn2 cc jj nn1 y
ounce_nn	nnu1	1987	2	nf_1987_773961.txt-509-6	 	Now mix a solution of 1 ounce of borax or soda to every gallon of lukewarm water.	24:29	0:81	Now mix a solution of 1 ounce of borax or soda to every gallon of lukewarm water .	6	0:18	now mix a solution of 1 ounce of borax or soda to every gallon of lukewarm water .	rt vv0 at1 nn1 io mc1 nnu1 io nn1 cc nn1 ii at1 nnu1 io jj nn1 y
ounce_nn	nnu2	2005	2	mag_2005_422919.txt-1-63	 	Prep time: 5 minutes Cooking time: 10 minutes 1 cup chopped onion 1 cup chopped bell pepper 1 small fennel bulb, remove stalks and leaves, chop bulb 8-ounce can diced tomatoes 8-ounce bottle clam juice 1 cup water pound uncooked, peeled, deveined medium-size shrimp, thawed if frozen pound cod or mild-flavored fish fillets, cubed 6 ounces bay scallops 1 teaspoon salt (optional) teaspoon hot-pepper sauce In 3-quart saucepan, combine onion, bell pepper, fennel, tomatoes, clam juice and water.	333:339	0:494	Prep time : 5 minutes Cooking time : 10 minutes 1 cup chopped onion 1 cup chopped bell pepper 1 small fennel bulb , remove stalks and leaves , chop bulb 8-ounce can diced tomatoes 8-ounce bottle clam juice 1 cup water pound uncooked , peeled , deveined medium-size shrimp , thawed if frozen pound cod or mild-flavored fish fillets , cubed 6 ounces bay scallops 1 teaspoon salt ( optional ) teaspoon hot-pepper sauce In 3-quart saucepan , combine onion , bell pepper , fennel , tomatoes , clam juice and water .	63	0:94	prep time : 5 minute cook time : 10 minute 1 cup chopped onion 1 cup chopped bell pepper 1 small fennel bulb , remove stalk and leaf , chop bulb 8-ounce can dice tomato 8-ounce bottle clam juice 1 cup water pound uncooked , peel , deveined medium-size shrimp , thaw if freeze pound cod or mild-flavored fish fillet , cube 6 ounce bay scallop 1 teaspoon salt ( optional ) teaspoon hot-pepper sauce in 3-quart saucepan , combine onion , bell pepper , fennel , tomato , clam juice and water .	nn1 nnt1 y mc nnt2 vvg_nn1 nnt1 y mc nnt2_vvz% mc1 nn1 jj_vvd_vvn nn1 mc1 nn1 jj_vvd_vvn nn1 nn1 mc1 jj nn1 nn1 y vv0 nn2 cc nn2_vvz y nn1 nn1 jj nn1% vvd_jj@ nn2 jj nn1 nn1_vv0 nn1 mc1 nn1 nn1 nn1_vv0@ jj y vvn_vvd@ y vvd jj nn1 y vvd cs_csw@ jj nn1 nn cc jj nn nn2 y vvn mc nnu2 jj@_nn1 nn2 mc1 nn1 nn1 y jj y nn1 nn1_jj nn1 ii jj_nnu1 nn1 y vv0 nn1 y nn1 nn1 y nn1 y nn2 y vv0_nn1 nn1 cc nn1 y
ounce_nn	nnu2	1993	2	fic_1993_1040060.txt-5217-8	 	I have four ounces every morning, four ounces of vitamins, minerals, and certain trace elements not yet understood by science.	39:45	0:126	I have four ounces every morning , four ounces of vitamins , minerals , and certain trace elements not yet understood by science .	8	0:24	i have four ounce every morning , four ounce of vitamin , mineral , and certain trace element not yet understand by science .	ppis1 vh0 mc nnu2 at1 nnt1 y mc nnu2 io nn2 y nn2 y cc jj nn1 nn2 xx rr vvn ii nn1 y
ounce_nn	nnu2	1967	2	mag_1967_274923.txt-17-19	 	A General Accounting Office report released at the hearings claimed that only half the homeless are getting the 14 ounces of rice and the 5$ a day that the Vietnamese government should be doling out.	115:121	0:199	A General Accounting Office report released at the hearings claimed that only half the homeless are getting the 14 ounces of rice and the 5$ a day that the Vietnamese government should be doling out .	19	0:36	a general account office report release at the hearing claim that only half the homeless be get the 14 ounce of rice and the 5$ a day that the vietnamese government should be dole out .	at1_zz1 jj_nn1 nn1_jj@ nn1 nn1 vvn ii at nn2 vvd_vvn cst_dd1 rr db at jj vbr vvg at mc nnu2 io nn1 cc at fo at1 nnt1 cst at jj nn1 vm vbi vvg rp y
ounce_nn	nnu1	1987	2	fic_1987_16030.txt-2495-3	 	With the last ounce of his strength, and with a BELLOW of RAGE, his arm muscles bulging, he crushes down on the handle.	14:19	0:119	With the last ounce of his strength , and with a BELLOW of RAGE , his arm muscles bulging , he crushes down on the handle .	3	0:27	with the last ounce of his strength , and with a bellow of rage , his arm muscle bulge , he crush down on the handle .	iw at md nnu1 io appge nn1 y cc iw at1 nn1 io nn1 y appge nn1 nn2 vvg y pphs1 nn2 rp ii at nn1 y
ounce_nn	nnu2	1973	2	mag_1973_431850.txt-80-8	 	At the same time, four to six ounces of seafood daily will supply the protein needed by the average adult.	30:36	0:106	At the same time , four to six ounces of seafood daily will supply the protein needed by the average adult .	8	0:22	at the same time , four to six ounce of seafood daily will supply the protein need by the average adult .	ii at da nnt1 y mc ii mc nnu2 io nn1 rr_nn1@ vm vvi at nn1 vvn ii at jj_nn1 nn1 y
ounce_nn	nnu1	1982	2	news_1982_668367.txt-34-15	 	A month later, he told them to buy them back - at $475 an ounce.	58:63	0:64	A month later , he told them to buy them back - at $475 an ounce .	15	0:17	a month later , he tell them to buy them back - at $475 an ounce .	at1 nnt1 rrr y pphs1 vvd ppho2 to vvi ppho2 rp - ii nnu at1 nnu1 y
ounce_nn	nnu1	1999	2	fic_1999_55547.txt-401-18	 	Lack of subtlety was one of Earl's most appealing traits, and Rick had to use every ounce of restraint and concentration to keep his mind on the road.	84:89	0:150	Lack of subtlety was one of Earl 's most appealing traits , and Rick had to use every ounce of restraint and concentration to keep his mind on the road .	18	0:31	lack of subtlety be one of earl 's most appealing trait , and rick have to use every ounce of restraint and concentration to keep his mind on the road .	nn1 io nn1 vbdz mc1 io nn1_np1@ ge rgt jj nn2 y cc np1 vhd to vvi at1 nnu1 io nn1 cc nn1 to vvi appge nn1 ii at nn1 y
ounce_nn	nnu1	1968	2	news_1968_726993.txt-12-13	 	Price Driven Down The banks first offered gold this morning at $43 an ounce.	70:75	0:76	Price Driven Down The banks first offered gold this morning at $43 an ounce .	13	0:15	price drive down the bank first offer gold this morning at $43 an ounce .	nn1_vv0@ vvn rp_ii@ at nn2 md jj@_vvd_vvn nn1 dd1 nnt1 ii nnu at1 nnu1 y
ounce_nn	nnu1	1991	2	nf_1991_774072.txt-358-2	 	Add 1 ounce (25 grams) of truffle peelings and sliced mushrooms or mushroom stems, and reduce the mixture by half.	6:11	0:114	Add 1 ounce ( 25 grams ) of truffle peelings and sliced mushrooms or mushroom stems , and reduce the mixture by half .	2	0:24	add 1 ounce ( 25 gram ) of truffle peeling and sliced mushroom or mushroom stem , and reduce the mixture by half .	vv0 mc1 nnu1 y mc nnu2 y io nn1 nn2 cc jj nn2 cc nn1_vv0@ nn2_vvz y cc vv0 at nn1 ii db_nn1@ y
ounce_nn	nnu1	2006	2	mag_2006_398384.txt-317-21	 	Yet population radically declined in the course of only three years in the 1970s-one woman at a time, without an ounce of government involvement.	113:118	0:145	Yet population radically declined in the course of only three years in the 1970s-one woman at a time , without an ounce of government involvement .	21	0:26	yet population radically decline in the course of only three year in the 1970s-one woman at a time , without an ounce of government involvement .	rr nn1 rr vvn_vvd ii at nn1 io rr mc nnt2 ii at mc nn1 ii at1 nnt1 y iw at1 nnu1 io nn1 nn1 y
ounce_nn	nnu1	1996	2	mag_1996_65462.txt-65-39	 	// It seemed especially fitting that Cigar, on the occasion of staking that claim, should deliver his greatest effort as a racehorse and the most desperate, dramatic performance of his life, one in which every ounce of him was tested through the final 200 yards.	210:215	0:262	// It seemed especially fitting that Cigar , on the occasion of staking that claim , should deliver his greatest effort as a racehorse and the most desperate , dramatic performance of his life , one in which every ounce of him was tested through the final 200 yards .	39	0:50	// it seem especially fit that cigar , on the occasion of stake that claim , should deliver his greatest effort as a racehorse and the most desperate , dramatic performance of his life , one in which every ounce of him be test through the final 200 yard .	vv0_<sub> pph1 vvd rr vvg dd1_cst nn1 y ii at nn1 io vvg dd1_cst nn1_vv0 y vm vvi appge jjt nn1 ii_csa at1 nn1 cc at rgt jj y jj nn1 io appge nn1 y pn1_mc1 ii ddq at1 nnu1 io ppho1 vbdz vvn ii at nn1_jj mc nn2 y
ounce_nn	nnu2	2001	2	mag_2001_414793.txt-112-11	 	MAKES 4 SERVINGS 8 ounces penne pasta 1 tablespoon salt 4 ounces Gorgonzola, crumbled 1/2 cup buttermilk 2 tablespoons flat-leaf parsley, chopped 1/4 teaspoon salt 1/4 coarsely ground pepper 2 cups fresh arugula leaves, washed, dried, and torn 2 tablespoons toasted pine nuts 1 Make the pasta: In a large pot over high heat, bring 4 quarts water to a boil.	58:64	0:356	MAKES 4 SERVINGS 8 ounces penne pasta 1 tablespoon salt 4 ounces Gorgonzola , crumbled 1/2 cup buttermilk 2 tablespoons flat-leaf parsley , chopped 1/4 teaspoon salt 1/4 coarsely ground pepper 2 cups fresh arugula leaves , washed , dried , and torn 2 tablespoons toasted pine nuts 1 Make the pasta : In a large pot over high heat , bring 4 quarts water to a boil .	11	0:69	make 4 serving 8 ounce penne pasta 1 tablespoon salt 4 ounce gorgonzola , crumble 1/2 cup buttermilk 2 tablespoon flat-leaf parsley , chop 1/4 teaspoon salt 1/4 coarsely ground pepper 2 cup fresh arugula leaf , wash , dry , and tear 2 tablespoon toast pine nut 1 make the pasta : in a large pot over high heat , bring 4 quart water to a boil .	vvz mc nn2 mc nnu2 nn1 nn1 mc1 nn1 nn1 mc nnu2 nn1@ y vvn_jj mf nn1 nn1_vv0 mc nn2 jj_nn1 nn1 y vvn_jj mf nn1 nn1 mf rr jj@_nn1_vvn@ nn1 mc vvz_nn2 jj jj_nn1 nn2_vvz y vvd_vvn_jj y vvd_vvn_jj y cc vvn_jj@ mc nn2 jj_vvd_vvn nn1 nn2_vvz% mc1 vv0 at nn1 y ii at1 jj nn1 ii jj nn1 y vv0 mc nnu2 nn1 ii at1 nn1@ y
ounce_nn	nnu1	1999	2	nf_1999_775061.txt-335-17	 	He could entertain an outsider with stories and send him home smiling, without ever revealing an ounce of himself.	97:102	0:114	He could entertain an outsider with stories and send him home smiling , without ever revealing an ounce of himself .	17	0:21	he could entertain an outsider with story and send him home smile , without ever reveal an ounce of himself .	pphs1 vm vvi at1 nn1 iw nn2 cc vvi ppho1 rl vvg_jj y iw rr vvg at1 nnu1 io ppx1 y
ounce_nn	nnu1	1997	2	news_1997_621111.txt-98-72	 	INGREDIENTS: * A little olive oil * 2 medium onions, cut in 1- inch chunks * 1/2 pound baby carrots * 1 tablespoon cumin seeds * 1 tablespoon mustard seeds * Salt to taste * 1 medium head of garlic * 6 medium tomatoes, not too ripe * 4 large red and/or yellow bell peppers * 1 cinnamon stick * 1 1/2 cups cooked chickpeas (or a 15- ounce can, rinsed and drained) * 3 tablespoons fresh lemon juice (possibly more) * Freshly ground black pepper to taste * Minced fresh parsley (optional) * Lemon wedges (optional) INSTRUCTIONS: Preheat the oven to 375 degrees.	332:337	0:558	INGREDIENTS : * A little olive oil * 2 medium onions , cut in 1- inch chunks * 1/2 pound baby carrots * 1 tablespoon cumin seeds * 1 tablespoon mustard seeds * Salt to taste * 1 medium head of garlic * 6 medium tomatoes , not too ripe * 4 large red and/or yellow bell peppers * 1 cinnamon stick * 1 1/2 cups cooked chickpeas ( or a 15- ounce can , rinsed and drained ) * 3 tablespoons fresh lemon juice ( possibly more ) * Freshly ground black pepper to taste * Minced fresh parsley ( optional ) * Lemon wedges ( optional ) INSTRUCTIONS : Preheat the oven to 375 degrees .	72	0:118	ingredient : * a little olive oil * 2 medium onion , cut in 1- inch chunk * 1/2 pound baby carrot * 1 tablespoon cumin seed * 1 tablespoon mustard seed * salt to taste * 1 medium head of garlic * 6 medium tomato , not too ripe * 4 large red and/or yellow bell pepper * 1 cinnamon stick * 1 1/2 cup cook chickpea ( or a 15- ounce can , rinse and drain ) * 3 tablespoon fresh lemon juice ( possibly more ) * freshly ground black pepper to taste * mince fresh parsley ( optional ) * lemon wedge ( optional ) instruction : preheat the oven to 375 degree .	nn2 y fu at1 jj jj_nn1 nn1 fu mc jj nn2 y vvn_vv0 ii jj nnu1 nn2 fu mf nn1_vv0@ nn1 nn2 fu mc1 nn1 nn1 nn2 fu mc1 nn1 nn1 nn2 fu nn1 to vvi fu mc1 jj_nn1 nn1 io nn1 fu mc jj nn2 y xx rg jj fu mc jj nn1_jj cc jj nn1 nn2 fu mc1 nn1 nn1 fu mc1 mf vvz_nn2 jj nn2 y cc at1 jj_<sub> nnu1 vm_nn1% y jj_vvn_vvd cc jj_vvn y fu mc nn2 jj nn1 nn1 y rr rrr_dar y fu rr jj@_vvn@_vvd@ jj nn1 to vvi fu jj_vvn jj nn1 y jj y fu nn1 nn2_vvz y jj y nn2 y vv0 at nn1 ii mc nn2 y
ounce_nn	nnu2	2005	2	news_2005_623926.txt-191-27	 	halved and sliced 4 cloves garlic, minced 2 tablespoons chopped fresh rosemary 4 pounds beef brisket, trimmed of fat Salt and pepper to taste 6 ounces portobello mushrooms, thickly sliced, then cut in thirds 1 cup dried cranberries INSTRUCTIONS: Preheat oven to 300.	144:150	0:266	halved and sliced 4 cloves garlic , minced 2 tablespoons chopped fresh rosemary 4 pounds beef brisket , trimmed of fat Salt and pepper to taste 6 ounces portobello mushrooms , thickly sliced , then cut in thirds 1 cup dried cranberries INSTRUCTIONS : Preheat oven to 300 .	27	0:49	halve and slice 4 clove garlic , mince 2 tablespoon chop fresh rosemary 4 pound beef brisket , trim of fat salt and pepper to taste 6 ounce portobello mushroom , thickly slice , then cut in thirds 1 cup dried cranberry instruction : preheat oven to 300 .	vvn_jj@ cc vvn mc nn2 nn1 y vvn_jj mc nn2 vvd_vvn_jj jj nn1 mc nn2 nn1_vv0% nn1_vv0 y vvd_vvn io nn1_jj nn1 cc nn1 to vvi mc nnu2 nn1 nn2 y rr vvn_vvd_jj y rt vvn_vv0 ii_rp@ mf mc1 nn1 jj_vvd_vvn nn2 nn2 y vv0_nn1 nn1 ii mc y
ounce_nn	nnu2	2001	2	mag_2001_414793.txt-199-2	 	* Eight ounces of buttermilk (made from skim milk) provides about 90 calories and is a good source of protein, calcium, and vitamin B2 (riboflavin).	8:14	0:148	* Eight ounces of buttermilk ( made from skim milk ) provides about 90 calories and is a good source of protein , calcium , and vitamin B2 ( riboflavin ) .	2	0:32	* eight ounce of buttermilk ( make from skim milk ) provide about 90 calory and be a good source of protein , calcium , and vitamin b2 ( riboflavin ) .	fu mc nnu2 io nn1 y vvn ii nn1 nn1 y vvz rg mc nnu2 cc vbz at1 jj nn1 io nn1 y nn1 y cc nn1 fo y nn1 y y
ounce_nn	nnu2	1968	2	fic_1968_10508.txt-1909-20	 	The baby girl was born last night at Lenox Hill Hospital, New York, weighing eight pounds, two ounces.	95:101	0:102	The baby girl was born last night at Lenox Hill Hospital , New York , weighing eight pounds , two ounces .	20	0:22	the baby girl be born last night at lenox hill hospital , new york , weigh eight pound , two ounce .	at nn1 nn1 vbdz vvn md nnt1 ii np1 nnl1 nn1 y np1 np1 y vvg_nn1 mc nn2 y mc nnu2 y
