lemma	pos	date	grouping	identifier	description	context	indexes_target_token	indexes_target_sentence	context_tokenized	indexes_target_token_tokenized	indexes_target_sentence_tokenized	context_lemmatized	context_pos
ounce_nn	nnu1	1853	1	mag_1853_566331.txt-172-5	 	The ingredients were, an ounce of the jaw-bone of a dog burned and pulverized, the false tongue of a newly foaled colt, dried and pulverized, and one scruple of verdigris, raised from the surface of old copper, by laying in moist earth -- the coppers of George I, or II, being preferred as most pure.	25:30	0:300	The ingredients were , an ounce of the jaw-bone of a dog burned and pulverized , the false tongue of a newly foaled colt , dried and pulverized , and one scruple of verdigris , raised from the surface of old copper , by laying in moist earth -- the coppers of George I , or II , being preferred as most pure .	5	0:64	the ingredient be , an ounce of the jaw-bone of a dog burn and pulverize , the false tongue of a newly foal colt , dried and pulverize , and one scruple of verdigris , raise from the surface of old copper , by lay in moist earth -- the copper of george i , or ii , be prefer as most pure .	at nn2 vbdr y at1 nnu1 io at nn1 io at1 nn1 vvn_vvd cc vvn y at jj nn1 io at1 rr jj@_vvd nn1 y jj_vvn_vvd cc vvd y cc mc1 nn1 io nn1 y vvn_vvd ii at nn1 io jj nn1 y ii vvg ii_rp@ jj nn1 nn1 at nn2 io np1 mc1 y cc mc y vbg vvn csa_ii@ dat jj y
ounce_nn	nnu1	1821	1	nf_1821_747955.txt-56-5	 	Take of bees wax an ounce, three ounces of ' olive oil, three drams of staves acre; of these	20:25	0:92	Take of bees wax an ounce , three ounces of ' olive oil , three drams of staves acre ; of these	5	0:22	take of bee wax an ounce , three ounce of ' olive oil , three dram of staff acre ; of these	vv0 io nn2 vv0 at1 nnu1 y mc nnu2 io ge jj_nn1 nn1 y mc nn2 io nn2 nnu1 y io dd2
ounce_nn	nnu2	1835	1	nf_1835_747966.txt-510-81	 	Taking North America as the standard, and that the value in silver of the produce of a. year's labour of one man, his wages having been advanced for a year, is two hundred and eighty ounces of silver, the value in silver in Hindostan and in England, of the produce of a year's labour of one man, his wages having been advanced for a year, would also be two hundred and eighty ounces, and as	376:382	0:390	Taking North America as the standard , and that the value in silver of the produce of a. year 's labour of one man , his wages having been advanced for a year , is two hundred and eighty ounces of silver , the value in silver in Hindostan and in England , of the produce of a year 's labour of one man , his wages having been advanced for a year , would also be two hundred and eighty ounces , and as	81	0:85	take north america as the standard , and that the value in silver of the produce of <nul> year 's labour of one man , his wage have be advance for a year , be two hundred and eighty ounce of silver , the value in silver in hindostan and in england , of the produce of a year 's labour of one man , his wage have be advance for a year , would also be two hundred and eighty ounce , and as	vvg nd1 np1 ii_csa at nn1_jj y cc cst at nn1 ii nn1 io at nn1@ io nnu nnt1 ge nn1 io mc1 nn1 y appge nn2 vhg vbn vvn if at1 nnt1 y vbz mc m cc mc nnu2 io nn1 y at nn1 ii nn1 ii np1_<sub> cc ii np1 y io at nn1@ io at1 nnt1 ge nn1 io mc1 nn1 y appge nn2 vhg vbn vvn if at1 nnt1 y vm rr vbi mc m cc mc nnu2 y cc ii_csa
ounce_nn	nnu1	1830	1	mag_1830_554014.txt-186-63	 	The first went round to the left side of the diligence, ai) d having unhooked the iron shoe and placed it under the wheel as an additional security against escape, he opened the door of the interior, and, mounting on the steps, I could hear him distinctly uttering a terrible threat in Spanish, and demanding an ounce of gold from each of the passengers.	312:317	0:354	The first went round to the left side of the diligence , ai ) d having unhooked the iron shoe and placed it under the wheel as an additional security against escape , he opened the door of the interior , and , mounting on the steps , I could hear him distinctly uttering a terrible threat in Spanish , and demanding an ounce of gold from each of the passengers .	63	0:72	the first go round to the left side of the diligence , ai ) d have unhook the iron shoe and place it under the wheel as an additional security against escape , he open the door of the interior , and , mount on the step , i could hear him distinctly utter a terrible threat in spanish , and demand an ounce of gold from each of the passenger .	at md vvd rp ii at jj nn1 io at nn1 y nnu y zz1 vhg vvn at nn1 nn1 cc vvn pph1 ii at nn1 ii_csa at1 jj nn1 ii nn1 y pphs1 vvd at nn1 io at nn1_jj y cc y vvg ii at nn2 y ppis1 vm vvi ppho1 rr vvg at1 jj nn1 ii jj_nn1@ y cc vvg at1 nnu1 io nn1 ii dd1 io at nn2 y
ounce_nn	nnu2	1852	1	nf_1852_748165.txt-2923-19	 	But suppose that a barrel of flour will purchase more wine in Bordeaux, than four dollars or four ounces of silver.	98:104	0:115	But suppose that a barrel of flour will purchase more wine in Bordeaux , than four dollars or four ounces of silver .	19	0:23	but suppose that a barrel of flour will purchase more wine in bordeaux , than four dollar or four ounce of silver .	ccb vv0 cst at1 nn1 io nn1 vm vvi dar nn1 ii np1 y csn mc nnu2 cc mc nnu2 io nn1 y
ounce_nn	nnu1	1844	1	nf_1844_747892.txt-1232-8	 	A recent writer says, he uses one ounce of nitre to one gallon of water, with which he syringes the plants once in ten days, and finds it an effectual cure.	34:39	0:156	A recent writer says , he uses one ounce of nitre to one gallon of water , with which he syringes the plants once in ten days , and finds it an effectual cure .	8	0:35	a recent writer say , he use one ounce of nitre to one gallon of water , with which he syringe the plant once in ten day , and find it an effectual cure .	at1_zz1 jj nn1 vvz y pphs1 vvz mc1 nnu1 io nn1 ii mc1 nnu1 io nn1 y iw ddq pphs1 vvz at nn2 rr ii mc nnt2 y cc vvz pph1 at1 jj nn1 y
ounce_nn	nnu2	1830	1	nf_1830_754783.txt-935-2	 	Take two ounces of shelled bitter almonds or peach-kernels.	9:15	0:59	Take two ounces of shelled bitter almonds or peach-kernels .	2	0:10	take two ounce of shell bitter almond or peach-kernels .	vv0 mc nnu2 io jj@ jj nn2 cc nn2_<sub> y
ounce_nn	nnu1	1853	1	nf_1853_748464.txt-1529-38	 	Put one pound of sulphate of copper in one quart of water; stir it until the sulphate of copper is all dissolved, and then add one half ounce of sulphuric acid and a quarter of an ounce of nitric acid.	180:185	0:201	Put one pound of sulphate of copper in one quart of water ; stir it until the sulphate of copper is all dissolved , and then add one half ounce of sulphuric acid and a quarter of an ounce of nitric acid .	38	0:43	put one pound of sulphate of copper in one quart of water ; stir it until the sulphate of copper be all dissolve , and then add one half ounce of sulphuric acid and a quarter of an ounce of nitric acid .	vv0 mc1 nn1 io nn1 io nn1 ii mc1 nnu1 io nn1 y vv0 pph1 cs_ii@ at nn1 io nn1 vbz rr@_db vvn_vvd y cc rt vv0 pn1_mc1 db nnu1 io jj nn1 cc at1 nn1 io at1 nnu1 io jj nn1 y
ounce_nn	nnu2	1839	1	nf_1839_747610.txt-1318-6	 	It is, to hire 220,000 ounces of silver or gold equivalent, for ten years at four per cent, in England, on the credit of the Province.	23:29	0:134	It is , to hire 220,000 ounces of silver or gold equivalent , for ten years at four per cent , in England , on the credit of the Province .	6	0:31	it be , to hire 220,000 ounce of silver or gold equivalent , for ten year at four per cent , in england , on the credit of the province .	pph1 vbz y to vvi mc nnu2 io nn1 cc nn1_jj@ nn1@_jj y if mc nnt2 ii mc nnu21 nnu22 y ii np1 y ii at nn1 io at nn1 y
ounce_nn	nnu1	1853	1	nf_1853_748464.txt-1043-9	 	For this purpose, take one and a half ounce of each, to which add ten ounces water, for warm weather, or from six to seven for cold.	38:43	0:132	For this purpose , take one and a half ounce of each , to which add ten ounces water , for warm weather , or from six to seven for cold .	9	0:32	for this purpose , take one and a half ounce of each , to which add ten ounce water , for warm weather , or from six to seven for cold .	if dd1 nn1 y vv0 mc1_pn1 cc at1 db nnu1 io dd1 y ii ddq vv0 mc nnu2 nn1 y if jj nn1 y cc ii mc ii mc if nn1_jj y
ounce_nn	nnu2	1853	1	mag_1853_555823.txt-95-26	 	Corresponding official returns of the gold plate annually manufactured in England, on which duty was paid, show that the average did not exceed 7,000 ounces troy, or about?	150:156	0:172	Corresponding official returns of the gold plate annually manufactured in England , on which duty was paid , show that the average did not exceed 7,000 ounces troy , or about ?	26	0:32	corresponding official return of the gold plate annually manufacture in england , on which duty be pay , show that the average do not exceed 7,000 ounce troy , or about ?	jj_vvg jj_nn1 nn2 io at nn1_jj@ nn1 rr vvn ii np1 y ii ddq nn1 vbdz vvn y vv0 cst at nn1 vdd xx vvi mc nnu2 nn1 y cc ii_rp@ y
ounce_nn	nnu2	1850	1	mag_1850_525559.txt-174-41	 	Gold is worth a dollar more the ounce measured by the standard of silver, in New York than inSanFrancisco; if, therefore, a merchant of Valparaiso receives m payment for lumber, or other produce, ten thousand ounces of gold in San Francisco, and desires to purchase goods from the United States or Europe, he will gain $10,000 by sending this gold to New York, and purchasing with it there.	209:215	0:390	Gold is worth a dollar more the ounce measured by the standard of silver , in New York than inSanFrancisco ; if , therefore , a merchant of Valparaiso receives m payment for lumber , or other produce , ten thousand ounces of gold in San Francisco , and desires to purchase goods from the United States or Europe , he will gain $10,000 by sending this gold to New York , and purchasing with it there .	41	0:78	gold be worth a dollar more the ounce measure by the standard of silver , in new york than insanfrancisco ; if , therefore , a merchant of valparaiso receive m payment for lumber , or other produce , ten thousand ounce of gold in san francisco , and desire to purchase good from the united state or europe , he will gain $10,000 by send this gold to new york , and purchase with it there .	nn1 vbz ii at1 nnu1 rrr at nnu1 jj@ ii at nn1 io nn1 y ii np1 np1 csn rr_<sub> y cs y rr y at1 nn1 io np1 vvz nnu@_mc@_zz1 nn1 if nn1 y cc jj nn1@ y mc m nnu2 io nn1 ii np1 np1 y cc vvz_nn2 to vvi nn2 ii at np1 np1 cc np1 y pphs1 vm vvi nnu ii vvg dd1 nn1 ii np1 np1 y cc vvg_nn1 iw pph1 rl y
ounce_nn	nnu1	1833	1	nf_1833_747505.txt-2334-62	 	In the third year of Q, ueen Anne, an attempt was made to put an end to this confusion, by a Royal Proclamation and act of Parliament, fixing the plantation pound at two ounces sixteen pennyweights sixteen grains of silver, of the fineness of common pieces of eight, at six shillings and ten pence half-penny per ounce; but, from various causes, the act proved effective in Barbadoes only.	313:318	0:389	In the third year of Q , ueen Anne , an attempt was made to put an end to this confusion , by a Royal Proclamation and act of Parliament , fixing the plantation pound at two ounces sixteen pennyweights sixteen grains of silver , of the fineness of common pieces of eight , at six shillings and ten pence half-penny per ounce ; but , from various causes , the act proved effective in Barbadoes only .	62	0:78	in the third year of q , ueen anne , an attempt be make to put an end to this confusion , by a royal proclamation and act of parliament , fix the plantation pound at two ounce sixteen pennyweights sixteen grain of silver , of the fineness of common piece of eight , at six shilling and ten pence half-penny per ounce ; but , from various cause , the act prove effective in barbadoes only .	ii at md nnt1 io zz1 y jj_nn1 np1 y at1 nn1 vbdz vvn to vvi at1 nn1 ii dd1 nn1 y ii at1 jj nn1 cc nn1 io nn1 y vvg at nn1 nn1 ii mc nnu2 mc nn2 mc nn2 io nn1 y io at nn1 io jj nn2 io mc y ii mc nn2 cc mc nnu nnu1 ii nnu1 y ccb y ii jj nn2 y at nn1 vvd_vvn jj ii np1_nn2 rr y
ounce_nn	nnu1	1850	1	nf_1850_747863.txt-2462-4	 	Eighteen Ounce, Twenty Ounce Pippin, erroneously.)	23:28	0:50	Eighteen Ounce , Twenty Ounce Pippin , erroneously . )	4	0:10	eighteen ounce , twenty ounce pippin , erroneously . )	mc nnu1 y mc nnu1 nn1_np1 y rr y y
ounce_nn	nnu1	1856	1	fic_1856_9779.txt-8800-18	 	Then, here comes the field-piece, of which such large expectations are formed; and not an ounce of powder! "	90:95	0:108	Then , here comes the field-piece , of which such large expectations are formed ; and not an ounce of powder ! "	18	0:23	then , here come the field-piece , of which such large expectation be form ; and not an ounce of powder ! "	rt y rl vvz at jj_<sub> y io ddq da jj nn2 vbr vvn y cc xx at1 nnu1 io nn1 ! "
ounce_nn	nnu1	1837	1	nf_1837_757476.txt-2889-24	 	Prepare, by pounding them in a mortar, two ounces of mustard seed, half an ounce of black pepper, half an ounce of nutmeg, a quarter of an ounce of mace, and a quarter of an ounce of cloves.	106:111	0:190	Prepare , by pounding them in a mortar , two ounces of mustard seed , half an ounce of black pepper , half an ounce of nutmeg , a quarter of an ounce of mace , and a quarter of an ounce of cloves .	24	0:45	prepare , by pound them in a mortar , two ounce of mustard seed , half an ounce of black pepper , half an ounce of nutmeg , a quarter of an ounce of mace , and a quarter of an ounce of clove .	vv0 y ii vvg@ ppho2 ii_rp@ at1 nn1 y mc nnu2 io nn1 nn1 y db_rr@ at1 nnu1 io jj nn1 y db_rr@ at1 nnu1 io nn1 y at1 nn1 io at1 nnu1 io nn1 y cc at1 nn1 io at1 nnu1 io nn2 y
ounce_nn	nnu1	1845	1	mag_1845_522622.txt-197-7	 	Thus, all letters under half an ounce weight pay one penny; all letters above half an ounce, and not exceeding an ounce, pay twopence; all letters above an ounce, and not exceeding two	32:37	0:184	Thus , all letters under half an ounce weight pay one penny ; all letters above half an ounce , and not exceeding an ounce , pay twopence ; all letters above an ounce , and not exceeding two	7	0:39	thus , all letter under half an ounce weight pay one penny ; all letter above half an ounce , and not exceed an ounce , pay twopence ; all letter above an ounce , and not exceed two	rr y db nn2 rg db at1 nnu1 nn1 nn1_vv0 mc1 nnu1 y db nn2 ii_rl db at1 nnu1 y cc xx vvg at1 nnu1 y vv0_nn1 nn y db nn2 ii_<sub> at1 nnu1 y cc xx vvg mc
ounce_nn	nnu2	1849	1	nf_1849_747900.txt-864-29	 	The story is as follows: " A poor Indian appeared before the viceroy, and stated that he had found in the street a bag full of golden ounces, which had been advertised, with the promise of a handsome reward to the person who should restore them to the owner; that upon carrying it to the Don he received the bag, counted the ounces, extracted two, which he had seen him slip into his pocket; and had then reproached the poor man with having stolen part of the money, had called him a thief and	134:140	0:493	The story is as follows : " A poor Indian appeared before the viceroy , and stated that he had found in the street a bag full of golden ounces , which had been advertised , with the promise of a handsome reward to the person who should restore them to the owner ; that upon carrying it to the Don he received the bag , counted the ounces , extracted two , which he had seen him slip into his pocket ; and had then reproached the poor man with having stolen part of the money , had called him a thief and	29	0:104	the story be as follow : " a poor indian appear before the viceroy , and state that he have find in the street a bag full of golden ounce , which have be advertise , with the promise of a handsome reward to the person who should restore them to the owner ; that upon carry it to the don he receive the bag , count the ounce , extract two , which he have see him slip into his pocket ; and have then reproach the poor man with have steal part of the money , have call him a thief and	at nn1 vbz csa vvz y " zz1_at1@ jj nn1@_jj vvd_vvn@ ii_cs at nn1 y cc vvd_vvn cst pphs1 vhd vvn ii at nn1 at1 nn1 jj io jj nnu2 y ddq vhd vbn vvn y iw at nn1 io at1 jj nn1 ii at nn1 pnqs vm vvi ppho2 ii at nn1 y dd1_cst ii vvg pph1 ii at nn1_np1 pphs1 vvd at nn1 y vvd_vvn at nnu2 y vvd_vvn mc y ddq pphs1 vhd vvn ppho1 vvi ii appge nn1 y cc vhd rt vvn at jj nn1 iw vhg vvn nn1 io at nn1 y vhd vvn ppho1 at1 nn1 cc
ounce_nn	nnu1	1821	1	nf_1821_747955.txt-493-6	 	Or you may dissolve half an ounce of gum Senegal, or Arabic, in half a pint of water; then put a penny-worth of vermillion into a small gallipot, and pour some of the gumwater to it, and stir it well, and mix it together with a hair pencil, to a proper consistency; but it will not incoporate presently, but by the next day it will; then having a clean pen, dip it into the ink, having first well stirred it with a pencil, and	28:33	0:426	Or you may dissolve half an ounce of gum Senegal , or Arabic , in half a pint of water ; then put a penny-worth of vermillion into a small gallipot , and pour some of the gumwater to it , and stir it well , and mix it together with a hair pencil , to a proper consistency ; but it will not incoporate presently , but by the next day it will ; then having a clean pen , dip it into the ink , having first well stirred it with a pencil , and	6	0:97	or you may dissolve half an ounce of gum senegal , or arabic , in half a pint of water ; then put a penny-worth of vermillion into a small gallipot , and pour some of the gumwater to it , and stir it well , and mix it together with a hair pencil , to a proper consistency ; but it will not incoporate presently , but by the next day it will ; then have a clean pen , dip it into the ink , have first well stir it with a pencil , and	cc ppy vm vvi db at1 nnu1 io nn1 np1 y cc nn1_jj y ii db at1 nnu1 io nn1 y rt vv0_vvd_vvn at1 nn1@_jj io nn1 ii at1 jj nn1_<sub> y cc vv0 dd io at nn1_<sub> ii pph1 y cc vv0 pph1 rr y cc vv0 pph1 rl iw at1 nn1 nn1 y ii at1 jj nn1 y ccb pph1 vm xx vvi rr y ccb ii at md nnt1 pph1 vm_nn1@ y rt vhg at1 jj nn1 y vv0 pph1 ii at nn1 y vhg md rr vvn pph1 iw at1 nn1 y cc
ounce_nn	nnu1	1853	1	nf_1853_748464.txt-1527-19	 	After filling the cell, of common size, nearly full with water; add about quarter of an ounce of sulphuric acid.	88:93	0:112	After filling the cell , of common size , nearly full with water ; add about quarter of an ounce of sulphuric acid .	19	0:24	after fill the cell , of common size , nearly full with water ; add about quarter of an ounce of sulphuric acid .	ii vvg at nn1 y io jj nn1 y rr jj iw nn1 y vv0 rg nn1 io at1 nnu1 io jj nn1 y
ounce_nn	nnu1	1853	1	nf_1853_748464.txt-725-20	 	This can be readily done by pouring one ounce and a half of muriatic acid upon a quarter of an ounce of powdered black oxide of manganese, and heat it gradually in a flask, to which is adapted a bent glass tube.	95:100	0:211	This can be readily done by pouring one ounce and a half of muriatic acid upon a quarter of an ounce of powdered black oxide of manganese , and heat it gradually in a flask , to which is adapted a bent glass tube .	20	0:45	this can be readily do by pour one ounce and a half of muriatic acid upon a quarter of an ounce of powdered black oxide of manganese , and heat it gradually in a flask , to which be adapt a bend glass tube .	dd1 vm vbi rr vdn ii vvg mc1 nnu1 cc at1 nn1@_db io jj nn1 ii at1 nn1 io at1 nnu1 io jj jj nn1 io nn1 y cc vv0@_nn1 pph1 rr ii at1 nn1 y ii ddq vbz vvn at1 jj@ nn1 nn1 y
ounce_nn	nnu1	1827	1	fic_1827_7168.txt-1308-148	 	wrought on, considering that every story he had heard, was strongly attested; some of the narrators having gone so far as to say, that if necessary, they would not mind swearing to what they had beheld on the brass clasps of Dominie Van Gieson's great parchment covered Bible, -- a folio, whose size and sacredness, was believed to be hallowed: and further, as to the very manner and distinct dress of the relations, the vividness of the Hollander's recollection, seemed to perfect itself nearly in a moment, as he looked about him midst the darkness of the forest; the groan of the tall pine tree, disturbed by the blast, as it rushed with the wing of an eagle o'er its towering crest, the sudden and startling yell of the ounce, as it roamed abroad in the jungles of the mountain, were conjured up, and dressed out in the livery of dire and nameless phantasies of the woud gest ' and the koubold; -- and ever and anon,	724:729	0:920	wrought on , considering that every story he had heard , was strongly attested ; some of the narrators having gone so far as to say , that if necessary , they would not mind swearing to what they had beheld on the brass clasps of Dominie Van Gieson 's great parchment covered Bible , -- a folio , whose size and sacredness , was believed to be hallowed : and further , as to the very manner and distinct dress of the relations , the vividness of the Hollander 's recollection , seemed to perfect itself nearly in a moment , as he looked about him midst the darkness of the forest ; the groan of the tall pine tree , disturbed by the blast , as it rushed with the wing of an eagle o'er its towering crest , the sudden and startling yell of the ounce , as it roamed abroad in the jungles of the mountain , were conjured up , and dressed out in the livery of dire and nameless phantasies of the woud gest ' and the koubold ; -- and ever and anon ,	148	0:191	work on , consider that every story he have hear , be strongly attest ; some of the narrator have go so far as to say , that if necessary , they would not mind swear to what they have behold on the brass clasp of dominie van gieson 's great parchment cover bible , -- a folio , whose size and sacredness , be believe to be hallowed : and far , as to the very manner and distinct dress of the relation , the vividness of the hollander 's recollection , seem to perfect itself nearly in a moment , as he look about him midst the darkness of the forest ; the groan of the tall pine tree , disturb by the blast , as it rush with the wing of an eagle over its towering crest , the sudden and startling yell of the ounce , as it roam abroad in the jungle of the mountain , be conjure up , and dress out in the livery of dire and nameless phantasy of the woud gest ' and the koubold ; -- and ever and anon ,	vvn rp@_ii y cs21 cs22 at1 nn1 pphs1 vhd vvn y vbdz rr vvn y dd io at nn2 vhg vvn rg rr csa to vvi y cst_dd1 cs jj y pphs2 vm xx vvi vvg_nn1 ii ddq pphs2 vhd vvn ii at nn1 nn2_vvz io np1 np1 np1 ge jj nn1 vvd_vvn_jj@ nn1 y z at1 nn1 y ddqge nn1 cc nn1 y vbdz vvn to vbi jj y cc rrr y ii21_csa ii22_ii at jj nn1 cc jj nn1 io at nn2 y at nn1 io at np1 ge nn1 y vvd to vvi ppx1 rr ii at1 nn1 y csa pphs1 vvd ii ppho1 nn1 at nn1 io at nn1 y at nn1 io at jj nn1 nn1 y vvn ii at nn1 y csa pph1 vvd_vvn iw at nn1 io at1 nn1 ii_rp appge jj nn1 y at jj cc jj_vvg nn1 io at nnu1 y csa pph1 vvd rl ii at nn2 io at nn1 y vbdr vvn rp y cc vvn_vvd@ rp ii at nn1 io jj cc jj nn2 io at nn1 jjt ge cc at nn1_<sub> y z cc rr cc rr_jj y
ounce_nn	nnu2	1858	1	fic_1858_1282.txt-4291-47	 	And when it did, a great excitement was got up against Leon, who was charged with various crimes against the dignity of the family; indeed, so far was their indignation carried that several ambitious members of the family threatened him with no few ounces of cold lead.	249:255	0:269	And when it did , a great excitement was got up against Leon , who was charged with various crimes against the dignity of the family ; indeed , so far was their indignation carried that several ambitious members of the family threatened him with no few ounces of cold lead .	47	0:52	and when it do , a great excitement be get up against leon , who be charge with various crime against the dignity of the family ; indeed , so far be their indignation carry that several ambitious member of the family threaten him with no few ounce of cold lead .	cc cs_rrq pph1 vdd y at1 jj nn1 vbdz vvn rp ii np1 y pnqs vbdz vvn iw jj nn2 ii at nn1 io at nn1 y rr y rg rr vbdz appge nn1 vvn cst%_dd1 da2 jj nn2 io at nn1 vvd_vvn ppho1 iw at da2 nnu2 io jj_nn1 nn1 y
ounce_nn	nnu1	1821	1	nf_1821_747955.txt-297-4	 	Take sea stonewort an ounce sea onions one /z/ ounce, mix together, and throw where eels come.	22:27	0:94	Take sea stonewort an ounce sea onions one /z/ ounce , mix together , and throw where eels come .	4	0:20	take sea stonewort an ounce sea onion one /z/ ounce , mix together , and throw where eel come .	vv0 nn1 vv0_nn1 at1 nnu1 nn1 nn2 mc1 jj nnu1 y vv0 rl y cc vv0_nn1 rrq_cs nn2 vv0 y
ounce_nn	nnu2	1849	1	mag_1849_525337.txt-223-10	 	If any man is fortunate enough to find a few ounces at the surface, it is heralded by the storekeepers and others interested in promoting emigration, to all parts of the world, while nothing is heard of the thousands who are daily undergoing extreme labor, sickness, and privation, without a return sufficient to pay their expenses.	45:51	0:332	If any man is fortunate enough to find a few ounces at the surface , it is heralded by the storekeepers and others interested in promoting emigration , to all parts of the world , while nothing is heard of the thousands who are daily undergoing extreme labor , sickness , and privation , without a return sufficient to pay their expenses .	10	0:63	if any man be fortunate enough to find a few ounce at the surface , it be herald by the storekeeper and other interested in promote emigration , to all part of the world , while nothing be hear of the thousands who be daily undergo extreme labor , sickness , and privation , without a return sufficient to pay their expense .	cs dd nn1 vbz jj rr to vvi at1 da2 nnu2 ii at nn1 y pph1 vbz vvn ii at nn2 cc nn2 jj ii vvg_jj@ nn1 y ii db nn2 io at nn1 y cs pn1 vbz vvn io at m pnqs vbr rr vvg jj nn1 y nn1 y cc nn1 y iw at1 jj@_nn1 jj to vvi appge nn2 y
