lemma	pos	date	grouping	identifier	description	context	indexes_target_token	indexes_target_sentence	context_tokenized	indexes_target_token_tokenized	indexes_target_sentence_tokenized	context_lemmatized	context_pos	context_normalized
abgebrüht	ADJA	1883	1	silberer_traber_1883-107-21	 	Von dem Zeitpunkte an, wo das Fohlen abgesetzt wurde, kann man ihm manchmal warmes Mash (mit heissem Wasser abgebrühte Weizenkleie) mit darunter gemischtem Hafer verabreichen.	108:118	0:175	Von dem Zeitpunkte an , wo das Fohlen abgesetzt wurde , kann man ihm manchmal warmes Mash ( mit heissem Wasser abgebrühte Weizenkleie ) mit darunter gemischtem Hafer verabreichen .	21	0:30	von d Zeitpunkt an , wo d Fohlen absetzen werden , können man er manchmal warm Mash ( mit heiß Wasser abgebrüht Weizenkleie ) mit darunter gemischt Hafer verabreichen .	APPR ART NN PTKVZ $, PWAV ART NN VVPP VAFIN $, VMFIN PIS PPER ADV ADJA NE $( APPR ADJA NN ADJA NN $( APPR PAV ADJA NN VVINF $.	Von dem Zeitpunkte an , wo das Fohlen abgesetzt wurde , kann man ihm manchmal warmes Mash ( mit heißem Wasser abgebrühte Weizenkleie ) mit darunter gemischtem Hafer verabreichen .
abgebrüht	ADJA	1879	1	davidis_kochbuch_1879-7229-4	 	Man läßt 1 Unze abgebrühtes isländisches Moos mit 1 1/8 Quart Wasser 3 Stunden bis zu 3 Tassen einkochen.	16:27	0:105	Man läßt 1 Unze abgebrühtes isländisches Moos mit 1 1/8 Quart Wasser 3 Stunden bis zu 3 Tassen einkochen .	4	0:20	man lassen 1 Unze abgebrüht isländisch Moos mit 1 1/8 Quart Wasser 3 Stunde bis zu 3 Tasse einkochen .	PIS VVFIN CARD NN ADJA ADJA NN APPR CARD CARD NN NN CARD NN APPR APPR CARD NN VVINF $.	Man läßt 1 Unze abgebrühtes isländisches Moos mit 1 1/8 Quart Wasser 3 Stunden bis zu 3 Tassen einkochen .
abgebrüht	ADJA	1849	1	davidis_kochbuch_1849-2062-61	 	Nachdem es gut gewaschen, mit Wasser und Salz rein ausgeschäumt, gibt man die Brühe nach Verlauf von einer starken halben Stunde durch ein Sieb, schwitzt wie in No. 2, Mehl in Butter, schüttet die Kalbfleischbrühe vom Bodensatz langsam hinzu, gibt eine Petersilien-und einige Scorzoner-Wurzeln dazu, so wie ½ Stunde vor dem Anrichten abgebrühten Reis, und kocht die Suppe langsam, fest zugedeckt, gahr.	334:345	0:402	Nachdem es gut gewaſchen , mit Waſſer und Salz rein ausgeſchäumt , gibt man die Brühe nach Verlauf von einer ſtarken halben Stunde durch ein Sieb , ſchwitzt wie in No. 2 , Mehl in Butter , ſchüttet die Kalbfleiſchbrühe vom Bodenſatz langſam hinzu , gibt eine Peterſilien- und einige Scorzoner- Wurzeln dazu , ſo wie ½ Stunde vor dem Anrichten abgebrühten Reis , und kocht die Suppe langſam , feſt zugedeckt , gahr .	61	0:75	nachdem es gut waschen , mit Wasser und Salz rein ausschäumen , geben man d Brühe nach Verlauf von eine stark halb Stunde durch eine Sieb , schwitzen wie in No. 2 , Mehl in Butter , schütten d Kalbfleischbrühe vom Bodensatz langsam hinzu , geben eine petersilien- und einige scorzoner- Wurzel dazu , so wie ½ Stunde vor d Anrichte abgebrüht Reis , und kochen d Suppe langsam , fest zudecken , gar .	KOUS PPER ADJD VVPP $, APPR NN KON NN ADJD VVPP $, VVFIN PIS ART NN APPR NN APPR ART ADJA ADJA NN APPR ART NN $, VVFIN KOKOM APPR NE CARD $, NN APPR NN $, VVFIN ART NN APPRART NN ADJD PTKVZ $, VVFIN ART TRUNC KON PIAT TRUNC NN PAV $, ADV KOKOM ADJA NN APPR ART NN ADJA NN $, KON VVFIN ART NN ADJD $, ADJD VVPP $, ADV $.	Nachdem es gut gewaschen , mit Wasser und Salz rein ausgeschäumt , gibt man die Brühe nach Verlauf von einer starken halben Stunde durch ein Sieb , schwitzt wie in No. 2 , Mehl in Butter , schüttet die Kalbfleischbrühe vom Bodensatz langsam hinzu , gibt eine Petersilien- und einige Scorzoner- Wurzeln dazu , so wie ½ Stunde vor dem Anrichten abgebrühten Reis , und kocht die Suppe langsam , fest zugedeckt , gar .
abgebrüht	ADJD	1849	1	davidis_kochbuch_1849-7327-6	 	Es wird eine Tasse Reis gut abgebrüht, mit einem Stück feinen Zimmet in einen irdenen Topf zu einem Maß kochendem Wasser gegeben, weich gekocht, ohne Rühren durch ein Sieb geschüttet und mit Zucker versüßt.	28:37	0:206	Es wird eine Taſſe Reis gut abgebrüht , mit einem Stück feinen Zimmet in einen irdenen Topf zu einem Maß kochendem Waſſer gegeben , weich gekocht , ohne Rühren durch ein Sieb geſchüttet und mit Zucker verſüßt .	6	0:38	es werden eine Tasse Reis gut abgebrüht , mit eine Stück fein Zimt in eine irden Topf zu eine Maß kochend Wasser geben , weich kochen , ohne Rühren durch eine Sieb schütten und mit Zucker versüßen .	PPER VAFIN ART NN NN ADJD ADJD $, APPR ART NN ADJA NN APPR ART ADJA NN APPR ART NN ADJA NN VVPP $, ADJD VVPP $, KOUI NN APPR ART NN VVPP KON APPR NN VVPP $.	Es wird eine Tasse Reis gut abgebrüht , mit einem Stück feinen Zimt in einen irdenen Topf zu einem Maß kochendem Wasser gegeben , weich gekocht , ohne Rühren durch ein Sieb geschüttet und mit Zucker versüßt .
abgebrüht	ADJD	1879	1	davidis_kochbuch_1879-3870-3	 	Ist der Reis abgebrüht, so setze man ihn nach vorhergehender Angabe aufs Feuer und gebe, wenn er 1/4 Stunde gekocht hat, ausgesuchte und gewaschene Rosinen dazu und lasse ihn weich werden, aber nicht zerkochen.	13:22	0:210	Ist der Reis abgebrüht , so setze man ihn nach vorhergehender Angabe aufs Feuer und gebe , wenn er 1/4 Stunde gekocht hat , ausgesuchte und gewaschene Rosinen dazu und lasse ihn weich werden , aber nicht zerkochen .	3	0:39	sein d Reis abgebrüht , so setzen man er nach vorhergehend Angabe aufs Feuer und geben , wenn er 1/4 Stunde kochen haben , ausgesucht und gewaschen Rosine dazu und lassen er weich werden , aber nicht zerkochen .	VAFIN ART NN ADJD $, ADV VVFIN PIS PPER APPR ADJA NN APPRART NN KON VVFIN $, KOUS PPER CARD NN VVPP VAFIN $, ADJA KON ADJA NN PAV KON VVFIN PPER ADJD VAINF $, ADV PTKNEG VVINF $.	Ist der Reis abgebrüht , so setze man ihn nach vorhergehender Angabe aufs Feuer und gebe , wenn er 1/4 Stunde gekocht hat , ausgesuchte und gewaschene Rosinen dazu und lasse ihn weich werden , aber nicht zerkochen .
abgebrüht	ADJA	1879	1	davidis_kochbuch_1879-2344-30	 	Beim Gebrauch wird es mit nicht zu vielem Wasser und Salz abgeschäumt, mit einigen Zwiebeln, 4 Lorberblättern, Pfeffer und Nelken (auch nach Belieben mit zwei Handvoll abgebrühten Pflaumen) gahr gekocht.	168:179	0:203	Beim Gebrauch wird es mit nicht zu vielem Wasser und Salz abgeschäumt , mit einigen Zwiebeln , 4 Lorberblättern , Pfeffer und Nelken ( auch nach Belieben mit zwei Handvoll abgebrühten Pflaumen ) gahr gekocht .	30	0:36	beim Gebrauch werden es mit nicht zu viel Wasser und Salz abschäumen , mit einige Zwiebel , 4 Lorberblättern , Pfeffer und Nelke ( auch nach Belieben mit zwei Handvoll abgebrüht Pflaume ) gar kochen .	APPRART NN VAFIN PPER APPR PTKNEG PTKA PIS NN KON NN VVPP $, APPR PIAT NN $, CARD NE $, NN KON NN $( ADV APPR NN APPR CARD NN ADJA NN $( ADV VVPP $.	Beim Gebrauch wird es mit nicht zu vielem Wasser und Salz abgeschäumt , mit einigen Zwiebeln , 4 Lorberblättern , Pfeffer und Nelken ( auch nach Belieben mit zwei Handvoll abgebrühten Pflaumen ) gar gekocht .
abgebrüht	ADJD	1879	1	davidis_kochbuch_1879-721-7	 	Echter Sago wird zweimal mit heißem Wasser abgebrüht, mit heißem, weichem Wasser aufs Feuer gebracht, und mit einigen Zitronenscheiben weich gekocht, welches etwa 2–2½ Stunden dauert; Perlsago, welcher aus Kartoffelmehl bereitet ist, bedarf nicht des Abgießens und nur einer Stunde Kochens.	43:52	0:290	Echter Sago wird zweimal mit heißem Wasser abgebrüht , mit heißem , weichem Wasser aufs Feuer gebracht , und mit einigen Zitronenscheiben weich gekocht , welches etwa 2–2½ Stunden dauert ; Perlsago , welcher aus Kartoffelmehl bereitet ist , bedarf nicht des Abgießens und nur einer Stunde Kochens .	7	0:49	echt Sago werden zweimal mit heiß Wasser abgebrüht , mit heiß , weich Wasser aufs Feuer bringen , und mit einige Zitronenscheibe weich kochen , welche etwa 2-21/2 Stunde dauern ; Perlsago , welche aus Kartoffelmehl bereiten sein , bedürfen nicht d Abgießen und nur eine Stunde Kochen .	ADJA NN VAFIN ADV APPR ADJA NN ADJD $, APPR ADJA $, ADJA NN APPRART NN VVPP $, KON APPR PIAT NN ADJD VVPP $, PRELS ADV CARD NN VVFIN $. NN $, PRELS APPR NN VVPP VAFIN $, VVFIN PTKNEG ART NN KON ADV ART NN NE $.	Echter Sago wird zweimal mit heißem Wasser abgebrüht , mit heißem , weichem Wasser aufs Feuer gebracht , und mit einigen Zitronenscheiben weich gekocht , welches etwa 2-21/2 Stunden dauert ; Perlsago , welcher aus Kartoffelmehl bereitet ist , bedarf nicht des Abgießens und nur einer Stunde Kochens .
abgebrüht	ADJD	1849	1	davidis_kochbuch_1849-3482-6	 	Drei Viertel Pfund Reis wird gut abgebrüht, in Wasser gahr gekocht, doch müssen die Körner ganz bleiben.	33:42	0:104	Drei Viertel Pfund Reis wird gut abgebrüht , in Waſſer gahr gekocht , doch müſſen die Körner ganz bleiben .	6	0:20	drei Viertel Pfund Reis werden gut abgebrüht , in Wasser gar kochen , doch müssen d Korn ganz bleiben .	CARD NN NN NN VAFIN ADJD ADJD $, APPR NN ADV VVPP $, ADV VMFIN ART NN ADV VVINF $.	Drei Viertel Pfund Reis wird gut abgebrüht , in Wasser gar gekocht , doch müssen die Körner ganz bleiben .
abgebrüht	ADJA	1879	1	davidis_kochbuch_1879-583-65	 	Nachdem es gut gewaschen, in Wasser und Salz abgeschäumt, gibt man die Brühe nach Verlauf von einer halben Stunde durch ein Sieb, schwitzt wie in No. 7 etwas Mehl in die Butter, gießt die Kalbfleischbrühe vom Bodensatz langsam hinzu, gibt eine Petersilienwurzel, auch, wenn man sie hat, einige Scorzonern hinein, sowie 1 Stunde vor dem Anrichten abgebrühten Reis.	346:357	0:363	Nachdem es gut gewaschen , in Wasser und Salz abgeschäumt , gibt man die Brühe nach Verlauf von einer halben Stunde durch ein Sieb , schwitzt wie in No. 7 etwas Mehl in die Butter , gießt die Kalbfleischbrühe vom Bodensatz langsam hinzu , gibt eine Petersilienwurzel , auch , wenn man sie hat , einige Scorzonern hinein , sowie 1 Stunde vor dem Anrichten abgebrühten Reis .	65	0:68	nachdem es gut waschen , in Wasser und Salz abschäumen , geben man d Brühe nach Verlauf von eine halb Stunde durch eine Sieb , schwitzen wie in No. 7 etwas Mehl in d Butter , gießen d Kalbfleischbrühe vom Bodensatz langsam hinzu , geben eine Petersilienwurzel , auch , wenn man sie haben , einige Scorzone hinein , sowie 1 Stunde vor d Anrichte abgebrüht Reis .	KOUS PPER ADJD VVPP $, APPR NN KON NN VVPP $, VVFIN PIS ART NN APPR NN APPR ART ADJA NN APPR ART NN $, VVFIN KOKOM APPR NN CARD PIAT NN APPR ART NN $, VVFIN ART NN APPRART NN ADJD PTKVZ $, VVFIN ART NN $, ADV $, KOUS PIS PPER VAFIN $, PIAT NN PTKVZ $, KON CARD NN APPR ART NN ADJA NN $.	Nachdem es gut gewaschen , in Wasser und Salz abgeschäumt , gibt man die Brühe nach Verlauf von einer halben Stunde durch ein Sieb , schwitzt wie in No. 7 etwas Mehl in die Butter , gießt die Kalbfleischbrühe vom Bodensatz langsam hinzu , gibt eine Petersilienwurzel , auch , wenn man sie hat , einige Scorzonen hinein , sowie 1 Stunde vor dem Anrichten abgebrühten Reis .
abgebrüht	ADJD	1879	1	davidis_kochbuch_1879-6112-25	 	No. 3. 4 Eigelb, 1 große saftige Zitrone, ¾ Tasse Zucker, 1 Soda-Cracker, fein gerollt, mit 1½ Tasse kochendem Wasser abgebrüht, Zucker, Eigelb, abgeriebene Schale und Saft der Zitrone hinzugedrückt, auf den Pie gegossen und gebacken.	118:127	0:234	No. 3. 4 Eigelb , 1 große saftige Zitrone , ¾ Tasse Zucker , 1 Soda-Cracker , fein gerollt , mit 1½ Tasse kochendem Wasser abgebrüht , Zucker , Eigelb , abgeriebene Schale und Saft der Zitrone hinzugedrückt , auf den Pie gegossen und gebacken .	25	0:46	No. 3. 4 Eigelb , 1 groß saftig Zitrone , ¾ Tasse Zucker , 1 Soda-Cracker , fein rollen , mit 11/2 Tasse kochend Wasser abgebrüht , Zucker , Eigelb , abgereiben Schale und Saft d Zitrone hinzudrücken , auf d Pie gießen und backen .	NE ADV CARD NN $, CARD ADJA ADJA NN $, ADJA NN NN $, CARD NE $, ADJD VVPP $, APPR CARD NN ADJA NN ADJD $, NN $, NN $, ADJA NN KON NN ART NN VVPP $, APPR ART NN VVPP KON VVPP $.	No. 3. 4 Eigelb , 1 große saftige Zitrone , ¾ Tasse Zucker , 1 Soda-Cracker , fein gerollt , mit 11/2 Tasse kochendem Wasser abgebrüht , Zucker , Eigelb , abgeriebene Schale und Saft der Zitrone hinzugedrückt , auf den Pie gegossen und gebacken .
abgebrüht	ADJD	1886	1	rein_japan02_1886-2847-26	 	Nachdem man dieselben ausgegraben hat, werden sie von den Fasern und andern Anhängseln befreit und sorgfältig abgewaschen, darauf rasch in kochendem Wasser oder Wasserdampf abgebrüht, so dass sie nachher auf dem Querschnitt braungelb und gallertartig aussehen.	173:182	0:260	Nachdem man dieselben ausgegraben hat , werden sie von den Fasern und andern Anhängseln befreit und sorgfältig abgewaschen , darauf rasch in kochendem Wasser oder Wasserdampf abgebrüht , so dass sie nachher auf dem Querschnitt braungelb und gallertartig aussehen .	26	0:40	nachdem man dieselbe ausgraben haben , werden sie von d Faser und ander Anhängsel befreien und sorgfältig abwaschen , darauf rasch in kochend Wasser oder Wasserdampf abgebrüht , so dass sie nachher auf d Querschnitt braungelb und gallertartig aussehen .	KOUS PIS PDAT VVPP VAFIN $, VAFIN PPER APPR ART NN KON ADJA NN VVPP KON ADJD VVPP $, PAV ADJD APPR ADJA NN KON NN ADJD $, ADV KOUS PPER ADV APPR ART NN ADJD KON ADJD VVINF $.	Nachdem man dieselben ausgegraben hat , werden sie von den Fasern und anderen Anhängseln befreit und sorgfältig abgewaschen , darauf rasch in kochendem Wasser oder Wasserdampf abgebrüht , so dass sie nachher auf dem Querschnitt braungelb und gallertartig aussehen .
abgebrüht	ADJD	1895	1	polenz_buettnerbauer_1895-5416-11	 	Sie war von zu Hause her gegen das Wüten der Männer abgebrüht.	52:61	0:62	Sie war von zu Hauſe her gegen das Wüten der Männer abgebrüht .	11	0:13	sie sein von zu Haus her gegen d Wüten d Mann abgebrüht .	PPER VAFIN APPR APPR NN APZR APPR ART NN ART NN ADJD $.	Sie war von zu Hause her gegen das Wüten der Männer abgebrüht .
abgebrüht	ADJD	1849	1	davidis_kochbuch_1849-4130-4	 	Reis, welcher gut abgebrüht ist, wird mit Milch und dem nöthigen Salz nicht gar zu steif gekocht; gekochter und gehackter Schinken, mit saurer Sahne vermischt lagenweise mit dem Reis und Parmesankäse in ausgestrichene und mit Zwieback bestreute Förmchen gefüllt und gebacken.	18:27	0:275	Reis , welcher gut abgebrüht iſt , wird mit Milch und dem nöthigen Salz nicht gar zu ſteif gekocht ; gekochter und gehackter Schinken , mit ſaurer Sahne vermiſcht lagenweiſe mit dem Reis und Parmeſankäſe in ausgeſtrichene und mit Zwieback beſtreute Förmchen gefüllt und gebacken .	4	0:46	Reis , welche gut abgebrüht sein , werden mit Milch und d nötig Salz nicht gar zu steif kochen ; gekocht und gehackt Schinken , mit sauer Sahne vermischen lagenweise mit d Reis und Parmesankäse in ausgestreichen und mit Zwieback bestreut Formchen füllen und backen .	NN $, PRELS ADJD ADJD VAFIN $, VAFIN APPR NN KON ART ADJA NN PTKNEG ADV PTKA ADJD VVPP $. ADJA KON ADJA NN $, APPR ADJA NN VVFIN ADV APPR ART NN KON NN APPR ADJA KON APPR NN ADJA NN VVPP KON VVPP $.	Reis , welcher gut abgebrüht ist , wird mit Milch und dem nötigen Salz nicht gar zu steif gekocht ; gekochter und gehackter Schinken , mit saurer Sahne vermischt lagenweise mit dem Reis und Parmesankäse in ausgestrichene und mit Zwieback bestreute Formchen gefüllt und gebacken .
abgebrüht	ADJD	1849	1	davidis_kochbuch_1849-4049-4	 	Ein Pfund Reis wird abgebrüht, in Wasser mit einem Stückchen Butter halb gahr gekocht, auf einen Durchschlag geschüttet und mit Jus, die man zurückgestellt hat, und einer Tasse Madeira gahr gekocht.	20:29	0:198	Ein Pfund Reis wird abgebrüht , in Waſſer mit einem Stückchen Butter halb gahr gekocht , auf einen Durchſchlag geſchüttet und mit Jus , die man zurückgeſtellt hat , und einer Taſſe Madeira gahr gekocht .	4	0:36	eine Pfund Reis werden abgebrüht , in Wasser mit eine Stückchen Butter halb gar kochen , auf eine Durchschlag schütten und mit Jus , die man zurückstellen haben , und eine Tasse Madeira gar kochen .	ART NN NN VAFIN ADJD $, APPR NN APPR ART NN NN ADJD ADV VVPP $, APPR ART NN VVPP KON APPR NN $, PRELS PIS VVPP VAFIN $, KON ART NN NE ADV VVPP $.	Ein Pfund Reis wird abgebrüht , in Wasser mit einem Stückchen Butter halb gar gekocht , auf einen Durchschlag geschüttet und mit Jus , die man zurückgestellt hat , und einer Tasse Madeira gar gekocht .
abgebrüht	ADJA	1879	1	davidis_kochbuch_1879-5129-12	 	Zur Ersparniß kann man etwas mit Zucker gestoßene Vanille lose in ein abgebrühtes Läppchen gebunden in der Sauce auskochen lassen.	70:81	0:130	Zur Ersparniß kann man etwas mit Zucker gestoßene Vanille lose in ein abgebrühtes Läppchen gebunden in der Sauce auskochen lassen .	12	0:21	zur Ersparnis können man etwas mit Zucker gestoßen Vanille lose in eine abgebrüht Läppchen binden in d Sauce auskochen lassen .	APPRART NN VMFIN PIS ADV APPR NN ADJA NN ADJA APPR ART ADJA NN VVPP APPR ART NN VVINF VVINF $.	Zur Ersparnis kann man etwas mit Zucker gestoßene Vanille lose in ein abgebrühtes Läppchen gebunden in der Sauce auskochen lassen .
abgebrüht	ADJA	1829	1	platen_oedipus_1829-1032-10	 	Es suchte sich zur Trunkenheit zu zwingen Durch Schillers zehnmal abgebrühte Phrase, Und als der Rausch ihm wollte nicht gelingen, Da rief es aus:	66:76	0:146	Es ſuchte ſich zur Trunkenheit zu zwingen Durch Schillers zehnmal abgebruͤhte Phraſe , Und als der Rauſch ihm wollte nicht gelingen , Da rief es aus :	10	0:27	es suchen sich zur Trunkenheit zu zwingen durch Schiller zehnmal abgebrüht Phrase , und als d Rausch er wollen nicht gelingen , da rufen es aus :	PPER VVFIN PRF APPRART NN PTKZU VVINF APPR NE ADV ADJA NN $, KON KOKOM ART NN PPER VMFIN PTKNEG VVINF $, ADV VVFIN PPER PTKVZ $.	Es suchte sich zur Trunkenheit zu zwingen Durch Schillers zehnmal abgebrühte Phrase , Und als der Rausch ihm wollte nicht gelingen , Da rief es aus :
abgebrüht	ADJD	1849	1	davidis_kochbuch_1849-2034-12	 	Zugleich hat man Reis, für jede Person einen Eßlöffel gerechnet, abgebrüht und in Bouillon, wozu man so viel mehr Fleisch genommen, gahr und dick gekocht; doch müssen die Körner ganz bleiben.	65:74	0:191	Zugleich hat man Reis , für jede Perſon einen Eßlöffel gerechnet , abgebrüht und in Bouillon , wozu man ſo viel mehr Fleiſch genommen , gahr und dick gekocht ; doch müſſen die Körner ganz bleiben .	12	0:37	zugleich haben man Reis , für jede Person eine Eßlöffel rechnen , abgebrüht und in Bouillon , wozu man so viel mehr Fleisch nehmen , gar und dick kochen ; doch müssen d Korn ganz bleiben .	ADV VAFIN PIS NN $, APPR PIAT NN ART NN VVPP $, ADJD KON APPR NE $, PWAV PIS ADV ADV PIAT NN VVPP $, ADV KON ADJD VVPP $. ADV VMFIN ART NN ADV VVINF $.	Zugleich hat man Reis , für jede Person einen Eßlöffel gerechnet , abgebrüht und in Bouillon , wozu man so viel mehr Fleisch genommen , gar und dick gekocht ; doch müssen die Körner ganz bleiben .
abgebrüht	ADJA	1879	1	davidis_kochbuch_1879-3868-23	 	Wird spät im Frühjahr dies Gericht von Paradies-Aepfeln zubereitet, so lasse man sie zur Hälfte weich kochen und gebe dann erst den abgebrühten Reis hinzu.	132:143	0:155	Wird spät im Frühjahr dies Gericht von Paradies-Aepfeln zubereitet , so lasse man sie zur Hälfte weich kochen und gebe dann erst den abgebrühten Reis hinzu .	23	0:27	werden spät im Frühjahr diese Gericht von Paradies-Apfel zubereiten , so lassen man sie zur Hälfte weich kochen und geben dann erst d abgebrüht Reis hinzu .	VAFIN ADJD APPRART NN PDS NN APPR NN VVPP $, ADV VVFIN PIS PPER APPRART NN ADJD VVFIN KON VVFIN ADV ADV ART ADJA NN PTKVZ $.	Wird spät im Frühjahr dies Gericht von Paradies-Äpfeln zubereitet , so lasse man sie zur Hälfte weich kochen und gebe dann erst den abgebrühten Reis hinzu .
abgebrüht	ADJD	1849	1	davidis_kochbuch_1849-6071-10	 	Ein Pfund Catharinenpflaumen, oder gute Zwetschen, werden gut abgebrüht und in etwas Wasser so lange langsam gekocht, bis sich die Steine herausdrücken lassen, dann werden sie mit der Brühe, ½ Flasche weißem Wein, 12 Loth Zucker, Saft und Schale einer Zitrone in einem irdenen Töpfchen fest zugedeckt, ganz langsam weich gekocht.	62:71	0:329	Ein Pfund Catharinenpflaumen , oder gute Zwetſchen , werden gut abgebrüht und in etwas Waſſer ſo lange langſam gekocht , bis ſich die Steine herausdrücken laſſen , dann werden ſie mit der Brühe , ½ Flaſche weißem Wein , 12 Loth Zucker , Saft und Schale einer Zitrone in einem irdenen Töpfchen feſt zugedeckt , ganz langſam weich gekocht .	10	0:60	eine Pfund Catharinenpflaumen , oder gut Zwetsche , werden gut abgebrüht und in etwas Wasser so lange langsam kochen , bis sich d Stein herausdrücken lassen , dann werden sie mit d Brühe , ½ Flasche weiß Wein , 12 Lot Zucker , Saft und Schale eine Zitrone in eine irden Topfchen fest zudecken , ganz langsam weich kochen .	ART NN NE $, KON ADJA NN $, VAFIN ADJD ADJD KON APPR PIAT NN ADV ADV ADJD VVPP $, KOUS PRF ART NN VVINF VVINF $, ADV VAFIN PPER APPR ART NN $, ADJA NN ADJA NN $, CARD NN NN $, NN KON NN ART NN APPR ART ADJA NN ADJD VVPP $, ADV ADJD ADJD VVPP $.	Ein Pfund Catharinenpflaumen , oder gute Zwetschen , werden gut abgebrüht und in etwas Wasser so lange langsam gekocht , bis sich die Steine herausdrücken lassen , dann werden sie mit der Brühe , ½ Flasche weißem Wein , 12 Lot Zucker , Saft und Schale einer Zitrone in einem irdenen Töpfchen fest zugedeckt , ganz langsam weich gekocht .
abgebrüht	ADJD	1879	1	davidis_kochbuch_1879-3789-9	 	Man kocht 1/2 Pfund Reis, nachdem derselbe gut abgebrüht, mit Milch weich und recht steif, gibt dann ein Ei dick Butter, Zucker und abgeriebene Zitronenschale nach Geschmack hinzu.	47:56	0:180	Man kocht 1/2 Pfund Reis , nachdem derselbe gut abgebrüht , mit Milch weich und recht steif , gibt dann ein Ei dick Butter , Zucker und abgeriebene Zitronenschale nach Geschmack hinzu .	9	0:33	man kochen 1/2 Pfund Reis , nachdem dieselbe gut abgebrüht , mit Milch weich und recht steif , geben dann eine Ei dick Butter , Zucker und abgereiben Zitronenschale nach Geschmack hinzu .	PIS VVFIN CARD NN NN $, KOUS PDAT ADJD ADJD $, APPR NN ADJD KON ADJD ADJD $, VVFIN ADV ART NN ADJD NN $, NN KON ADJA NN APPR NN PTKVZ $.	Man kocht 1/2 Pfund Reis , nachdem derselbe gut abgebrüht , mit Milch weich und recht steif , gibt dann ein Ei dick Butter , Zucker und abgeriebene Zitronenschale nach Geschmack hinzu .
abgebrüht	ADJA	1879	1	davidis_kochbuch_1879-614-11	 	Die Bouillon wird nach No. 1 gekocht, feine Perlgrauben oder abgebrühter Reis gleich nach dem Ausschäumen hineingegeben, auch werden zur Zeit wohl einige junge Wurzeln (Möhren) und junge entschotete Erbsen, oder 1/2 Stunde vor dem Anrichten Spargelköpfe oder etwas Blumenkohl, letzterer vorher abgekocht, hinzugefügt.	61:72	0:317	Die Bouillon wird nach No. 1 gekocht , feine Perlgrauben oder abgebrühter Reis gleich nach dem Ausschäumen hineingegeben , auch werden zur Zeit wohl einige junge Wurzeln ( Möhren ) und junge entschotete Erbsen , oder 1/2 Stunde vor dem Anrichten Spargelköpfe oder etwas Blumenkohl , letzterer vorher abgekocht , hinzugefügt .	11	0:52	d Bouillon werden nach No. 1 kochen , fein Perlgrauben oder abgebrüht Reis gleich nach d Ausschäumen hineingeben , auch werden zur Zeit wohl einige jung Wurzel ( Möhre ) und jung Entschotete Erbsen , oder 1/2 Stunde vor d Anrichte Spargelkopf oder etwas Blumenkohl , letztere vorher abkochen , hinzufügen .	ART NN VAFIN APPR NN CARD VVPP $, ADJA NN KON ADJA NN ADV APPR ART NN VVPP $, ADV VAFIN APPRART NN ADV PIAT ADJA NN $( NN $( KON ADJA NE NE $, KON CARD NN APPR ART NN NN KON PIAT NN $, PIS ADV VVPP $, VVPP $.	Die Bouillon wird nach No. 1 gekocht , feine Perlgrauben oder abgebrühter Reis gleich nach dem Ausschäumen hineingegeben , auch werden zur Zeit wohl einige junge Wurzeln ( Möhren ) und junge entschotete Erbsen , oder 1/2 Stunde vor dem Anrichten Spargelköpfe oder etwas Blumenkohl , letzterer vorher abgekocht , hinzugefügt .
abgebrüht	ADJD	1895	1	wedekind_erdgeist_1895-2727-9	 	Gott sei Dank, daß es noch nicht so abgebrüht ist.	36:45	0:50	Gott ſei Dank , daß es noch nicht ſo abgebrüht iſt .	9	0:12	Gott sein Dank , daß es noch nicht so abgebrüht sein .	NN VAFIN NN $, KOUS PPER ADV PTKNEG ADV ADJD VAFIN $.	Gott sei Dank , daß es noch nicht so abgebrüht ist .
abgebrüht	ADJD	1879	1	davidis_kochbuch_1879-5545-9	 	Die Pflaumen werden in heißem Wasser abgewaschen, Zwetschen abgebrüht (siehe Compotes), und in wenig Wasser so lange langsam gekocht, bis sich die Steige herausdrücken lassen.	60:69	0:175	Die Pflaumen werden in heißem Wasser abgewaschen , Zwetschen abgebrüht ( siehe Compotes ) , und in wenig Wasser so lange langsam gekocht , bis sich die Steige herausdrücken lassen .	9	0:31	d Pflaume werden in heiß Wasser abwaschen , Zwetsche abgebrüht ( sehen Compotes ) , und in wenig Wasser so lange langsam kochen , bis sich d Steig herausdrücken lassen .	ART NN VAFIN APPR ADJA NN VVPP $, NN ADJD $( VVIMP NE $( $, KON APPR PIAT NN ADV ADV ADJD VVPP $, KOUS PRF ART NN VVINF VVINF $.	Die Pflaumen werden in heißem Wasser abgewaschen , Zwetschen abgebrüht ( siehe Compotes ) , und in wenig Wasser so lange langsam gekocht , bis sich die Steige herausdrücken lassen .
abgebrüht	ADJD	1879	1	davidis_kochbuch_1879-4226-4	 	Der Reis wird gut abgebrüht, in Wasser gahr und dick, nicht steif gekocht, die Körner aber dürfen nicht zerkochen.	18:27	0:114	Der Reis wird gut abgebrüht , in Wasser gahr und dick , nicht steif gekocht , die Körner aber dürfen nicht zerkochen .	4	0:23	d Reis werden gut abgebrüht , in Wasser gar und dick , nicht steif kochen , die Körner aber dürfen nicht zerkochen .	ART NN VAFIN ADJD ADJD $, APPR NN ADV KON ADJD $, PTKNEG ADJD VVPP $, PRELS NE ADV VMFIN PTKNEG VVINF $.	Der Reis wird gut abgebrüht , in Wasser gar und dick , nicht steif gekocht , die Körner aber dürfen nicht zerkochen .
