lemma	pos	date	grouping	identifier	description	context	indexes_target_token	indexes_target_sentence	context_tokenized	indexes_target_token_tokenized	indexes_target_sentence_tokenized	context_lemmatized	context_pos	context_normalized
artikulieren	VVFIN	1805	1	treviranus_biologie03_1805-380-35	 	1) Die Encriniten, Zoophyten, welche zunächst an die heutige Familie der Seefedern, und zwar vorzüglich an das Geschlecht Encrinus gränzen, und aus einem einfachen gegliederten Stiele, und einfachen, artikulirten, der Länge nach gespaltenen, auf ihrer innern Seite mit Flossen versehenen, auf dem Gipfel des Stiels rings um eine gemeinschaftliche artikulirte Basis sitzenden, und, bey der gemeinen Art, zusammengeschlagen einer unaufgeblühten Lilie ähnlichen Organen bestehen.	200:212	0:476	1 ) Die Encriniten , Zoophyten , welche zunächst an die heutige Familie der Seefedern , und zwar vorzüglich an das Geschlecht Encrinus gränzen , und aus einem einfachen gegliederten Stiele , und einfachen , artikulirten , der Länge nach gespaltenen , auf ihrer innern Seite mit Flossen versehenen , auf dem Gipfel des Stiels rings um eine gemeinschaftliche artikulirte Basis sitzenden , und , bey der gemeinen Art , zusammengeschlagen einer unaufgeblühten Lilie ähnlichen Organen bestehen .	35	0:78	1 ) d Encriniten , Zoophyt , welche zunächst an d heutig Familie d Seefeder , und zwar vorzüglich an d Geschlecht Encrinus grenzen , und aus eine einfach gegliedert Stiel , und einfach , artikulieren , d Länge nach gespalten , auf ihr inner Seite mit Flosse versehen , auf d Gipfel d Stiel rings um eine gemeinschaftlich artikuliert Basis sitzend , und , bei d gemein Art , zusammenschlagen eine unaufgeblüht Lilie ähnlich Organ bestehen .	CARD $( ART NN $, NN $, PRELS ADV APPR ART ADJA NN ART NN $, KON ADV ADJD APPR ART NN NE VVINF $, KON APPR ART ADJA ADJA NN $, KON ADJA $, VVFIN $, ART NN APPR ADJA $, APPR PPOSAT ADJA NN APPR NN ADJA $, APPR ART NN ART NN ADV APPR ART ADJA ADJA NN ADJA $, KON $, APPR ART ADJA NN $, VVPP ART ADJA NN ADJA NN VVINF $.	1 ) Die Encriniten , Zoophyten , welche zunächst an die heutige Familie der Seefedern , und zwar vorzüglich an das Geschlecht Encrinus grenzen , und aus einem einfachen gegliederten Stiele , und einfachen , artikulierten , der Länge nach gespaltenen , auf ihrer inneren Seite mit Flossen versehenen , auf dem Gipfel des Stiels rings um eine gemeinschaftliche artikulierte Basis sitzenden , und , bei der gemeinen Art , zusammengeschlagen einer unaufgeblühten Lilie ähnlichen Organen bestehen .
artikulieren	VVINF	1822	1	treviranus_biologie06_1822-2602-51	 	Mehrere Fische, namentlich alle Arten von Cyprinus, Silurus Glanis, Cobitis fossilis und Cobitis Barbatula, haben, nach E. H. Weber’s Entdeckung, drey Gehörknöchelchen, die zu beyden Seiten der drey ersten Halswirbel in einer Höhlung derselben liegen und sowohl unter sich, als mit diesen Wirbeln artikuliren.	297:308	0:309	Mehrere Fische , namentlich alle Arten von Cyprinus , Silurus Glanis , Cobitis fossilis und Cobitis Barbatula , haben , nach E. H. Weber’s Entdeckung , drey Gehörknöchelchen , die zu beyden Seiten der drey ersten Halswirbel in einer Höhlung derselben liegen und sowohl unter sich , als mit diesen Wirbeln artikuliren .	51	0:53	mehrere Fisch , namentlich alle Art von Cyprinus , Silurus Glanis , Cobitis fossil und Cobitis Barbatula , haben , nach E. H. Webers Entdeckung , drei Gehörknöchelchen , die zu beide Seite d drei erst Halswirbel in eine Höhlung dieselbe liegen und sowohl unter sich , als mit diese Wirbel artikulieren .	PIAT NN $, ADV PIAT NN APPR NE $, NE NE $, NE ADJA KON NE NE $, VAFIN $, APPR NE NE NE NN $, CARD NN $, PRELS APPR PIAT NN ART CARD ADJA NN APPR ART NN PDAT VVFIN KON KON APPR PRF $, KOUS APPR PDAT NN VVINF $.	Mehrere Fische , namentlich alle Arten von Cyprinus , Silurus Glanis , Cobitis fossiles und Cobitis Barbatula , haben , nach E. H. Weber's Entdeckung , drei Gehörknöchelchen , die zu beiden Seiten der drei ersten Halswirbel in einer Höhlung derselben liegen und sowohl unter sich , als mit diesen Wirbeln artikulieren .
artikulieren	VVFIN	1805	1	blumenbach_anatomie_1805-773-31	 	Er ist dicht, flachrundlicht, ohngefähr von der Form und Grösse einer glatten Castanie, verläuft sich am obern Rande mit der einen Seite in einem knochichten Stachel, und articulirt auf der andern mittelst eines bewundernswerthen Ginglymus ohne seines Gleichen mit zwey kleinen Knöchelchen verschiedener Grösse, die ohngefähr die Form von Pfeilspitzen haben.	171:181	0:358	Er ist dicht , flachrundlicht , ohngefähr von der Form und Gröſse einer glatten Castanie , verläuft sich am obern Rande mit der einen Seite in einem knochichten Stachel , und articulirt auf der andern mittelst eines bewundernswerthen Ginglymus ohne seines Gleichen mit zwey kleinen Knöchelchen verschiedener Gröſse , die ohngefähr die Form von Pfeilspitzen haben .	31	0:57	er sein dicht , flachrundlich , ungefähr von d Form und Größe eine glatt Kastanie , verlaufen sich am ober Rand mit d eine Seite in eine knochig Stachel , und artikulieren auf d ander mittels eine bewundernswert Ginglymus ohne seine Gleichen mit zwei klein Knöchelchen verschieden Größe , die ungefähr d Form von Pfeilspitze haben .	PPER VAFIN ADJD $, ADJD $, ADJD APPR ART NN KON NN ART ADJA NN $, VVFIN PRF APPRART ADJA NN APPR ART ART NN APPR ART ADJA NN $, KON VVFIN APPR ART ADJA APPR ART ADJA NN APPR PPOSAT NN APPR CARD ADJA NN ADJA NN $, PRELS ADJD ART NN APPR NN VAFIN $.	Er ist dicht , flachrundlich , ungefähr von der Form und Größe einer glatten Kastanie , verläuft sich am oberen Rande mit der einen Seite in einem knochigen Stachel , und artikuliert auf der anderen mittels eines bewundernswerten Ginglymus ohne seines Gleichen mit zwei kleinen Knöchelchen verschiedener Größe , die ungefähr die Form von Pfeilspitzen haben .
artikulieren	VVFIN	1834	1	varnhagen_rahel03_1834-2750-7	 	Thiere drücken nur ihre Zustände aus: artikuliren auch nicht.	38:49	0:61	Thiere drücken nur ihre Zuſtände aus : artikuliren auch nicht .	7	0:11	Tier drücken nur ihr Zustand aus : artikulieren auch nicht .	NN VVFIN ADV PPOSAT NN PTKVZ $. VVFIN ADV PTKNEG $.	Tiere drücken nur ihre Zustände aus : artikulieren auch nicht .
artikulieren	VVFIN	1857	1	vischer_aesthetik030204_1857-537-2	 	Die Sprache articulirt den Ton durch die abschließende Kraft des Mitlauters zum Ausdruck des Bewußtseins und nur mittelbar durch dieses zum Ausdruck des Gefühls.	12:22	0:161	Die Sprache articulirt den Ton durch die abſchließende Kraft des Mitlauters zum Ausdruck des Bewußtſeins und nur mittelbar durch dieſes zum Ausdruck des Gefühls .	2	0:25	d Sprache artikulieren d Ton durch d abschließend Kraft d Mitlauter zum Ausdruck d Bewußtsein und nur mittelbar durch diese zum Ausdruck d Gefühl .	ART NN VVFIN ART NN APPR ART ADJA NN ART NN APPRART NN ART NN KON ADV ADJD APPR PDAT APPRART NN ART NN $.	Die Sprache artikuliert den Ton durch die abschließende Kraft des Mitlauters zum Ausdruck des Bewußtseins und nur mittelbar durch dieses zum Ausdruck des Gefühls .
artikulieren	VVFIN	1807	1	blumenbach_knochen_1807-1442-28	 	Jener, das corpus, ist mit einer ungleich ausgeschweiften Gelenkfläche versehen, in welcher, wie gedacht, der Kopf des Hammers, wie in einer Pfanne articulirt.	148:158	0:159	Jener , das corpus , ist mit einer ungleich ausgeschweiften Gelenkfläche versehen , in welcher , wie gedacht , der Kopf des Hammers , wie in einer Pfanne articulirt .	28	0:30	jen , d Corpus , sein mit eine ungleich ausgeschweift Gelenkfläche versehen , in welche , wie gedenken , d Kopf d Hammer , wie in eine Pfanne artikulieren .	PDAT $, ART NE $, VAFIN APPR ART ADJD ADJA NN VVPP $, APPR PRELS $, PWAV VVPP $, ART NN ART NN $, PWAV APPR ART NN VVFIN $.	Jener , das corpus , ist mit einer ungleich ausgeschweiften Gelenkfläche versehen , in welcher , wie gedacht , der Kopf des Hammers , wie in einer Pfanne artikuliert .
artikulieren	VVINF	1848	1	nn_nrhz090_1848-614-7	 	Soll ich also Herrn Grün die Summen artikuliren, die er vom November 1846 bis zum Februar 1847 für seine Thätigkeit in der Presse von mir beanspruchte und erhielt?	36:47	0:163	Soll ich also Herrn Grün die Summen artikuliren , die er vom November 1846 bis zum Februar 1847 für seine Thätigkeit in der Presse von mir beanspruchte und erhielt ?	7	0:30	sollen ich also Herr Grün d Summe artikulieren , die er vom November 1846 bis zum Februar 1847 für seine Tätigkeit in d Presse von ich beanspruchen und erhalten ?	VMFIN PPER ADV NN NN ART NN VVINF $, PRELS PPER APPRART NN CARD APPR APPRART NN CARD APPR PPOSAT NN APPR ART NN APPR PPER VVFIN KON VVFIN $.	Soll ich also Herrn Grün die Summen artikulieren , die er vom November 1846 bis zum Februar 1847 für seine Tätigkeit in der Presse von mir beanspruchte und erhielt ?
artikulieren	VVFIN	1824	1	blumenbach_anatomie_1824-867-31	 	Er ist dicht, flachrundlich, ohngefähr von der Form und Grösse einer glatten Castanie, verläuft sich am obern Rande mit der einen Seite in einem knochichten Stachel, und articulirt auf der andern mittelst eines bewundernswerthen Giuglymus ohne seines Gleichen mit zwey kleinen Knöchelchen verschiedener Grösse, die ohngefähr die Form von Pfeilspitzen haben.	170:180	0:357	Er ist dicht , flachrundlich , ohngefähr von der Form und Grösse einer glatten Castanie , verläuft sich am obern Rande mit der einen Seite in einem knochichten Stachel , und articulirt auf der andern mittelst eines bewundernswerthen Giuglymus ohne seines Gleichen mit zwey kleinen Knöchelchen verschiedener Grösse , die ohngefähr die Form von Pfeilspitzen haben .	31	0:57	er sein dicht , flachrundlich , ungefähr von d Form und Größe eine glatt Kastanie , verlaufen sich am ober Rand mit d eine Seite in eine knochig Stachel , und artikulieren auf d ander mittels eine bewundernswert Giuglymus ohne seine Gleichen mit zwei klein Knöchelchen verschieden Größe , die ungefähr d Form von Pfeilspitze haben .	PPER VAFIN ADJD $, ADJD $, ADJD APPR ART NN KON NN ART ADJA NN $, VVFIN PRF APPRART ADJA NN APPR ART ART NN APPR ART ADJA NN $, KON VVFIN APPR ART ADJA APPR ART ADJA NN APPR PPOSAT NN APPR CARD ADJA NN ADJA NN $, PRELS ADJD ART NN APPR NN VAFIN $.	Er ist dicht , flachrundlich , ungefähr von der Form und Größe einer glatten Kastanie , verläuft sich am oberen Rande mit der einen Seite in einem knochigen Stachel , und artikuliert auf der anderen mittels eines bewundernswerten Giuglymus ohne seines Gleichen mit zwei kleinen Knöchelchen verschiedener Größe , die ungefähr die Form von Pfeilspitzen haben .
artikulieren	VVFIN	1811	1	goethe_leben01_1811-1983-8	 	Nachdem der junge Mann mir die gewünschten Aenderungen articulirt und ein Schreibzeug herbeygeholt hatte, sich aber wegen eines Geschäfts auf kurze Zeit beurlaubte, blieb ich auf der Wandbank hinter dem großen Tische sitzen, und probierte die zu machenden Veränderungen auf der großen, fast den ganzen Tisch einnehmenden Schieferplatte, mit einem Griffel, der stets im Fenster lag, weil man auf dieser Steinfläche oft rechnete, sich mancherley notirte, ja die Gehenden und Kommenden sich sogar Notizen dadurch mittheilten.	55:65	0:522	Nachdem der junge Mann mir die gewuͤnſchten Aenderungen articulirt und ein Schreibzeug herbeygeholt hatte , ſich aber wegen eines Geſchaͤfts auf kurze Zeit beurlaubte , blieb ich auf der Wandbank hinter dem großen Tiſche ſitzen , und probierte die zu machenden Veraͤnderungen auf der großen , faſt den ganzen Tiſch einnehmenden Schieferplatte , mit einem Griffel , der ſtets im Fenſter lag , weil man auf dieſer Steinflaͤche oft rechnete , ſich mancherley notirte , ja die Gehenden und Kommenden ſich ſogar Notizen dadurch mittheilten .	8	0:86	nachdem d jung Mann ich d gewünscht Änderung artikulieren und eine Schreibzeug herbeiholen haben , sich aber wegen eine Geschäft auf kurz Zeit beurlauben , bleiben ich auf d Wandbank hinter d groß Tisch sitzen , und probieren d zu machend Veränderung auf d groß , fast d ganz Tisch einnehmend Schieferplatte , mit eine Griffel , die stets im Fenster liegen , weil man auf diese Steinfläche oft rechnen , sich mancherlei notieren , ja d Gehende und Kommende sich sogar Notiz dadurch mitteilen .	KOUS ART ADJA NN PPER ART ADJA NN VVFIN KON ART NN VVPP VAFIN $, PRF ADV APPR ART NN APPR ADJA NN VVFIN $, VVFIN PPER APPR ART NN APPR ART ADJA NN VVFIN $, KON VVFIN ART PTKZU ADJA NN APPR ART ADJA $, ADV ART ADJA NN ADJA NN $, APPR ART NN $, PRELS ADV APPRART NN VVFIN $, KOUS PIS APPR PDAT NN ADV VVFIN $, PRF PIS VVFIN $, ADV ART NN KON NN PRF ADV NN PAV VVFIN $.	Nachdem der junge Mann mir die gewünschten Änderungen artikuliert und ein Schreibzeug herbeigeholt hatte , sich aber wegen eines Geschäfts auf kurze Zeit beurlaubte , blieb ich auf der Wandbank hinter dem großen Tische sitzen , und probierte die zu machenden Veränderungen auf der großen , fast den ganzen Tisch einnehmenden Schieferplatte , mit einem Griffel , der stets im Fenster lag , weil man auf dieser Steinfläche oft rechnete , sich mancherlei notierte , ja die Gehenden und Kommenden sich sogar Notizen dadurch mitteilten .
artikulieren	VVFIN	1874	1	wernicke_symptomencomplex_1874-998-5	 	Dabei ist das Sprechen vollständig articulirt, ohne mechanische Behinderung.	35:45	0:76	Dabei ist das Sprechen vollständig articulirt , ohne mechanische Behinderung .	5	0:11	dabei sein d Sprechen vollständig artikulieren , ohne mechanisch Behinderung .	PAV VAFIN ART NN ADJD VVFIN $, KOUI ADJA NN $.	Dabei ist das Sprechen vollständig artikuliert , ohne mechanische Behinderung .
artikulieren	VVFIN	1828	1	patzig_msgermfol841842_1828-259-29	 	Kopflose Molusken die mit Seidenfäden anhängen an den Felsen haben eine geringe Bewegung, u. die Seeigel bewegen sich vollkommen durch membranöse Füße, ja die Stacheln selbst sind artikulirt, u. welcher Unterschied ist in der Beweglichkeit beider.	180:190	0:247	Kopfloſe Molusken die mit Seidenfäden anhängen an den Felſen haben eine geringe Bewegung , u. die Seeigel bewegen ſich vollkom̃en durch membranöſe Füße , ja die Stacheln ſelbſt ſind artikulirt , u. welcher Unterſchied iſt in der Beweglichkeit beider .	29	0:40	Kopflos Molluske d mit Seidenfaden anhängen an d Felsen haben eine gering Bewegung , u. d Seeigel bewegen sich vollkommen durch Membranöse Fuß , ja d Stachel selbst sein artikulieren , u. welcher Unterschied sein in d Beweglichkeit beide .	NN NN ART APPR NN VVFIN APPR ART NN VAFIN ART ADJA NN $, APPR ART NN VVFIN PRF ADJD APPR NE NN $, ADV ART NN ADV VAFIN VVFIN $, APPR PWAT NN VAFIN APPR ART NN PIAT $.	Kopflose Mollusken die mit Seidenfäden anhängen an den Felsen haben eine geringe Bewegung , u. die Seeigel bewegen sich vollkommen durch membranöse Füße , ja die Stacheln selbst sind artikuliert , u. welcher Unterschied ist in der Beweglichkeit beider .
artikulieren	VVFIN	1805	1	blumenbach_anatomie_1805-533-78	 	— Bey den pecoribus vor der Geburt aus zweyen dicht an einander liegenden, die aber nachher durch Absorbtion der Scheidewände zu einer gemeinschaftlichen Röhre umgebildet werden. — Beym Pferd aus einer einzigen Hauptröhre (gamba Veget. Fr. le canon), an deren hintern Seitenrändern ein Paar weit kürzere unbewegliche Nebenröhren (Fr. les poinçons oder os epineux) wie angewachsen sitzen, so dass nur jene Hauptröhre mit dem Fesselknochen (Fr. le paturon) articulirt, welcher sich mit der ersten Phalanx eines der mittlern Finger in der Menschenhand, so wie der Hufknochen gewissermassen mit dem dritten oder Nagelgliede desselben vergleichen lässt. — Ueberhaupt aber ist diese äusserste Phalanx nach der Verschiedenheit der hornartigen Bedeckung derselben durch platte Nägel oder Krallen oder Hufe oder gespaltne Klauen u. s. w. selbst von verschiedner damit correspondirender Bildung.	455:465	0:885	— Bey den pecoribus vor der Geburt aus zweyen dicht an einander liegenden , die aber nachher durch Absorbtion der Scheidewände zu einer gemeinschaftlichen Röhre umgebildet werden . — Beym Pferd aus einer einzigen Hauptröhre ( gamba Veget. Fr. le canon ) , an deren hintern Seitenrändern ein Paar weit kürzere unbewegliche Nebenröhren ( Fr. les poinçons oder os epineux ) wie angewachsen sitzen , so daſs nur jene Hauptröhre mit dem Fesselknochen ( Fr. le paturon ) articulirt , welcher sich mit der ersten Phalanx eines der mittlern Finger in der Menschenhand , so wie der Hufknochen gewissermaſsen mit dem dritten oder Nagelgliede desselben vergleichen läſst . — Ueberhaupt aber ist diese äuſserste Phalanx nach der Verschiedenheit der hornartigen Bedeckung derselben durch platte Nägel oder Krallen oder Hufe oder gespaltne Klauen u. s. w. selbst von verschiedner damit correspondirender Bildung .	78	0:142	-- bei d Pecoribus vor d Geburt aus zweien dicht an einander liegend , die aber nachher durch Absorption d Scheidewand zu eine gemeinschaftlich Röhre umbilden werden . -- beim Pferd aus eine einzig Hauptröhre ( Gamba veget. fr. le canon ) , an die hinter Seitenrand eine Paar weit kurz unbeweglich Nebenröhre ( Fr. les poincons oder os epineux ) wie anwachsen sitzen , so dass nur jen Hauptröhre mit d Fesselknochen ( Fr. le paturon ) artikulieren , welche sich mit d erst Phalanx eine d mittel Finger in d Menschenhand , so wie d Hufknochen gewißermaßen mit d dritt oder Nagelglied dieselbe vergleichen lassen . -- überhaupt aber sein diese äußerst Phalanx nach d Verschiedenheit d hornartig Bedeckung dieselbe durch platt Nagel oder Kralle oder Hufe oder gespalten Klaue u. s. W. selbst von verschieden damit korrespondierend Bildung .	$( APPR ART NE APPR ART NN APPR VVFIN ADJD APPR ADV ADJA $, PRELS ADV ADV APPR NN ART NN APPR ART ADJA NN VVPP VAINF $. $( APPRART NN APPR ART ADJA NN $( NE XY XY FM FM $( $, APPR PRELAT ADJA NN ART NN ADJD ADJA ADJA NN $( NE FM FM KON FM FM $( PWAV VVPP VVFIN $, ADV KOUS ADV PDAT NN APPR ART NN $( NE FM FM $( VVFIN $, PRELS PRF APPR ART ADJA NN ART ART ADJA NN APPR ART NN $, ADV KOKOM ART NN ADV APPR ART ADJA KON NN PDS VVINF VVFIN $. $( ADV ADV VAFIN PDAT ADJA NN APPR ART NN ART ADJA NN PDAT APPR ADJA NN KON NN KON NN KON ADJA NN APPR VVIMP NN ADV APPR ADJA PAV ADJA NN $.	-- Bei den pecoribus vor der Geburt aus zweien dicht an einander liegenden , die aber nachher durch Absorption der Scheidewände zu einer gemeinschaftlichen Röhre umgebildet werden . -- Beim Pferd aus einer einzigen Hauptröhre ( Gamba Veget. Fr. le canon ) , an deren hinteren Seitenrändern ein Paar weit kürzere unbewegliche Nebenröhren ( Fr. les poincons oder os epineux ) wie angewachsen sitzen , so dass nur jene Hauptröhre mit dem Fesselknochen ( Fr. le paturon ) artikuliert , welcher sich mit der ersten Phalanx eines der mittleren Finger in der Menschenhand , so wie der Hufknochen gewissermaßen mit dem dritten oder Nagelgliede desselben vergleichen lässt . -- Überhaupt aber ist diese äußerste Phalanx nach der Verschiedenheit der hornartigen Bedeckung derselben durch platte Nägel oder Krallen oder Hufe oder gespaltene Klauen u. s. w. selbst von verschiedener damit korrespondierender Bildung .
artikulieren	VVFIN	1824	1	blumenbach_anatomie_1824-618-52	 	Beym Pferd aus einer einzigen Hauptrohre (gamba Veget. Fr. le canon), an deren hintern Seitenrändern ein Paar weit kürzere unbewegliche Nebenröhren, die Griffelbeine (Fr. les poinçons oder os epineux) wie angewachsen sitzen, so dass nur jene Hauptröhre mit dem Fesselknochen (Fr. le paturon) articulirt, welcher sich mit der ersten phalanx eines der mittlern Finger in der Menschenhand, so wie der Hufknochen gewissermassen mit dem dritten oder Nagelgliede desselben, vergleichen lässt.	292:302	0:486	Beym Pferd aus einer einzigen Hauptrohre ( gamba Veget. Fr. le canon ) , an deren hintern Seitenrändern ein Paar weit kürzere unbewegliche Nebenröhren , die Griffelbeine ( Fr. les poinçons oder os epineux ) wie angewachsen sitzen , so dass nur jene Hauptröhre mit dem Fesselknochen ( Fr. le paturon ) articulirt , welcher sich mit der ersten phalanx eines der mittlern Finger in der Menschenhand , so wie der Hufknochen gewissermassen mit dem dritten oder Nagelgliede desselben , vergleichen lässt .	52	0:83	beim Pferd aus eine einzig Hauptrohr ( Gamba veget. fr. le canon ) , an die hinter Seitenrand eine Paar weit kurz unbeweglich Nebenröhre , d Griffelbein ( Fr. les poincons oder os epineux ) wie anwachsen sitzen , so dass nur jen Hauptröhre mit d Fesselknochen ( Fr. le paturon ) artikulieren , welche sich mit d erst Phalanx eine d mittel Finger in d Menschenhand , so wie d Hufknochen gewißermaßen mit d dritt oder Nagelglied dieselbe , vergleichen lassen .	APPRART NN APPR ART ADJA NN $( NE XY XY FM FM $( $, APPR PRELAT ADJA NN ART NN ADJD ADJA ADJA NN $, ART NN $( NE FM FM KON FM FM $( PWAV VVPP VVFIN $, ADV KOUS ADV PDAT NN APPR ART NN $( NE FM FM $( VVFIN $, PRELS PRF APPR ART ADJA NE ART ART ADJA NN APPR ART NN $, ADV KOKOM ART NN ADV APPR ART ADJA KON NN PDS $, VVINF VVFIN $.	Beim Pferd aus einer einzigen Hauptrohre ( Gamba Veget. Fr. le canon ) , an deren hinteren Seitenrändern ein Paar weit kürzere unbewegliche Nebenröhren , die Griffelbeine ( Fr. les poincons oder os epineux ) wie angewachsen sitzen , so dass nur jene Hauptröhre mit dem Fesselknochen ( Fr. le paturon ) artikuliert , welcher sich mit der ersten phalanx eines der mittleren Finger in der Menschenhand , so wie der Hufknochen gewissermaßen mit dem dritten oder Nagelgliede desselben , vergleichen lässt .
artikulieren	VVFIN	1805	1	treviranus_biologie03_1805-447-3	 	Bey den Encriniten artikulirt ferner der Stiel mit den Armen durch mehrere Knochen, die eine ganz ähnliche Verbindung unter einander haben, wie die Knochen der Handwurzel des Menschen.	19:29	0:184	Bey den Encriniten artikulirt ferner der Stiel mit den Armen durch mehrere Knochen , die eine ganz ähnliche Verbindung unter einander haben , wie die Knochen der Handwurzel des Menschen .	3	0:31	bei d Encriniten artikulieren ferner d Stiel mit d Arme durch mehrere Knochen , die eine ganz ähnlich Verbindung unter einander haben , wie d Knochen d Handwurzel d Mensch .	APPR ART NN VVFIN ADV ART NN APPR ART NN APPR PIAT NN $, PRELS ART ADV ADJA NN APPR PRF VAFIN $, PWAV ART NN ART NN ART NN $.	Bei den Encriniten artikuliert ferner der Stiel mit den Armen durch mehrere Knochen , die eine ganz ähnliche Verbindung unter einander haben , wie die Knochen der Handwurzel des Menschen .
artikulieren	VVFIN	1802	1	treviranus_biologie01_1802-2066-33	 	Aber der Kopf ist hier immer statt eines Mundes mit einem hornartigen Schnabel versehen, dessen beyde Kinnladen beweglich sind; es fehlen ihm die äussern Geruchs-und Gehörorgane der Säugthiere; er artikulirt immer nur durch einen einzigen Gelenkkopf mit dem ersten Halswirbel.	197:207	0:276	Aber der Kopf ist hier immer statt eines Mundes mit einem hornartigen Schnabel versehen , dessen beyde Kinnladen beweglich sind ; es fehlen ihm die äussern Geruchs- und Gehörorgane der Säugthiere ; er artikulirt immer nur durch einen einzigen Gelenkkopf mit dem ersten Halswirbel .	33	0:45	aber d Kopf sein hier immer statt eine Mund mit eine hornartig Schnabel versehen , die beide Kinnlade beweglich sein ; es fehlen er d äußer geruchs- und Gehörorgan d Säugetier ; er artikulieren immer nur durch eine einzig Gelenkkopf mit d erst Halswirbel .	KON ART NN VAFIN ADV ADV APPR ART NN APPR ART ADJA NN VVPP $, PDS PIAT NN ADJD VAFIN $. PPER VVFIN PPER ART ADJA TRUNC KON NN ART NN $. PPER VVFIN ADV ADV APPR ART ADJA NN APPR ART ADJA NN $.	Aber der Kopf ist hier immer statt eines Mundes mit einem hornartigen Schnabel versehen , dessen beide Kinnladen beweglich sind ; es fehlen ihm die äußeren Geruchs- und Gehörorgane der Säugetiere ; er artikuliert immer nur durch einen einzigen Gelenkkopf mit dem ersten Halswirbel .
artikulieren	VVINF	1851	1	vogt_briefe02_1851-338-28	 	Meist gehen von der Basis dieser oberen Bogen noch eigene schiefe Fortsätze oder Gelenkfortsätze aus, welche nach hinten und vorn mit den entsprechenden Fortsätzen der anstoßenden Wirbel artikuliren.	187:198	0:199	Meiſt gehen von der Baſis dieſer oberen Bogen noch eigene ſchiefe Fortſätze oder Gelenkfortſätze aus , welche nach hinten und vorn mit den entſprechenden Fortſätzen der anſtoßenden Wirbel artikuliren .	28	0:30	meist gehen von d Basis diese ober Bogen noch eigen schief Fortsatz oder Gelenkfortsatz aus , welche nach hinten und vorn mit d entsprechend Fortsatz d anstoßend Wirbel artikulieren .	ADV VVFIN APPR ART NN PDAT ADJA NN ADV ADJA ADJA NN KON NN PTKVZ $, PRELS APPR ADV KON ADV APPR ART ADJA NN ART ADJA NN VVINF $.	Meist gehen von der Basis dieser oberen Bogen noch eigene schiefe Fortsätze oder Gelenkfortsätze aus , welche nach hinten und vorn mit den entsprechenden Fortsätzen der anstoßenden Wirbel artikulieren .
