lemma	pos	date	grouping	identifier	description	context	indexes_target_token	indexes_target_sentence	context_tokenized	indexes_target_token_tokenized	indexes_target_sentence_tokenized	context_lemmatized	context_pos	context_normalized
artikulieren	VVINF	1851	1	vogt_briefe02_1851-5741-27	 	Man hat bis jetzt noch kein Volk gefunden, welches derselben entbehrt hätte; es liegt mithin die Sprachfähigkeit nicht in den Organen, welche die Laute artikuliren, sondern vielmehr in der Ausbildung des Gehirnes, welches den von ihm elaborirten Gedanken gewisse Muskelbewegungen, die bestimmte Laute hervorbringen, zum Ausdrucke dienen läßt.	152:163	0:342	Man hat bis jetzt noch kein Volk gefunden , welches derſelben entbehrt hätte ; es liegt mithin die Sprachfähigkeit nicht in den Organen , welche die Laute artikuliren , ſondern vielmehr in der Ausbildung des Gehirnes , welches den von ihm elaborirten Gedanken gewiſſe Muskelbewegungen , die beſtimmte Laute hervorbringen , zum Ausdrucke dienen läßt .	27	0:56	man haben bis jetzt noch keine Volk finden , welche dieselbe entbehren haben ; es liegen mithin d Sprachefähigkeit nicht in d Organ , welche d Laute artikulieren , sondern vielmehr in d Ausbildung d Gehirn , welche d von er elaboriert Gedanke gewiß Muskelbewegung , d bestimmt Laute hervorbringen , zum Ausdruck dienen lassen .	PIS VAFIN ADV ADV ADV PIAT NN VVPP $, PRELS PDS VVPP VAFIN $. PPER VVFIN ADV ART NN PTKNEG APPR ART NN $, PRELS ART NN VVINF $, KON ADV APPR ART NN ART NN $, PRELS ART APPR PPER ADJA NN ADJA NN $, ART ADJA NN VVFIN $, APPRART NN VVINF VVFIN $.	Man hat bis jetzt noch kein Volk gefunden , welches derselben entbehrt hätte ; es liegt mithin die Sprachfähigkeit nicht in den Organen , welche die Laute artikulieren , sondern vielmehr in der Ausbildung des Gehirnes , welches den von ihm elaborierten Gedanken gewisse Muskelbewegungen , die bestimmte Laute hervorbringen , zum Ausdrucke dienen läßt .
artikulieren	VVFIN	1809	1	goerres_wunderhorn_1809-82-35	 	Gerade in demselben Geiste und Sinne sind die meisten jener Volkslieder gedichtet; seit undenklichen Zeiten sind sie in Aller Munde, aber namen-und vaterlos wissen sie den nicht anzugeben, der sie zuerst articulirt; die Gewähr ihres innern Lebens tragen sie in ihrer Vollendung, und bedürfen dazu nicht eines fremden Lebens, daß es ihnen Zeugniß gebe.	204:214	0:351	Gerade in demselben Geiste und Sinne sind die meisten jener Volkslieder gedichtet ; seit undenklichen Zeiten sind sie in Aller Munde , aber namen- und vaterlos wissen sie den nicht anzugeben , der sie zuerst articulirt ; die Gewaͤhr ihres innern Lebens tragen sie in ihrer Vollendung , und beduͤrfen dazu nicht eines fremden Lebens , daß es ihnen Zeugniß gebe .	35	0:62	gerade in demselben Geist und Sinn sein d meiste jen Volkslied dichten ; seit undenklich Zeit sein sie in Aller Mund , aber namen- und vaterlos wissen sie d nicht angeben , die sie zuerst artikulieren ; d Gewähr ihr inner Leben tragen sie in ihr Vollendung , und bedürfen dazu nicht eine fremd Leben , daß es sie Zeugnis geben .	ADV APPR PDAT NN KON NN VAFIN ART PIS PDAT NN VVPP $. APPR ADJA NN VAFIN PPER APPR ADJA NN $, ADV TRUNC KON ADJD VVFIN PPER ART PTKNEG VVIZU $, PRELS PPER ADV VVFIN $. ART NN PPOSAT ADJA NN VVFIN PPER APPR PPOSAT NN $, KON VVFIN PAV PTKNEG ART ADJA NN $, KOUS PPER PPER NN VVFIN $.	Gerade in demselben Geiste und Sinne sind die meisten jener Volkslieder gedichtet ; seit undenklichen Zeiten sind sie in Aller Munde , aber namen- und vaterlos wissen sie den nicht anzugeben , der sie zuerst artikuliert ; die Gewähr ihres inneren Lebens tragen sie in ihrer Vollendung , und bedürfen dazu nicht eines fremden Lebens , daß es ihnen Zeugnis gebe .
artikulieren	VVINF	1855	1	steinthal_grammatik_1855-986-46	 	Dagegen sieht man gar nicht ein, welch ein Zusammenhang, welch eine Beziehung zwischen Gedanken und Stimmwerkzeug Statt habe, so daß jener als Reiz auf dieses wirken könne, daß es töne, und auf die Mundhöhle und Zunge, daß sie den Ton articuliren.	235:246	0:247	Dagegen sieht man gar nicht ein , welch ein Zusammenhang , welch eine Beziehung zwischen Gedanken und Stimmwerkzeug Statt habe , so daß jener als Reiz auf dieses wirken könne , daß es töne , und auf die Mundhöhle und Zunge , daß sie den Ton articuliren .	46	0:48	dagegen sehen man gar nicht ein , welch eine Zusammenhäng , welch eine Beziehung zwischen Gedanke und Stimmewerkzeug Stadt haben , so daß jene als Reiz auf diese wirken können , daß es tönen , und auf d Mundhöhle und Zunge , daß sie d Ton artikulieren .	PAV VVFIN PIS ADV PTKNEG PTKVZ $, PWAT ART NN $, PWAT ART NN APPR NN KON NN NN VAFIN $, ADV KOUS PDS KOKOM NN APPR PDAT VVINF VMFIN $, KOUS PPER VVFIN $, KON APPR ART NN KON NN $, KOUS PPER ART NN VVINF $.	Dagegen sieht man gar nicht ein , welch ein Zusammenhäng , welch eine Beziehung zwischen Gedanken und Stimmwerkzeug Stadt habe , so daß jener als Reiz auf dieses wirken könne , daß es töne , und auf die Mundhöhle und Zunge , daß sie den Ton artikulieren .
artikulieren	VVINF	1822	1	treviranus_biologie06_1822-2300-25	 	Hier findet man auf jeder Seite des Halses eine Vertiefung, worin ein Glied befestigt ist, mit dessen äusserm Ende platte, dreyeckige Lamellen artikuliren, die sich unter dem Vergrösserungsglase als sehr gefässreich und mit einem schleimigen Ueberzuge bedeckt zeigen.	143:154	0:267	Hier findet man auf jeder Seite des Halses eine Vertiefung , worin ein Glied befestigt ist , mit dessen äuſserm Ende platte , dreyeckige Lamellen artikuliren , die sich unter dem Vergröſserungsglase als sehr gefäſsreich und mit einem schleimigen Ueberzuge bedeckt zeigen .	25	0:43	hier finden man auf jede Seite d Hals eine Vertiefung , worin eine Glied befestigen sein , mit die äußer Ende platt , dreieckeig Lamelle artikulieren , die sich unter d Vergrösserungsglas als sehr Gefäßreich und mit eine schleimig Überzug bedeckt zeigen .	ADV VVFIN PIS APPR PIAT NN ART NN ART NN $, PWAV ART NN VVPP VAFIN $, APPR PRELAT ADJA NN ADJA $, ADJA NN VVINF $, PRELS PRF APPR ART NN KOKOM ADV NN KON APPR ART ADJA NN ADJD VVINF $.	Hier findet man auf jeder Seite des Halses eine Vertiefung , worin ein Glied befestigt ist , mit dessen äußerem Ende platte , dreieckige Lamellen artikulieren , die sich unter dem Vergrösserungsglase als sehr Gefässreich und mit einem schleimigen Überzuge bedeckt zeigen .
artikulieren	VVFIN	1805	1	blumenbach_anatomie2_1805-776-31	 	Er ist dicht, flachrundlicht, ohngefähr von der Form und Grösse einer glatten Castanie, verläuft sich am obern Rande mit der einen Seite in einem knochichten Stachel, und articulirt auf der andern mittelst eines bewundernswerthen Ginglymus ohne seines Gleichen mit zwey kleinen Knörhelchen verschiedener Grösse, die ohngefähr die Form von Pfeilspitzen haben.	171:181	0:358	Er ist dicht , flachrundlicht , ohngefähr von der Form und Grösse einer glatten Castanie , verläuft sich am obern Rande mit der einen Seite in einem knochichten Stachel , und articulirt auf der andern mittelst eines bewundernswerthen Ginglymus ohne seines Gleichen mit zwey kleinen Knörhelchen verschiedener Grösse , die ohngefähr die Form von Pfeilspitzen haben .	31	0:57	er sein dicht , flachrundlich , ungefähr von d Form und Größe eine glatt Kastanie , verlaufen sich am ober Rand mit d eine Seite in eine knochig Stachel , und artikulieren auf d ander mittels eine bewundernswert Ginglymus ohne seine Gleichen mit zwei klein Knörhelge verschieden Größe , die ungefähr d Form von Pfeilspitze haben .	PPER VAFIN ADJD $, ADJD $, ADJD APPR ART NN KON NN ART ADJA NN $, VVFIN PRF APPRART ADJA NN APPR ART ART NN APPR ART ADJA NN $, KON VVFIN APPR ART ADJA APPR ART ADJA NN APPR PPOSAT NN APPR CARD ADJA NN ADJA NN $, PRELS ADJD ART NN APPR NN VAFIN $.	Er ist dicht , flachrundlich , ungefähr von der Form und Größe einer glatten Kastanie , verläuft sich am oberen Rande mit der einen Seite in einem knochigen Stachel , und artikuliert auf der anderen mittels eines bewundernswerten Ginglymus ohne seines Gleichen mit zwei kleinen Knörhelgen verschiedener Größe , die ungefähr die Form von Pfeilspitzen haben .
artikulieren	VVFIN	1805	1	treviranus_biologie03_1805-3863-85	 	Die beyden Schaambeine jedes Kindes hingen nicht, wie gewöhnlich, unmittelbar unter einander durch einen Knorpel zusammen, sondern das rechte Schaambein des einen war mit dem linken des andern, und das linke des letztern mit dem rechten des erstern durch ein kurzes, sehr starkes, aber auch sehr biegsames Ligament verbunden, und diese Knochen bildeten mit den Darm-, Sitz-und Kreutzbeinen beyder Individuen ein einziges gemeinschaftliches Becken, welches, vermittelst der erwähnten Ligamente, in der Mitte dergestalt artikulirt war, dass die dem einen Kinde gehörige Hälfte desselben sich um die andere Hälfte bis auf einen gewissen Punkt bewegen konnte.	518:528	0:655	Die beyden Schaambeine jedes Kindes hingen nicht , wie gewöhnlich , unmittelbar unter einander durch einen Knorpel zusammen , sondern das rechte Schaambein des einen war mit dem linken des andern , und das linke des letztern mit dem rechten des erstern durch ein kurzes , sehr starkes , aber auch sehr biegsames Ligament verbunden , und diese Knochen bildeten mit den Darm- , Sitz- und Kreutzbeinen beyder Individuen ein einziges gemeinschaftliches Becken , welches , vermittelst der erwähnten Ligamente , in der Mitte dergestalt artikulirt war , daſs die dem einen Kinde gehörige Hälfte desselben sich um die andere Hälfte bis auf einen gewissen Punkt bewegen konnte .	85	0:109	d beide Schambein jede Kind hangen nicht , wie gewöhnlich , unmittelbar unter einander durch eine Knorpel zusammen , sondern d recht Schambein d eine sein mit d link d ander , und d link d letztere mit d recht d erstere durch eine kurz , sehr stark , aber auch sehr biegsam Ligament verbinden , und diese Knochen bilden mit d darm- , sitz- und Kreuzbein beide Individuum eine einzig gemeinschaftlich Becken , welche , vermittels d erwähnt Ligament , in d Mitte dergestalt artikulieren sein , dass d d eine Kind gehörig Hälfte dieselbe sich um d ander Hälfte bis auf eine gewiß Punkt bewegen können .	ART PIAT NN PIAT NN VVFIN PTKNEG $, PWAV ADJD $, ADJD APPR PRF APPR ART NN PTKVZ $, KON ART ADJA NN ART PIS VAFIN APPR ART ADJA ART ADJA $, KON ART ADJA ART ADJA APPR ART ADJA ART ADJA APPR ART ADJA $, ADV ADJA $, ADV ADV ADV ADJA NN VVPP $, KON PDAT NN VVFIN APPR ART TRUNC $, TRUNC KON NN PIAT NN ART ADJA ADJA NN $, PRELS $, APPR ART ADJA NN $, APPR ART NN ADV VVFIN VAFIN $, KOUS ART ART ART NN ADJA NN PDS PRF APPR ART ADJA NN APPR APPR ART ADJA NN VVINF VMFIN $.	Die beiden Schambeine jedes Kindes hingen nicht , wie gewöhnlich , unmittelbar unter einander durch einen Knorpel zusammen , sondern das rechte Schambein des einen war mit dem linken des anderen , und das linke des letzteren mit dem rechten des ersteren durch ein kurzes , sehr starkes , aber auch sehr biegsames Ligament verbunden , und diese Knochen bildeten mit den Darm- , Sitz- und Kreuzbeinen beider Individuen ein einziges gemeinschaftliches Becken , welches , vermittels der erwähnten Ligamente , in der Mitte dergestalt artikuliert war , dass die dem einen Kinde gehörige Hälfte desselben sich um die andere Hälfte bis auf einen gewissen Punkt bewegen konnte .
artikulieren	VVFIN	1851	1	vogt_briefe02_1851-535-61	 	Bei den Haien und Rochen, wo das Maul so weit nach hinten auf der Bauchfläche angebracht ist, wird der vom Schädel getrennte Oberkiefer einfach mit dem Unterkiefer durch ein Gelenk verbunden und das Gelenk durch das obere Stück des Zungenbogens an dem Schädel aufgehängt, während bei den Seekatzen der Unterkiefer noch unmittelbar an einem knorpeligen Fortsatze des Schädels articulirt.	375:385	0:386	Bei den Haien und Rochen , wo das Maul ſo weit nach hinten auf der Bauchfläche angebracht iſt , wird der vom Schädel getrennte Oberkiefer einfach mit dem Unterkiefer durch ein Gelenk verbunden und das Gelenk durch das obere Stück des Zungenbogens an dem Schädel aufgehängt , während bei den Seekatzen der Unterkiefer noch unmittelbar an einem knorpeligen Fortſatze des Schädels articulirt .	61	0:63	bei d Haien und Rochen , wo d Maul so weit nach hinten auf d Bauchfläche anbringen sein , werden d vom Schädel getrennt Oberkiefer einfach mit d Unterkiefer durch eine Gelenk verbinden und d Gelenk durch d ober Stück d Zungenbogen an d Schädel aufhängen , während bei d Seekatze d Unterkiefer noch unmittelbar an eine knorpelig Fortsatz d Schädel artikulieren .	APPR ART NN KON NN $, PWAV ART NN ADV ADJD APPR ADV APPR ART NN VVPP VAFIN $, VAFIN ART APPRART NE ADJA NN ADV APPR ART NN APPR ART NN VVPP KON ART NN APPR ART ADJA NN ART NN APPR ART NE VVPP $, KOUS APPR ART NN ART NN ADV ADJD APPR ART ADJA NN ART NN VVFIN $.	Bei den Haien und Rochen , wo das Maul so weit nach hinten auf der Bauchfläche angebracht ist , wird der vom Schädel getrennte Oberkiefer einfach mit dem Unterkiefer durch ein Gelenk verbunden und das Gelenk durch das obere Stück des Zungenbogens an dem Schädel aufgehängt , während bei den Seekatzen der Unterkiefer noch unmittelbar an einem knorpeligen Fortsatze des Schädels artikuliert .
artikulieren	VVFIN	1852	1	alexis_ruhe05_1852-5115-10	 	Seine Stimme polterte, aber die Laute waren nicht mehr articulirt.	55:65	0:66	Seine Stimme polterte , aber die Laute waren nicht mehr articulirt .	10	0:12	seine Stimme poltern , aber d Laute sein nicht mehr artikulieren .	PPOSAT NN VVFIN $, ADV ART NN VAFIN PTKNEG ADV VVFIN $.	Seine Stimme polterte , aber die Laute waren nicht mehr artikuliert .
artikulieren	VVFIN	1805	1	blumenbach_anatomie2_1805-645-20	 	Und da die Vögel weder wahre Nebenröhre (sibula), noch auch Fusswurzel (tarsus) haben, so articulirt ihre Schienbeinröhre unmittelbar mit der gedachten Mittelfussröhre.	90:100	0:168	Und da die Vögel weder wahre Nebenröhre ( sibula ) , noch auch Fusswurzel ( tarsus ) haben , so articulirt ihre Schienbeinröhre unmittelbar mit der gedachten Mittelfussröhre .	20	0:29	und da d Vogel weder wahr Nebenröhre ( Sibula ) , noch auch Fußwurzel ( Tarsus ) haben , so artikulieren ihr Schienbeinröhre unmittelbar mit d gedenkt Mittelfußröhre .	KON KOUS ART NN KON ADJA NN $( NE $( $, ADV ADV NN $( NE $( VAFIN $, ADV VVFIN PPOSAT NN ADJD APPR ART ADJA NN $.	Und da die Vögel weder wahre Nebenröhre ( sibula ) , noch auch Fusswurzel ( Tarsus ) haben , so artikuliert ihre Schienbeinröhre unmittelbar mit der gedachten Mittelfussröhre .
artikulieren	VVFIN	1802	1	treviranus_biologie01_1802-2665-2	 	Die letztern artikuliren auf der einen Seite mit dem Schädel, auf der andern mit dem Zungenbeine.	13:24	0:97	Die letztern artikuliren auf der einen Seite mit dem Schädel , auf der andern mit dem Zungenbeine .	2	0:18	d letztere artikulieren auf d eine Seite mit d Schädel , auf die andere mit d Zungenbein .	ART PIS VVFIN APPR ART ART NN APPR ART NE $, APPR PRELS PIS APPR ART NN $.	Die letzteren artikulieren auf der einen Seite mit dem Schädel , auf der anderen mit dem Zungenbeine .
artikulieren	VVFIN	1892	1	kraepelin_arzneimittel_1892-202-10	 	Das Lesen geschah halblaut; die einzelnen Silben sollten deutlich articulirt, der Sinn aber nicht beachtet und die Interpunctionszeichen nicht eingehalten werden.	66:76	0:162	Das Lesen geschah halblaut ; die einzelnen Silben sollten deutlich articulirt , der Sinn aber nicht beachtet und die Interpunctionszeichen nicht eingehalten werden .	10	0:24	d Lesen geschehen halblaut ; d einzeln Silbe sollen deutlich artikulieren , d Sinn aber nicht beachten und d Interpunktionszeichen nicht einhalten werden .	ART NN VVFIN ADJD $. ART ADJA NN VMFIN ADJD VVFIN $, ART NN ADV PTKNEG VVPP KON ART NN PTKNEG VVPP VAINF $.	Das Lesen geschah halblaut ; die einzelnen Silben sollten deutlich artikuliert , der Sinn aber nicht beachtet und die Interpunktionszeichen nicht eingehalten werden .
artikulieren	VVFIN	1855	1	steinthal_grammatik_1855-2531-7	 	Der Laut, d. h. der organisch articulirte, ist nicht ein selbständiges Wesen für sich, begründet nicht etwa ein Wesen, Sprache genannt, abgesondert und verschieden vom Gedanken; sondern der Laut gehört dem Denken selbst, ist ihm organisch so nothwendig, wie eine Materie der Kraft, ein Leib der Seele.	30:41	0:301	Der Laut , d. h. der organisch articulirte , ist nicht ein selbständiges Wesen für sich , begründet nicht etwa ein Wesen , Sprache genannt , abgesondert und verschieden vom Gedanken ; sondern der Laut gehört dem Denken selbst , ist ihm organisch so nothwendig , wie eine Materie der Kraft , ein Leib der Seele .	7	0:57	d laut , d. h. d organisch artikulieren , sein nicht eine selbständig Wesen für sich , begründen nicht etwa eine Wesen , Sprache nennen , absondern und verschieden vom Gedanke ; sondern d laut gehören d Denken selbst , sein er organisch so notwendig , wie eine Materie d Kraft , eine Leib d Seele .	ART APPR $, PDS VVFIN ART ADJD VVFIN $, VAFIN PTKNEG ART ADJA NN APPR PRF $, VVFIN PTKNEG ADV ART NN $, NN VVPP $, VVPP KON ADJD APPRART NN $. KON ART APPR VVFIN ART NN ADV $, VAFIN PPER ADJD ADV ADJD $, PWAV ART NN ART NN $, ART NN ART NN $.	Der Laut , d. h. der organisch artikulierte , ist nicht ein selbständiges Wesen für sich , begründet nicht etwa ein Wesen , Sprache genannt , abgesondert und verschieden vom Gedanken ; sondern der Laut gehört dem Denken selbst , ist ihm organisch so notwendig , wie eine Materie der Kraft , ein Leib der Seele .
artikulieren	VVINF	1874	1	wernicke_symptomencomplex_1874-837-40	 	Eine an diesem Tage vorgenommene Untersuchung ergab nun Folgendes. Pat. kann, bei voller Beweglichkeit der Zunge und der Lippen, kein einziges Wort sprechen, nur Sylben mit dem Buchstaben a und einem stummen Anhang, meist m, articuliren.	225:236	0:237	Eine an diesem Tage vorgenommene Untersuchung ergab nun Folgendes. Pat. kann , bei voller Beweglichkeit der Zunge und der Lippen , kein einziges Wort sprechen , nur Sylben mit dem Buchstaben a und einem stummen Anhang , meist m , articuliren .	40	0:42	eine an diese Tag vorgenehmen Untersuchung ergeben nun Folgendes. Pat. können , bei voll Beweglichkeit d Zunge und d Lippe , keine einzig Wort sprechen , nur Silbe mit d Buchstabe A und eine stumm Anhang , meist M , artikulieren .	ART APPR PDAT NN ADJA NN VVFIN ADV NE NE VMFIN $, APPR ADJA NN ART NN KON ART NN $, PIAT ADJA NN VVINF $, ADV NN APPR ART NN NE KON ART ADJA NN $, ADV NN $, VVINF $.	Eine an diesem Tage vorgenommene Untersuchung ergab nun Folgendes. Pat. kann , bei voller Beweglichkeit der Zunge und der Lippen , kein einziges Wort sprechen , nur Silben mit dem Buchstaben a und einem stummen Anhang , meist m , artikulieren .
artikulieren	VVFIN	1804	1	clodius_poetik01_1804-3105-11	 	Um dies Werden darzustellen, müssen die Töne nicht blos als artikulirt getrennt, sondern noch als Continua, die sich rythmisch entwickeln, erscheinen.	60:70	0:150	Um dies Werden darzustellen , müssen die Töne nicht blos als artikulirt getrennt , sondern noch als Continua , die sich rythmisch entwickeln , erscheinen .	11	0:26	um diese werden darstellen , müssen d Ton nicht bloß als artikulieren getrennt , sondern noch als Continua , die sich Rythmisch entwickeln , erscheinen .	KOUI PDS VAFIN VVIZU $, VMFIN ART NN PTKNEG ADV KOKOM VVFIN ADJD $, KON ADV KOKOM NE $, PRELS PRF NE VVINF $, VVINF $.	Um dies Werden darzustellen , müssen die Töne nicht bloß als artikuliert getrennt , sondern noch als Continua , die sich rythmisch entwickeln , erscheinen .
artikulieren	VVFIN	1815	1	blumenbach_anatomie_1815-806-31	 	Er ist dicht, flachrundlich, ohngefähr von der Form und Grösse einer glatten Castanie, verläuft sich am obern Rande mit der einen Seite in einem knochichten Stachel, und articulirt auf der andern mittelst eines bewundernswerthen Ginglymus ohne seines Gleichen mit zwey kleinen Knöchelchen verschiedener Grösse, die ohngefähr die Form von Pfeilspitzen haben.	170:180	0:357	Er ist dicht , flachrundlich , ohngefähr von der Form und Grösse einer glatten Castanie , verläuft sich am obern Rande mit der einen Seite in einem knochichten Stachel , und articulirt auf der andern mittelst eines bewundernswerthen Ginglymus ohne seines Gleichen mit zwey kleinen Knöchelchen verschiedener Grösse , die ohngefähr die Form von Pfeilspitzen haben .	31	0:57	er sein dicht , flachrundlich , ungefähr von d Form und Größe eine glatt Kastanie , verlaufen sich am ober Rand mit d eine Seite in eine knochig Stachel , und artikulieren auf d ander mittels eine bewundernswert Ginglymus ohne seine Gleichen mit zwei klein Knöchelchen verschieden Größe , die ungefähr d Form von Pfeilspitze haben .	PPER VAFIN ADJD $, ADJD $, ADJD APPR ART NN KON NN ART ADJA NN $, VVFIN PRF APPRART ADJA NN APPR ART ART NN APPR ART ADJA NN $, KON VVFIN APPR ART ADJA APPR ART ADJA NN APPR PPOSAT NN APPR CARD ADJA NN ADJA NN $, PRELS ADJD ART NN APPR NN VAFIN $.	Er ist dicht , flachrundlich , ungefähr von der Form und Größe einer glatten Kastanie , verläuft sich am oberen Rande mit der einen Seite in einem knochigen Stachel , und artikuliert auf der anderen mittels eines bewundernswerten Ginglymus ohne seines Gleichen mit zwei kleinen Knöchelchen verschiedener Größe , die ungefähr die Form von Pfeilspitzen haben .
artikulieren	VVFIN	1835	1	valentin_entwicklungsgeschichte_1835-3185-9	 	Er stösst noch als Warze an den Amboss und articulirt sich bald mit ihm.	43:53	0:72	Er stöſst noch als Warze an den Amboſs und articulirt sich bald mit ihm .	9	0:15	er stoßen noch als Warze an d Amboß und artikulieren sich bald mit er .	PPER VVFIN ADV KOKOM NN APPR ART NN KON VVFIN PRF ADV APPR PPER $.	Er stößt noch als Warze an den Amboss und artikuliert sich bald mit ihm .
artikulieren	VVINF	1807	1	blumenbach_knochen_1807-3239-19	 	Das hintere Ende dient zur Verbindung der Rippen mit den Rückenwirbeln, an welchen sie mit zwey besondern Gelenkknöpfen articuliren.	120:131	0:132	Das hintere Ende dient zur Verbindung der Rippen mit den Rückenwirbeln , an welchen sie mit zwey besondern Gelenkknöpfen articuliren .	19	0:21	d hinter Ende dienen zur Verbindung d Rippe mit d Rückenwirbel , an welchen sie mit zwei besondere Gelenkknopf artikulieren .	ART ADJA NN VVFIN APPRART NN ART NN APPR ART NN $, APPR PWAT PPER APPR CARD ADJA NN VVINF $.	Das hintere Ende dient zur Verbindung der Rippen mit den Rückenwirbeln , an welchen sie mit zwei besonderen Gelenkknöpfen artikulieren .
artikulieren	VVFIN	1805	1	treviranus_biologie03_1805-825-9	 	In der Gegend von Eschweiler, wo man auch artikulirte, gereifelte Versteinerungen antrifft, die dem Equisetum giganteum L. ähnlich sind, fand man einen grossen Theil eines versteinerten starken Baums, welcher, der Rinde nach, zum Geschlechte der Palmen gehörte.	42:53	0:261	In der Gegend von Eschweiler , wo man auch artikulirte , gereifelte Versteinerungen antrifft , die dem Equisetum giganteum L. ähnlich sind , fand man einen groſsen Theil eines versteinerten starken Baums , welcher , der Rinde nach , zum Geschlechte der Palmen gehörte .	9	0:45	in d Gegend von Eschweiler , wo man auch artikulieren , gereifelt Versteinerung antreffen , die d Equisetum Giganteum L. ähnlich sein , finden man eine groß Teil eine versteinert stark Baum , welche , d Rinde nach , zum Geschlecht d Palme gehören .	APPR ART NN APPR NE $, PWAV PIS ADV VVFIN $, ADJA NN VVFIN $, PRELS ART NN NE NE ADJD VAFIN $, VVFIN PIS ART ADJA NN ART ADJA ADJA NN $, PRELS $, ART NN PTKVZ $, APPRART NN ART NN VVFIN $.	In der Gegend von Eschweiler , wo man auch artikulierte , gereifelte Versteinerungen antrifft , die dem Equisetum giganteum L. ähnlich sind , fand man einen großen Teil eines versteinerten starken Baums , welcher , der Rinde nach , zum Geschlecht der Palmen gehörte .
artikulieren	VVINF	1845	1	griesinger_psychische_1845-3878-13	 	Der Kranke fängt an, mit Anstrengung zu sprechen, etwas ungenau zu articuliren, und zu stottern.	67:78	0:96	Der Kranke fängt an , mit Anstrengung zu sprechen , etwas ungenau zu articuliren , und zu stottern .	13	0:19	d Kranke fangen an , mit Anstrengung zu sprechen , etwas ungenau zu artikulieren , und zu stottern .	ART NN VVFIN PTKVZ $, APPR NN PTKZU VVINF $, ADV ADJD PTKZU VVINF $, KON PTKZU VVINF $.	Der Kranke fängt an , mit Anstrengung zu sprechen , etwas ungenau zu artikulieren , und zu stottern .
artikulieren	VVFIN	1855	1	steinthal_grammatik_1855-2625-1	 	Jeder articulirte Laut müßte eine Bedeutung haben, und die reinste und vollendetste Quelle der Begriffsbildung müßte diejenige sein, welche aus dem Bemühen entstünde, Wortlaute zu bilden.	6:17	0:187	Jeder articulirte Laut müßte eine Bedeutung haben , und die reinste und vollendetste Quelle der Begriffsbildung müßte diejenige sein , welche aus dem Bemühen entstünde , Wortlaute zu bilden .	1	0:30	jede artikulieren laut müssen eine Bedeutung haben , und d rein und vollendet Quelle d Begriffsbildung müssen diejenige sein , welche aus d Bemühen entstehen , Wortlaut zu bilden .	PIS VVFIN APPR VMFIN ART NN VAFIN $, KON ART ADJA KON ADJA NN ART NN VMFIN PDS VAINF $, PRELS APPR ART NN VVFIN $, NN PTKZU VVINF $.	Jeder artikulierte Laut müßte eine Bedeutung haben , und die reinste und vollendetste Quelle der Begriffsbildung müßte diejenige sein , welche aus dem Bemühen entstünde , Wortlaute zu bilden .
