lemma	pos	date	grouping	identifier	description	context	indexes_target_token	indexes_target_sentence	context_tokenized	indexes_target_token_tokenized	indexes_target_sentence_tokenized	context_lemmatized	context_pos	context_normalized
artikulieren	VVFIN	1867	1	brehm_thierleben04_1867-19559-19	 	Die Augenscheidewand ist ganz durchbrochen, ein pyramidaler, dreieckig zugespitzter Knechen, welcher mit dem Schuppentheile des Hinterhauptsbeines artikulirt und wagerecht nach hinten gekehrt ist, sehr eigenthümlich.	147:157	0:216	Die Augenſcheidewand iſt ganz durchbrochen , ein pyramidaler , dreieckig zugeſpitzter Knechen , welcher mit dem Schuppentheile des Hinterhauptsbeines artikulirt und wagerecht nach hinten gekehrt iſt , ſehr eigenthümlich .	19	0:30	d Augenscheidewand sein ganz durchbrechen , eine pyramidal , dreieckeig zugespitzt Knechen , welche mit d Schuppenteil d Hinterhauptsbein artikulieren und waagerecht nach hinten kehren sein , sehr eigentümlich .	ART NN VAFIN ADV VVPP $, ART ADJA $, ADJD ADJA NN $, PRELS APPR ART NN ART NN VVFIN KON ADJD APPR ADV VVPP VAFIN $, ADV ADJD $.	Die Augenscheidewand ist ganz durchbrochen , ein pyramidaler , dreieckig zugespitzter Knechen , welcher mit dem Schuppenteile des Hinterhauptsbeines artikuliert und waagerecht nach hinten gekehrt ist , sehr eigentümlich .
artikulieren	VVINF	1810	1	goethe_farbenlehre01_1810-4726-57	 	Wenn wir es von unserer Seite für nöthig und vortheilhaft hielten, nach den acht ersten Versuchen eine Uebersicht derselben zu veranlassen, so thut Newton dasselbige auf seine Weise, nach dem zehnten; und indem wir ihn hier zu beobachten alle Ursache haben, finden wir uns in dem Falle, unsern Widerspruch abermals zu articuliren.	318:329	0:330	Wenn wir es von unſerer Seite fuͤr noͤthig und vortheilhaft hielten , nach den acht erſten Verſuchen eine Ueberſicht derſelben zu veranlaſſen , ſo thut Newton daſſelbige auf ſeine Weiſe , nach dem zehnten ; und indem wir ihn hier zu beobachten alle Urſache haben , finden wir uns in dem Falle , unſern Widerſpruch abermals zu articuliren .	57	0:59	wenn wir es von unsere Seite für nötig und vorteilhaft halten , nach d acht erst Versuch eine Übersicht dieselbe zu veranlassen , so tun Newton dasselbe auf seine Weise , nach d zehnt ; und indem wir er hier zu beobachten alle Ursache haben , finden wir uns in d Falle , unsere Widerspruch abermals zu artikulieren .	KOUS PPER PPER APPR PPOSAT NN APPR ADJD KON ADJD VVFIN $, APPR ART CARD ADJA NN ART NN PDAT PTKZU VVINF $, ADV VVFIN NN PDAT APPR PPOSAT NN $, APPR ART ADJA $. KON KOUS PPER PPER ADV PTKZU VVINF PIAT NN VAFIN $, VVFIN PPER PRF APPR ART NN $, PPOSAT NN ADV PTKZU VVINF $.	Wenn wir es von unserer Seite für nötig und vorteilhaft hielten , nach den acht ersten Versuchen eine Übersicht derselben zu veranlassen , so tut Newton dasselbe auf seine Weise , nach dem zehnten ; und indem wir ihn hier zu beobachten alle Ursache haben , finden wir uns in dem Falle , unseren Widerspruch abermals zu artikulieren .
artikulieren	VVFIN	1855	1	steinthal_grammatik_1855-4878-29	 	Daß aber Anschauungen Bewegungen verursachen, die gar nichts mit der Verwirklichung jener Anschauungen zu thun haben, wie dies in der Sprache vorliegt — da das Tönen und Articuliren keine Ausführung der angeschauten Dinge oder Bewegungen ist —: dies scheint mir nur dadurch erklärbar zu sein, daß wir die Anschauungen von Gefühlen begleitet sein lsssen.	170:181	0:353	Daß aber Anschauungen Bewegungen verursachen , die gar nichts mit der Verwirklichung jener Anschauungen zu thun haben , wie dies in der Sprache vorliegt — da das Tönen und Articuliren keine Ausführung der angeschauten Dinge oder Bewegungen ist — : dies scheint mir nur dadurch erklärbar zu sein , daß wir die Anschauungen von Gefühlen begleitet sein lsssen .	29	0:59	daß aber Anschauung Bewegung verursachen , die gar nichts mit d Verwirklichung jen Anschauung zu tun haben , wie diese in d Sprache vorliegen -- da d Ton und artikulieren keine Ausführung d angeschaut Ding oder Bewegung sein -- : diese scheinen ich nur dadurch erklärbar zu sein , daß wir d Anschauung von Gefühl begleiten sein lsssen .	KOUS ADV NN NN VVINF $, PRELS ADV PIS APPR ART NN PDAT NN PTKZU VVINF VAFIN $, PWAV PDS APPR ART NN VVFIN $( KOUS ART NN KON VVFIN PIAT NN ART ADJA NN KON NN VAFIN $( $. PDS VVFIN PPER ADV PAV ADJD PTKZU VAINF $, KOUS PPER ART NN APPR NN VVPP VAINF VMFIN $.	Daß aber Anschauungen Bewegungen verursachen , die gar nichts mit der Verwirklichung jener Anschauungen zu tun haben , wie dies in der Sprache vorliegt -- da das Tönen und artikulieren keine Ausführung der angeschauten Dinge oder Bewegungen ist -- : dies scheint mir nur dadurch erklärbar zu sein , daß wir die Anschauungen von Gefühlen begleitet sein lsssen .
artikulieren	VVINF	1807	1	goerres_volksbuecher_1807-152-102	 	Sie ordnen sich am nächsten jenen spätern Versuchen der Neuern bey, diese Literatur zu erweitern durch andere der großen Masse fremde Combinationen, mit denen vorher nie das Volk vertraut gewesen, die daher auch in ihrer Wirkung so wenig gedeihlich und so oft unnütz gewesen sind. Das Volk hat sie nicht mit der Liebe umfassen können, wie jene Früheren, mit denen es gleichsam aufgewachsen, und in welchen es erstaunt auf einmal sein eigenstes Eigenthum erkannte, und klar und deutlich im Worte ausgesprochen fand, was es wohl oft mit schwerer, dicker Zunge undeutlich nur articuliren konnte.	573:584	0:592	Sie ordnen ſich am nächſten jenen ſpätern Verſuchen der Neuern bey , dieſe Literatur zu erweitern durch andere der großen Maſſe fremde Combinationen , mit denen vorher nie das Volk vertraut geweſen , die daher auch in ihrer Wirkung ſo wenig gedeihlich und ſo oft unnütz geweſen ſind . Das Volk hat ſie nicht mit der Liebe umfaſſen können , wie jene Früheren , mit denen es gleichſam aufgewachſen , und in welchen es erſtaunt auf einmal ſein eigenſtes Eigenthum erkannte , und klar und deutlich im Worte ausgeſprochen fand , was es wohl oft mit ſchwerer , dicker Zunge undeutlich nur articuliren konnte .	102	0:105	sie ordnen sich am nächst jen spät Versuch d Neueren bei , diese Literatur zu erweitern durch andere d groß Maß fremd Kombination , mit die vorher nie d Volk vertraut sein , die daher auch in ihr Wirkung so wenig gedeihlich und so oft unnütz sein sein . d Volk haben sie nicht mit d Liebe umfassen können , wie jen Früheren , mit die es gleichsam aufwachsen , und in welchen es erstaunt auf einmal sein eigen Eigentum erkennen , und klar und deutlich im Wort aussprechen finden , was es wohl oft mit schwer , dick Zunge undeutlich nur artikulieren können .	PPER VVINF PRF APPRART ADJA PDAT ADJA NN ART NN PTKVZ $, PDAT NN PTKZU VVINF APPR PIS ART ADJA NN ADJA NN $, APPR PRELS ADV ADV ART NN ADJD VAPP $, PRELS PAV ADV APPR PPOSAT NN ADV ADV ADJD KON ADV ADV ADJD VAPP VAFIN $. ART NN VAFIN PPER PTKNEG APPR ART NN VVINF VMINF $, PWAV PDAT NN $, APPR PRELS PPER ADJD VVPP $, KON APPR PWAT PPER ADJD APPR ADV PPOSAT ADJA NN VVFIN $, KON ADJD KON ADJD APPRART NN VVPP VVFIN $, PWS PPER ADV ADV APPR ADJA $, ADJA NN ADJD ADV VVINF VMFIN $.	Sie ordnen sich am nächsten jenen späteren Versuchen der Neueren bei , diese Literatur zu erweitern durch andere der großen Maße fremde Kombinationen , mit denen vorher nie das Volk vertraut gewesen , die daher auch in ihrer Wirkung so wenig gedeihlich und so oft unnütz gewesen sind . Das Volk hat sie nicht mit der Liebe umfassen können , wie jene Früheren , mit denen es gleichsam aufgewachsen , und in welchen es erstaunt auf einmal sein eigenstes Eigentum erkannte , und klar und deutlich im Worte ausgesprochen fand , was es wohl oft mit schwerer , dicker Zunge undeutlich nur artikulieren konnte .
artikulieren	VVFIN	1834	1	varnhagen_rahel03_1834-2745-3	 	Daher ist sie artikulirt: heißt, mit Willkür (Wahl, zu einem Zweck) versetzt.	14:24	0:77	Daher iſt ſie artikulirt : heißt , mit Willkür ( Wahl , zu einem Zweck ) verſetzt .	3	0:18	daher sein sie artikulieren : heißen , mit Willkür ( Wahl , zu eine Zweck ) versetzen .	PAV VAFIN PPER VVFIN $. VVFIN $, APPR NN $( NN $, APPR ART NN $( VVPP $.	Daher ist sie artikuliert : heißt , mit Willkür ( Wahl , zu einem Zweck ) versetzt .
artikulieren	VVFIN	1978	2	2532889X_1978-12-20_01_052.tcf.xml-23-1	 	Mitunter artikuliert sich in ihnen auch etwas von einer Bereitschaft zur aktiven Verteidigung des	9:20	0:97	Mitunter artikuliert sich in ihnen auch etwas von einer Bereitschaft zur aktiven Verteidigung des	1	0:14	mitunter artikulieren sich in sie auch etwas von eine Bereitschaft zur aktiv Verteidigung d	ADV VVFIN PRF APPR PPER ADV ADV APPR ART NN APPRART ADJA NN ART	
artikulieren	VVINF	1990	2	2532889X_1990-08-11_01_041.tcf.xml-6-10	 	Weil sie eine eigene Meinung haben und diese auch öffentlich artikulieren.	61:73	0:74	Weil sie eine eigene Meinung haben und diese auch öffentlich artikulieren .	10	0:12	weil sie eine eigen Meinung haben und diese auch öffentlich artikulieren .	KOUS PPER ART ADJA NN VAFIN KON PDS ADV ADJD VVINF $.	
artikulieren	VVFIN	1984	2	26120215_1984_08_21_01_070.tcf.xml-10-29	 	Die politisch nachhaltigste Neuproduktion der Spielzeit war die Staatsoper-Inszenierung von Brecht/Dessaus „Die Verurteilung des Lukullus", die in aller Wünschenswerten Deutlichkeit die brennend aktuelle Dimension des Werkes artikulierte.	225:237	0:238	Die politisch nachhaltigste Neuproduktion der Spielzeit war die Staatsoper-Inszenierung von Brecht/Dessaus „ Die Verurteilung des Lukullus " , die in aller Wünschenswerten Deutlichkeit die brennend aktuelle Dimension des Werkes artikulierte .	29	0:31	d politisch nachhaltig Neuproduktion d Spielzeit sein d Staatsoper-Inszenierung von Brecht/dessaus „ d Verurteilung d Lukullus " , die in alle wünschenswert Deutlichkeit d brennend aktuell Dimension d Werk artikulieren .	ART ADJD ADJA NN ART NN VAFIN ART NN APPR NE $( ART NN ART NN $( $, PRELS APPR PIAT ADJA NN ART ADJD ADJA NN ART NN VVFIN $.	
artikulieren	VVINF	1976	2	2532889X_1976-01-29_01_086.tcf.xml-25-15	 	Kein Wunder also, daß sich in der britischen Gewerkschaftsbewegung Unmut und Unzufriedenheit immer deutlicher artikulieren.	110:122	0:123	Kein Wunder also , daß sich in der britischen Gewerkschaftsbewegung Unmut und Unzufriedenheit immer deutlicher artikulieren .	15	0:17	Kein Wunder also , daß sich in d britisch Gewerkschaftsbewegung Unmut und Unzufriedenheit immer deutlich artikulieren .	PIAT NN ADV $, KOUS PRF APPR ART ADJA NN NN KON NN ADV ADJD VVINF $.	
artikulieren	VVFIN	1990	2	26120215_1990_11_15_01_113.tcf.xml-47-16	 	Hohe Erwartungen, aber auch Besorgnisse wurden bei dem Treffen zum Thema.Deutschland in Europa * artikuliert.	97:108	0:109	Hohe Erwartungen , aber auch Besorgnisse wurden bei dem Treffen zum Thema .Deutschland in Europa * artikuliert .	16	0:18	hoch Erwartung , aber auch Besorgnis werden bei d Treffen zum Thema .deutschland in Europa * artikulieren .	ADJA NN $, ADV ADV NN VAFIN APPR ART NN APPRART NN NE APPR NE XY VVFIN $.	
artikulieren	VVINF	1966	2	2532889X_1966-10-20_01_054.tcf.xml-64-7	 	Wir müssen verständlich für die vi elen artikulieren. wie neu, wie original, wie. noch nie dagewesen** wir sind.	40:52	0:112	Wir müssen verständlich für die vi elen artikulieren . wie neu , wie original , wie . noch nie dagewesen** wir sind .	7	0:23	wir müssen verständlich für d vi elen artikulieren . wie neu , wie original , wie . noch nie dagewesen** wir sein .	PPER VMFIN ADJD APPR ART FM FM VVINF $. PWAV ADJD $, PWAV ADJD $, PWAV $. ADV ADV VVFIN PPER VAFIN $.	
artikulieren	VVFIN	1975	2	2532889X_1975-05-21_01_064.tcf.xml-5-2	 	Diese Freude artikuliert sich musikalisch mit ernster Stimme in zwei „Reflexionen", die jeweils mit „These", Ausdruck humanitären Ringens, und „Antithese", stellvertretend für barbarischen Zerstörungsdrang, verbunden sind.	13:24	0:222	Diese Freude artikuliert sich musikalisch mit ernster Stimme in zwei „ Reflexionen " , die jeweils mit „ These " , Ausdruck humanitären Ringens , und „ Antithese " , stellvertretend für barbarischen Zerstörungsdrang , verbunden sind .	2	0:38	diese Freude artikulieren sich musikalisch mit ernst Stimme in zwei „ Reflexion " , die jeweils mit „ These " , Ausdruck humanitär Ringen , und „ Antithese " , stellevertretend für barbarisch Zerstörungsdrang , verbinden sein .	PDAT NN VVFIN PRF ADJD APPR ADJA NN APPR CARD $( NN $( $, PRELS ADV APPR $( NN $( $, NN ADJA NN $, KON $( NN $( $, ADJD APPR ADJA NN $, VVPP VAFIN $.	
artikulieren	VVFIN	1979	2	26120215_1979_06_05_01_167.tcf.xml-6-7	 	Kann ihr Lebensgefühl nur von gleichaltrigen Schriftstellern artikuliert werden?	61:72	0:80	Kann ihr Lebensgefühl nur von gleichaltrigen Schriftstellern artikuliert werden ?	7	0:10	können ihr Lebensgefühl nur von gleichaltrig Schriftsteller artikulieren werden ?	VMFIN PPOSAT NN ADV APPR ADJA NN VVFIN VAINF $.	
artikulieren	VVFIN	1987	2	2532889X_1987-10-31_01_504.tcf.xml-2-27	 	Marginalien, Randverfügungen, Kabinettsordern und Briefe Friedrichs II. fesseln mit ihrer originellen Sicht, ihrem Esprit, aber auch in ihrer Bosheit, die sich zuweilen artikuliert.	169:180	0:181	Marginalien , Randverfügungen , Kabinettsordern und Briefe Friedrichs II. fesseln mit ihrer originellen Sicht , ihrem Esprit , aber auch in ihrer Bosheit , die sich zuweilen artikuliert .	27	0:29	Marginalie , Randverfügung , Kabinettsorder und Brief Friedrichs Ii. fesseln mit ihr originell Sicht , ihr Esprit , aber auch in ihr Bosheit , die sich zuweilen artikulieren .	NN $, NN $, NN KON NN NE NE VVFIN APPR PPOSAT ADJA NN $, PPOSAT NN $, ADV ADV APPR PPOSAT NN $, PRELS PRF ADV VVFIN $.	
artikulieren	VVINF	1988	2	2532889X_1988-08-20_01_267.tcf.xml-12-30	 	Ob Huhn gekocht, gegrillt, paniert, weiße Bohnen mit Speck, Powideldatschkerln oder Moussaka... man wundert sich, was für verrückte Ideen sich hier zu artikulieren wußten.	151:163	0:171	Ob Huhn gekocht , gegrillt , paniert , weiße Bohnen mit Speck , Powideldatschkerln oder Moussaka . . . man wundert sich , was für verrückte Ideen sich hier zu artikulieren wußten .	30	0:33	ob Huhn kochen , gegrillt , panieren , weiß Bohne mit Speck , Powideldatschkerln oder Moussaka . . . man wundern sich , was für verrückt Idee sich hier zu artikulieren wissen .	KOUS NN VVPP $, ADJD $, VVFIN $, ADJA NN APPR NN $, NE KON NN $. $. $. PIS VVFIN PRF $, PRELS APPR ADJA NN PRF ADV PTKZU VVINF VVFIN $.	
artikulieren	VVFIN	1982	2	2532889X_1982-11-11_01_053.tcf.xml-14-7	 	Das Geschieh ts-Verständnis der jungen Generation artikuliert sich unter anderem in der Darstellung von Stätten der Revolution.	50:61	0:127	Das Geschieh ts- Verständnis der jungen Generation artikuliert sich unter anderem in der Darstellung von Stätten der Revolution .	7	0:19	die geschehen ts- Verständnis d jung Generation artikulieren sich unter ander in d Darstellung von Stätte d Revolution .	PDS VVFIN TRUNC NN ART ADJA NN VVFIN PRF APPR PIS APPR ART NN APPR NN ART NN $.	
artikulieren	VVFIN	1986	2	26120215_1986_01_07_01_262.tcf.xml-15-24	 	Da spürte man sofort, daß alte Musik sehr lebendig und überzeugend wirken kann, wenn sie so engagiert und stilkundig, so klar artikuliert und dynamisch lebendig, also insgesamt mit soviel außergewöhnlicher interpretatorischer Qualität dargeboten wird.	126:137	0:251	Da spürte man sofort , daß alte Musik sehr lebendig und überzeugend wirken kann , wenn sie so engagiert und stilkundig , so klar artikuliert und dynamisch lebendig , also insgesamt mit soviel außergewöhnlicher interpretatorischer Qualität dargeboten wird .	24	0:39	da spüren man sofort , daß alt Musik sehr lebendig und überzeugend wirken können , wenn sie so engagiert und stilkundig , so klar artikulieren und dynamisch lebendig , also insgesamt mit soviel außergewöhnlich interpretatorisch Qualität darbieten werden .	ADV VVFIN PIS ADV $, KOUS ADJA NN ADV ADJD KON ADJD VVINF VMFIN $, KOUS PPER ADV ADJD KON ADJD $, ADV ADJD VVFIN KON ADJD ADJD $, ADV ADV APPR PIAT ADJA ADJA NN VVPP VAFIN $.	
artikulieren	VVINF	1984	2	2532889X_1984-02-16_01_072.tcf.xml-3-19	 	In jedem Jahr fasziniert die Breite des musikalischen Spektrums, in dem die fortschrittlichen Sänger ihre politischen Absichten künstlerisch artikulieren und sich beim Festival des politischen Liedes in Berlin vorstellen.	141:153	0:221	In jedem Jahr fasziniert die Breite des musikalischen Spektrums , in dem die fortschrittlichen Sänger ihre politischen Absichten künstlerisch artikulieren und sich beim Festival des politischen Liedes in Berlin vorstellen .	19	0:31	in jede Jahr faszinieren d Breite d musikalisch Spektrum , in die d fortschrittlich Sänger ihr politisch Absicht künstlerisch artikulieren und sich beim Festival d politisch Lied in Berlin vorstellen .	APPR PIAT NN VVFIN ART NN ART ADJA NN $, APPR PRELS ART ADJA NN PPOSAT ADJA NN ADJD VVINF KON PRF APPRART NN ART ADJA NN APPR NE VVINF $.	
artikulieren	VVINF	1989	2	26120215_1989_12_09_01_378.tcf.xml-211-27	 	Wir sollten nicht zuletzt zuhören lernen, eine Kunst, die heute offenbar nicht zu hoch im Kurs steht, da viele politische Gruppen vor allem sich artikulieren und sich profilieren möchten Da ereifert sich manchmal einer und gewinnt mehr Aufmerksamkeit als eifrige, fleißige Arbeiter, die nicht so schnell mit dem Mund, aber vor allem mit dem Herzen für den Sozialismus sind.	145:157	0:373	Wir sollten nicht zuletzt zuhören lernen , eine Kunst , die heute offenbar nicht zu hoch im Kurs steht , da viele politische Gruppen vor allem sich artikulieren und sich profilieren möchten Da ereifert sich manchmal einer und gewinnt mehr Aufmerksamkeit als eifrige , fleißige Arbeiter , die nicht so schnell mit dem Mund , aber vor allem mit dem Herzen für den Sozialismus sind .	27	0:66	wir sollen nicht zuletzt zuhören lernen , eine Kunst , die heute offenbar nicht zu hoch im Kurs stehen , da viel politisch Gruppe vor alle sich artikulieren und sich profilieren mögen da ereifern sich manchmal eine und gewinnen mehr Aufmerksamkeit als eifrig , fleißig Arbeiter , die nicht so schnell mit d Mund , aber vor alle mit d Herz für d Sozialismus sein .	PPER VMFIN PTKNEG ADV VVINF VVINF $, ART NN $, PRELS ADV ADJD PTKNEG PTKA ADJD APPRART NN VVFIN $, KOUS PIAT ADJA NN APPR PIS PRF VVINF KON PRF VVINF VMFIN ADV VVFIN PRF ADV PIS KON VVFIN PIAT NN KOKOM ADJA $, ADJA NN $, PRELS PTKNEG ADV ADJD APPR ART NN $, ADV APPR PIS APPR ART NN APPR ART NN VAFIN $.	
artikulieren	VVFIN	1988	2	2532889X_1988-05-07_01_215.tcf.xml-13-3	 	Um so deutlicher artikuliert sich in den Werken und Schriften vom Altertum bis in unsere Zeit die Friedenssehnsucht.	17:28	0:116	Um so deutlicher artikuliert sich in den Werken und Schriften vom Altertum bis in unsere Zeit die Friedenssehnsucht .	3	0:19	um so deutlich artikulieren sich in d Werken und Schrift vom Altertum bis in unsere Zeit d Friedenssehnsucht .	KOUI ADV ADJD VVFIN PRF APPR ART NN KON NN APPRART NN APPR APPR PPOSAT NN ART NN $.	
artikulieren	VVFIN	1974	2	26120215_1974_01_11_01_062.tcf.xml-70-2	 	Diese Sympathie artikulierte er nicht nur so nebenbei, er schrieb darüber ein ganzes Drama mit dem Titel „Bankett der Siegel	16:28	0:124	Diese Sympathie artikulierte er nicht nur so nebenbei , er schrieb darüber ein ganzes Drama mit dem Titel „ Bankett der Siegel	2	0:22	diese Sympathie artikulieren er nicht nur so nebenbei , er schreiben darüber eine ganz Drama mit d Titel „ Bankett d Siegel	PDAT NN VVFIN PPER PTKNEG ADV ADV ADV $, PPER VVFIN PAV ART ADJA NN APPR ART NN $( NN ART NN	
artikulieren	VVFIN	1967	2	2532889X_1967-11-29_01_257.tcf.xml-2-17	 	» Industriekurier beschäftigte sich am Dienstag mit der.Artikulation". des SP Wirtschaftsministers.. Schiller artikuliert", lobte der Kurier der Industrie,. kaum einmal gesellschaftspolitische Vorurteile, und er hat sich eben deswegen das Mißtrauen der Gewerkschaften und gewisser Kreise der SPD zugezogen. ¦ •_.	110:121	0:312	» Industriekurier beschäftigte sich am Dienstag mit der .Artikulation " . des SP Wirtschaftsministers . . Schiller artikuliert " , lobte der Kurier der Industrie , . kaum einmal gesellschaftspolitische Vorurteile , und er hat sich eben deswegen das Mißtrauen der Gewerkschaften und gewisser Kreise der SPD zugezogen . ¦ •_.	17	0:51	» Industriekurier beschäftigen sich am Dienstag mit d .artikulation " . d SP Wirtschaftsminister . . Schiller artikulieren " , loben d Kurier d Industrie , . kaum einmal gesellschaftspolitisch Vorurteil , und er haben sich eben deswegen d Mißtrauen d Gewerkschaft und gewiß Kreis d Sozialdemokratische_Partei_Deutschlands zuziehen . ¦ •_.	$( NN VVFIN PRF APPRART NN APPR ART NE $( $. ART NE NN $. $. NE VVFIN $( $, VVFIN ART NN ART NN $, $. ADV ADV ADJA NN $, KON PPER VAFIN PRF ADV PAV ART NN ART NN KON ADJA NN ART NE VVPP $. $( XY	
artikulieren	VVFIN	1966	2	2532889X_1966-07-09_01_121.tcf.xml-18-14	 	Menschen erscheinen reduziert auf simple Ansprüche und Überlegungen, selbst Ihr Widerspruch ist kaum artikuliert:	101:112	0:113	Menschen erscheinen reduziert auf simple Ansprüche und Überlegungen , selbst Ihr Widerspruch ist kaum artikuliert :	14	0:16	Mensch erscheinen reduzieren auf simpel Anspruch und Überlegung , selbst ihr Widerspruch sein kaum artikulieren :	NN VVFIN VVPP APPR ADJA NN KON NN $, ADV PPOSAT NN VAFIN ADV VVFIN $.	
artikulieren	VVINF	1990	2	2532889X_1990-06-05_01_087.tcf.xml-33-37	 	Dieser Beschluß richte sich „kaum verhüllt gegen einen Teil der linken Opposition, die vielleicht den sozialen Protest, der sich spätestens im Herbst, gegen die jetzige Form der Vereinigung Deutschlands erheben wird, mit artikulieren wird.	221:233	0:239	Dieser Beschluß richte sich „ kaum verhüllt gegen einen Teil der linken Opposition , die vielleicht den sozialen Protest , der sich spätestens im Herbst , gegen die jetzige Form der Vereinigung Deutschlands erheben wird , mit artikulieren wird .	37	0:40	diese Beschluß richten sich „ kaum verhüllt gegen eine Teil d link Opposition , die vielleicht d sozial Protest , die sich spätestens im Herbst , gegen d jetzig Form d Vereinigung Deutschland erheben werden , mit artikulieren werden .	PDAT NN VVFIN PRF $( ADV ADJD APPR ART NN ART ADJA NN $, PRELS ADV ART ADJA NN $, PRELS PRF ADV APPRART NN $, APPR ART ADJA NN ART NN NE VVINF VAFIN $, APPR VVINF VAFIN $.	
artikulieren	VVFIN	1988	2	26120215_1988_09_02_01_087.tcf.xml-15-1	 	Souverän artikulierte am Pult Gert Bahner diese durchsichtigspröde Musik.	9:21	0:73	Souverän artikulierte am Pult Gert Bahner diese durchsichtigspröde Musik .	1	0:10	Souverän artikulieren am Pult Gert Bahner diese durchsichtigspröde Musik .	NN VVFIN APPRART NN NE NE PDAT ADJA NN $.	
artikulieren	VVFIN	1975	2	2532889X_1975-12-01_01_164.tcf.xml-165-6	 	Und Becher Rabe bei Brechts Tod artikuliert, was wir verloren hatten und was uns durch Arbeit neu zu gewinnen war:	32:43	0:114	Und Becher Rabe bei Brechts Tod artikuliert , was wir verloren hatten und was uns durch Arbeit neu zu gewinnen war :	6	0:22	und Becher Rabe bei Brecht Tod artikulieren , was wir verlieren haben und was wir durch Arbeit neu zu gewinnen sein :	KON NN NN APPR NE NN VVFIN $, PWS PPER VVPP VAFIN KON PWS PPER APPR NN ADJD PTKZU VVINF VAFIN $.	
artikulieren	VVINF	1973	2	26120215_1973_08_31_01_082.tcf.xml-4-24	 	Das im Minsker Funktechnischen Institut entwickelte Gerät vermag aus einem Bestand von 64 In seinem „Gedächtnis" gespeicherten Lauten jeden beliebigen Satz zu artikulieren.	159:171	0:172	Das im Minsker Funktechnischen Institut entwickelte Gerät vermag aus einem Bestand von 64 In seinem „ Gedächtnis " gespeicherten Lauten jeden beliebigen Satz zu artikulieren .	24	0:26	die im Minsker funktechnisch Institut entwickelt Gerät vermögen aus eine Bestand von 64 in seine „ Gedächtnis " gespeichert Laute jede beliebig Satz zu artikulieren .	PDS APPRART NN ADJA NN ADJA NN VVFIN APPR ART NN APPR CARD APPR PPOSAT $( NN $( ADJA NN PIAT ADJA NN PTKZU VVINF $.	
artikulieren	VVINF	1989	2	2532889X_1989-11-04_01_137.tcf.xml-16-35	 	Um den Informationsgehalt der Medien in dieser Hinsicht umfassend zu sichern, ist die Publikation von Ergebnissen der Meinungsforschung, speziell zur Lage und Meinung solcher Gruppen, die sich selbst kaum in der Öffentlichkeit artikulieren, äußerst wichtig.	227:239	0:257	Um den Informationsgehalt der Medien in dieser Hinsicht umfassend zu sichern , ist die Publikation von Ergebnissen der Meinungsforschung , speziell zur Lage und Meinung solcher Gruppen , die sich selbst kaum in der Öffentlichkeit artikulieren , äußerst wichtig .	35	0:40	um d Informationsgehalt d Medien in diese Hinsicht umfaßend zu sichern , sein d Publikation von Ergebnis d Meinungsforschung , speziell zur Lage und Meinung solch Gruppe , die sich selbst kaum in d Öffentlichkeit artikulieren , äußerst wichtig .	KOUI ART NN ART NN APPR PDAT NN ADJD PTKZU VVINF $, VAFIN ART NN APPR NN ART NN $, ADJD APPRART NN KON NN PIAT NN $, PRELS PRF ADV ADV APPR ART NN VVINF $, ADV ADJD $.	
artikulieren	VVFIN	1990	2	26120215_1990_07_31_01_316.tcf.xml-10-12	 	Die Spaltung innerhalb der Allianz schreitet trotz Appellen zur Einigung fort und artikuliert sich ebenfalls in bewaffneten Auseinandersetzungen.	82:93	0:145	Die Spaltung innerhalb der Allianz schreitet trotz Appellen zur Einigung fort und artikuliert sich ebenfalls in bewaffneten Auseinandersetzungen .	12	0:19	d Spaltung innerhalb d Allianz schreiten trotz Appell zur Einigung fort und artikulieren sich ebenfalls in bewaffnet Auseinandersetzung .	ART NN APPR ART NN VVFIN APPR NN APPRART NN PTKVZ KON VVFIN PRF ADV APPR ADJA NN $.	
