lemma	pos	date	grouping	identifier	description	context	indexes_target_token	indexes_target_sentence	context_tokenized	indexes_target_token_tokenized	indexes_target_sentence_tokenized	context_lemmatized	context_pos	context_normalized
Knotenpunkt	NN	1949	2	26120215_1949_10_22_01_196.tcf.xml-4-12	 	Diesen lobenswerten Satz konnte der geschäftig hastende Bürger unserer Stadt an allen Knotenpunkten, in allen Straßenbahnen.	86:99	0:124	Diesen lobenswerten Satz konnte der geschäftig hastende Bürger unserer Stadt an allen Knotenpunkten , in allen Straßenbahnen .	12	0:18	diese lobenswert Satz können d geschäftig hastend Bürger unsere Stadt an alle Knotenpunkt , in alle Straßenbahn .	PDAT ADJA NN VMFIN ART ADJD ADJA NN PPOSAT NN APPR PIAT NN $, APPR PIAT NN $.	
Knotenpunkt	NN	1968	2	2532889X_1968-05-07_01_098.tcf.xml-4-7	 	Im Stern, so nennen wir jenen Knotenpunkt im Tunnel, wo sich zwei Wegstrecken vereinen, feierten wir unser Richtfest.	30:41	0:117	Im Stern , so nennen wir jenen Knotenpunkt im Tunnel , wo sich zwei Wegstrecken vereinen , feierten wir unser Richtfest .	7	0:22	im Stern , so nennen wir jen Knotenpunkt im Tunnel , wo sich zwei Wegstrecken vereinen , feiern wir unsere Richtfest .	APPRART NN $, ADV VVFIN PPER PDAT NN APPRART NN $, PWAV PRF CARD NN VVINF $, VVFIN PPER PPOSAT NN $.	
Knotenpunkt	NN	1962	2	26120215_1962_08_28_01_163.tcf.xml-56-14	 	Unter den neueren Betrieben ragen in der Hauptstadt Tscheboksary ein Elektroapparatewerk und im Eisenbahn-Knotenpunkt Kanasch ein Waggonreparaturbetrieb hervor.	106:117	0:160	Unter den neueren Betrieben ragen in der Hauptstadt Tscheboksary ein Elektroapparatewerk und im Eisenbahn- Knotenpunkt Kanasch ein Waggonreparaturbetrieb hervor .	14	0:20	unter d neu Betrieb ragen in d Hauptstadt Tscheboksary eine Elektroapparatewerk und im eisenbahn- Knotenpunkt Kanasch eine Waggonreparaturbetrieb hervor .	APPR ART ADJA NN VVFIN APPR ART NN NE ART NN KON APPRART TRUNC NN NE ART NN PTKVZ $.	
Knotenpunkt	NN	1982	2	2532889X_1982-01-08_01_162.tcf.xml-29-0	 	Knotenpunkt erforderte eine Ver-, größerung des Alex um das Dred-bis Vierfache.	0:11	0:79	Knotenpunkt erforderte eine Ver- , größerung des Alex um das Dred- bis Vierfache .	0	0:14	Knotenpunkt erfordern eine ver- , Größerung d Alex um d dred- bis Vierfach .	NN VVFIN ART TRUNC $, NN ART NE APPR ART TRUNC KON NN $.	
Knotenpunkt	NN	1971	2	2532889X_1971-02-16_01_044.tcf.xml-558-7	 	Die Abfertlgungsfähl « keit der Stationen, Knotenpunkte und Betriebsnebenbahnen Ist zu vergrößern.	43:55	0:98	Die Abfertlgungsfähl « keit der Stationen , Knotenpunkte und Betriebsnebenbahnen Ist zu vergrößern .	7	0:14	d Abfertlgungsfähl « Keit d Station , Knotenpunkt und Betriebsnebenbahn sein zu vergrößern .	ART NE $( NE ART NN $, NN KON NN VAFIN PTKZU VVINF $.	
Knotenpunkt	NN	1962	2	2532889X_1962-03-02_01_062.tcf.xml-38-10	 	Zur Zeit entsteht dafür bei Mukatschewo in der Westukraine ein Knotenpunkt.	63:74	0:75	Zur Zeit entsteht dafür bei Mukatschewo in der Westukraine ein Knotenpunkt .	10	0:12	zur Zeit entstehen dafür bei Mukatschewo in d Westukraine eine Knotenpunkt .	APPRART NN VVFIN PAV APPR NE APPR ART NN ART NN $.	
Knotenpunkt	NN	1973	2	26120215_1973_09_07_01_143.tcf.xml-4-16	 	Sie dient vor allem einer erhöhten Sicherheit der Fußgänger und beschleunigt zugleich den Verkehrsablauf an diesem Knotenpunkt dar	115:126	0:130	Sie dient vor allem einer erhöhten Sicherheit der Fußgänger und beschleunigt zugleich den Verkehrsablauf an diesem Knotenpunkt dar	16	0:18	sie dienen vor alle eine erhöht Sicherheit d Fußgänger und beschleunigen zugleich d Verkehrsablauf an diese Knotenpunkt dar	PPER VVFIN APPR PIS ART ADJA NN ART NN KON VVFIN ADV ART NN APPR PDAT NN PTKVZ	
Knotenpunkt	NN	1949	2	26120215_1949_09_09_01_190.tcf.xml-28-6	 	Es ist beabsichtigt, an diesem Knotenpunkt des Krafverkehrs zwischen.	31:42	0:69	Es ist beabsichtigt , an diesem Knotenpunkt des Krafverkehrs zwischen .	6	0:11	es sein beabsichtigen , an diese Knotenpunkt d Krafverkehrs zwischen .	PPER VAFIN VVPP $, APPR PDAT NN ART NN APPR $.	
Knotenpunkt	NN	1963	2	2532889X_1963-02-05_01_006.tcf.xml-10-21	 	Vordringliche Aufgabe der örtlichen Staatsorgane ist es, in engem Zusammenwirken mit der Wirtschaft und den Verkehrsträgern die festgelegten etwa 160 Knotenpunkte überall ohne Zeitverlust einzurichten und die reibungslose Arbeit auf diesen • Punkten zu organisieren.	150:162	0:266	Vordringliche Aufgabe der örtlichen Staatsorgane ist es , in engem Zusammenwirken mit der Wirtschaft und den Verkehrsträgern die festgelegten etwa 160 Knotenpunkte überall ohne Zeitverlust einzurichten und die reibungslose Arbeit auf diesen • Punkten zu organisieren .	21	0:37	vordringlich Aufgabe d örtlich Staatsorgan sein es , in eng Zusammenwirken mit d Wirtschaft und d Verkehrsträger d festgelegt etwa 160 Knotenpunkt überall ohne Zeitverlust einrichten und d reibungslos Arbeit auf diese • Punkt zu organisieren .	ADJA NN ART ADJA NN VAFIN PPER $, APPR ADJA NN APPR ART NN KON ART NN ART ADJA ADV CARD NN ADV APPR NN VVIZU KON ART ADJA NN APPR PDAT $( NN PTKZU VVINF $.	
Knotenpunkt	NN	1973	2	26120215_1973_04_09_01_003.tcf.xml-5-19	 	In den ersten vier Apriltage gelangten allein 40000 Tonnen Eisenerze und Roheisen vom Haup thandelspartner UdSSR über diesen bedeutenden Knotenpunkt der Fre undschaftsmagistrale an die Metallurgiekombinate der Republik.	137:148	0:219	In den ersten vier Apriltage gelangten allein 40000 Tonnen Eisenerze und Roheisen vom Haup thandelspartner UdSSR über diesen bedeutenden Knotenpunkt der Fre undschaftsmagistrale an die Metallurgiekombinate der Republik .	19	0:29	in d erst vier Apriltag gelangen allein 40000 Tonne Eisenerz und Roheisen vom Haup Thandelspartner UdSSR über diese bedeutend Knotenpunkt d Fre Undschaftsmagistrale an d Metallurgiekombinat d Republik .	APPR ART ADJA CARD NN VVFIN ADV CARD NN NN KON NN APPRART NN NE NE APPR PDAT ADJA NN ART NE NE APPR ART NN ART NN $.	
Knotenpunkt	NN	1969	2	2532889X_1969-04-23_01_073.tcf.xml-14-1	 	An Knotenpunkten der beliebtesten Wanderwege traten Volkskunstgruppen auf — auch der Bergsteigerchor war dabei — es wurde zu, forstwirtschaftlichen Lehrwanderungen und zu Unterweisungen des Deutschen Roten Kreuzes eingeladen.	3:16	0:225	An Knotenpunkten der beliebtesten Wanderwege traten Volkskunstgruppen auf — auch der Bergsteigerchor war dabei — es wurde zu , forstwirtschaftlichen Lehrwanderungen und zu Unterweisungen des Deutschen Roten Kreuzes eingeladen .	1	0:30	an Knotenpunkt d beliebt Wanderweg treten Volkskunstgruppe auf — auch d Bergsteigerchor sein dabei — es werden zu , forstwirtschaftlich Lehrwanderung und zu Unterweisung d deutsch rot Kreuz einladen .	APPR NN ART ADJA NN VVFIN NN PTKVZ $( ADV ART NN VAFIN PAV $( PPER VAFIN PTKVZ $, ADJA NN KON APPR NN ART ADJA ADJA NN VVPP $.	
Knotenpunkt	NN	1970	2	26120215_1970_05_29_01_258.tcf.xml-28-7	 	Als erster Kangiergefältebähnhof der Welt wird der Knotenpunkt Dresden-Friedrichstadt vo automatisiert.	51:62	0:103	Als erster Kangiergefältebähnhof der Welt wird der Knotenpunkt Dresden-Friedrichstadt vo automatisiert .	7	0:12	als erst Kangiergefältebähnhof d Welt werden d Knotenpunkt Dresden-Friedrichstadt vo automatisieren .	KOUS ADJA NN ART NN VAFIN ART NN NN XY VVPP $.	
Knotenpunkt	NN	1951	2	2532889X_1951-12-29_01_058.tcf.xml-16-4	 	Ruß' land war der Knotenpunkt aller Widersprüche des Imperialismus, es war der Herd jeder Art von Unterdrückung, „sowohl der kapitalistischen als auch der kolonialen ühö	18:29	0:169	Ruß' land war der Knotenpunkt aller Widersprüche des Imperialismus , es war der Herd jeder Art von Unterdrückung , „ sowohl der kapitalistischen als auch der kolonialen ühö	4	0:28	Ruß Land sein d Knotenpunkt alle Widerspruch d Imperialismus , es sein d Herd jede Art von Unterdrückung , „ sowohl d kapitalistisch als auch d kolonial Ühö	NE NE VAFIN ART NN PIAT NN ART NN $, PPER VAFIN ART NN PIAT NN APPR NN $, $( KON ART ADJA KOKOM ADV ART ADJA NN	
Knotenpunkt	NN	1966	2	26120215_1966_09_18_01_339.tcf.xml-259-41	 	So gibt es z. B. ein Projekt zum Einsatz von zwei miteinander gekoppelten Großrechenanlagen im Wertumfang von etwa 20 Millionen VM und Gesamtinvestitionskosten von 140 Millionen Mark zur automatisierten Disposition und Abrechnung des Güterfahrzeugparkes, das über Fernschreibeinnchtungen mit den wichtigsten Knotenpunkten des Bahnnetzes verbunden ist.	308:321	0:351	So gibt es z. B. ein Projekt zum Einsatz von zwei miteinander gekoppelten Großrechenanlagen im Wertumfang von etwa 20 Millionen VM und Gesamtinvestitionskosten von 140 Millionen Mark zur automatisierten Disposition und Abrechnung des Güterfahrzeugparkes , das über Fernschreibeinnchtungen mit den wichtigsten Knotenpunkten des Bahnnetzes verbunden ist .	41	0:47	so geben es z. B. eine Projekt zum Einsatz von zwei miteinander gekoppelt Großrechenanlage im Wertumfang von etwa 20 Million Verkehrsgesellschaft_Mittelhessen_Gmbh und Gesamtinvestitionskosten von 140 Million Mark zur automatisiert Disposition und Abrechnung d Guterfahrzeugpark , die über Fernschreibeinnchtungen mit d wichtig Knotenpunkt d Bahnnetz verbinden sein .	ADV VVFIN PPER APPRART NN ART NN APPRART NN APPR CARD ADV ADJA NN APPRART NN APPR ADV CARD NN NE KON NN APPR CARD NN NN APPRART ADJA NN KON NN ART NN $, PRELS APPR NE APPR ART ADJA NN ART NN VVPP VAFIN $.	
Knotenpunkt	NN	1948	2	26120215_1948_06_19_01_181.tcf.xml-3-7	 	Polizeikräfte gestiefelt und gespornt vor allen wichtigen Knotenpunkten, Bahnhöfen, Ministerien.	58:71	0:96	Polizeikräfte gestiefelt und gespornt vor allen wichtigen Knotenpunkten , Bahnhöfen , Ministerien .	7	0:13	Polizeikraft stiefeln und spornen vor alle wichtig Knotenpunkt , Bahnhof , Ministerium .	NN VVPP KON VVPP APPR PIAT ADJA NN $, NN $, NN $.	
Knotenpunkt	NN	1990	2	2532889X_1990-07-30_01_020.tcf.xml-4-11	 	30 Personenzuge mit ungefähr 25000 Passagieren und 200 Güterzüge liegen am Knotenpunkt von Nordkaukasi -	75:86	0:104	30 Personenzuge mit ungefähr 25000 Passagieren und 200 Güterzüge liegen am Knotenpunkt von Nordkaukasi -	11	0:15	30 Personenzug mit ungefähr 25000 Passagier und 200 Guterzug liegen am Knotenpunkt von Nordkaukasi -	CARD NN APPR ADJD CARD NN KON CARD NN VVFIN APPRART NN APPR NE $(	
Knotenpunkt	NN	1990	2	26120215_1990_05_11_01_035.tcf.xml-43-5	 	Notwendig wäre im Bereich des Knotenpunktes Ostkreuz eine Verbindungskurve eventuell als Tunnelbauwerk.	30:43	0:103	Notwendig wäre im Bereich des Knotenpunktes Ostkreuz eine Verbindungskurve eventuell als Tunnelbauwerk .	5	0:13	notwendig sein im Bereich d Knotenpunkt Ostkreuz eine Verbindungskurve eventuell als Tunnelbauwerk .	ADJD VAFIN APPRART NN ART NN NN ART NN ADJD KOKOM NN $.	
Knotenpunkt	NN	1989	2	26120215_1989_01_09_01_036.tcf.xml-43-4	 	Eine Straßenbrücke über den Knotenpunkt Edisonstraße — 423 Meter lang — wird es künftig ermöglichen, daß die Straßenbahn, die einen gesonderten Gleiskörper erhält, zügiger über die Kreuzung kommt und der Verkehr in alle Richtungen flüssiger rollen kann.	28:39	0:253	Eine Straßenbrücke über den Knotenpunkt Edisonstraße — 423 Meter lang — wird es künftig ermöglichen , daß die Straßenbahn , die einen gesonderten Gleiskörper erhält , zügiger über die Kreuzung kommt und der Verkehr in alle Richtungen flüssiger rollen kann .	4	0:41	eine Straßenbrücke über d Knotenpunkt Edisonstraße — 423 Meter lang — werden es künftig ermöglichen , daß d Straßenbahn , die eine gesondert Gleiskörper erhalten , zügig über d Kreuzung kommen und d Verkehr in alle Richtung flüssig rollen können .	ART NN APPR ART NN NN $( CARD NN ADJD $( VAFIN PPER ADJD VVINF $, KOUS ART NN $, PRELS ART ADJA NN VVFIN $, ADJD APPR ART NN VVFIN KON ART NN APPR PIAT NN ADJD VVINF VMFIN $.	
Knotenpunkt	NN	1988	2	2532889X_1988-09-10_01_026.tcf.xml-19-7	 	Die Leipziger Messe hat ihre Rolle als Knotenpunkt der Ost-West-Beziehungen in ökonomischer wie politischer Hinsicht eineut glänzend erfüllt.	39:50	0:141	Die Leipziger Messe hat ihre Rolle als Knotenpunkt der Ost- West-Beziehungen in ökonomischer wie politischer Hinsicht eineut glänzend erfüllt .	7	0:20	d Leipziger Messe haben ihr Rolle als Knotenpunkt d ost- Westen-Beziehung in ökonomisch wie politisch Hinsicht Eineut glänzend erfüllen .	ART ADJA NN VAFIN PPOSAT NN KOUS NN ART TRUNC NN APPR ADJA KON ADJA NN NE ADJD VVPP $.	
Knotenpunkt	NN	1966	2	2532889X_1966-09-18_01_163.tcf.xml-263-42	 	So gibt es z. B. ein Projekt zum Einsatz von zwei miteinander gekoppelten Großrechenanlagen im Wertumfang von etwa 20 Millionen VM uhd Ge* samtlnvestltlonskosten von 140 Millionen Mark zur automatisierten Disposition und Abrechnung des Güterfahrzeugparkes, das über Fernschreibeinrichtungen mit den wichtigsten Knotenpunkten des Bahnnetzes verbunden iat, Die daniit verbundene Rationalisierung von Verwaltungsarbeiten würde ermöglichen, eine sonst zur geplanten Leistungssteigerung notwendige Erhöhung des Güterwagenparks um etwa 9000 Wagen in Fortfall kommen zu lassen, etwa 1800 Arbeitskräfte einzusparen und etwa 123.5 Millionen Mark einmaligen Nutzen und jährlich 27.4 Millionen Mark EinAparunaen im Betrieb der Reichsbahn au erzielen.	311:324	0:739	So gibt es z. B. ein Projekt zum Einsatz von zwei miteinander gekoppelten Großrechenanlagen im Wertumfang von etwa 20 Millionen VM uhd Ge* samtlnvestltlonskosten von 140 Millionen Mark zur automatisierten Disposition und Abrechnung des Güterfahrzeugparkes , das über Fernschreibeinrichtungen mit den wichtigsten Knotenpunkten des Bahnnetzes verbunden iat , Die daniit verbundene Rationalisierung von Verwaltungsarbeiten würde ermöglichen , eine sonst zur geplanten Leistungssteigerung notwendige Erhöhung des Güterwagenparks um etwa 9000 Wagen in Fortfall kommen zu lassen , etwa 1800 Arbeitskräfte einzusparen und etwa 123.5 Millionen Mark einmaligen Nutzen und jährlich 27.4 Millionen Mark EinAparunaen im Betrieb der Reichsbahn au erzielen .	42	0:100	so geben es z. B. eine Projekt zum Einsatz von zwei miteinander gekoppelt Großrechenanlage im Wertumfang von etwa 20 Million Verkehrsgesellschaft_Mittelhessen_Gmbh Uhd Ge* Samtlnvestltlonskosten von 140 Million Mark zur automatisiert Disposition und Abrechnung d Guterfahrzeugpark , die über Fernschreibeinrichtung mit d wichtig Knotenpunkt d Bahnnetz verbinden Iat , d Daniit verbinden Rationalisierung von Verwaltungsarbeit werden ermöglichen , eine sonst zur geplant Leistungssteigerung notwendig Erhöhung d Guterwagenpark um etwa 9000 Wagen in Fortfall kommen zu lassen , etwa 1800 Arbeitskraft einsparen und etwa 123.5 Million Mark einmalig Nutzen und jährlich 27.4 Million Mark Einaparunaen im Betrieb d Reichsbahn Au erzielen .	ADV VVFIN PPER APPRART NN ART NN APPRART NN APPR CARD ADV ADJA NN APPRART NN APPR ADV CARD NN NE NE NE NE APPR CARD NN NN APPRART ADJA NN KON NN ART NN $, PRELS APPR NN APPR ART ADJA NN ART NN VVPP NE $, ART NN ADJA NN APPR NN VAFIN VVINF $, ART ADV APPRART ADJA NN ADJA NN ART NN APPR ADV CARD NN APPR NN VVINF PTKZU VVINF $, ADV CARD NN VVIZU KON ADV CARD NN NN ADJA NN KON ADJD CARD NN NN NE APPRART NN ART NN NE VVINF $.	
Knotenpunkt	NN	1984	2	2532889X_1984-11-24_01_174.tcf.xml-53-26	 	Ich denke dabei an die bewährten Methoden der Arbeit in den Kreisen Sondershausen und Aue. die Erfahrungen der Reichsbahndirektion Cottbus oder die Arbeit an den Knotenpunkten des Transports und der Produktion nach der Odessa-Iljitschowsker Methode.	162:175	0:249	Ich denke dabei an die bewährten Methoden der Arbeit in den Kreisen Sondershausen und Aue . die Erfahrungen der Reichsbahndirektion Cottbus oder die Arbeit an den Knotenpunkten des Transports und der Produktion nach der Odessa-Iljitschowsker Methode .	26	0:37	ich denken dabei an d bewährt Methode d Arbeit in d Kreis Sondershausen und Aue . d Erfahrung d Reichsbahndirektion Cottbus oder d Arbeit an d Knotenpunkt d Transport und d Produktion nach d odessa-iljitschowsker Methode .	PPER VVFIN PAV APPR ART ADJA NN ART NN APPR ART NN NE KON NN $. ART NN ART NN NE KON ART NN APPR ART NN ART NN KON ART NN APPR ART ADJA NN $.	
Knotenpunkt	NN	1970	2	2532889X_1970-04-02_01_150.tcf.xml-46-49	 	Diese Werke sind ein Ausdruck dafür, daß mit der estaltung des entwickelten gesellschaftlichen Systems sich auch eine Literatur herausgebilde hat, die sich als Ganzes nunmeh r auf systemeigenen sozialöko omisehen Grundlagen entfaltet, Dieser Übergang der Literatu auf systemeigene sozialistische Gr undlagen ist ein ganz wesentl er Knotenpunkt in der Gesch te unserer sozialistischen deuts hen Nationalliteratur.	332:343	0:412	Diese Werke sind ein Ausdruck dafür , daß mit der estaltung des entwickelten gesellschaftlichen Systems sich auch eine Literatur herausgebilde hat , die sich als Ganzes nunmeh r auf systemeigenen sozialöko omisehen Grundlagen entfaltet , Dieser Übergang der Literatu auf systemeigene sozialistische Gr undlagen ist ein ganz wesentl er Knotenpunkt in der Gesch te unserer sozialistischen deuts hen Nationalliteratur .	49	0:60	diese Werk sein eine Ausdruck dafür , daß mit d Estaltung d entwickelt gesellschaftlich System sich auch eine Literatur Herausgebilde haben , die sich als Ganze Nunmeh R auf systemeigen Sozialöko Omisehen Grundlage entfalten , diese Übergang d Literatu auf systemeigen sozialistisch Gr Undlagen sein eine ganz wesentl er Knotenpunkt in d Gesch Te unsere sozialistisch deuts hen Nationalliteratur .	PDAT NN VAFIN ART NN PAV $, KOUS APPR ART NN ART ADJA ADJA NN PRF ADV ART NN NE VAFIN $, PRELS PRF KOUS NN NE NE APPR ADJA NN NE NN VVFIN $, PDAT NN ART NN APPR ADJA ADJA NE NE VAFIN ART ADV VVFIN PPER NN APPR ART NE NE PPOSAT ADJA FM FM NN $.	
Knotenpunkt	NN	1979	2	26120215_1979_03_22_01_240.tcf.xml-8-2	 	An den Knotenpunkten Dimitroffstraße— Storkower Straße/Grellstraße und Ostseestraße/Michelangelostraße kann die Greifswalder Straße überquert werden.	7:20	0:149	An den Knotenpunkten Dimitroffstraße— Storkower Straße/Grellstraße und Ostseestraße/Michelangelostraße kann die Greifswalder Straße überquert werden .	2	0:15	an d Knotenpunkt dimitroffstraße— Storkower Straße/grellstraße und Ostseestraße/michelangelostraße können d Greifswalder Straße überqueren werden .	APPR ART NN TRUNC NN NE KON NE VMFIN ART NN NN VVPP VAINF $.	
Knotenpunkt	NN	1959	2	2532889X_1959-03-03_01_027.tcf.xml-94-41	 	Ausgehend von-den Beschlüssen des V. Parteitages, wird der sozialistische Aufbau in Berlin bestimmt von seiner Funktion als Hauptstadt der Deutschen Demokratischen Republik, von der Rolle Berlins als bedeutendstes industrielles Verarbeitungsgebiet, als Modezentrum unserer Republik und als wichtiger Knotenpunkt des innerdeutschen und internationalen Handels und Verkehrs.	300:311	0:372	Ausgehend von- den Beschlüssen des V. Parteitages , wird der sozialistische Aufbau in Berlin bestimmt von seiner Funktion als Hauptstadt der Deutschen Demokratischen Republik , von der Rolle Berlins als bedeutendstes industrielles Verarbeitungsgebiet , als Modezentrum unserer Republik und als wichtiger Knotenpunkt des innerdeutschen und internationalen Handels und Verkehrs .	41	0:50	ausgehend von- d Beschluß d v. Parteitag , werden d sozialistisch Aufbau in Berlin bestimmen von seine Funktion als Hauptstadt d deutsch demokratisch Republik , von d Rolle Berlin als bedeutend industriell Verarbeitungsgebiet , als Modezentrum unsere Republik und als wichtig Knotenpunkt d innerdeutsch und international Handel und Verkehr .	ADJD TRUNC ART NN ART ADJA NN $, VAFIN ART ADJA NN APPR NE VVFIN APPR PPOSAT NN KOUS NN ART ADJA ADJA NN $, APPR ART NN NE KOUS ADJA ADJA NN $, KOUS NN PPOSAT NN KON KOUS ADJA NN ART ADJA KON ADJA NN KON NN $.	
Knotenpunkt	NN	1977	2	2532889X_1977-06-21_01_030.tcf.xml-33-10	 	Infolge der Wolkenbrüche war am Sonntag auch der Eisenbahnverkehr im Knotenpunkt Magdeburg zum Erliegen gekommen, Signale fielen aus, Weichen und Gleisanlagen standen unter Wasser.	69:80	0:180	Infolge der Wolkenbrüche war am Sonntag auch der Eisenbahnverkehr im Knotenpunkt Magdeburg zum Erliegen gekommen , Signale fielen aus , Weichen und Gleisanlagen standen unter Wasser .	10	0:27	infolge d Wolkenbruch sein am Sonntag auch d Eisenbahnverkehr im Knotenpunkt Magdeburg zum Erliegen kommen , Signal fallen aus , Weiche und Gleisanlage stehen unter Wasser .	APPR ART NN VAFIN APPRART NN ADV ART NN APPRART NN NE APPRART NN VVPP $, NN VVFIN PTKVZ $, NN KON NN VVFIN APPR NN $.	
Knotenpunkt	NN	1973	2	2532889X_1973-03-29_01_375.tcf.xml-0-27	 	Straßensperrung Wegen Durchführung von Straßenbauarbeiten auf der F96, — Greifswalder Chaussee —, Ortsdurchfahrt Stralsund, wird der Teilabschnitt von km 211,030 Andershof bis km 214,330 Knotenpunkt Werftstraße vom 26. März bis 30. Juni 1973 für den Durchgangsverkehr gesperrt außer für den a) Berufs-und Linienverkehr im öberlandverkehr, b) innerstädtischen Berufs-und Anliegerverkehr.	187:198	0:386	Straßensperrung Wegen Durchführung von Straßenbauarbeiten auf der F96 , — Greifswalder Chaussee — , Ortsdurchfahrt Stralsund , wird der Teilabschnitt von km 211,030 Andershof bis km 214,330 Knotenpunkt Werftstraße vom 26. März bis 30. Juni 1973 für den Durchgangsverkehr gesperrt außer für den a ) Berufs- und Linienverkehr im öberlandverkehr , b ) innerstädtischen Berufs- und Anliegerverkehr .	27	0:58	Straßensperrung wegen Durchführung von Straßenbauarbeit auf d F96 , — Greifswalder Chaussee — , Ortsdurchfahrt Stralsund , werden d Teilabschnitt von Km 211,030 Andershof bis Km 214,330 Knotenpunkt Werftstraße vom 26. März bis 30. Juni 1973 für d Durchgangsverkehr sperren außer für d A ) berufs- und Linienverkehr im Öberlandverkehr , b ) innerstädtisch berufs- und Anliegerverkehr .	NN APPR NN APPR NN APPR ART NE $, $( NN NN $( $, NN NE $, VAFIN ART NN APPR NN CARD NN APPR NN CARD NN NN APPRART ADJA NN APPR ADJA NN CARD APPR ART NN VVPP APPR APPR ART NE $( TRUNC KON NN APPRART NE $, XY $( ADJA TRUNC KON NN $.	
Knotenpunkt	NN	1979	2	2532889X_1979-11-15_01_033.tcf.xml-3-4	 	In mehr als 100 Knotenpunkten des Güterverkehrs der DDR arbeiten die Kollektive nach Erfahrungen des sowjetischen Seeumschlagplatzes Odessa-Iljitschowsk, um durch gute Kooperation und exakte Arbeitsteilung der beteiligten Verkehrsträger und Betriebe Transportreserven zu erschließen.	16:29	0:283	In mehr als 100 Knotenpunkten des Güterverkehrs der DDR arbeiten die Kollektive nach Erfahrungen des sowjetischen Seeumschlagplatzes Odessa-Iljitschowsk , um durch gute Kooperation und exakte Arbeitsteilung der beteiligten Verkehrsträger und Betriebe Transportreserven zu erschließen .	4	0:35	in mehr als 100 Knotenpunkt d Guterverkehr d DDR arbeiten d Kollektiv nach Erfahrung d sowjetisch Seeumschlagplatz Odessa-Iljitschowsk , um durch gut Kooperation und exakt Arbeitsteilung d beteiligt Verkehrsträger und Betrieb Transportreserve zu erschließen .	APPR PIAT KOKOM CARD NN ART NN ART NE VVFIN ART NN APPR NN ART ADJA NN NE $, KOUI APPR ADJA NN KON ADJA NN ART ADJA NN KON NN NN PTKZU VVINF $.	
Knotenpunkt	NN	1973	2	2532889X_1973-11-10_01_234.tcf.xml-5-8	 	Das Dokument schildert Iasi als bevölkerten Handelsplatz und Knotenpunkt der alten Handelswege, die die Hansestädte der Ostsee mit den byzantinischen und venezianischen Häfen verbanden.	61:72	0:185	Das Dokument schildert Iasi als bevölkerten Handelsplatz und Knotenpunkt der alten Handelswege , die die Hansestädte der Ostsee mit den byzantinischen und venezianischen Häfen verbanden .	8	0:26	d Dokument schildern Iasi als bevölkert Handelsplatz und Knotenpunkt d alt Handelsweg , die d Hansestadt d Ostsee mit d byzantinisch und venezianisch Hafen verbinden .	ART NN VVFIN NE KOUS ADJA NN KON NN ART ADJA NN $, PRELS ART NN ART NE APPR ART ADJA KON ADJA NN VVFIN $.	
Knotenpunkt	NN	1982	2	2532889X_1982-02-19_02_118.tcf.xml-7-15	 	Neben wesentlich größerer Sicherheit für die Beschäftigten soll damit auch eine erheblich höhere Durchlaßfähigkeit dieses Knotenpunktes erreicht werden.	122:135	0:152	Neben wesentlich größerer Sicherheit für die Beschäftigten soll damit auch eine erheblich höhere Durchlaßfähigkeit dieses Knotenpunktes erreicht werden .	15	0:19	neben wesentlich groß Sicherheit für d Beschäftigte sollen damit auch eine erheblich hoch Durchlaßfähigkeit diese Knotenpunkt erreichen werden .	APPR ADJD ADJA NN APPR ART NN VMFIN PAV ADV ART ADJD ADJA NN PDAT NN VVPP VAINF $.	
Knotenpunkt	NN	1980	2	2532889X_1980-02-09_01_592.tcf.xml-2-15	 	Eine Steuerzentrale auf dem Kalvinplatz wertet die Signale von 60 Detektoren an den 16 wichtigsten Knotenpunkten der Innenstadt aus.	99:112	0:132	Eine Steuerzentrale auf dem Kalvinplatz wertet die Signale von 60 Detektoren an den 16 wichtigsten Knotenpunkten der Innenstadt aus .	15	0:20	eine Steuerzentrale auf d Kalvinplatz werten d Signal von 60 Detektor an d 16 wichtig Knotenpunkt d Innenstadt aus .	ART NN APPR ART NE VVFIN ART NN APPR CARD NN APPR ART CARD ADJA NN ART NN PTKVZ $.	
Knotenpunkt	NN	1972	2	2532889X_1972-09-14_01_084.tcf.xml-27-30	 	Diese Aufgabe leitet sich., aus.. der,. Funktion. ab, die Moskau als" politisches, Wirtschaftliches und kulturelles Zentrum der ' Sowjetunion und gleichzeitig Knotenpunkt des internationalen Touristenverkehrs zu erfüllen hat.	159:170	0:225	Diese Aufgabe leitet sich . , aus . . der ,. Funktion . ab , die Moskau als " politisches , Wirtschaftliches und kulturelles Zentrum der ' Sowjetunion und gleichzeitig Knotenpunkt des internationalen Touristenverkehrs zu erfüllen hat .	30	0:38	diese Aufgabe leiten sich . , aus . . d ,. Funktion . ab , die Moskau als " politisch , wirtschaftlich und kulturell Zentrum d ' Sowjetunion und gleichzeitig Knotenpunkt d international Touristenverkehr zu erfüllen haben .	PDAT NN VVFIN PRF $. $, PTKVZ $. $. ART $( NN $. PTKVZ $, PRELS NE KOUS $( ADJA $, ADJA KON ADJA NN ART $( NE KON ADJD NN ART ADJA NN PTKZU VVINF VAFIN $.	
