lemma	pos	date	grouping	identifier	description	context	indexes_target_token	indexes_target_sentence	context_tokenized	indexes_target_token_tokenized	indexes_target_sentence_tokenized	context_lemmatized	context_pos	context_normalized
Knotenpunkt	NN	1867	1	wundt_medizinische_1867-4071-10	 	Jeder Strahl, der vor der Brechung nach dem ersten Knotenpunkt h' gerichtet ist, geht nach geschehener Brechung, wenn man ihn sich rückwärts verlängert denkt, durch den zweiten Knotenpunkt h ″.	51:62	0:193	Jeder Strahl , der vor der Brechung nach dem ersten Knotenpunkt h' gerichtet ist , geht nach geschehener Brechung , wenn man ihn sich rückwärts verlängert denkt , durch den zweiten Knotenpunkt h ″ .	10	0:35	jede Strahl , die vor d Brechung nach d erst Knotenpunkt H' richten sein , gehen nach geschehen Brechung , wenn man er sich rückwärts verlängern denken , durch d zweit Knotenpunkt h. " .	PIAT NN $, PRELS APPR ART NN APPR ART ADJA NN NE VVPP VAFIN $, VVFIN APPR ADJA NN $, KOUS PIS PPER PRF ADV VVPP VVFIN $, APPR ART ADJA NN VVFIN $( $.	Jeder Strahl , der vor der Brechung nach dem ersten Knotenpunkt h' gerichtet ist , geht nach geschehener Brechung , wenn man ihn sich rückwärts verlängert denkt , durch den zweiten Knotenpunkt h. " .
Knotenpunkt	NN	1886	1	mueller_festigkeitslehre_1886-592-16	 	1) ein Momentenpolygon A '' R B '' zu zeichnen, entsprechend den durch die Knotenpunkte m der unteren Gurtung gehenden Lasten [Formel]	75:87	0:134	1 ) ein Momentenpolygon A '' R B '' zu zeichnen , entsprechend den durch die Knotenpunkte m der unteren Gurtung gehenden Lasten [Formel]	16	0:24	1 ) eine Momentenpolygon a '' r b '' zu zeichnen , entsprechend d durch d Knotenpunkt M d unter Gurtung gehend Last [formel]	CARD $( ART NN XY $( XY XY $( PTKZU VVFIN $, APPR ART APPR ART NN NN ART ADJA NN ADJA NN XY	1 ) ein Momentenpolygon A '' R B '' zu zeichnen , entsprechend den durch die Knotenpunkte m der unteren Gurtung gehenden Lasten [Formel]
Knotenpunkt	NN	1875	1	mohr_fachwerk02_1875-108-4	 	man versehe den oberen Knotenpunkt des Füllungstheils (Figur 32) mit dem Zeichen —, den unteren mit dem Zeichen + und den Füllungstheil selbst mit dem Vorzeichen von Δ l.	23:34	0:170	man versehe den oberen Knotenpunkt des Füllungstheils ( Figur 32 ) mit dem Zeichen — , den unteren mit dem Zeichen + und den Füllungstheil selbst mit dem Vorzeichen von Δ l .	4	0:33	man versehen d ober Knotenpunkt d Füllungsteil ( Figur 32 ) mit d Zeichen -- , d unter mit d Zeichen + und d Füllungsteil selbst mit d Vorzeichen von d l .	PIS VVFIN ART ADJA NN ART NN $( NN CARD $( APPR ART NN $( $, ART ADJA APPR ART NN $( KON ART NN ADV APPR ART NN APPR XY XY $.	man versehe den oberen Knotenpunkt des Füllungsteils ( Figur 32 ) mit dem Zeichen -- , den unteren mit dem Zeichen + und den Füllungsteil selbst mit dem Vorzeichen von D l .
Knotenpunkt	NN	1886	1	mueller_festigkeitslehre_1886-260-20	 	Nachdem für den vorgeschriebenen Belastungsfall die Spannkräfte S ermittelt worden sind, wird der Theil des Fachwerks, welchem der Knotenpunkt m angehört, statisch bestimmt gemacht.	131:142	0:181	Nachdem für den vorgeschriebenen Belastungsfall die Spannkräfte S ermittelt worden sind , wird der Theil des Fachwerks , welchem der Knotenpunkt m angehört , statisch bestimmt gemacht .	20	0:28	nachdem für d vorgeschreiben Belastungsfall d Spannkraft S ermitteln werden sein , werden d Teil d Fachwerk , welche d Knotenpunkt M angehören , statisch bestimmt machen .	KOUS APPR ART ADJA NN ART NN NE VVPP VAPP VAFIN $, VAFIN ART NN ART NN $, PRELS ART NN NN VVFIN $, ADJD ADJD VVPP $.	Nachdem für den vorgeschriebenen Belastungsfall die Spannkräfte S ermittelt worden sind , wird der Teil des Fachwerks , welchem der Knotenpunkt m angehört , statisch bestimmt gemacht .
Knotenpunkt	NN	1886	1	mueller_festigkeitslehre_1886-88-7	 	Ein bewegliches Auflager entsteht, sobald ein Knotenpunkt gezwungen wird, auf einer gegebenen Linie zu bleiben, an der Bewegung längs dieser Linie aber durch den Zusammenhang mit dem Fachwerke gehindert wird; der Stützenwiderstand wirkt, wenn keine Reibung auftritt, senkrecht zu dieser Bahn, seine Richtung ist gegeben, seine Grösse wird gesucht.	46:57	0:347	Ein bewegliches Auflager entsteht , sobald ein Knotenpunkt gezwungen wird , auf einer gegebenen Linie zu bleiben , an der Bewegung längs dieser Linie aber durch den Zusammenhang mit dem Fachwerke gehindert wird ; der Stützenwiderstand wirkt , wenn keine Reibung auftritt , senkrecht zu dieser Bahn , seine Richtung ist gegeben , seine Grösse wird gesucht .	7	0:58	eine beweglich Auflager entstehen , sobald eine Knotenpunkt zwingen werden , auf eine gegeben Linie zu bleiben , an d Bewegung längs diese Linie aber durch d Zusammenhäng mit d Fachwerk hindern werden ; d Stützenwiderstand wirken , wenn keine Reibung auftreten , senkrecht zu diese Bahn , seine Richtung sein geben , seine Größe werden suchen .	ART ADJA NN VVFIN $, KOUS ART NN VVPP VAFIN $, APPR ART ADJA NN PTKZU VVINF $, APPR ART NN APPR PDAT NN ADV APPR ART NN APPR ART NN VVPP VAFIN $. ART NN VVFIN $, KOUS PIAT NN VVFIN $, ADJD APPR PDAT NN $, PPOSAT NN VAFIN VVPP $, PPOSAT NN VAFIN VVPP $.	Ein bewegliches Auflager entsteht , sobald ein Knotenpunkt gezwungen wird , auf einer gegebenen Linie zu bleiben , an der Bewegung längs dieser Linie aber durch den Zusammenhäng mit dem Fachwerke gehindert wird ; der Stützenwiderstand wirkt , wenn keine Reibung auftritt , senkrecht zu dieser Bahn , seine Richtung ist gegeben , seine Größe wird gesucht .
Knotenpunkt	NN	1875	1	mohr_fachwerk02_1875-131-82	 	Bezeichnet man demnach mit (Fig. 37 auf Bl. 614) y1, y2, y3.... diejenigen Durchbiegungen, welche die Knotenpunkte I, II, III.... des Fachwerks (Fig. 36) erleiden, wenn ein bestimmter Knotenpunkt z. B. VI mit dem Gewichte R belastet ist, so ergibt sich für den Fall, in welchem die Knotenpunkte I, II, III.... mit P1, P2, P3.... belastet sind, die Durchbiegung y des Knotenpunktes VI aus der Formel: 20) [Formel]	367:380	0:412	Bezeichnet man demnach mit ( Fig. 37 auf Bl. 614 ) y1 , y2 , y3 .... diejenigen Durchbiegungen , welche die Knotenpunkte I , II , III .... des Fachwerks ( Fig. 36 ) erleiden , wenn ein bestimmter Knotenpunkt z. B. VI mit dem Gewichte R belastet ist , so ergibt sich für den Fall , in welchem die Knotenpunkte I , II , III .... mit P1 , P2 , P3 .... belastet sind , die Durchbiegung y des Knotenpunktes VI aus der Formel : 20 ) [Formel]	82	0:91	bezeichnen man demnach mit ( Fig. 37 auf Bl. 614 ) y1 , y2 , y3 .... diejenige Durchbiegung , welche d Knotenpunkt i , ii , iii .... d Fachwerk ( fig. 36 ) erleiden , wenn eine bestimmt Knotenpunkt z. B. vi mit d Gewicht R belasten sein , so ergeben sich für d Fall , in welche d Knotenpunkt i , ii , iii .... mit P1 , p2 , p3 .... belasten sein , d Durchbiegung Y d Knotenpunkt vi aus d Formel : 20 ) [formel]	VVFIN PIS PAV APPR $( NN CARD APPR NN CARD $( XY $, XY $, XY $( PDS NN $, PRELS ART NN CARD $, CARD $, CARD $( ART NN $( XY CARD $( VVINF $, KOUS ART ADJA NN APPRART NN XY APPR ART NN NE VVPP VAFIN $, ADV VVFIN PRF APPR ART NN $, APPR PRELS ART NN CARD $, CARD $, CARD $( APPR NE $, XY $, XY $( VVPP VAFIN $, ART NN NE ART NN XY APPR ART NN $. CARD $( XY	Bezeichnet man demnach mit ( Fig. 37 auf Bl. 614 ) y1 , y2 , y3 .... diejenigen Durchbiegungen , welche die Knotenpunkte I , II , III .... des Fachwerks ( Fig. 36 ) erleiden , wenn ein bestimmter Knotenpunkt z. B. VI mit dem Gewichte R belastet ist , so ergibt sich für den Fall , in welchem die Knotenpunkte I , II , III .... mit P1 , P2 , P3 .... belastet sind , die Durchbiegung y des Knotenpunktes VI aus der Formel : 20 ) [Formel]
Knotenpunkt	NN	1875	1	mohr_fachwerk02_1875-167-33	 	Da Form und Dimensionen des Fachwerks in Bezug auf die durch die Trägermitte gelegte Vertikalachse symmetrisch angeordnet sind, so ergibt sich für den Fall, in welchem die Belastung R auf den Knotenpunkt D einwirkt, ein dem Polygon A symmetrisch geformtes Biegungspolygon B.	192:203	0:274	Da Form und Dimensionen des Fachwerks in Bezug auf die durch die Trägermitte gelegte Vertikalachse symmetrisch angeordnet sind , so ergibt sich für den Fall , in welchem die Belastung R auf den Knotenpunkt D einwirkt , ein dem Polygon A symmetrisch geformtes Biegungspolygon B .	33	0:46	da Form und Dimension d Fachwerk in Bezug auf d durch d Trägermitte gelegt Vertikalachse symmetrisch anordnen sein , so ergeben sich für d Fall , in welche d Belastung R auf d Knotenpunkt D einwirken , eine d Polygon A symmetrisch geformt Biegungspolygon b .	KOUS NN KON NN ART NN APPR NN APPR ART APPR ART NN ADJA NN ADJD VVPP VAFIN $, ADV VVFIN PRF APPR ART NN $, APPR PRELS ART NN NE APPR ART NN NE VVFIN $, ART ART NN NE ADJD ADJA NN XY $.	Da Form und Dimensionen des Fachwerks in Bezug auf die durch die Trägermitte gelegte Vertikalachse symmetrisch angeordnet sind , so ergibt sich für den Fall , in welchem die Belastung R auf den Knotenpunkt D einwirkt , ein dem Polygon A symmetrisch geformtes Biegungspolygon B .
Knotenpunkt	NN	1808	1	schubert_naturwissenschaft_1808-2642-18	 	Denn dieser ist gerade eben so weit nach der andern Seite hin von dem 136sten, oder dem Knotenpunkt des Mercur entfernt, als dieser von dem der Vesta (136 °). Vorhin (§. 26.) fanden wir gemeinschaftlich von den Knotenpunkten der Vesta und des Mercur aus, den der Erde und den des ihr in der andern Reihe entsprechenden Saturn, jetzt aber finden wir (man erlaube uns einstweilen diesen Ausdruck) durch den abermals aus dem Verhältniß der Knotenpunkte der Vesta und des Merkur erhaltenen 273sten Grad der Länge, die Sonnenfernen dieser beyden Planeten.	88:99	0:550	Denn dieſer iſt gerade eben ſo weit nach der andern Seite hin von dem 136ſten , oder dem Knotenpunkt des Mercur entfernt , als dieſer von dem der Veſta ( 136 ° ). Vorhin ( §. 26. ) fanden wir gemeinſchaftlich von den Knotenpunkten der Veſta und des Mercur aus , den der Erde und den des ihr in der andern Reihe entſprechenden Saturn , jetzt aber finden wir ( man erlaube uns einſtweilen dieſen Ausdruck ) durch den abermals aus dem Verhaͤltniß der Knotenpunkte der Veſta und des Merkur erhaltenen 273ſten Grad der Laͤnge , die Sonnenfernen dieſer beyden Planeten .	18	0:102	denn diese sein gerade eben so weit nach d ander Seite hin von d 136sten , oder d Knotenpunkt d Merkur entfernen , als diese von d d Vesta ( 136 ° ). vorhin ( §. 26. ) finden wir gemeinschaftlich von d Knotenpunkt d Vesta und d Merkur aus , die d Erde und d d ihr in d ander Reihe entsprechend Saturn , jetzt aber finden wir ( man erlauben wir einstweilen diese Ausdruck ) durch d abermals aus d Verhältnis d Knotenpunkt d Vesta und d Merkur erhalten 273sten Grad d Länge , d Sonnenferne diese beide Planet .	KON PDS VAFIN ADV ADV ADV ADJD APPR ART ADJA NN ADV APPR ART ADJA $, KON ART NN ART NN VVPP $, KOUS PDAT APPR ART ART NE $( CARD $( $( ADV $( $( ADJA $( VVFIN PPER ADJD APPR ART NN ART NE KON ART NN PTKVZ $, PRELS ART NN KON ART ART PPOSAT APPR ART ADJA NN ADJA NN $, ADV ADV VVFIN PPER $( PIS VVFIN PPER ADV PDAT NN $( APPR ART ADV APPR ART NN ART NN ART NE KON ART NN ADJA CARD NN ART NN $, ART NN PDAT PIAT NN $.	Denn dieser ist gerade eben so weit nach der anderen Seite hin von dem 136sten , oder dem Knotenpunkt des Merkur entfernt , als dieser von dem der Vesta ( 136 ° ). Vorhin ( §. 26. ) fanden wir gemeinschaftlich von den Knotenpunkten der Vesta und des Merkur aus , den der Erde und den des ihr in der anderen Reihe entsprechenden Saturn , jetzt aber finden wir ( man erlaube uns einstweilen diesen Ausdruck ) durch den abermals aus dem Verhältnis der Knotenpunkte der Vesta und des Merkur erhaltenen 273sten Grad der Länge , die Sonnenfernen dieser beiden Planeten .
Knotenpunkt	NN	1886	1	mueller_festigkeitslehre_1886-80-13	 	1) Ein Fachwerk ist eine Verbindung von Stäben, welche in den Knotenpunkten, d. h. in den Punkten, in denen mehrere Stabachsen zusammentreffen, durch reibungslose Gelenke miteinander befestigt sind.	62:75	0:198	1 ) Ein Fachwerk ist eine Verbindung von Stäben , welche in den Knotenpunkten , d. h. in den Punkten , in denen mehrere Stabachsen zusammentreffen , durch reibungslose Gelenke miteinander befestigt sind .	13	0:34	1 ) eine Fachwerk sein eine Verbindung von Stab , welche in d Knotenpunkt , d. h. in d Punkt , in die mehrere Stabachse zusammentreffen , durch reibungslos Gelenk miteinander befestigen sein .	CARD $( ART NN VAFIN ART NN APPR NN $, PRELS APPR ART NN $, PDS VVFIN APPR ART NN $, APPR PRELS PIAT NN VVINF $, APPR ADJA NN ADV VVPP VAFIN $.	1 ) Ein Fachwerk ist eine Verbindung von Stäben , welche in den Knotenpunkten , d. h. in den Punkten , in denen mehrere Stabachsen zusammentreffen , durch reibungslose Gelenke miteinander befestigt sind .
Knotenpunkt	NN	1886	1	mueller_festigkeitslehre_1886-490-3	 	Eine in dem Knotenpunkte A1 und im Sinne A1 B1 angreifende Kraft „Eins“ verschiebt einen Knotenpunkt A2 im Sinne A2 B2 um eine Strecke, welche ebenso gross ist wie die Verschiebung, welche der Knotenpunkt A1 im Sinne A1 B1 erfährt, sobald im Punkte A2 und im Sinne A2 B2 eine Kraft „Eins“ angreift.	12:24	0:298	Eine in dem Knotenpunkte A1 und im Sinne A1 B1 angreifende Kraft „ Eins “ verschiebt einen Knotenpunkt A2 im Sinne A2 B2 um eine Strecke , welche ebenso gross ist wie die Verschiebung , welche der Knotenpunkt A1 im Sinne A1 B1 erfährt , sobald im Punkte A2 und im Sinne A2 B2 eine Kraft „ Eins “ angreift .	3	0:61	eine in d Knotenpunkt A1 und im Sinn A1 B1 angreifend Kraft " Eins " verschieben eine Knotenpunkt A2 im Sinn A2 B2 um eine Strecke , welche ebenso groß sein wie d Verschiebung , welche d Knotenpunkt A1 im Sinn A1 B1 erfahren , sobald im Punkt A2 und im Sinn A2 B2 eine Kraft " Eins " angreifen .	ART APPR ART NN NE KON APPRART NN NE NE ADJA NN $( NE $( VVFIN ART NN NE APPRART NN NE NE APPR ART NN $, PRELS ADV ADJD VAFIN KOKOM ART NN $, PRELS ART NN NE APPRART NN NE NE VVFIN $, KOUS APPRART NN NE KON APPRART NN NE NE ART NN $( NE $( VVFIN $.	Eine in dem Knotenpunkte A1 und im Sinne A1 B1 angreifende Kraft " Eins " verschiebt einen Knotenpunkt A2 im Sinne A2 B2 um eine Strecke , welche ebenso groß ist wie die Verschiebung , welche der Knotenpunkt A1 im Sinne A1 B1 erfährt , sobald im Punkte A2 und im Sinne A2 B2 eine Kraft " Eins " angreift .
Knotenpunkt	NN	1852	1	ludwig_physiologie01_1852-2873-2	 	— Die Knotenpunkte sind analog denjenigen Punkten, die wir an einer einfachen Linse ebenfalls Knotenpunkte der Richtungsstrahlen und an der einfachen brechenden Fläche den Kreuzungspunkt der Achsenstrahlen (den Krümmungsmittelpunkt) nannten, und endlich sind die Hauptpunkte zwei Punkte, welche den Knotenpunkten coordinirt sind, indem sie voneinander eben so weit entfernt liegen, als die Knotenpunkte und der vorderste Hauptpunkt von dem vorderen Hauptbrennpunkt genau so weit absteht, als der hintere Knotenpunkt von dem hintern Hauptbrennpunkt.	6:18	0:548	— Die Knotenpunkte sind analog denjenigen Punkten , die wir an einer einfachen Linse ebenfalls Knotenpunkte der Richtungsstrahlen und an der einfachen brechenden Fläche den Kreuzungspunkt der Achsenstrahlen ( den Krümmungsmittelpunkt ) nannten , und endlich sind die Hauptpunkte zwei Punkte , welche den Knotenpunkten coordinirt sind , indem sie voneinander eben so weit entfernt liegen , als die Knotenpunkte und der vorderste Hauptpunkt von dem vorderen Hauptbrennpunkt genau so weit absteht , als der hintere Knotenpunkt von dem hintern Hauptbrennpunkt .	2	0:82	-- d Knotenpunkt sein analog diejenige Punkt , die wir an eine einfach Linse ebenfalls Knotenpunkt d Richtungsstrahl und an d einfach brechend Fläche d Kreuzungspunkt d Achsenstrahl ( d Krümmungsmittelpunkt ) nennen , und endlich sein d Hauptpunkt zwei Punkt , welche d Knotenpunkt koordinieren sein , indem sie voneinander eben so weit entfernt liegen , als d Knotenpunkt und d vorder Hauptpunkt von d vorder Hauptbrennpunkt genau so weit abstehen , als d hinter Knotenpunkt von d hinter Hauptbrennpunkt .	$( ART NN VAFIN ADJD PDS NN $, PRELS PPER APPR ART ADJA NN ADV NN ART NN KON APPR ART ADJA ADJA NN ART NN ART NN $( ART NN $( VVFIN $, KON ADV VAFIN ART NN CARD NN $, PRELS ART NN VVFIN VAFIN $, KOUS PPER ADV ADV ADV ADJD ADJD VVFIN $, KOUS ART NN KON ART ADJA NN APPR ART ADJA NN ADJD ADV ADJD VVFIN $, KOKOM ART ADJA NN APPR ART ADJA NN $.	-- Die Knotenpunkte sind analog denjenigen Punkten , die wir an einer einfachen Linse ebenfalls Knotenpunkte der Richtungsstrahlen und an der einfachen brechenden Fläche den Kreuzungspunkt der Achsenstrahlen ( den Krümmungsmittelpunkt ) nannten , und endlich sind die Hauptpunkte zwei Punkte , welche den Knotenpunkten koordiniert sind , indem sie voneinander eben so weit entfernt liegen , als die Knotenpunkte und der vorderste Hauptpunkt von dem vorderen Hauptbrennpunkt genau so weit absteht , als der hintere Knotenpunkt von dem hinteren Hauptbrennpunkt .
Knotenpunkt	NN	1867	1	marx_kapital01_1867-6290-31	 	Indess begreift man, dass bei einer Arbeit, wo es sich nicht um vorübergehende Paroxysmen handelt, sondern um Tag aus, Tag ein wiederholte, regelmässige Gleichförmigkeit, ein Knotenpunkt eintreten muss, wo Ausdehnung des Arbeitstags und Intensivität der Arbeit einander ausschliessen, so dass die Verlängerung des Arbeitstags nur mit schwächerem Intensivitätsgrad der Arbeit und umgekehrt ein erhöhter Intensivitätsgrad nur mit Verkürzung des Arbeitstags verträglich bleibt.	175:186	0:474	Indess begreift man , dass bei einer Arbeit , wo es sich nicht um vorübergehende Paroxysmen handelt , sondern um Tag aus , Tag ein wiederholte , regelmässige Gleichförmigkeit , ein Knotenpunkt eintreten muss , wo Ausdehnung des Arbeitstags und Intensivität der Arbeit einander ausschliessen , so dass die Verlängerung des Arbeitstags nur mit schwächerem Intensivitätsgrad der Arbeit und umgekehrt ein erhöhter Intensivitätsgrad nur mit Verkürzung des Arbeitstags verträglich bleibt .	31	0:71	indes begreifen man , dass bei eine Arbeit , wo es sich nicht um vorübergehend Paroxysmus handeln , sondern um Tag aus , Tag eine wiederholt , regelmässig Gleichförmigkeit , eine Knotenpunkt eintreten müssen , wo Ausdehnung d Arbeitstag und Intensivität d Arbeit einander ausschließen , so dass d Verlängerung d Arbeitstag nur mit schwach Intensivitätsgrad d Arbeit und umgekehrt eine erhöht Intensivitätsgrad nur mit Verkürzung d Arbeitstag verträglich bleiben .	ADV VVFIN PIS $, KOUS APPR ART NN $, PWAV PPER PRF PTKNEG APPR ADJA NN VVFIN $, KON APPR NN PTKVZ $, NN ART ADJA $, ADJA NN $, ART NN VVINF VMFIN $, PWAV NN ART NN KON NN ART NN ADV VVINF $, ADV KOUS ART NN ART NN ADV APPR ADJA NN ART NN KON ADJD ART ADJA NN ADV APPR NN ART NN ADJD VVFIN $.	indes begreift man , dass bei einer Arbeit , wo es sich nicht um vorübergehende Paroxysmen handelt , sondern um Tag aus , Tag ein wiederholte , regelmässige Gleichförmigkeit , ein Knotenpunkt eintreten muss , wo Ausdehnung des Arbeitstags und Intensivität der Arbeit einander ausschließen , so dass die Verlängerung des Arbeitstags nur mit schwächerem Intensivitätsgrad der Arbeit und umgekehrt ein erhöhter Intensivitätsgrad nur mit Verkürzung des Arbeitstags verträglich bleibt .
Knotenpunkt	NN	1879	1	treitschke_geschichte01_1879-10728-61	 	Die erste Nachricht von den Gefechten bei Charleroi ließ er unbeachtet, da er dort nur einen Theil der Armee Napoleons vermuthete; und auch als er endlich am Abend des 15. von Brüssel aus, einen ganzen Tag später als Blücher, die Concentration seiner Armee anordnete, befahl er nicht einfach den Linksabmarsch des gesammten Heeres nach dem wichtigen Knotenpunkte Quatrebras, wo die Straßen von Charleroi und Namur nach Brüssel zusammentrafen und eine Vereinigung mit den Preußen möglich war, sondern gab seinen Corps die Richtung auf die fünf Meilen lange Linie von Enghien im Westen über Nivelles nach Genappe im Osten, so daß die englische Armee nur mit ihrer äußersten Linken die Straße nach Charleroi berührte.	350:362	0:714	Die erſte Nachricht von den Gefechten bei Charleroi ließ er unbeachtet , da er dort nur einen Theil der Armee Napoleons vermuthete ; und auch als er endlich am Abend des 15. von Brüſſel aus , einen ganzen Tag ſpäter als Blücher , die Concentration ſeiner Armee anordnete , befahl er nicht einfach den Linksabmarſch des geſammten Heeres nach dem wichtigen Knotenpunkte Quatrebras , wo die Straßen von Charleroi und Namur nach Brüſſel zuſammentrafen und eine Vereinigung mit den Preußen möglich war , ſondern gab ſeinen Corps die Richtung auf die fünf Meilen lange Linie von Enghien im Weſten über Nivelles nach Genappe im Oſten , ſo daß die engliſche Armee nur mit ihrer äußerſten Linken die Straße nach Charleroi berührte .	61	0:122	d erst Nachricht von d Gefecht bei Charleroi lassen er unbeachtet , da er dort nur eine Teil d Armee Napoleon vermuten ; und auch als er endlich am Abend d 15. von Brüssel aus , eine ganz Tag spät als Blücher , d Konzentration seine Armee anordnen , befehlen er nicht einfach d Linksabmarsch d gesamt Heer nach d wichtig Knotenpunkt Quatrebras , wo d Straße von Charleroi und Namur nach Brüssel zusammentreffen und eine Vereinigung mit d Preuße möglich sein , sondern geben seine Korps d Richtung auf d fünf Meile lang Linie von Enghien im Westen über Nivelles nach Genappe im Osten , so daß d englisch Armee nur mit ihr äußerst Linken d Straße nach Charleroi berühren .	ART ADJA NN APPR ART NN APPR NE VVFIN PPER ADJD $, KOUS PPER ADV ADV ART NN ART NN NE VVFIN $. KON ADV KOKOM PPER ADV APPRART NN ART ADJA APPR NE PTKVZ $, ART ADJA NN ADJD KOKOM NE $, ART NN PPOSAT NN VVFIN $, VVFIN PPER PTKNEG ADV ART NN ART ADJA NN APPR ART ADJA NN NE $, PWAV ART NN APPR NE KON NE APPR NE VVFIN KON ART NN APPR ART NN ADJD VAFIN $, KON VVFIN PPOSAT NN ART NN APPR ART CARD NN ADJA NN APPR NE APPRART NN APPR NE APPR NE APPRART NN $, ADV KOUS ART ADJA NN ADV APPR PPOSAT ADJA NN ART NN APPR NE VVFIN $.	Die erste Nachricht von den Gefechten bei Charleroi ließ er unbeachtet , da er dort nur einen Teil der Armee Napoleons vermutete ; und auch als er endlich am Abend des 15. von Brüssel aus , einen ganzen Tag später als Blücher , die Konzentration seiner Armee anordnete , befahl er nicht einfach den Linksabmarsch des gesamten Heeres nach dem wichtigen Knotenpunkte Quatrebras , wo die Straßen von Charleroi und Namur nach Brüssel zusammentrafen und eine Vereinigung mit den Preußen möglich war , sondern gab seinen Korps die Richtung auf die fünf Meilen lange Linie von Enghien im Westen über Nivelles nach Genappe im Osten , so daß die englische Armee nur mit ihrer äußersten Linken die Straße nach Charleroi berührte .
Knotenpunkt	NN	1875	1	mohr_fachwerk02_1875-128-9	 	Denn bezeichnet man die Werthe von u für den Knotenpunkt C mit u1 und für den Knotenpunkt D mit u2, so erzeugt die Belastung P des Knotenpunktes D Spannungen der Konstruktionstheile von der Grösse [Formel] also elastische Längenänderungen [Formel] und in Folge dessen eine Durchbiegung des Knotenpunktes C von der Grösse:	45:56	0:321	Denn bezeichnet man die Werthe von u für den Knotenpunkt C mit u1 und für den Knotenpunkt D mit u2 , so erzeugt die Belastung P des Knotenpunktes D Spannungen der Konstruktionstheile von der Grösse [Formel] also elastische Längenänderungen [Formel] und in Folge dessen eine Durchbiegung des Knotenpunktes C von der Grösse :	9	0:53	denn bezeichnen man d Wert von U für d Knotenpunkt C mit U1 und für d Knotenpunkt D mit U2 , so erzeugen d Belastung P d Knotenpunkt d Spannung d Konstruktionsteile von d Größe [formel] also elastisch Längenänderung [formel] und in Folge die eine Durchbiegung d Knotenpunkt C von d Größe :	KON VVFIN PIS ART NN APPR NE APPR ART NN NE APPR NE KON APPR ART NN NE APPR NE $, ADV VVFIN ART NN NE ART NN XY NN ART NN APPR ART NN XY ADV ADJA NN XY KON APPR NN PDS ART NN ART NN NE APPR ART NN $.	Denn bezeichnet man die Werte von u für den Knotenpunkt C mit u1 und für den Knotenpunkt D mit u2 , so erzeugt die Belastung P des Knotenpunktes D Spannungen der Konstruktionsteile von der Größe [Formel] also elastische Längenänderungen [Formel] und in Folge dessen eine Durchbiegung des Knotenpunktes C von der Größe :
